"QoE-aware FEC mechanism for intrusion detection in multi-tier Wireless Multimedia Sensor Networks","Zhongliang Zhao; Braun, T.; do Rosario, D.; Cerqueira, E.; Immich, R.; Curado, M.","Univ. of Bern, Bern, Switzerland","Wireless and Mobile Computing, Networking and Communications (WiMob), 2012 IEEE 8th International Conference on","20121213","2012","","","689","696","Wireless Multimedia Sensor Networks (WMSNs) play an important role in pervasive and ubiquitous systems. The multimedia content in such networks has the potential of enhancing the level of information collected, enlarging the range of coverage, and enabling multi-view support. For WMSN applications, the multi-tier network architecture has proven to be more beneficial than a single-tier in terms of energy-efficiency, scalability, functionality and reliability. In this context, a multimedia intrusion detection application appears as a promising application of multi-tier WMSNs, where the lower tier can detect the intruder using scalar sensors, and the higher tier camera nodes will be woken up to send real time video sequences from the detected area. The transmission of multimedia content requires a certain quality level from the user perspective, while energy consumption and network overhead should be minimized. Among the existing mechanisms for improving video transmissions, Forward Error Correction (FEC) can be regarded as a suitable solution to improve video quality level from the user point-of-view. In this work, we propose a Quality of Experience (QoE)-aware FEC mechanism for WMSNs, which creates redundant packets based on impact of the frame on the user experience. According to the simulation results, our proposed mechanism achieved similar video quality level compared with standard FEC, while reducing the transmission of redundant packets, which will bring many benefits in a resource-constrained system.","2160-4886","978-1-4673-1429-9","","10.1109/WiMOB.2012.6379150","http://ieeexplore.ieee.org.ezproxy.rit.edu/stamp/stamp.jsp?arnumber=6379150","Forward error correction;Intrusion detection;Multi-tier architecture;QoE;Wireless multimedia sensor networks","Cameras;Forward error correction;Multimedia communication;Quality assessment;Redundancy;Streaming media;Video recording","forward error correction;image sequences;multimedia communication;quality of experience;security of data;telecommunication network reliability;telecommunication security;video coding;wireless sensor networks","QoE-aware FEC mechanism;camera nodes;forward error correction;multimedia content transmission;multimedia intrusion detection;multitier WMSN;multitier network architecture;multitier wireless multimedia sensor networks;quality of experience-aware FEC mechanism;real-time video sequences;redundant packets;reliability;resource-constrained system;scalar sensors;ubiquitous systems;video quality level","","3","","25","","","8-10 Oct. 2012","","IEEE","IEEE Conference Publications"
"A random key distribution based Artificial Immune System for security in clustered wireless sensor networks","Kumar, E.S.; Kusuma, S.M.; Kumar, B.P.V.","Dept. of Telecommun. Eng., M.S Ramaiah Inst. of Technol., Bangalore, India","Electrical, Electronics and Computer Science (SCEECS), 2014 IEEE Students' Conference on","20140424","2014","","","1","7","Wireless sensor networks are associated with risk due to the threats of security vulnerabilities. In this context, we propose a scheme, which uses random key distribution based Artificial Immune System (AIS) for detecting spoofing attacks. The prospective method is for clustered sensor networks and as an example, the algorithm is executed on LEACH protocol. The simulation results prove that the design is energy efficient than the other widely used cryptographic methods while providing robust security in the network.","","978-1-4799-2525-4","","10.1109/SCEECS.2014.6804506","http://ieeexplore.ieee.org.ezproxy.rit.edu/stamp/stamp.jsp?arnumber=6804506","Artificial Immune System;LEACH protocol;clustered sensor networks;cryptography","Algorithm design and analysis;Equations;Immune system;Mathematical model;Protocols;Security;Wireless sensor networks","artificial immune systems;cryptographic protocols;telecommunication security;wireless sensor networks","AIS;LEACH protocol;clustered wireless sensor network security;cryptographic methods;energy efficient design;random key distribution based artificial immune system;security vulnerability;spoofing attack detection","","0","","12","","","1-2 March 2014","","IEEE","IEEE Conference Publications"
"A multi-agent system architecture for cooperative maritime networks","Geoghegan, S.J.; McCorkle, G.; Robinson, C.; Fundyler, G.; Ramaswamy, S.; Tudoreanu, M.; Seker, R.; Brown, J.; Itmi, M.","Univ. of Arkansas at Little Rock, Little Rock, AR","Systems Conference, 2009 3rd Annual IEEE","20090417","2009","","","7","12","The maritime container shipping industry derives significant efficiency by utilizing standard sized containers to ship goods all over the world. The standard size facilitates the use of equipment and procedures optimized for the containers. Due to the importance of the cargo, the security of the containers is extremely important. In this paper, a system is described to enhance the monitoring of the containers at a port or on a ship. Each container is instrumented with an intrusion detection system and a wireless device. Utilizing an ad-hoc network topology, security data for each container is communicated to other containers, a ship-board computer and a port computer. The data can be used by security personnel to ascertain the status of the container and to plan the necessary action to re-secure the container or to minimize the damage cause by an unauthorized access to the container contents.","","978-1-4244-3462-6","978-1-4244-3463-3","10.1109/SYSTEMS.2009.4815762","http://ieeexplore.ieee.org.ezproxy.rit.edu/stamp/stamp.jsp?arnumber=4815762","Container;Isotainer;Jade;Maritime Shipping;Multi-Agent;Network;P2P;Security","Communication system security;Computer networks;Computerized monitoring;Containers;Data security;Instruments;Intrusion detection;Marine vehicles;Multiagent systems;Shipbuilding industry","ad hoc networks;goods distribution;marine communication;multi-agent systems;security of data","ad-hoc network topology;cooperative maritime networks;data security;intrusion detection system;maritime container shipping industry;multiagent system architecture;port computer;ship-board computer;wireless device","","1","","9","","","23-26 March 2009","","IEEE","IEEE Conference Publications"
"Filtering Based Multiple String Matching Algorithm Combining q-Grams and BNDM","Changsheng Miao; Guiran Chang; Xingwei Wang","Sch. of Inf. Sci. & Eng., Northeastern Univ., Shenyang, China","Genetic and Evolutionary Computing (ICGEC), 2010 Fourth International Conference on","20110217","2010","","","582","585","We present a new algorithm for exact multiple string matching. Our algorithm is based on filtration combining BNDM and q-grams. We have tested it with experiments and compared it with other algorithms, e.g. DFA, AC_BM and MWM. The preprocessing phase of our algorithms is fast, the memory usage is fairly small, and our algorithm is considerably faster for huge sets of several thousand patterns. The benefits are due to the bit parallelism of BNDM and the improved filtering efficiency by q-grams.","","978-1-4244-8891-9","978-0-7695-4281-2","10.1109/ICGEC.2010.149","http://ieeexplore.ieee.org.ezproxy.rit.edu/stamp/stamp.jsp?arnumber=5715499","Backward Nondeterministic DAWG Matching (BNDM);q-BNDM;q-grams;strng matching","Algorithm design and analysis;Approximation algorithms;Classification algorithms;Complexity theory;Computers;Filtering;Pattern matching","computational linguistics;security of data;string matching","BNDM;backward nondeterministic DAWG matching;filtering based multiple string matching algorithm;q-gram method","","1","","12","","","13-15 Dec. 2010","","IEEE","IEEE Conference Publications"
"Multi-events analysis for anomaly intrusion detection","Jian Yin; Gang Zhang; Yi-Qun Chen; Xian-Li Fan","","Machine Learning and Cybernetics, 2004. Proceedings of 2004 International Conference on","20050124","2004","2","","1298","1303 vol.2","Probabilistic methods are widely used in intrusion detection especially in computer audit data analysis. There are many famous probabilistic algorithm such as decision tree, Hotelling's T2, chi-square, first-order and high-order Markov model. These algorithms focus on some data features to mark anomaly state. New features are introduced into these algorithms and proper combination of these features will provide excellent result. But these algorithms are used single metric generated by multi-events so as to detect intrusion by comparison with a certain threshold. Experiment shows that using per event-based metric can improve accuracy of intrusion detection but not improve complexity of algorithm. In our paper we will provide a metric vector based on algorithm to detection intrusion that is more accurate and effective than traditional ones. Also, we provide some intrusion detection methods to our algorithm.","","0-7803-8403-2","","10.1109/ICMLC.2004.1382393","http://ieeexplore.ieee.org.ezproxy.rit.edu/stamp/stamp.jsp?arnumber=1382393","","Computer science;Data analysis;Decision trees;Detection algorithms;Frequency;Intrusion detection;Linear regression;Pattern recognition;Telecommunication traffic;Testing","Markov processes;decision trees;security of data","Markov model;anomaly intrusion detection;computer audit data analysis;decision tree;multievents analysis","","1","","11","","","26-29 Aug. 2004","","IEEE","IEEE Conference Publications"
"S_Firewall: A Firewall in Wireless Sensor Networks","Jianqing Ma; Ping Yi; Yi-Ping Zhong; Shiyong Zhang","Dept. of Comput. & Inf. Technol., Fudan Univ., Shanghai","Wireless Communications, Networking and Mobile Computing, 2006. WiCOM 2006.International Conference on","20070410","2006","","","1","4","Wireless sensor networks (WSNs) have wide applications both in military and civil fields. However, when deployed in untended/hostile area, WSNs may suffer all kinds of attacks like flooding, sinkhole, etc. To apply WSNs more practically and wildly, some secure countermeasures must be deployed in WSNs. In this paper, we design a kind of firewall scheme, which is based on mobile agent, to isolate the intruder with less communication overhead and memory cost. The S_Firewall can be generated automatically, distributively and in real time when network-wide attacks happen. The paper also proposes a route restoring scheme by local repair and makes a performance analysis by prototype implementation of S_Firewall","","1-4244-0517-3","","10.1109/WiCOM.2006.280","http://ieeexplore.ieee.org.ezproxy.rit.edu/stamp/stamp.jsp?arnumber=4149457","","Computer networks;Filters;Floods;Information technology;Military computing;Performance analysis;Protection;Prototypes;Telecommunication traffic;Wireless sensor networks","mobile radio;telecommunication network routing;telecommunication security;wireless sensor networks","S_Firewall;network-wide attacks;route restoring scheme;wireless sensor networks","","0","","11","","","22-24 Sept. 2006","","IEEE","IEEE Conference Publications"
"Intelligent Distributed Intrusion Detection Systems of Computer Communication Systems","Grzech, A.","Inst. of Inf. Sci. & Eng., Wroclaw Univ. of Technol., Wroclaw, Poland","Intelligent Information and Database Systems, 2009. ACIIDS 2009. First Asian Conference on","20090731","2009","","","1","6","The paper is devoted to present various intelligent, distributed network-based intrusion detection systems architectures and quality measures. Moreover an impact of network and their intrusion detection system architectures parameters on the intrusion detection systems quality is discussed.","","978-0-7695-3580-7","","10.1109/ACIIDS.2009.87","http://ieeexplore.ieee.org.ezproxy.rit.edu/stamp/stamp.jsp?arnumber=5175957","anomaly detection;computer communication systems;distributed intrusion detection systems","Communication system security;Computer architecture;Computer networks;Computerized monitoring;Deductive databases;Distributed computing;Intelligent networks;Intrusion detection;Technology management;Telecommunication traffic","security of data","computer communication systems;intelligent distributed intrusion detection systems;intrusion detection system architectures;intrusion detection systems quality","","0","","13","","","1-3 April 2009","","IEEE","IEEE Conference Publications"
"Trust-Based Security for the Spanning Tree Protocol","Yingxu Lai; Qiuyue Pan; Zenghui Liu; Yinong Chen; Zhizheng Zhou","Coll. of Comput. Sci., Beijing Univ. of Technol., Beijing, China","Parallel & Distributed Processing Symposium Workshops (IPDPSW), 2014 IEEE International","20141204","2014","","","1338","1343","Attacks executed on Spanning Tree Protocol (STP) expose the weakness of link layer protocols and put the higher layers in jeopardy. Although the problems have been studied for many years and various solutions have been proposed, many security issues remain. To enhance the security and credibility of layer-2 network, we propose a trust-based spanning tree protocol aiming at achieving a higher credibility of LAN switch with a simple and lightweight authentication mechanism. If correctly implemented in each trusted switch, the authentication of trust-based STP can guarantee the credibility of topology information that is announced to other switch in the LAN. To verify the enforcement of the trusted protocol, we present a new credible evaluation method of the STP using a specification-based state model. We implement a prototype of trust-based STP to investigate its practicality. Experiment shows that the trusted protocol can achieve security goals and effectively avoid STP attacks with a lower computation overhead and good convergence performance.","","978-1-4799-4117-9","","10.1109/IPDPSW.2014.150","http://ieeexplore.ieee.org.ezproxy.rit.edu/stamp/stamp.jsp?arnumber=6969534","STP;credible evaluation;network security;trusted network","Authentication;Bridges;Network topology;Protocols;Switches;Topology","computer network security;formal specification;local area networks;message authentication;routing protocols;trees (mathematics)","LAN switch;authentication mechanism;link layer protocol;spanning tree protocol;specification-based state model;topology information;trust-based STP;trust-based security","","0","","14","","","19-23 May 2014","","IEEE","IEEE Conference Publications"
"Detecting Man-in-the-Middle and Wormhole Attacks in Wireless Mesh Networks","Glass, S.M.; Muthukkumarasamy, V.; Portmann, M.","NICTA, NSW","Advanced Information Networking and Applications, 2009. AINA '09. International Conference on","20090619","2009","","","530","538","Wireless networks are being used increasingly in industrial, health care, military and public-safety environments. In these environments security is extremely important because a successful attack against the network may pose a threat to human life. To secure such wireless networks against hostile attack requires both preventative and detective measures.In this paper we propose a novel intrusion detection mechanism that identifies man-in-the-middle and wormhole attacks against wireless mesh networks by external adversaries. A simple modification to the wireless MAC protocol is proposed to expose the presence of an adversary conducting a frame-relaying attack. We evaluate the modified MAC protocol experimentally and show the detection mechanism to have a high detection rate, no false positives and a small computational and communication overhead.","1550-445X","978-1-4244-4000-9","978-0-7695-3638-5","10.1109/AINA.2009.131","http://ieeexplore.ieee.org.ezproxy.rit.edu/stamp/stamp.jsp?arnumber=5076244","intrusion-detection;security;wireless network","Authentication;Communication system traffic control;Defense industry;Fingerprint recognition;Glass;Intrusion detection;Media Access Protocol;Sections;Wireless mesh networks;Wireless networks","access protocols;radio networks;telecommunication security","intrusion detection mechanism;man-in-the-middle detection;wireless MAC protocol;wireless mesh network;wormhole attack","","1","","19","","","26-29 May 2009","","IEEE","IEEE Conference Publications"
"Deep packet inspection with DFA-trees and parametrized language overapproximation","Luchaup, D.; De Carli, L.; Jha, S.; Bach, E.","U. of Wisconsin-Madison, Madison, WI, USA","INFOCOM, 2014 Proceedings IEEE","20140708","2014","","","531","539","IPSs determine whether incoming traffic matches a database of vulnerability signatures defined as regular expressions. DFA representations are popular, but suffer from the state-explosion problem. We introduce a new matching structure: a tree of DFAs where the DFA associated with a node over-approximates those at its children, and the DFAs at the leaves represent the signature set. Matching works top-down, starting at the root of the tree and stopping at the first node whose DFA does not match. In the common case (benign traffic) matching does not reach the leaves. DFA-trees are built using Compact Overapproximate DFAs (CODFAs). A CODFA D' for D over-approximates the language accepted by D, has a smaller number of states than D, and has a low false-match rate. Although built from approximate DFAs, DFA-trees perform exact matching faster than a commonly used method, have a low memory overhead and a guaranteed good worst case performance.","","","","10.1109/INFOCOM.2014.6847977","http://ieeexplore.ieee.org.ezproxy.rit.edu/stamp/stamp.jsp?arnumber=6847977","","Approximation error;Automata;Computers;Conferences;DH-HEMTs;Payloads;Training","computational complexity;deterministic automata;digital signatures;finite automata;formal languages;pattern matching;tree data structures","CODFAs;DFA-trees;IPSs;NP-hard problem;benign traffic matching;compact overapproximate DFAs;deep packet inspection;deterministic finite automata;intrusion prevention system;low false-match rate;low memory overhead;matching structure;parametrized language overapproximation;regular expressions;state-explosion problem;vulnerability signatures","","1","","30","","","April 27 2014-May 2 2014","","IEEE","IEEE Conference Publications"
"Prevention of malware propagation in AMI","Younghee Park; Nicol, D.M.; Huaiyu Zhu; Cheol Won Lee","Inf. Trust Inst., Univ. of Illinois at Urbana-Champaign, Urbana, IL, USA","Smart Grid Communications (SmartGridComm), 2013 IEEE International Conference on","20131219","2013","","","474","479","Malware can disrupt the operation of services in advanced metering infrastructure (AMI), which is at risk due to connectivity with the global Internet. In motion, malware may hide within the data payloads of legitimate AMI control traffic, implying the need for deep packet inspection. Some of the inspections one may make look for consistency with respect to data available only at the application layer, requiring one to position the analysis high in the protocol stack. Towards this end we propose a policy engine that examines both ingress and egress traffic to the AMI application layer. Policy engine rules may refer to the structure and behavior of the AMI protocol, and may also perform multi-stage analysis of data payloads looking for evidence that executable code is carried, rather than data. Our experimental results demonstrate that the policy engine is able to accurately distinguish between legitimate traffic and malware bearing traffic.","","","","10.1109/SmartGridComm.2013.6688003","http://ieeexplore.ieee.org.ezproxy.rit.edu/stamp/stamp.jsp?arnumber=6688003","","Encryption;Engines;Entropy;Malware;Payloads;Protocols","metering;power meters;power system security;protocols","AMI application layer;AMI control traffic;AMI protocol;advanced metering infrastructure;data payloads;deep packet inspection;malware propagation;multistage analysis;policy engine","","1","","25","","","21-24 Oct. 2013","","IEEE","IEEE Conference Publications"
"Intrusion detection in wireless ad hoc networks","Mishra, A.; Nadkarni, K.; Patcha, A.","Virginia Tech, Blacksburg, VA, USA","Wireless Communications, IEEE","20040816","2004","11","1","48","60","Intrusion detection has, over the last few years, assumed paramount importance within the broad realm of network security, more so in the case of wireless ad hoc networks. These are networks that do not have an underlying infrastructure; the network topology is constantly changing. The inherently vulnerable characteristics of wireless ad hoc networks make them susceptible to attacks, and it may be too late before any counter action can take effect. Second, with so much advancement in hacking, if attackers try hard enough they will eventually succeed in infiltrating the system. This makes it important to constantly (or at least periodically) monitor what is taking place on a system and look for suspicious behavior. Intrusion detection systems (IDSs) do just that: monitor audit data, look for intrusions to the system, and initiate a proper response (e.g., email the systems administrator, start an automatic retaliation). As such, there is a need to complement traditional security mechanisms with efficient intrusion detection and response. In this article we present a survey on the work that has been done in the area of intrusion detection in mobile ad hoc networks.","1536-1284","","","10.1109/MWC.2004.1269717","http://ieeexplore.ieee.org.ezproxy.rit.edu/stamp/stamp.jsp?arnumber=1269717","","Ad hoc networks;Communication system security;Computer crime;Data security;Intelligent networks;Intrusion detection;Mobile ad hoc networks;Monitoring;Network topology;Spread spectrum communication","ad hoc networks;mobile agents;mobile radio;network topology;telecommunication security","automatic retaliation;hacking;intrusion detection systems;mobile ad hoc networks;network security;network topology;security mechanisms;wireless ad hoc networks","","111","4","13","","","Feb 2004","","IEEE","IEEE Journals & Magazines"
"Table of contents","","","Computers and Communications (ISCC), 2010 IEEE Symposium on","20100812","2010","","","1","10","The paper deals with the following topics: wireless sensor networks; peer-to-peer networks; distributed systems; pattern clustering; Web service; mobile networks; ad-hoc networks; Internet; virtual machines; data security; cryptography; traffic engineering computing; protocols; image processing; video signal processing; tourism computing; and interoperability.","1530-1346","978-1-4244-7754-8","","10.1109/ISCC.2010.5546603","http://ieeexplore.ieee.org.ezproxy.rit.edu/stamp/stamp.jsp?arnumber=5546603","","","Internet;ad hoc networks;cryptography;distributed processing;image processing;mobile radio;open systems;peer-to-peer computing;protocols;traffic engineering computing;travel industry;virtual machines;wireless sensor networks","Internet;Web service;ad-hoc networks;cryptography;data security;distributed systems;image processing;interoperability;mobile networks;pattern clustering;peer-to-peer networks;protocols;tourism computing;traffic engineering computing;video signal processing;virtual machines;wireless sensor networks","","0","","","","","22-25 June 2010","","IEEE","IEEE Conference Publications"
