"StriFA: Stride Finite Automata for High-Speed Regular Expression Matching in Network Intrusion Detection Systems","Xiaofei Wang; Yang Xu; Junchen Jiang; Ormond, O.; Bin Liu; Xiaojun Wang","Dept. of Comput. Sci. & Technol., Tsinghua Univ., Beijing, China","Systems Journal, IEEE","20130704","2013","7","3","374","384","Deep packet inspection has become a key component in network intrusion detection systems (NIDSes), where every packet in the incoming data stream needs to be compared with patterns in an attack database, byte-by-byte, using either string matching or regular expression matching. Regular expression matching, despite its flexibility and efficiency in attack identification, brings significantly high computation and storage complexities to NIDSes, making line-rate packet processing a challenging task. In this paper, we present stride finite automata (StriFA), a novel finite automata family, to accelerate both string matching and regular expression matching. Different from conventional finite automata, which scan the entire traffic stream to locate malicious information, a StriFA only needs to scan a partial traffic stream to find suspicious information. The presented StriFA technique has been implemented in software and evaluated based on different traces. The simulation results show that the StriFA acceleration scheme offers an increased speed over traditional nondeterministic finite automaton/deterministic finite automaton, while at the same time reducing the memory requirement.","1932-8184","","","10.1109/JSYST.2013.2244791","http://ieeexplore.ieee.org.ezproxy.rit.edu/stamp/stamp.jsp?arnumber=6475958","Deep packet inspection (DPI);deterministic finite automaton (DFA);network intrusion detection systems (NIDSes);nondeterministic finite automaton (NFA)","Acceleration;Automata;Doped fiber amplifiers;Educational institutions;Engines;Memory management;Pattern matching","finite automata;security of data;string matching","NIDS;StriFA acceleration scheme;attack database;attack identification;data stream;high-speed regular expression matching;line-rate packet processing;malicious information;network intrusion detection systems;stride finite automata;string matching;traffic stream","","2","","31","","2013-03-07","Sept. 2013","","IEEE","IEEE Journals & Magazines"
"Intrusion Detection with Neural Networks and Watermarking Techniques for MANET","Mitrokotsa, Aikaterini; Komninos, Nikos; Douligeris, Christos","Department of Informatics, University of Piraeus, 80 Karaoli & Dimitriou Str. Piraeus, 18534, Greece, mitrokat@unipi.gr","Pervasive Services, IEEE International Conference on","20070808","2007","","","118","127","In mobile ad hoc networks (MANET) specific Intrusion Detection Systems (IDSs) are needed to safeguard them since traditional intrusion prevention techniques are not sufficient in the protection of MANET. In this paper we present an intrusion detection engine based on neural networks combined with a protection method, which is based on watermarking techniques. We exploit the advantages of information visualization and machine learning techniques in order to achieve intrusion detection. Then, we authenticate the maps produced by the application of the intelligent techniques using a novel combined watermarking embedded method. The performance of the proposed model is evaluated under different traffic conditions, mobility patterns and visualization metrics, showing its high efficiency.","","1-4244-1325-7","1-4244-1326-5","10.1109/PERSER.2007.4283901","http://ieeexplore.ieee.org.ezproxy.rit.edu/stamp/stamp.jsp?arnumber=4283901","","Engines;Intrusion detection;Learning systems;Machine learning;Mobile ad hoc networks;Neural networks;Protection;Traffic control;Visualization;Watermarking","ad hoc networks;learning (artificial intelligence);mobile radio;neural nets;security of data;watermarking","information visualization;intrusion detection engine;machine learning technique;mobile ad hoc network;neural network;watermarking technique","","3","","19","","","15-20 July 2007","","IEEE","IEEE Conference Publications"
"Effective Acquaintance Management based on Bayesian Learning for Distributed Intrusion Detection Networks","Fung, C.J.; Jie Zhang; Boutaba, R.","Dept. of Comput. Sci., Univ. of Waterloo, Waterloo, ON, Canada","Network and Service Management, IEEE Transactions on","20120903","2012","9","3","320","332","An effective Collaborative Intrusion Detection Network (CIDN) allows distributed Intrusion Detection Systems (IDSes) to collaborate and share their knowledge and opinions about intrusions, to enhance the overall accuracy of intrusion assessment as well as the ability of detecting new classes of intrusions. Toward this goal, we propose a distributed Host-based IDS (HIDS) collaboration system, particularly focusing on acquaintance management where each HIDS selects and maintains a list of collaborators from which they can consult about intrusions. Specifically, each HIDS evaluates both the false positive (FP) rate and false negative (FN) rate of its neighboring HIDSes' opinions about intrusions using Bayesian learning, and aggregates these opinions using a Bayesian decision model. Our dynamic acquaintance management algorithm allows each HIDS to effectively select a set of collaborators. We evaluate our system based on a simulated collaborative HIDS network. The experimental results demonstrate the convergence, stability, robustness, and incentive-compatibility of our system.","1932-4537","","","10.1109/TNSM.2012.051712.110124","http://ieeexplore.ieee.org.ezproxy.rit.edu/stamp/stamp.jsp?arnumber=6205096","Host-based intrusion detection systems;acquaintance management;collaborative networks;computer security","Accuracy;Bayesian methods;Collaboration;Heuristic algorithms;Intrusion detection;Maintenance engineering;Random variables","belief networks;computer network security;convergence;decision theory;knowledge management;learning (artificial intelligence);stability","Bayesian decision model;Bayesian learning;CIDN;HIDSes opinions;collaborative intrusion detection network;convergence;distributed HIDS collaboration system;distributed host-based IDS collaboration system;distributed intrusion detection networks;dynamic acquaintance management algorithm;false negative rate;false positive rate;incentive-compatibility;intrusion assessment;knowledge sharing;robustness;simulated collaborative HIDS network;stability","","3","","36","","2012-05-25","September 2012","","IEEE","IEEE Journals & Magazines"
"Scalable security schemes for ad hoc networks","Bhargava, S.; Agrawal, D.P.","Center for Distributed & Mobile Comput., Cincinnati Univ., OH, USA","MILCOM 2002. Proceedings","20030225","2002","2","","1089","1094 vol.2","Inherent characteristics of any ad hoc network such as dynamic topology and limited physical security poses severe security challenges to the network. Hence, these networks demand much stronger security mechanisms than the traditional networks. It is hard to achieve security and robustness in the routing protocols at the same time in such networks. Several issues have to be understood and addressed before devising a security mechanism. This paper targets securing the reactive routing protocol AODV. The routing protocol is vulnerable to two kinds of attack: external and internal attack. We have discussed some existing external attacks and possible malicious behavior from compromised nodes. To mitigate the attacks, we propose a dual level security model. On the first level, we have the external attack detection model (EADM), that secures the network with authentication and confidentiality that rely on mutual trust between nodes. And on the second level, the intrusion detection model (IDM) identifies the misbehaving nodes using the knowledge base and the response model (RM) isolates these nodes from the network.","","0-7803-7625-0","","10.1109/MILCOM.2002.1179629","http://ieeexplore.ieee.org.ezproxy.rit.edu/stamp/stamp.jsp?arnumber=1179629","","Ad hoc networks;Authentication;Environmental management;Intrusion detection;Mobile ad hoc networks;Mobile computing;Network topology;Robustness;Routing protocols;Wireless networks","ad hoc networks;authorisation;data privacy;military communication;mobile computing;mobile radio;routing protocols;telecommunication security","AODV;EADM;IDM;ad hoc networks;authentication;compromised nodes;confidentiality;dual level security model;external attack;external attack detection model;internal attack;intrusion detection model;knowledge base;malicious behavior;military communication;mutual trust;reactive routing protocol;response model;robustness;scalable security schemes","","1","","17","","","7-10 Oct. 2002","","IEEE","IEEE Conference Publications"
"A fault tolerance approach for distributed systems using monitoring based replication","Costan, A.; Dobre, C.; Pop, F.; Leordeanu, C.; Cristea, V.","Comput. Sci. Dept., Univ. Politeh. of Bucharest, Bucharest, Romania","Intelligent Computer Communication and Processing (ICCP), 2010 IEEE International Conference on","20101021","2010","","","451","458","High availability is a desired feature of a dependable distributed system. Replication is a well-known technique to achieve fault tolerance in distributed systems, thereby enhancing availability. We propose an approach relying on replication techniques and based on monitoring information to be applied in distributed systems for fault tolerance. Our approach uses both active and passive strategies to implement an optimistic replication protocol. Using a proxy to handle service calls and relying on service replication strategies, we effectively deal with the complexity and overhead issues. This paper presents an architecture for implementing the proxy based on monitoring data and the replication management. Experimentation and application testing using an implementation of the architecture is presented. The architecture is demonstrated to be a viable technique for increasing dependability in distributed systems.","","978-1-4244-8228-3","978-1-4244-8230-6","10.1109/ICCP.2010.5606398","http://ieeexplore.ieee.org.ezproxy.rit.edu/stamp/stamp.jsp?arnumber=5606398","","Computer architecture;Containers;Distributed databases;Fault tolerance;Fault tolerant systems;Monitoring;Security","distributed processing;software fault tolerance;system monitoring","dependable distributed system;distributed systems;fault tolerance;monitoring based replication;monitoring information;optimistic replication protocol;replication management;replication techniques;service calls;service replication","","1","","10","","","26-28 Aug. 2010","","IEEE","IEEE Conference Publications"
"A Novel Method of Software Vulnerability Detection based on Fuzzing Technique","Xiao-Song Zhang; Lin Shao; Jiong Zheng","NSTL Security Lab., UESTC, Chengdu","Apperceiving Computing and Intelligence Analysis, 2008. ICACIA 2008. International Conference on","20090202","2008","","","270","273","Buffer overflow vulnerabilities can cause attacks that result in serious consequences. However the techniques of buffer overflow vulnerability detection are limited to manual analysis, binary-patch comparison, fuzzing and so on. They rely on manual analysis, thus cause high overhead. In this paper, we propose a novel method of detection of buffer overflow vulnerabilities, which is based on fuzzing, data-flow dynamic analysis and automated exception analysis. This new method effectively improves the detection of unknown security vulnerabilities (0 Day). Moreover, it is more automated and has better performance in finding new security vulnerabilities.","","978-1-4244-3427-5","978-1-4244-3426-8","10.1109/ICACIA.2008.4770021","http://ieeexplore.ieee.org.ezproxy.rit.edu/stamp/stamp.jsp?arnumber=4770021","Automation;buffer overflow;fuzzing technique;security vulnerability;vulnerability detection","Assembly;Automatic testing;Buffer overflow;Computer hacking;Computer security;Data security;Intrusion detection;Protection;Software testing;Vehicle crash testing","fuzzy set theory;security of data","automated exception analysis;binary-patch comparison;buffer overflow vulnerability detection;data-flow dynamic analysis;fuzzing technique;software vulnerability detection","","2","","10","","","13-15 Dec. 2008","","IEEE","IEEE Conference Publications"
"An AODE-based intrusion detection system for computer networks","Baig, Z.A.; Shaheen, A.S.; AbdelAal, R.","Dept. of Comput. Eng., King Fahd Univ. of Pet. & Miner., Dhahran, Saudi Arabia","Internet Security (WorldCIS), 2011 World Congress on","20110415","2011","","","28","35","Detecting anomalous traffic on the Internet has remained an issue of concern for the community of security researchers over the years. Advances in computing performance, in terms of processing power and storage, have allowed the use of resource-intensive intelligent algorithms, to detect intrusive activities, in a timely manner. Naive Bayes is a statistical inference learning algorithm with promise for document classification, spam detection and intrusion detection. The attribute independence issue associated with Naive Bayes has been resolved through the development of the Average One Dependence Estimator (AODE) algorithm. In this paper, we propose the application of AODE for intrusion detection. The performance of the proposed scheme is studied and analyzed on the KDD-99 intrusion benchmark data set. With a detection rate of 99.7%, AODE outperformed Naive Bayes, which reported a detection rate of 97.3%, and a larger number of false positives.","","978-1-4244-8879-7","978-0-9564263-7-6","","http://ieeexplore.ieee.org.ezproxy.rit.edu/stamp/stamp.jsp?arnumber=5749877","","Accuracy;Bayesian methods;Computational modeling;Data models;Feature extraction;Intrusion detection;Training","Bayes methods;Internet;computer network security;document handling;learning (artificial intelligence);statistical analysis;unsolicited e-mail","AODE based intrusion detection system;Internet;average one dependence estimator algorithm;computer network;document classification;intrusive activity detection;naive Bayes;resource intensive intelligent algorithm;security researcher;spam detection;statistical inference learning algorithm","","0","","23","","","21-23 Feb. 2011","","IEEE","IEEE Conference Publications"
"Design of Intelligent Checkers to Enhance the Security and Safety of Cyber Physical Systems","Sabaliauskaite, G.; Mathur, A.P.","Inf. Syst. Technol. & Design Pillar, Singapore Univ. of Technol. & Design, Singapore, Singapore","Computer Software and Applications Conference Workshops (COMPSACW), 2014 IEEE 38th International","20140922","2014","","","7","12","An approach for the design and placement of Intelligent Checkers (ICs) is presented along with an application to enhance the security and safety of a water purification system. Each IC, a smart sensor with a one-way outgoing communication over the network, monitors in real-time the status of one or more physical processes and raises an alarm when the monitored process measurements violate predefined constraints. ICs are structurally and behaviorally independent of the cyber-portion of a Cyber Physical System (CPS) and hence are much less likely to be affected by cyber attacks than the control system that monitors and controls a CPS. Thus, ICs serve as devices orthogonal to an existing intrusion detection system and assist in the early detection of successful attacks through independent monitoring of physical processes.","","","","10.1109/COMPSACW.2014.128","http://ieeexplore.ieee.org.ezproxy.rit.edu/stamp/stamp.jsp?arnumber=6903097","cyber attacks;cyber-physical systems;intelligent checkers;safety;security","Integrated circuits;Liquids;Monitoring;Process control;Purification;Security;Sensors","intelligent sensors;process control;process monitoring;safety;security of data;water treatment","CPS control;control system;cyber attacks;cyber physical systems;intelligent checker design;intrusion detection system;one-way outgoing communication;physical process;predefined constraint violation;process measurement;process monitoring;real-time status monitoring;safety enhancement;security enhancement;smart sensor;successful attack detection;water purification system","","0","","20","","","21-25 July 2014","","IEEE","IEEE Conference Publications"
"Optimization of Regular Expression Pattern Matching Circuits on FPGA","Cheng-Hung Lin; Chih-Tsun Huang; Chang-Ping Jiang; Shih-Chieh Chang","Dept. of Comput. Sci., National Tsing Hua Univ., Hsinchu","Design, Automation and Test in Europe, 2006. DATE '06. Proceedings","20060724","2006","2","","1","6","Regular expressions are widely used in network intrusion detection system (NIDS) to represent patterns of network attacks. Since traditional software-only NIDS cannot catch up to the speed advance of networks, many previous works propose hardware architectures on FPGA to accelerate attack detection. The challenge of hardware implementation is to accommodate the regular expressions to FPGAs of the large number of attacks. Although the minimization of logic equations has been studied intensively in the CAD area, the minimization of multiple regular expressions has been largely neglected. This paper presents an architecture allowing our algorithm to extract and share common sub-regular expressions. Experimental results show that our sharing scheme significantly reduces the area of regular expression circuits","","3-9810801-1-4","","10.1109/DATE.2006.244157","http://ieeexplore.ieee.org.ezproxy.rit.edu/stamp/stamp.jsp?arnumber=1657107","","Acceleration;Circuits;Equations;Field programmable gate arrays;Hardware;Impedance matching;Intrusion detection;Logic design;Minimization;Pattern matching","digital arithmetic;field programmable gate arrays;logic design;security of data","FPGA;attack detection;network attacks;network intrusion detection system;pattern matching circuits;regular expression circuits","","4","","7","","","6-10 March 2006","","IEEE","IEEE Conference Publications"
"Network Anomaly Detection: Methods, Systems and Tools","Bhuyan, M.H.; Bhattacharyya, D.K.; Kalita, J.K.","Dept. of Comput. Sci. & Eng., Tezpur Univ., Tezpur, India","Communications Surveys & Tutorials, IEEE","20140207","2014","16","1","303","336","Network anomaly detection is an important and dynamic research area. Many network intrusion detection methods and systems (NIDS) have been proposed in the literature. In this paper, we provide a structured and comprehensive overview of various facets of network anomaly detection so that a researcher can become quickly familiar with every aspect of network anomaly detection. We present attacks normally encountered by network intrusion detection systems. We categorize existing network anomaly detection methods and systems based on the underlying computational techniques used. Within this framework, we briefly describe and compare a large number of network anomaly detection methods and systems. In addition, we also discuss tools that can be used by network defenders and datasets that researchers in network anomaly detection can use. We also highlight research directions in network anomaly detection.","1553-877X","","","10.1109/SURV.2013.052213.00046","http://ieeexplore.ieee.org.ezproxy.rit.edu/stamp/stamp.jsp?arnumber=6524462","Anomaly detection;NIDS;attack;classifier;dataset;intrusion detection;tools","Computational modeling;Computer architecture;Computers;Intrusion detection;Monitoring;Sun","Internet;computer network security","network anomaly detection;network defenders;network intrusion detection methods;network intrusion detection systems","","11","","231","","2013-06-06","First Quarter 2014","","IEEE","IEEE Journals & Magazines"
"Observation Mechanism and Cost Model for Tightly Coupled Asymmetric Concurrency","Seeger, M.M.; Wolthusen, S.D.","Dept. of Secure Services, Center for Adv. Security Res. Darmstadt (CASED), Darmstadt, Germany","Systems (ICONS), 2010 Fifth International Conference on","20100513","2010","","","158","163","Whilst the precise objectives and mechanisms used by malicious code will vary widely and may involve wholly unknown techniques to achieve their respective objectives, certain second-order operations such as privilege escalation or concealment of the code's presence or activity are predictable. In particular, concealment mechanisms must modify well-known data structures, which could be detected trivially otherwise. We argue that any such mechanism is necessarily non-atomic and can hence be detected through concurrent observations forcing an interleaved linearization of the malicious code with observations of memory state changes induced in tightly coupled concurrent processing units. Extending previous research for the case of symmetric concurrent observation, we propose a computational model and observation mechanism for the case of tightly coupled asymmetric concurrent processing units as may be found in most current computing environments with particular emphasis on metrics for the cost of forced synchronization and resource contention caused by observations. We argue that the resulting observations will provide a novel sensor datum for intrusion detection but may also be used as a standalone probabilistic detection mechanism particularly suited to detect attacks in progress.","","978-1-4244-6231-5","","10.1109/ICONS.2010.34","http://ieeexplore.ieee.org.ezproxy.rit.edu/stamp/stamp.jsp?arnumber=5464146","Asymmetric Concurrency;Computational Model;Intrusion Detection;Memory Observation","Computational modeling;Computer architecture;Concurrent computing;Costs;Data structures;Information security;Interference;Intrusion detection;Kernel;Monitoring","concurrency control;data structures;invasive software","computational model;concealment mechanism;concurrent observations;concurrent processing units;cost model;data structures;forced synchronization;interleaved linearization;malicious code;observation mechanism;privilege escalation;resource contention;second-order operation;tightly coupled asymmetric concurrency","","2","","19","","","11-16 April 2010","","IEEE","IEEE Conference Publications"
"Data preprocessing for distance-based unsupervised Intrusion Detection","Said, D.; Stirling, L.; Federolf, P.; Barker, K.","Dept. of Comput. Sci., Univ. of Calgary, Calgary, AB, Canada","Privacy, Security and Trust (PST), 2011 Ninth Annual International Conference on","20110804","2011","","","181","188","Since Intrusion Detection Systems (IDSs) operate in real-time, they should be light-weighted to detect intrusions as fast as possible. Distance-based Outlier Detection (DBOD) is one of the most widely-used techniques for detecting outliers due to its simplicity and efficiency. Additionally, DBOD is an unsupervised approach which overcomes the problem of the lack of training datasets with known intrusions. However, since IDSs usually have high-dimensional datasets, using DBOD becomes subject to the curse of the dimensionality problem. Furthermore, intrusion datasets should be normalized before calculating pair-wise distance between observations. The purpose of this research is conduct a comparative study among different normalization methods in conjunction with a well-known feature extraction technique; Principle Component Analysis (PCA). Therefore, the efficiency of these methods as data preprocessing techniques can be investigated when applying DBOD to detect intrusions. Experiments were performed using two kinds of distance metrics; Euclidean distance and Mahalanobis distance. We further examined the PCA using 7 threshold values to indicate the number of Principle components to consider according to their total contribution in the variability of features. These approaches have been evaluated using the KDD Cup 1999 intrusion detection (KDD-Cup) dataset. The main purpose of this study is to find the best attribute normalization method along with the correct threshold value for PCA so that a fast unsupervised IDS can discover intrusions effectively. The results recommended using the Log normalization method combined the Euclidean distance while performing PCA.","","978-1-4577-0582-3","","10.1109/PST.2011.5971981","http://ieeexplore.ieee.org.ezproxy.rit.edu/stamp/stamp.jsp?arnumber=5971981","","Equations;Euclidean distance;Feature extraction;Intrusion detection;Principal component analysis;Training","principal component analysis;security of data;unsupervised learning","DBOD;Euclidean distance;IDS;Mahalanobis distance;PCA;data preprocessing;dimensionality problem;distance based outlier detection;distance based unsupervised intrusion detection;feature extraction technique;principle component analysis","","1","","29","","","19-21 July 2011","","IEEE","IEEE Conference Publications"
"Abstracts by ID","","","Electronic Design, 2008. ICED 2008. International Conference on","20090220","2008","","","i","157","Presents abstracts for the articles comprising the conference proceedings.","","978-1-4244-2315-6","","10.1109/ICED.2008.4786615","http://ieeexplore.ieee.org.ezproxy.rit.edu/stamp/stamp.jsp?arnumber=4786615","","","","","","0","","","","","1-3 Dec. 2008","","IEEE","IEEE Conference Publications"
