"Towards Energy-Efficient Intrusion Detection in Pervasive Computing","Bo Zhou; Qi Shi; Merabti, M.","Liverpool John Moores Univ., Liverpool","Communications, 2007. ICC '07. IEEE International Conference on","20070813","2007","","","1417","1422","In our previous work we proposed a service- oriented and user-centric intrusion detection system (SUIDS) for pervasive/ubiquitous computing. The inherent features of pervasive computing request an IDS to give special concerns about resource-efficiency. In this paper, we discuss the existing resource-efficient solutions used in intrusion detection systems and refine the SUIDS with new techniques. Specifically, the paper shows how a user profile is managed in a distributed pattern to reduce the communication cost; and how a hybrid metric is used to extend the network lifetime. As a result, SUIDS achieves better performance in terms of energy efficiency while keeping high detection effectiveness.","","1-4244-0353-7","","10.1109/ICC.2007.238","http://ieeexplore.ieee.org.ezproxy.rit.edu/stamp/stamp.jsp?arnumber=4288909","","Communications Society;Communications technology;Computer network management;Costs;Energy efficiency;Home appliances;Intrusion detection;Pervasive computing;Protection;Ubiquitous computing","security of data;ubiquitous computing","energy-efficient intrusion detection;intrusion detection systems;pervasive computing;ubiquitous computing","","0","","21","","","24-28 June 2007","","IEEE","IEEE Conference Publications"
"Security in Building Automation Systems","Granzer, W.; Praus, F.; Kastner, W.","Autom. Syst. Group, Vienna Univ. of Technol., Vienna, Austria","Industrial Electronics, IEEE Transactions on","20101011","2010","57","11","3622","3630","Building automation systems are traditionally concerned with the control of heating, ventilation, and air conditioning, as well as lighting and shading, systems. They have their origin in a time where security has been considered as a side issue at best. Nowadays, with the rising desire to integrate security-critical services that were formerly provided by isolated subsystems, security must no longer be neglected. Thus, the development of a comprehensive security concept is of utmost importance. This paper starts with a security threat analysis and identifies the challenges of providing security in the building automation domain. Afterward, the security mechanisms of available standards are thoroughly analyzed. Finally, two approaches that provide both secure communication and secure execution of possibly untrusted control applications are presented.","0278-0046","","","10.1109/TIE.2009.2036033","http://ieeexplore.ieee.org.ezproxy.rit.edu/stamp/stamp.jsp?arnumber=5332331","Building automation;embedded networks;integration;security","Air conditioning;Automatic control;Automation;Communication system control;Communication system security;Control systems;Heating;Lighting control;Temperature control;Ventilation","building management systems;computer network security;home automation;message authentication","air conditioning control;building automation system;heating control;security critical service;security threat analysis;ventilation control","","22","","41","","2009-11-13","Nov. 2010","","IEEE","IEEE Journals & Magazines"
"Anomaly Behavior Analysis for Web Page Inspection","Chia-Mei Chen; Wan-Yi Tsai; Hsiao-Chung Lin","Nat. Sun Yat-Sen Univ., Kaohsiung, Taiwan","Networks and Communications, 2009. NETCOM '09. First International Conference on","20100115","2009","","","358","363","As the Internet prevails, people access web services directly via web browsers over the network. However, most websites are not developed with sufficient security consideration. Hackers have taken the advantage of web application vulnerabilities to inject malicious codes into web pages. A victim who visits such a malicious web page will be compromised. Therefore, an efficient malicious web detection method is needed to prevent users from being compromised. Based on our observation, malicious web pages have uncommon behavior in order to evade from detection of Antivirus software. The anomaly behavior such as code encoding makes malicious web pages different from normal benign web pages. Current researches have noticed pattern-matching approach is not suitable to detect malicious web pages anymore, and then proposes a new detection method. The proposed method, a client-side malicious web page detection method, is based on anomaly behavior analysis. It focuses on distinguishing the behavior difference between malicious and benign web pages. The experimental results show that the proposed method can identify malicious web pages and alarm the website visitors efficiently.","","978-1-4244-5364-1","978-0-7695-3924-9","10.1109/NetCoM.2009.72","http://ieeexplore.ieee.org.ezproxy.rit.edu/stamp/stamp.jsp?arnumber=5383961","Anomaly behavior;Drive-by download;Malicious webpage","Application software;Banking;Computer hacking;Data security;Inspection;Java;Monitoring;Web and internet services;Web pages;Web services","Internet;security of data","Internet;Web browser;Web page inspection;Web service;anomaly behavior analysis;antivirus software;client side malicious Web page detection method;code encoding;malicious Web detection method;pattern matching approach","","2","","10","","","27-29 Dec. 2009","","IEEE","IEEE Conference Publications"
"On the Effectiveness of Monitoring for Intrusion Detection in Mobile Ad Hoc Networks","Boppana, R.V.; Xu Su","Dept. of Comput. Sci., Univ. of Texas at San Antonio, San Antonio, TX, USA","Mobile Computing, IEEE Transactions on","20110620","2011","10","8","1162","1174","Several intrusion detection techniques (IDTs) proposed for mobile ad hoc networks rely on each node passively monitoring the data forwarding by its next hop. This paper presents quantitative evaluations of false positives and their impact on monitoring-based intrusion detection for ad hoc networks. Experimental results show that, even for a simple three-node configuration, an actual ad hoc network suffers from high false positives; these results are validated by Markov and probabilistic models. However, this false positive problem cannot be observed by simulating the same network using popular ad hoc network simulators, such as ns-2, OPNET or Glomosim. To remedy this, a probabilistic noise generator model is implemented in the Glomosim simulator. With this revised noise model, the simulated network exhibits the aggregate false positive behavior similar to that of the experimental testbed. Simulations of larger (50-node) ad hoc networks indicate that monitoring-based intrusion detection has very high false positives. These false positives can reduce the network performance or increase the overhead. In a simple monitoring-based system where no secondary and more accurate methods are used, the false positives impact the network performance in two ways: reduced throughput in normal networks without attackers and inability to mitigate the effect of attacks in networks with attackers.","1536-1233","","","10.1109/TMC.2010.210","http://ieeexplore.ieee.org.ezproxy.rit.edu/stamp/stamp.jsp?arnumber=5620919","Mobile ad hoc networks;analytical models;false positives;intrusion detection;noise modeling;passive monitoring;performance analysis.","Ad hoc networks;Analytical models;Intrusion detection;Markov processes;Monitoring;Noise;Noise measurement","Markov processes;mobile ad hoc networks;telecommunication security","Glomosim simulator;Markov models;data forwarding;false positive behavior;mobile ad hoc networks;monitoring-based intrusion detection;probabilistic noise generator model;revised noise model;three-node configuration","","3","","32","","2010-11-09","Aug. 2011","","IEEE","IEEE Journals & Magazines"
"Curve-Based Planar Graph Routing in Multihop Wireless Networks","Frey, H.; Hollick, M.; Loch, A.","Dept. of Comput. Sci., Comput. Networks Group, Univ. Paderborn, Paderborn, Germany","Mobile Adhoc and Sensor Systems (MASS), 2011 IEEE 8th International Conference on","20111114","2011","","","149","151","Scalability of routing algorithms is a critical issue in large multihop wireless networks. In this sense, approaches like localized geographic routing are very promising. Existing schemes base routing path construction on faces defined by the planar graph of the network. Once running on a particular planar graph, none of the existing schemes is flexible enough to adapt the sequence of faces visited by the constructed path. To address this problem, we extend planar graph routing with one further degree of freedom: control over the sequence of visited faces. Basically, our face routing extension now follows a sequence of faces intersected by any curve we can freely adjust. We motivate our work by discussing application scenarios that benefit from our scheme and suggest basic mechanisms for choosing appropriate curves. We further present preliminary results from an implementation of our curve-based routing scheme.","2155-6806","978-1-4577-1345-3","","10.1109/MASS.2011.127","http://ieeexplore.ieee.org.ezproxy.rit.edu/stamp/stamp.jsp?arnumber=6076605","Algorithms;localized routing;network protocols;routing algorithms;wireless multihop networks","Ad hoc networks;Joining processes;Mobile computing;Routing;Spread spectrum communication;Trajectory;Wireless networks","radio networks;routing protocols;telecommunication network reliability","curve-based planar graph routing;face routing extension;localized geographic routing;multihop wireless network;network protocol;routing algorithm scalability","","0","","10","","","17-22 Oct. 2011","","IEEE","IEEE Conference Publications"
"Protection against data drop, an enhanced security model of authentication protocol for Ad-hoc N/w","Mahajan, R.K.; Patil, S.M.","Dept. of Electron. Eng., Mumbai Univ., Navi Mumbai, India","Electrical, Electronics, Signals, Communication and Optimization (EESCO), 2015 International Conference on","20150910","2015","","","1","4","Effective network security may targets a plenty of threats and also avoids them from entering or opening out on a network. An attack in Mobile Ad hoc NETwork (MANET) is due to unreliability, unfixed topology, limited battery power and lack of centralized control. The first line of defense solutions is Encryption and authentication which are not adequate to protect MANETs from packet dropping attacks. Existing IDSs for MANETS depend on the Watchdog technique. In existing system Researchers main attraction is on designing new prevention, detection and response mechanism for MANETs. The scheme will identify, supervise and observe the malicious nodes without adjusting the performances in the network. The motivation is to overcome the issues such as limited transmission power, packet dropping, receiver collision and false misbehavior reports generation of the Watchdog system. In this paper, we proposed a new the Modified Version of EAACK based IDS that is used to overcome the MANET attacks. Elliptic Curve Digital signature Algorithm (ECDSA) is use to authenticate the acknowledgment packets used in the propose work to overcome drawbacks in the security level.","","978-1-4799-7676-8","","10.1109/EESCO.2015.7253867","http://ieeexplore.ieee.org.ezproxy.rit.edu/stamp/stamp.jsp?arnumber=7253867","Elliptic Curve Digital Signature Algorithm (ECDSA);Enhanced Adaptive ACKnowledgment (EAACK);Mobile Adhoc NETwork (MANET)","Ad hoc networks;Atmospheric modeling;Authentication;Cryptography;Logic gates;Mobile computing;Programmable logic arrays","cryptographic protocols;digital signatures;mobile ad hoc networks;public key cryptography","EAACK based IDS;ECDSA;MANET;authentication protocol;data drop;elliptic curve digital signature algorithm;enhanced security model;mobile ad hoc network;network security;packet dropping attacks;watchdog technique","","0","","","","","24-25 Jan. 2015","","IEEE","IEEE Conference Publications"
"Hybrid Transactions: Lock Allocation and Assignment for Irrevocability","Sreeram, J.; Santosh Pande","","Parallel & Distributed Processing Symposium (IPDPS), 2012 IEEE 26th International","20120816","2012","","","1192","1203","Irrevocable Software Memory Transactions provide a safe way to perform certain unrecoverable operations such as I/O or system calls inside transactions. In this paper we show that this notion of irrevocability has strong relevance and impact on the performance and throughput of a transactional program. In this paper we propose a compile-time analysis and transactional memory runtime system that allows several irrevocable transactions to execute concurrently with normal revocable transactions unlike state-of-the-art methods that allow for at most one irrevocable transaction at a time. Our approach uses a compile-time analysis to derive a fine-grained lock-assignment scheme using a precise context-sensitive data structure analysis that is able to identify disjoint logical data structures. We describe the prototype implementation of our system in the LLVM compiler and TL2 STM system and evaluate the parallel performance of our system on high-contention transactional programs in the STAMP suite.","1530-2075","978-1-4673-0975-2","","10.1109/IPDPS.2012.109","http://ieeexplore.ieee.org.ezproxy.rit.edu/stamp/stamp.jsp?arnumber=6267922","irrevocable;lock assignment;software transactions","Concurrent computing;Data structures;Interference;Memory management;Runtime;Software;Synchronization","concurrency control;data structures;program compilers;shared memory systems","I/O;LLVM compiler;STAMP suite;TL2 STM system;compile-time analysis;context-sensitive data structure analysis;fine-grained lock-assignment scheme;high-contention transactional programs;hybrid transactions;irrevocable software memory transactions;lock allocation;lock assignment;normal revocable transactions;system calls;transactional memory runtime system;transactional program;unrecoverable operations","","0","","20","","","21-25 May 2012","","IEEE","IEEE Conference Publications"
"Reducing false positives through fuzzy alert correlation in collaborative intelligent intrusion detection systems  A review","Elshoush, H.T.; Osman, I.M.","Dept. of Comput. Sci., Univ. of Khartoum, Khartoum, Sudan","Fuzzy Systems (FUZZ), 2010 IEEE International Conference on","20100923","2010","","","1","8","As complete prevention of computer attacks is not possible, intrusion detection systems (IDS) play a very important role in minimizing the damage caused by different computer attacks. There are two intrusion detection methods: namely misuse- and anomaly-based. A collaborative intelligent intrusion detection system (CIIDS) is proposed to include both methods, since it is concluded from recent research that the performance of an individual detection engine is rarely satisfactory. In particular, two main challenges in current collaborative intrusion detection systems (CIDSs) research are highlighted and reviewed: CIDS architectures and alert correlation algorithms. The focus will be on correlation of CIIDS alerts. At the end of the review, the paper suggests fuzzy logic and other AI techniques to be exploited to reduce the rate of false alarms while keeping the detection rate high. In conclusion, the paper highlights opportunities for an integrated solution to large-scale CIIDS.","1098-7584","978-1-4244-6919-2","","10.1109/FUZZY.2010.5584418","http://ieeexplore.ieee.org.ezproxy.rit.edu/stamp/stamp.jsp?arnumber=5584418","","Artificial intelligence;Collaboration;Correlation;Detectors;Intrusion detection;Protocols","security of data","collaborative intelligent intrusion detection system;computer attacks;false positives;fuzzy alert correlation;fuzzy logic","","1","","25","","","18-23 July 2010","","IEEE","IEEE Conference Publications"
"Scalable and Performance-Efficient Client Honeypot on High Interaction System","Akiyama, M.; Kawakoya, Y.; Hariu, T.","Secure Platform Labortories, NTT Corp., Musashino, Japan","Applications and the Internet (SAINT), 2012 IEEE/IPSJ 12th International Symposium on","20120920","2012","","","40","50","We investigated client honeypots for detecting and circumstantially analyzing drive-by download attacks. A client honeypot requires both improved inspection performance and in-depth analysis for inspecting and discovering malicious websites. However, OS overhead in recent client honeypot operation cannot be ignored for improving honeypot multiplication performance. We propose a client honeypot client system that uses our proposed multi-OS and multi-process honeypot multiplication approaches and implemented this system to evaluate its performance. Our process sandbox mechanism, a security measure for our multi-process approach, creates a virtually isolated environment for each web browser. In a field trial, we confirmed that the use of our multi-process approach was three or more times faster than that of a single process and [our multi-OS approach lineally improved system performance according to the number of honeypot instances. Thus, our proposed multiplication approaches improve performance efficiency and enables in-depth analysis on high interaction systems.","","978-1-4673-2001-6","978-0-7695-4737-4","10.1109/SAINT.2012.15","http://ieeexplore.ieee.org.ezproxy.rit.edu/stamp/stamp.jsp?arnumber=6305259","client honeypot;intrusion detection;malware;sandbox","Browsers;Inspection;Kernel;Malware;Monitoring;Process control;Rendering (computer graphics)","Web sites;online front-ends;operating systems (computers);security of data","OS overhead;Web browser;drive-by download attacks;high interaction system;inspection performance;malicious Websites;multiOS;multiprocess honeypot multiplication approaches;performance-efficient client honeypot;process sandbox mechanism;scalable client honeypot;security measure;virtually isolated environment","","0","","10","","","16-20 July 2012","","IEEE","IEEE Conference Publications"
"SPITFIRE: toward a semantic web of things","Pfisterer, D.; Romer, K.; Bimschas, D.; Kleine, O.; Mietz, R.; Cuong Truong; Hasemann, H.; Kro&#x0308;ller, A.; Pagel, M.; Hauswirth, M.; Karnstedt, M.; Leggieri, M.; Passant, A.; Richardson, R.","Univ. of Lubeck, Lubeck, Germany","Communications Magazine, IEEE","20111110","2011","49","11","40","48","The developed world is awash with sensors. However, they are typically locked into unimodal closed systems. To unleash their full potential, access to sensors should be opened such that their data and services can be integrated with data and services available in other information systems, facilitating novel applications and services that are based on the state of the real world. We describe our vision and architecture of a Semantic Web of Things: a service infrastructure that makes the deployment and use of semantic applications involving Internet-connected sensors almost as easy as building, searching, and reading a web page today.","0163-6804","","","10.1109/MCOM.2011.6069708","http://ieeexplore.ieee.org.ezproxy.rit.edu/stamp/stamp.jsp?arnumber=6069708","","Communication protocols;Ontologies;Resource description framework;Semantics;Sensor phenomena and characterization;Sensors","semantic Web;sensors","Internet-connected sensors;SPITFIRE;Web page;information systems;semantic Web of things;sensors;unimodal closed systems","","35","1","","","","November 2011","","IEEE","IEEE Journals & Magazines"
"HVSM: An In-Out-VM security monitoring architecture in IAAS cloud","Yaqiang Mao; Xujian Chen; Yuan Luo","Comput. Sci. & Eng. Dept., Shanghai Jiao Tong Univ., Shanghai, China","Information and Network Security, ICINS 2014 - 2014 International Conference on","20150625","2014","","","185","192","As a basic cloud service model, the Infrastructure-as-aService (IaaS) provides fundamental computing resources for PaaS and SaaS with a guaranteed ability to reduce costs and improve resource efficiency. Virtualization plays a crucial role to support the IaaS. However, it is not safety because of exposing the hosted virtual machines (VMs) to uncontrollable environment. In addition, traditional in-guest security solutions, relying on operation system kernel trustworthiness, are no longer effective to virtual infrastructure. In this paper, we introduce HVSM (Hybrid Virtualization Security Monitor) to deal with above security problems, which is a new In-OutVM hybrid virtualization-aware architecture depending on lightweight, comprehensive and dynamic security monitoring. First, as to Hybrid, HVSM utilizes virtual machine introspection technique to inspect kernel running state of the guest VM (GVM) from outside. Inside the GVM, measure agent (MA) tests and delivers processes' integrity information to security VM (SVM). In succession, MA is in the guard of measure agent keeper (MAK) running in the SVM. Second, dynamically, HVSM combines kernel state information with processes' integrity so as to provide a security report on GVM. Third, a proof-of-concept prototype is implemented using libvmi based on Xen hypervisor. Finally, we evaluate efficiency and the performance overhead of HVSM, which is acceptably low to support real-time monitoring.","","978-1-84919-909-4","","10.1049/cp.2014.1285","http://ieeexplore.ieee.org.ezproxy.rit.edu/stamp/stamp.jsp?arnumber=7133816","Hybrid Security Monitor;IaaS Security;Integrity Measurement;Virtual Machine Introspection;Xen","","cloud computing;cost reduction;multi-agent systems;operating system kernels;resource allocation;security of data;virtual machines;virtualisation","GVM;HVSM;IAAS cloud;MA test;MAK;PaaS;SVM;SaaS;Xen hypervisor;cost reduction;dynamic security monitoring;guest VM;hosted virtual machines;hybrid virtualization security monitor;in-guest security solutions;in-out-VM hybrid virtualization-aware architecture;in-out-VM security monitoring architecture;infrastructure-as-a service;kernel running state;kernel state information;libvmi;measure agent keeper;measure agent test;operation system kernel trustworthiness;process integrity;resource efficiency;security VM;virtual machine introspection technique","","0","","","","","14-16 Nov. 2014","","IET","IET Conference Publications"
"A Dynamic Honeypot Design for Intrusion Detection","Kuwatly, I.; Sraj, M.; Al Masri, Z.; Artail, H.","American University of Beirut, Lebanon","Pervasive Services, 2004. ICPS 2004. IEEE/ACS International Conference on","20050117","2004","","","95","104","A modern technology in the area of intrusion detection is honeypot technology that unlike common IDSs tends to provide the attacker with all the necessary resources needed for a successful attack. Honeypots provide a platform for studying the methods and tools used by the intruders (blackhat community), thus deriving their value from the unauthorized use of their resources. This paper discusses the design of a dynamic honeypot, which is an autonomous honeypot capable of adapting in a dynamic and constantly changing network environment. The dynamic honeypot approach integrates passive or active probing and virtual honeypots. This approach addresses the challenge of deploying and configuring virtual honeypots.","","0-7695-2535-0","","10.1109/PERSER.2004.3","http://ieeexplore.ieee.org.ezproxy.rit.edu/stamp/stamp.jsp?arnumber=1372012","","Computer crime;Computer network management;Computer security;Computerized monitoring;Data security;Face detection;Intrusion detection;Probes;Telecommunication traffic;Virtual private networks","","","","5","2","17","","","19-23 July 2004","","IEEE","IEEE Conference Publications"
