"Preventing SQL injection attacks using negative tainting approach","Gadgikar, A.S.","Dept. of Comput. Eng., D.Y. Patil Coll. of Eng., Pune, India","Computational Intelligence and Computing Research (ICCIC), 2013 IEEE International Conference on","20140127","2013","","","1","5","One of the major issues of web application security is SQL injection attacks, which gives attackers an unrestricted access to the database. Preventing SQL Injection attacks using negative tainting approach is an idea of incorporating the uniqueness of negative tainting with linked list structure. As most of the tools available today concentrates on positive tainting technique, less work has been done on negative tainting. So this approach has been chosen and it provides good response time for application programs where large databases are used. This system is able to stop most of the known successful attacks except stored procedures and character encoding attacks and generates very less (negligible) false positives.","","978-1-4799-1594-1","","10.1109/ICCIC.2013.6724140","http://ieeexplore.ieee.org.ezproxy.rit.edu/stamp/stamp.jsp?arnumber=6724140","SQL Injection;negative tainting;positive tainting","Computational intelligence;Conferences;Data mining;Databases;Runtime;Security;Servers","SQL;security of data","SQL injection attack;Web application security;negative tainting approach;positive tainting","","0","","19","","","26-28 Dec. 2013","","IEEE","IEEE Conference Publications"
"A Survey of Trust in Workflows and Relevant Contexts","Viriyasitavat, W.; Martin, A.","Dept. of Stat., Chulalongkorn Univ., Bangkok, Thailand","Communications Surveys & Tutorials, IEEE","20120727","2012","14","3","911","940","With the fast-growing Internet technology, several service-based interactions are prevalent and appear in several forms such as e-commerce, content provider, Virtual Organizations, Peer-to-Peer, Web Service, Grids, Cloud Computing, and individual interactions. This demands for an effective mechanism to establish trust among participants in a high-level abstract way, capturing relevant factors ranging on Service Level Agreement, security policies, requirements, regulations, constraints, Quality of Service, reputation, and recommendation. Trust is platform-independent and flexible to be seamlessly integrated into heterogeneous domains and interoperate with different security solutions in distributed environments. Establishing trust in a service workflow leads to the willingness of services to participate. Coordinating service workflows without trust consideration may pose higher risks, possibly results in poor performance, additional vulnerabilities, or failures. Although trust in service workflows and relevant contexts has been studied for a past decade, the standard development is still immature. Nowadays, trust approaches to service workflows comprise a large area of research where one can hardly classify into a comprehensive survey. This survey examines and explores the role of trust in service workflows and their contexts from a wide variety of literatures. Various mechanisms, architecture, techniques, standards, and frameworks are explained along the way with discussions. Working trust definition and classification are newly provided and supported with examples.","1553-877X","","","10.1109/SURV.2011.072811.00081","http://ieeexplore.ieee.org.ezproxy.rit.edu/stamp/stamp.jsp?arnumber=5989901","Security;Trust;Wowkflows","Companies;Context;Permission;Reliability","Internet;security of data","Internet technology;distributed environments;quality of service;security policies;security solutions;service level agreement;service workflow trust;service-based interactions","","3","","230","","2011-08-18","Third Quarter 2012","","IEEE","IEEE Journals & Magazines"
"A Modified Multi-Resolution Approach for Port Scan Detection","Hwashin Moon; Sungwon Yi; Keeseong Cho","Broadcasting & Telecommun. Convergence Res. Lab., Electron. & Telecommun. Res. Inst., Daejeon, South Korea","Global Telecommunications Conference (GLOBECOM 2010), 2010 IEEE","20110110","2010","","","1","5","Although port scan detection techniques have been widely adopted by the modern network based security systems, the effectiveness of these techniques can significantly be limited since the detection performance heavily relies on the statically determined detection threshold. To tackle the problem, a multi-resolution approach called MRDS, maintaining multiple monitoring windows with the corresponding detection thresholds, has been proposed. However, deploying such technique in a high speed network is not easy due to the time and space complexity required for calculating the number of unique destination addresses contacted in the multiple monitoring windows. In this paper, we present a novel failed flow dispersion estimation technique, called Multi-Window State Map (MWSM), which requires a small amount of memory and a constant number of memory access for implementing the multi-resolution concept. We then extend the proposed MWSM into a complete port scan detector. Simulation results with real world traffic traces indicate that the proposed estimation technique manages the expected relative error and average standard error of less than 0.8% and 9% respectively and thus the MWSM based detection scheme reduces false positives by 60% compared to MRDS.","1930-529X","978-1-4244-5636-9","978-1-4244-5637-6","10.1109/GLOCOM.2010.5684064","http://ieeexplore.ieee.org.ezproxy.rit.edu/stamp/stamp.jsp?arnumber=5684064","","Detectors;Dispersion;Estimation;Internet;Memory management;Monitoring;Security","estimation theory;telecommunication security","detection performance;flow dispersion estimation;multi resolution approach;multi-window state map;multiple monitoring windows;port scan detection;security systems;space complexity;time complexity","","0","","17","","","6-10 Dec. 2010","","IEEE","IEEE Conference Publications"
"Research of detecting e-business fraud based on data mining","Ma Jun","Dept. of Econ. & Bus. Adm., Luoyang Inst. of Sci. & Technol., Luoyang, China","Computer Science and Network Technology (ICCSNT), 2011 International Conference on","20120412","2011","4","","2201","2204","The advent of electronic business (e-business) has made a large change in the way of business. Electronic business growth has increased very much in a great deal of practices. Researchers have posed rules-based auditing systems for electronic business transactions, but they rely on the auditor's knowledge of e-business fraud highly. While fraud happen, it is difficult to deal with by business systems due to the large number of online transactions. In this paper, we introduce a method that to bring about rules from fraud patterns based on data mining. Nextly, the system can distinguish transactions that have a high chance be deceptive by making use of these rules to e-business databases.","","978-1-4577-1586-0","","10.1109/ICCSNT.2011.6182413","http://ieeexplore.ieee.org.ezproxy.rit.edu/stamp/stamp.jsp?arnumber=6182413","auditing systems;data mining;e-business","Databases;Manuals","auditing;data mining;electronic commerce;fraud;knowledge based systems;security of data;transaction processing","auditor knowledge;data mining;e-business fraud detection;electronic business transactions;online transactions;rule-based auditing systems","","1","","8","","","24-26 Dec. 2011","","IEEE","IEEE Conference Publications"
"Virtual-Machine-based Intrusion Detection on File-aware Block Level Storage","Youhui Zhang; Yu Gu; Hongyi Wang; Dongsheng Wang","Tsinghua Nat. Lab. for Inf. Sci. & Technol., Tsinghua Univ., Beijing","Computer Architecture and High Performance Computing, 2006. SBAC-PAD '06. 18TH International Symposium on","20061219","2006","","","185","192","In this paper we present a storage-based intrusion detection system (IDS) that makes use of advantages of virtual machine (VM) and smart disk technologies. The virtual machine monitor (VMM) can prevent the IDS itself from potential attacks while the smart disk technology provides IDS with a whole view of the file system of the monitored VM. We show how to use a tool and some file system knowledge to enable the virtual disk to maintain a sector-to-file mapping table (called file-aware block level storage) as well as how to detect the changes to file content on-line. Based on these features, normal file-level intrusion detection (ID) rules can be converted to sector-level ones in order to integrate ID functions to the virtual storage. We implement such a prototype based on QEMU VMM and the OS of VM is Windows XP. Moreover the time overhead introduced by this solution is tested","1550-6533","0-7695-2704-3","","10.1109/SBAC-PAD.2006.32","http://ieeexplore.ieee.org.ezproxy.rit.edu/stamp/stamp.jsp?arnumber=4032431","","Condition monitoring;File systems;Information science;Intrusion detection;Laboratories;Prototypes;Testing;Virtual machine monitors;Virtual machining;Virtual manufacturing","security of data;system monitoring;virtual machines;virtual storage","file system monitoring;file-aware block level storage;sector-to-file mapping table;smart disk;storage-based intrusion detection system;virtual machine monitor;virtual storage;virtual-machine-based intrusion detection","","3","3","20","","","Oct. 2006","","IEEE","IEEE Conference Publications"
"Security technology in virtualization system: State of the art and future direction","Xiaorui Wang; Qingxian Wang; Xiaolong Hu; Jianping Lu","China Nat. Digital Switching Syst. Eng. & Technol. Res. Center, Zhengzhou, China","Information Science and Control Engineering 2012 (ICISCE 2012), IET International Conference on","20140306","2012","","","1","7","As a new abstraction layer in computer system, virtualization not only played an important role in improving the resource utilization, its isolated nature has also been used to enhance the security of the operating system, it is an important direction of current security research. In this paper, we make a comprehensive analysis of security technology based on virtualization, and give the characteristics of four types of typical security systems and its key technologies, including virtual machine-based intrusion detection, virtual machine-based kernel protection, virtual machine-based access control, virtual machine-based trusted computing. By focus on the statistical analysis of 35 kinds of security model, we give the problems of current research about threat model establishment, VMM self-protection, as well as formal verification. Finally, we discuss the future direction of research on virtualization security in depth.","","","978-1-84919-641-3","10.1049/cp.2012.2392","http://ieeexplore.ieee.org.ezproxy.rit.edu/stamp/stamp.jsp?arnumber=6755771","access control;intrusion detection;malware;safety protection;virtualization","","operating systems (computers);program verification;security of data;trusted computing;virtual machines;virtualisation","VMM self-protection;abstraction layer;computer system;formal verification;operating system;resource utilization;security technology;virtual machine-based access control;virtual machine-based intrusion detection;virtual machine-based kernel protection;virtual machine-based trusted computing;virtualization security;virtualization system","","0","","","","","7-9 Dec. 2012","","IET","IET Conference Publications"
"Building an inter-IDS central analysis platform in the network center of China's Central Bank","Zhao, Z.","ECE Dept., Drexel Univ., Philadelphia, PA","Collaborative Technologies and Systems, 2005. Proceedings of the 2005 International Symposium on","20051219","2005","","","113","119","In this paper, we present a new model that makes use of currently-separate intrusion detection systems (IDS) to share intersystem alarm information between homogeneous protected systems. The goal is to improve the overall intrusion detection performance provided by the IDSs used in China's commercial banking system. This model focuses mainly on improving the average intrusion detection performance of the collection of IDSs by making the subscribed IDSs cooperate. The estimates presented in this paper show that this proposal results in a valuable improvement of the whole banking system's security compared to the cost and overhead to the network","","0-7695-2387-0","","10.1109/ISCST.2005.1553302","http://ieeexplore.ieee.org.ezproxy.rit.edu/stamp/stamp.jsp?arnumber=1553302","","Acquired immune deficiency syndrome;Banking;Costs;Event detection;Government;Information security;Intelligent networks;Intrusion detection;Proposals;Protection","bank data processing;security of data","China Central Bank;IDS central analysis platform;commercial banking system;intersystem alarm information;intrusion detection system;network security","","0","","18","","","20-20 May 2005","","IEEE","IEEE Conference Publications"
"E-LEACH: Improving the LEACH protocol for privacy preservation in secure data aggregation in Wireless Sensor Networks","Patel, H.B.; Jinwala, D.C.","Comput. Eng. Dept., S.V. Nat. Inst. of Technol., Surat, India","Industrial and Information Systems (ICIIS), 2014 9th International Conference on","20150212","2014","","","1","5","The Wireless Sensor Networks (WSNs) after their emergence have triggered many active research areas; not because of low-scale hardware design but also due to a wide spectrum of its potential applications being in day-to-day areas of our life. However, because of the ubiquitous and pervasive computing paradigm that the WSNs foster and because of the resource constrained characteristic, security & privacy issues therein assume critical investigation. Amongst many potential aspects of investigation, one has been the design of a secure routing protocol in which a value sensed to be delivered to an appropriate receiver securely and efficiently with least amount of energy consumption. We observe that LEACH (Low Energy Adaptive Clustering Hierarchy) is a popular clustering based protocol used in WSNs. However, the same lacks any security support. Amongst numerous improvements of LEACH suggested to incorporate security & privacy, we observe that none, to the best of our knowledge offers end-to-end privacy using the homomorphic encryption schemes. We propose here an improvement of LEACH viz. E-LEACH (end-to-end secure LEACH) which uses homomorphic encryption to provide secure data aggregation in Wireless Sensor Networks. Due to the algebraic characteristics in homomorphic encryption, data can be algebraically aggregated without decryption and hence require least amount of energy, while ensuring privacy.","","978-1-4799-6499-4","","10.1109/ICIINFS.2014.7036607","http://ieeexplore.ieee.org.ezproxy.rit.edu/stamp/stamp.jsp?arnumber=7036607","Clustering;Homomorphic Encryption;LEACH;Secure Data Aggregation","Base stations;Encryption;Routing protocols;Steady-state;Wireless sensor networks","cryptographic protocols;data privacy;energy consumption;routing protocols;wireless sensor networks","E-LEACH;WSN;clustering based protocol;end-to-end privacy;end-to-end secure LEACH;energy consumption;homomorphic encryption schemes;low energy adaptive clustering hierarchy;pervasive computing paradigm;receiver securely;resource constrained characteristic;secure data aggregation;secure routing protocol;ubiquitous computing paradigm;wireless sensor networks","","0","","16","","","15-17 Dec. 2014","","IEEE","IEEE Conference Publications"
"Non-Stationary Markov Models and Anomaly Propagation Analysis in IDS","Tokhtabayev, A.G.; Skormin, V.A.","Binghamton Univ., Binghamton","Information Assurance and Security, 2007. IAS 2007. Third International Symposium on","20070910","2007","","","203","208","We propose an anomaly based IDS that results in a decreased rate of false positives. It employs the new means of host-based detection in the system call domain with correlating anomalies reported by different hosts to the IDS server. A novel anomaly detection mechanism operating at the host level treats an application or service as a non-stationary stochastic process and models it as a non- stationary Markov chain that significantly improves model accuracy. A server-based procedure for the detection of anomaly propagation is employed. While false alarms do not propagate within the network, detected anomaly propagation with a high degree of certainty can be attributed to a computer worm; otherwise the alarms are to be treated as false positives.","","0-7695-2876-7","978-0-7695-2876-2","10.1109/IAS.2007.72","http://ieeexplore.ieee.org.ezproxy.rit.edu/stamp/stamp.jsp?arnumber=4299775","Anomaly Propagation;Intrusion detection;Markov Models","Buffer overflow;Computer security;Computer worms;Frequency;Histograms;Information analysis;Information security;Intrusion detection;Stochastic processes;Viruses (medical)","Markov processes;invasive software","IDS server;anomaly detection mechanism;anomaly propagation analysis;anomaly propagation detection;computer worm;host-based detection;nonstationary Markov chain;nonstationary Markov models;nonstationary stochastic process;server-based procedure;system call domain","","1","","13","","","29-31 Aug. 2007","","IEEE","IEEE Conference Publications"
"Development of cyber security testbed for critical infrastructure","Jarmakiewicz, J.; Maslanka, K.; Parobczak, K.","Dept. of Electron., Mil. Univ. of Technol., Warsaw, Poland","Military Communications and Information Systems (ICMCIS), 2015 International Conference on","20150716","2015","","","1","10","The paper describes a critical infrastructure testbed environment for SCADA (Supervisory Control and Data Acquisition) cyber security evaluation and assessment. This includes results of the performed analysis of important features of the critical infrastructure for determination of testbed architecture. As a result the ontology of security for critical infrastructure domain, ontology of protection elements and corresponding taxonomies of infrastructure elements and threats were proposed. A brief survey of the critical infrastructure threats and countermeasure tools was carried out. The proposed environment reflects the real control and supervision substation of electricity generation and distribution control system. SCADA system uses IEC 60870-5-104 and IEC 61850 protocols encapsulated in IPv4 datagrams. The structure of the built testbed environment was shown and its software and hardware components were described. Traffic samples collected from real power IP control and management network for use within testbed generators were analyzed and described.","","978-8-3934-8485-0","","10.1109/ICMCIS.2015.7158687","http://ieeexplore.ieee.org.ezproxy.rit.edu/stamp/stamp.jsp?arnumber=7158687","SCADA;critical infrastructure;ontology;security;testbed;threats","Cascading style sheets;Generators;IEC standards;SCADA systems;Security;Taxonomy","IEC standards;IP networks;SCADA systems;ontologies (artificial intelligence);power distribution control;power engineering computing;power generation control;security of data","IEC 60870-5-104 protocol;IEC 61850 protocol;IPv4 datagrams;SCADA;critical infrastructure testbed environment;cyber security evaluation;cyber security testbed;distribution control system;electricity generation;hardware component;infrastructure elements;management network;ontology;protection elements;real power IP control;software component;supervision substation;supervisory control and data acquisition;testbed architecture;testbed generators","","0","","46","","","18-19 May 2015","","IEEE","IEEE Conference Publications"
"Network processor acceleration for a Linux* netfilter firewall","Accardi, K.; Bock, T.; Hady, F.; Krueger, J.","Intel Corp., Hillsboro, OR","Architecture for networking and communications systems, 2005. ANCS 2005. Symposium on","20081117","2005","","","115","123","Network firewalls occupy a central role in computer security, protecting data, compute, and networking resources while still allowing useful packets to flow. Increases in both the work per network packet and packet rate make it increasingly difficult for general-purpose processor based firewalls to maintain line rate. In a bid to address these evolving requirements we have prototyped a hybrid firewall, using a simple firewall running on a network processor to accelerate a Linux* Netfilter Firewall executing on a general purpose processor. The simple firewall on the network processor provides high rate packet processing for all the packets while the general-purpose processor delivers high rate, full featured firewall processing for those packets that need it. This paper describes the hybrid firewall prototype with a focus on the software created to accelerate Netfilter with a network processor resident firewall. Measurements show our hybrid firewall able to maintain close to 2 Gb/sec line rate for all packet sizes, a significant improvement over the original firewall. We also include the hard won lessons learned while implementing the hybrid firewall.","","978-1-59593-082-8","","","http://ieeexplore.ieee.org.ezproxy.rit.edu/stamp/stamp.jsp?arnumber=4675271","hybrid firewall;netfilter;network firewall;network processor;prototype;throughput","Acceleration;Computer networks;Computer security;Information filtering;Information filters;Linux;Local area networks;Permission;Protection;Prototypes","Linux;authorisation;microprocessor chips","Linux Netfilter firewall;general-purpose processor;network firewalls;network processor acceleration","","1","3","15","","","26-28 Oct. 2005","","IEEE","IEEE Conference Publications"
"Distributed Intrusion Detection with Intelligent Network Interfaces for Future Networks","Yan Luo; Ke Xiang; Jie Fan; Chunhui Zhang","Dept. of Electr. & Comput. Eng., Univ. of Massachusetts, Lowell, MA, USA","Communications, 2009. ICC '09. IEEE International Conference on","20090811","2009","","","1","5","Intrusion detection remains an important and challenging task in current and next generation networks (NGN). Emerging technologies such as multi-core processors and virtualization have changed the architecture of the building elements of NGN significantly, thus call for rethinking of how network processing is done. In this paper, we propose distributed intrusion detection using intelligent network interfaces where additional processing capabilities are available. We design and implement a prototype to perform pattern matching using network processors since pattern matching is one of the important workloads in intrusion detection. Through the experimental results, we show the feasibility and performance of distributed intrusion detection in next generation networks.","1938-1883","978-1-4244-3435-0","978-1-4244-3435-0","10.1109/ICC.2009.5198928","http://ieeexplore.ieee.org.ezproxy.rit.edu/stamp/stamp.jsp?arnumber=5198928","","Computer architecture;IP networks;Intelligent networks;Intrusion detection;Multicore processing;Network interfaces;Network servers;Next generation networking;Pattern matching;Prototypes","network interfaces;pattern matching;security of data","distributed intrusion detection;intelligent network interfaces;multicore processors;network processing;network processors;next generation networks;pattern matching;virtualization","","0","","15","","","14-18 June 2009","","IEEE","IEEE Conference Publications"
"[Teaser abstract]","","","Networks, 2007. ICON 2007. 15th IEEE International Conference on","20080128","2007","","","","","Presents abstracts of presentations from the conference proceedings.","1556-6463","978-1-4244-1229-7","","10.1109/ICON.2007.4444041","http://ieeexplore.ieee.org.ezproxy.rit.edu/stamp/stamp.jsp?arnumber=4444041","","","","","","0","","","","","19-21 Nov. 2007","","IEEE","IEEE Conference Publications"
