"A testbed for quantitative assessment of intrusion detection systems using fuzzy logic","Gautam Singaraju; L. Teo; Y. Zheng","Lab. of Inf. Integration, Security & Privacy, North Carolina Univ., Charlotte, NC, USA","Information Assurance Workshop, 2004. Proceedings. Second IEEE International","20040824","2004","","","79","93","The current intrusion detection system (IDS) technology is a major investment for a firm and its evaluation is desired prior to a commitment. A testbed compares different IDSs on a common platform. A major challenge in evaluating IDSs stems from the fact that they are generally tested in specific environments. A real-world environment could be different from the environment designed for a testbed. The results obtained, from such testbeds, may not be accurate and reliable. Hence, a quantitative and metrics based evaluation of IDSs is desired. We propose testbed for evaluating intrusion detection systems (TIDeS), that allows a user to select the best IDS for a specific customized environment. A quantitative analysis is provided by TIDeS, using fuzzy logic, under varying network loads. We also propose robust metrics to evaluate an IDS. We follow up with recommendations, based on our experience, on the general practices in the field of IDSs.","","0-7695-2117-7;0769521177","","10.1109/IWIA.2004.1288040","http://ieeexplore.ieee.org/stamp/stamp.jsp?arnumber=1288040","","Fuzzy logic;Information security;Intrusion detection;Logic testing;NIST;Protocols;Robustness;System testing;Telecommunication traffic;Tides","computer networks;fuzzy logic;message authentication;telecommunication traffic","computer network security management;fuzzy logic;intrusion detection system","","2","","35","","","8-9 April 2004","","IEEE","IEEE Conference Publications"
"A Detector Generation Algorithm Based on Negative Selection","Q. Wang; X. k. Feng","Coll. of Comput. Sci., Chongqing Univ., Chongqing","2008 Fourth International Conference on Natural Computation","20081107","2008","6","","605","611","Detector generation is a crucial step of immune-based intrusion detection system. In order to improve the detecting efficiency of detectors and the dependence of matching threshold on an experienced value in the negative selection algorithm, an algorithm named VRGA for detector generation is proposed in this paper. Variable matching threshold r (r-variable) is introduced in VRGA to effectively increase the detector coverage. Clonal selection strategy considering detector similarity is adopted to increase the diversity of detectors. With above two improvements, VRGA brings the self-adaptability of matching threshold in negative selection and reduces the dependence of matching threshold on experience. In addition, VRGA increases the coverage and diversity of the detector set. The experimental results show that VGRA has better performance and its detecting efficiency is also improved correspondingly over the traditional negative selection algorithm.","2157-9555;21579555","978-0-7695-3304-9;9780769533049","","10.1109/ICNC.2008.617","http://ieeexplore.ieee.org/stamp/stamp.jsp?arnumber=4667907","artificial immune;concentration of detector;matching threshold;negative selection","Biology computing;Computer science;Detectors;Educational institutions;Immune system;Intrusion detection;Pattern matching;Phase detection;Protection;Random number generation","pattern matching;security of data","VRGA;clonal selection;detector generation;detector similarity;immune-based intrusion detection system;negative selection algorithm;self-adaptability;variable matching threshold","","1","","17","","","18-20 Oct. 2008","","IEEE","IEEE Conference Publications"
"Vehicular cloud networking: architecture and design principles","E. Lee; E. K. Lee; M. Gerla; S. Y. Oh","UCLA, Los Angeles, CA, USA","IEEE Communications Magazine","20140212","2014","52","2","148","155","Over the past several decades, VANET has been a core networking technology to provide safety and comfort to drivers in vehicular environments. Emerging applications and services, however, require major changes to its underlying computing and networking models, which demand new network planning for VANET. This article especially examines how VANET evolves with two emerging paradigms: vehicular cloud computing and information-centric networking. VCC brings the mobile cloud model to vehicular networks and thus changes the way of network service provisioning, whereas ICN changes the notion of data routing and dissemination. We envision a new vehicular networking system, vehicular cloud networking, on top of them. This article scrutinizes its architecture and operations, and discusses its design principles.","0163-6804;01636804","","","10.1109/MCOM.2014.6736756","http://ieeexplore.ieee.org/stamp/stamp.jsp?arnumber=6736756","","Cloud computing;Computational modeling;Computer architecture;Intelligent vehicles;Telecommunication network management;Vehicular ad hoc networks","cloud computing;telecommunication network planning;telecommunication network routing;vehicular ad hoc networks","VANET;data dissemination;data routing;information-centric networking;mobile cloud model;network planning;vehicular cloud computing;vehicular cloud networking;vehicular networking system;vehicular networks","","24","","13","","","February 2014","","IEEE","IEEE Journals & Magazines"
"A Research on Intrusion Detection Based on Support Vector Machines","X. Fang; W. Zhang; S. Teng; N. Han","Fac. of Comput., Guangdong Univ. of Technol., Guangzhou, China","Communications and Intelligence Information Security (ICCIIS), 2010 International Conference on","20101111","2010","","","109","112","Mass of the training samples and setting parameters of SVM artificially will affect badly the efficiency to find an optimal decision hyper plane for SVM. In this paper, FCM clustering algorithm and heuristic PSO algorithm are applied to Intrusion Detection. FCM clustering algorithm is designed to help SVM to find the optimal training samples from vast amounts of data; heuristic PSO algorithm is designed to find optimal parameters for SVM intelligently. The result of simulations run on the data of KDDCUP1999 shows that this approach can not only reduce the number of training samples and training time for SVM, but also detect unknown and known intrusions efficiently in the network.","","978-1-4244-8649-6;9781424486496","978-0-7695-4260-7;9780769542607","10.1109/ICCIIS.2010.42","http://ieeexplore.ieee.org/stamp/stamp.jsp?arnumber=5629206","Fuzzy C-means Clustering;Particle Swarm Optimization;Support Vector Machines;Support vector","Algorithm design and analysis;Classification algorithms;Clustering algorithms;Intrusion detection;Support vector machines;Training;Training data","fuzzy set theory;particle swarm optimisation;security of data;support vector machines","clustering algorithm;fuzzy c-means clustering;heuristic PSO algorithm;intrusion detection;optimal decision hyperplane;particle swarm optimization;support vector machines","","0","","11","","","13-14 Oct. 2010","","IEEE","IEEE Conference Publications"
"A network intrusion detection method using independent component analysis","Dayu Yang; Hairong Qi","Electrical Engineering and Computer Science Department, University of Tennessee, Knoxville, 37996, USA","Pattern Recognition, 2008. ICPR 2008. 19th International Conference on","20090123","2008","","","1","4","An intrusion detection system (IDS) detects illegal manipulations of computer systems. In intrusion detection systems, feature reduction, including feature extraction and feature selection, plays an important role in a sense of improving classification performance and reducing the computational complexity. Feature reduction is even more important when online detection, which means less computational power and fast real time delivery compared with offline detection, is needed. In this paper, independent component analysis approach is applied to feature extraction in online network intrusion detection problem. We use the KDD Cup 99 data and try to reduce its 41 features such that significant less number of features would be fed into kNN and SVM classifiers. Also, a decision fusion method is employed to aggregate the results from multiple classifiers to achieve higher accuracy.","1051-4651;10514651","978-1-4244-2174-9;9781424421749","978-1-4244-2175-6;9781424421756","10.1109/ICPR.2008.4761087","http://ieeexplore.ieee.org/stamp/stamp.jsp?arnumber=4761087","","Computational complexity;Computer networks;Data security;Feature extraction;Independent component analysis;Information security;Intrusion detection;Principal component analysis;Support vector machine classification;Support vector machines","computational complexity;feature extraction;independent component analysis;pattern classification;security of data","classification performance improvement;computational complexity;decision fusion mathod;feature extraction;feature reduction;feature selection;independent component analysis;k-nearest-neighbor classifier;online network intrusion detection method;support vector machine","","0","","14","","","8-11 Dec. 2008","","IEEE","IEEE Conference Publications"
"A review on different Intrusion Detection Systems for MANET and its vulnerabilities","S. Banerjee; R. Nandi; R. Dey; H. N. Saha","CSE Dept., B.P. Poddar Inst. of Manage. & Technol., Kolkata, India","Computing and Communication (IEMCON), 2015 International Conference and Workshop on","20151203","2015","","","1","7","In recent years, Mobile Ad hoc NETwork (MANET) have become a very popular research topic. By providing communications in the absence of a fixed infrastructure MANET are an attractive technology for many applications such as resource app, military app, environmental monitoring and conferences. However, this flexibility introduces new security threats due to the vulnerable nature of MANET, there will be the necessity of protecting the data, information from the attackers as it is an infrastructure-less network. Thus, securing such demanding network is a big challenge. At this point, IDS came into existence to secure MANET in detecting at what point they are getting weak. In this review paper, we will discuss, MANET and its vulnerabilities, and how we can tackle it using different techniques of IDS (Intrusion Detection System).","","","","10.1109/IEMCON.2015.7344466","http://ieeexplore.ieee.org/stamp/stamp.jsp?arnumber=7344466","Anomaly Detection;EAACK;IDS;MANET","Intrusion detection;Mobile ad hoc networks;Monitoring;Protocols;Routing","data protection;mobile ad hoc networks;security of data","IDS;data protection;fixed infrastructure MANET vulnerability;information protection;infrastructure-less network;intrusion detection system;mobile ad hoc network security;security threat","","","","21","","","15-17 Oct. 2015","","IEEE","IEEE Conference Publications"
"A novel framework for jamming detection and classification in wireless networks","A. Y. Dak; N. E. A. Khalid; S. Yahya","Faculty of Computer and Mathematical Sciences, Universiti Teknologi MARA, 40450 Shah Alam, Selangor, Malaysia","Computing and Networking Technology (ICCNT), 2012 8th International Conference on","20130124","2012","","","240","246","Launching jamming attacks is trivial but detecting and classifying attacks are more difficult especially in Wireless Networks. This is due to the open nature of this medium that leaves it vulnerable to multiple security threats. Anyone with a transceiver can launch jamming based DoS attacks on wireless transmissions, inject spurious messages, or jam legitimate ones. Jamming attacks usually occur at physical and MAC layers and involves different methods, techniques and technology. Therefore designing an efficient Intrusion Detection System (IDS) is a challenging task. The objective of this paper is to propose a new IDS framework that enables detection and classification of jamming in physical and MAC layers in wireless networks. To address this, problems that arise due to jamming at both layers are identified and investigated. Lists of parameters and variables are associated with jamming are identified and formulated to detect and classify attacks. Finally a novel IDS framework for detecting and classifying jamming attacks is proposed. This framework is found to be able to detect and classify jamming faster and more efficient.","","978-1-4673-1326-1;9781467313261","","","http://ieeexplore.ieee.org/stamp/stamp.jsp?arnumber=6418660","Wireless Network;classification;detection;jamming;security","Benchmark testing;Business process re-engineering;Communication system security;Jamming;Radio frequency;Wireless communication;Wireless sensor networks","access protocols;jamming;pattern classification;radio networks","IDS framework;MAC layers;attack classification;intrusion detection system;jamming attack classification;jamming based DoS attacks;jamming detection;multiple security threats;physical layers;wireless networks;wireless transmissions","","0","","26","","","27-29 Aug. 2012","","IEEE","IEEE Conference Publications"
"An Intrusion Detection System Model Based on Particle Swarm Reduction","W. Hai-Bing; F. De-Sheng","Sch. of Comput. & Software, Nanjing Univ. of Inf. & Technol., Nanjing, China","Genetic and Evolutionary Computing (ICGEC), 2010 Fourth International Conference on","20110217","2010","","","383","385","A intrusion detection system model based on particle swarm reduction was proposed in this paper. Though the experiment of this model, it turns out that the improved algorithm of quantum particle swarm can get the minimal reduction, improve particle convergence and make particles trapped into local minima more difficult. The algorithm is faster than GA and has a high rate of network intrusion detection.","","978-1-4244-8891-9;9781424488919","978-0-7695-4281-2;9780769542812","10.1109/ICGEC.2010.101","http://ieeexplore.ieee.org/stamp/stamp.jsp?arnumber=5715449","Intrusion detection;Particle swarm reduction;Rough set","Algorithm design and analysis;Classification algorithms;Computational modeling;Convergence;Intrusion detection;Particle swarm optimization;Rough sets","genetic algorithms;particle swarm optimisation;rough set theory;security of data","genetic algorithm;intrusion detection system;local minima;particle convergence;particle swarm reduction;quantum particle swarm;rough set","","0","","5","","","13-15 Dec. 2010","","IEEE","IEEE Conference Publications"
"Online Naive Bayes classification for network intrusion detection","F. Gumus; C. O. Sakar; Z. Erdem; O. Kursun","Dept. of Computer Engineering, Istanbul University, Turkey","Advances in Social Networks Analysis and Mining (ASONAM), 2014 IEEE/ACM International Conference on","20141016","2014","","","670","674","Intrusion detection system (IDS) is an important component to ensure network security. In this paper we build an online Naive Bayes classifier to discriminate normal and bad (intrusion) connections on KDD 99 dataset for network intrusion detection. The classifier starts with a small number of training examples of normal and bad classes; then, as it classifies the rest of the samples one at a time, it continuously updates the mean and the standard deviations of the features (IDS variables). We present experimental results of parameter updating methods and their parameters for the online Naive Bayes classifier. The obtained results show that our proposed method performs comparably to the simple incremental update.","","","","10.1109/ASONAM.2014.6921657","http://ieeexplore.ieee.org/stamp/stamp.jsp?arnumber=6921657","KDD 99 intrusion detection;exponentially weighted moving average;online learning Naive Bayes","Conferences;Educational institutions;Intrusion detection;Probes;Social network services;Standards;Training","Bayes methods;computer network security;data mining;learning (artificial intelligence);pattern classification","IDS;KDD 99 dataset;network intrusion detection system;online Naive Bayes classification;online Naive Bayes classifier;parameter updating methods;standard deviations","","2","","8","","","17-20 Aug. 2014","","IEEE","IEEE Conference Publications"
"Sequential Frequency Vector Based System Call Anomaly Detection","Y. Wu; J. Jiang; L. Kong","Dept. of Comput. Sci. & Technol., Tongji Univ., Shanghai, China","Dependable Computing (PRDC), 2010 IEEE 16th Pacific Rim International Symposium on","20110128","2010","","","215","222","Although either of temporal ordering and frequency distribution information embedded in process traces can profile normal process behaviors, but none of ever published schemes uses both of them to detect system call anomaly. This paper claims combining those two kinds of useful information can improve detection performance and firstly proposes sequential frequency vector (SFV) to exploit both temporal ordering and frequency information for system call anomaly detection. Extensive experiments on DARPA-1998 and UNM dataset have substantiated the claim. It is shown that SFV contains richer information and significantly outperforms other techniques in achieving lower false positive rates at 100% detection rate.","","978-1-4244-8975-6;9781424489756","978-0-7695-4289-8;9780769542898","10.1109/PRDC.2010.26","http://ieeexplore.ieee.org/stamp/stamp.jsp?arnumber=5703247","KNN scheme;enumerating model;intrusion detection;sequential frequency vector;system call","","remote procedure calls;security of data","frequency distribution information;sequential frequency vector;system call anomaly detection;temporal ordering","","1","","23","","","13-15 Dec. 2010","","IEEE","IEEE Conference Publications"
"Intrusion detection technique by using fuzzy ART on computer network security","P. Somwang; W. Lilakiatsakun","Faculty of Information Science, Nakhon Ratchasima College, Thailand","2012 7th IEEE Conference on Industrial Electronics and Applications (ICIEA)","20121124","2012","","","697","702","The problem of computer network security is the very hard of detecting new attacks which do not have known signatures of intrusion. Intrusion Detection Systems (IDS) is a program of monitoring the events in a computer network and analyzing them for signature of intrusions. This paper proposed the clustering technique by using hybrid method based on Principal Component Analysis (PCA) and Fuzzy Adaptive Resonance Theory (FART) for identifying various attacks. The PCA is applied to random selects the best attribution and reduction the feature space. FART is implementing used to classifying difference group of data, Normal and Anomalous. The results show that the proposed technique can improve the high performance of the detection rate and to minimize the false alarm rate. The evaluated our approach on the benchmark data from KDDCup'99 data set.","2156-2318;21562318","978-1-4577-2118-2;9781457721182","","10.1109/ICIEA.2012.6360815","http://ieeexplore.ieee.org/stamp/stamp.jsp?arnumber=6360815","Fuzzy Adaptive Resonance Theory;Intrusion Detection System;Network Security;Principal Component Analysis","Computer networks;Conferences;Covariance matrix;Intrusion detection;Principal component analysis;Vectors","computer network security;fuzzy set theory;principal component analysis","FART;clustering technique;computer network security;detection rate;false alarm rate;feature space;fuzzy ART;fuzzy adaptive resonance theory;hybrid method;intrusion detection systems;intrusion signatures;principal component analysis","","0","","26","","","18-20 July 2012","","IEEE","IEEE Conference Publications"
"Minimax Probability Machine Classifier with Feature Extraction by Kernel Pca for Intrusion Detection","Z. Chen; H. Ren; X. Du","Dept. of Comput. Sci. & Technol., North China Inst. of Sci. & Technol., Beijing","2008 4th International Conference on Wireless Communications, Networking and Mobile Computing","20081118","2008","","","1","4","In this paper, we synthetically applied kernel principal component analysis method and minimax probability machine to the intrusion detection. The intrusion features were extracted by kernel principal component analysis (KPCA) and followed by minimax probability machine (MPM) for classification. The dataset kddcup99 is our experiment data, our algorithm is compared with the algorithm which applies the support vector machine and minimax probability machine without application of feature extraction to intrusion detection. The experiment result has shown that the minimax probability machine classifier with feature extraction by KPCA can greatly reduce the training time and will not degrade the classifiers' performance.","2161-9646;21619646","978-1-4244-2107-7;9781424421077","978-1-4244-2108-4;9781424421084","10.1109/WiCom.2008.1101","http://ieeexplore.ieee.org/stamp/stamp.jsp?arnumber=4679009","","Computer vision;Data mining;Degradation;Feature extraction;Intrusion detection;Kernel;Minimax techniques;Principal component analysis;Support vector machine classification;Support vector machines","feature extraction;minimax techniques;pattern classification;principal component analysis;security of data;support vector machines","feature extraction;intrusion detection;kernel principal component analysis;minimax probability machine classifier;support vector machine","","0","","8","","","12-14 Oct. 2008","","IEEE","IEEE Conference Publications"
"Dimensionality Reduction and Attack Recognition using Neural Network Approaches","V. A. Golovko; L. U. Vaitsekhovich; P. A. Kochurko; U. S. Rubanau","Professor, Computer Science, Head, Intelligence Information Technologies Department, Laboratory of Artificial Neural Networks of Brest State Technical University, Belarus. phone: +375-162-42-63-21; fax: +375-162-42-21-27; e-mail: gva@bstu.by","2007 International Joint Conference on Neural Networks","20071029","2007","","","2734","2739","Most current Intrusion Detection Systems (IDS) examine all data features to detect intrusion. Also existing intrusion detection approaches have some limitations, namely impossibility to process a large number of audit data for realtime operation, low detection and recognition accuracy. To overcome these limitations, we apply modular neural network models to detect and recognize attacks in computer networks. They are based on the combination of principal component analysis (PCA) neural networks and multilayer perceptrons (MLP). PCA networks are employed for important data extraction and to reduce high dimensional data vectors. We present two PCA neural networks for feature extraction: linear PCA (LPCA) and nonlinear PCA (NPCA). MLP is employed to detect and recognize attacks using feature-extracted data instead of original data. The proposed approaches are tested with the help of KDD-99 dataset. The experimental results demonstrate that the designed models are promising in terms of accuracy and computational time for real world intrusion detection.","2161-4393;21614393","978-1-4244-1379-9;9781424413799","978-1-4244-1380-5;9781424413805","10.1109/IJCNN.2007.4371391","http://ieeexplore.ieee.org/stamp/stamp.jsp?arnumber=4371391","","Computer networks;Computer vision;Data mining;Feature extraction;Intrusion detection;Multi-layer neural network;Multilayer perceptrons;Neural networks;Principal component analysis;Vectors","computer networks;data mining;data reduction;feature extraction;multilayer perceptrons;principal component analysis;security of data;telecommunication computing;telecommunication security","IDS;PCA neural networks;audit data;computer network attack recognition;data extraction;dimensionality reduction;feature extraction;intrusion detection systems;linear PCA;modular neural network models;multilayer perceptrons;nonlinear PCA;principal component analysis","","11","","17","","","12-17 Aug. 2007","","IEEE","IEEE Conference Publications"
