http://ieeexplore.ieee.org/search/searchresult.jsp?download-format=download-csv&bulkSetSize=2000&refinements%3D4291944822%2C4291944246%26ranges%3D2009_2016_p_Publication_Year%26matchBoolean%3Dtrue%26searchField%3DSearch_All_Text%26queryText%3D%28%28%28%28.QT.Lines+of+Code.QT.%29+OR+.QT.LOC.QT.%29+OR+.QT.SLOC.QT.%29+AND+.QT.Intrusion+Detection+System.QT.%29,11/9/2015 20:29,"((((""Lines of Code"") OR ""LOC"") OR ""SLOC"") AND ""Intrusion Detection System"")",IEEE,,,,,,,,,,,,,,,,,,,,,,,,,,
Document Title,Authors,Author Affiliations,Publication Title,Date Added To Xplore,Year,Volume,Issue,Start Page,End Page,Abstract,ISSN,ISBN,EISBN,DOI,PDF Link,Author Keywords,IEEE Terms,INSPEC Controlled Terms,INSPEC Non-Controlled Terms,MeSH Terms,Article Citation Count,Patent Citation Count,Reference Count,Copyright Year,Online Date,Issue Date,Meeting Date,Publisher,Document Identifier
Enhancing OpenFlow actions to offload packet-in processing,"Farhadi, H.; Ping Du; Nakao, A.","Univ. of Tokyo, Tokyo, Japan","Network Operations and Management Symposium (APNOMS), 2014 16th Asia-Pacific",20141229,2014,,,1,6,"Software-Defined Networking (SDN) increasingly attracts more researchers as well as industry attentions. Open-Flow as a major API for SDN applies <;match, action> rules to every packet. However, it only supports a few actions that are all predefined. We extend this limitation of OpenFlow and propose User-Defined Actions (UDAs) for SDN. We discuss usecases of UDAs and propose an architecture to realize UDAs. Using our architecture we conduct a series of tests. We indicate that our UDAs can elevate millisecond-scale running time of current proposals to nanosecond-scale (including proposals from northbound applications of SDN community and virtual appliances of Network Function Virtualization or NFV community). Also, regarding ease of programmability, we show that our proposal decrease the lines of code of by 72.9% and 79.3% compared to implementing the same functionality as a northbound application and as a standalone middlebox, respectively. In addition, we extended OpenFlow to support UDAs and implemented a few sample UDAs.",,,,10.1109/APNOMS.2014.6996603,http://ieeexplore.ieee.org/stamp/stamp.jsp?arnumber=6996603,,Computer architecture;Detectors;Home appliances;Middleboxes;Peer-to-peer computing;Proposals;Throughput,packet radio networks;software defined networking,API;OpenFlow;network function virtualization;packet-in processing;software-defined networking;user-defined actions,,0,,10,,,17-19 Sept. 2014,,IEEE,IEEE Conference Publications
GenProg: A Generic Method for Automatic Software Repair,"Le Goues, C.; ThanhVu Nguyen; Forrest, S.; Weimer, W.","Dept. of Comput. Sci., Univ. of Virginia, Charlottesville, VA, USA","Software Engineering, IEEE Transactions on",20120130,2012,38,1,54,72,"This paper describes GenProg, an automated method for repairing defects in off-the-shelf, legacy programs without formal specifications, program annotations, or special coding practices. GenProg uses an extended form of genetic programming to evolve a program variant that retains required functionality but is not susceptible to a given defect, using existing test suites to encode both the defect and required functionality. Structural differencing algorithms and delta debugging reduce the difference between this variant and the original program to a minimal repair. We describe the algorithm and report experimental results of its success on 16 programs totaling 1.25 M lines of C code and 120K lines of module code, spanning eight classes of defects, in 357 seconds, on average. We analyze the generated repairs qualitatively and quantitatively to demonstrate that the process efficiently produces evolved programs that repair the defect, are not fragile input memorizations, and do not lead to serious degradation in functionality.",0098-5589,,,10.1109/TSE.2011.104,http://ieeexplore.ieee.org/stamp/stamp.jsp?arnumber=6035728,Automatic programming;corrections;testing and debugging.,Automatic programming;Computer bugs;Debugging;Encoding;Maintenance engineering;Syntactics,formal specification;genetic algorithms;software maintenance,GenProg;automatic software repair;defects repair;formal specifications;genetic programming;legacy programs;program annotations;special coding practices,,31,,75,,10/6/2011,Jan.-Feb. 2012,,IEEE,IEEE Journals & Magazines
Software Crash Analysis for Automatic Exploit Generation on Binary Programs,Shih-Kun Huang; Min-Hsiang Huang; Po-Yen Huang; Han-Lin Lu; Chung-Wei Lai,"Inf. Technol. Service Center, Nat. Chiao Tung Univ., Hsinchu, Taiwan","Reliability, IEEE Transactions on",20140227,2014,63,1,270,289,"This paper presents a new method, capable of automatically generating attacks on binary programs from software crashes. We analyze software crashes with a symbolic failure model by performing concolic executions following the failure directed paths, using a whole system environment model and concrete address mapped symbolic memory in S<sup>2</sup> E. We propose a new selective symbolic input method and lazy evaluation on pseudo symbolic variables to handle symbolic pointers and speed up the process. This is an end-to-end approach able to create exploits from crash inputs or existing exploits for various applications, including most of the existing benchmark programs, and several large scale applications, such as a word processor (Microsoft office word), a media player (mpalyer), an archiver (unrar), or a pdf reader (foxit). We can deal with vulnerability types including stack and heap overflows, format string, and the use of uninitialized variables. Notably, these applications have become software fuzz testing targets, but still require a manual process with security knowledge to produce mitigation-hardened exploits. Using this method to generate exploits is an automated process for software failures without source code. The proposed method is simpler, more general, faster, and can be scaled to larger programs than existing systems. We produce the exploits within one minute for most of the benchmark programs, including mplayer. We also transform existing exploits of Microsoft office word into new exploits within four minutes. The best speedup is 7,211 times faster than the initial attempt. For heap overflow vulnerability, we can automatically exploit the unlink() macro of glibc, which formerly requires sophisticated hacking efforts.",0018-9529,,,10.1109/TR.2014.2299198,http://ieeexplore.ieee.org/stamp/stamp.jsp?arnumber=6717039,Automatic exploit generation;bug forensics;software crash analysis;symbolic execution;taint analysis,Analytical models;Computer crashes;Concrete;Libraries;Registers;Security;Software,computer crime;program diagnostics;program testing;software fault tolerance;symbol manipulation,Microsoft office word;S<sup>2</sup>E;archiver;attack generation;automatic exploit generation;binary programs;concolic executions;end-to-end approach;format string;foxit;heap overflows;mapped symbolic memory;media player;mitigation-hardened exploits;mpalyer;pdf reader;pseudo symbolic variables;software crash analysis;software failures;software fuzz testing targets;sophisticated hacking efforts;stack overflows;symbolic failure model;symbolic pointers;unrar;word processor,,1,,30,,1/20/2014,Mar-14,,IEEE,IEEE Journals & Magazines
Effective Detection of SQL/XPath Injection Vulnerabilities in Web Services,"Antunes, N.; Laranjeiro, N.; Vieira, M.; Madeira, H.","Dept. of Inf. Eng., Univ. of Coimbra, Coimbra, Portugal","Services Computing, 2009. SCC '09. IEEE International Conference on",20091013,2009,,,260,267,"This paper proposes a new automatic approach for the detection of SQL Injection and XPath Injection vulnerabilities, two of the most common and most critical types of vulnerabilities in Web services. Although there are tools that allow testing Web applications against security vulnerabilities, previous research shows that the effectiveness of those tools in Web services environments is very poor. In our approach a representative workload is used to exercise the Web service and a large set of SQL/XPath injection attacks are applied to disclose vulnerabilities. Vulnerabilities are detected by comparing the structure of the SQL/XPath commands issued in the presence of attacks to the ones previously learned when running the workload in the absence of attacks. Experimental evaluation shows that our approach performs much better than known tools (including commercial ones), achieving extremely high detection coverage while maintaining the false positives rate very low.",,978-1-4244-5183-8,978-0-7695-3811-2,10.1109/SCC.2009.23,http://ieeexplore.ieee.org/stamp/stamp.jsp?arnumber=5283945,,Data security;Informatics;Pattern analysis;Performance analysis;Performance evaluation;Relational databases;Runtime;Stress;Testing;Web services,SQL;Web services;program testing;security of data,SQL injection vulnerabilities;Web services;XPath injection vulnerabilities;security vulnerabilities,,13,,23,,,21-25 Sept. 2009,,IEEE,IEEE Conference Publications
Evaluating and Improving Penetration Testing in Web Services,"Antunes, N.; Vieira, M.","Dept. of Inf. Eng., Univ. of Coimbra - Portugal, Coimbra, Portugal","Software Reliability Engineering (ISSRE), 2012 IEEE 23rd International Symposium on",20130404,2012,,,201,210,"Developers often rely on penetration testing tools to detect vulnerabilities in web services, although frequently without really knowing their effectiveness. In fact, the lack of information on the internal state of the tested services and the complexity and variability of the responses analyzed, limits the effectiveness of such technique, highlighting the importance of evaluating and improving existing tools. The goal of this paper is to investigate if attack signatures and interface monitoring can be an effective mean to assess and improve the performance of penetration testing tools in web services environments. In practice, attacks performed by such tools are signed and the interfaces between the target application and external resources are monitored (e.g., between services and a database server), allowing gathering additional information on existing vulnerabilities. A prototype was implemented focusing on SQL injection vulnerabilities. The experimental evaluation results clearly show that the proposed approach can be used in real scenarios.",1071-9458,978-1-4673-4638-2,,10.1109/ISSRE.2012.26,http://ieeexplore.ieee.org/stamp/stamp.jsp?arnumber=6405368,attack signatures;interface monitoring;penetration testing;security;vulnerability detection;web-services,Databases;Java;Monitoring;Security;Servers;Testing;Web services,SQL;Web services;digital signatures;program testing,SQL injection vulnerabilities;Web services;attack signatures;existing vulnerabilities;interface monitoring;penetration testing tools,,1,,32,,,27-30 Nov. 2012,,IEEE,IEEE Conference Publications
External Integrity Checking with Invariants,"Shimada, H.; Nakajima, T.","Dept. of Comput. Sci., Waseda Univ., Tokyo, Japan","Embedded and Real-Time Computing Systems and Applications (RTCSA), 2011 IEEE 17th International Conference on",20110929,2011,2,,122,125,"In order to enhance OS security, most of people use security patches to fix the vulnerabilities of the OS. However, the security patches may also incur vulnerabilities. These vulnerabilities are generated since most OSes has a lot of functionalities and their functionalities are very complex to manage the entire source code manually. Moreover, in order to use the security patch, rebooting the system is required. Some of systems such as enterprise servers and embedded systems cannot accept the rebooting. Therefore, we propose an external integrity checking system to enhance the OS security. The external integrity checking system and a target OS run on a hyper visor simultaneously, therefore, their operations do not affect each other. In addition, the integrity checking system is generated automatically with invariants. Therefore, the possibility of inserting vulnerabilities into the system is as small as possible, and the system can cover a lot of vulnerabilities.",1533-2306,978-1-4577-1118-3,,10.1109/RTCSA.2011.52,http://ieeexplore.ieee.org/stamp/stamp.jsp?arnumber=6029871,invariant;monitoring service;security,Data structures;Embedded systems;Kernel;Linux;Prototypes;Security;Virtual machine monitors,operating systems (computers);security of data,OS security enhancement;external integrity checking system;hyper visor;security patches;source code,,0,,12,,,28-31 Aug. 2011,,IEEE,IEEE Conference Publications
A Streaming Intrusion Detection System for Grid Computing Environments,"Smith, M.; Schwarzer, F.; Harbach, M.; Noll, T.; Freisleben, B.","Dept. of Math. & Comput. Sci., Univ. of Marburg, Marburg, Germany","High Performance Computing and Communications, 2009. HPCC '09. 11th IEEE International Conference on",20090717,2009,,,44,51,"In this paper, a novel architecture for a streaming intrusion detection system for Grid computing environments is presented. Detection mechanisms based on traditional log-files or single host databases are replaced by a streaming database approach. The streaming architecture allows processing of temporal attack data across multiple sites and offers the potential for performance benefits in large scale systems, since data is processed during its natural flow and only stored as long as necessary for analysis. Two cross-site example attacks in a Grid environment and the streaming detection logic for these attacks are presented to illustrate the approach. Experimental results of a prototypical implementation are presented.",,978-1-4244-4600-1,978-0-7695-3738-2,10.1109/HPCC.2009.99,http://ieeexplore.ieee.org/stamp/stamp.jsp?arnumber=5166975,Grid;Intrustion Detection;PIPES;Streaming Database,Computer architecture;Computer science;Databases;Grid computing;High performance computing;Intrusion detection;Mathematics;Reconnaissance;Security;Telecommunication traffic,database management systems;grid computing;security of data,grid computing environment;large scale system;single host database;streaming database intrusion detection system;streaming detection logic;temporal attack data;traditional log-file,,4,,15,,,25-27 June 2009,,IEEE,IEEE Conference Publications
An Intrusion Detection System for Critical Information Infrastructures using Wireless Sensor Network technologies,"Coppolino, Luigi; D'Antonio, S.; Romano, L.; Spagnuolo, G.","Dipt. per le Tecnol., Univ. of Naples Parthenope (DiT), Naples, Italy","Critical Infrastructure (CRIS), 2010 5th International Conference on",20101101,2010,,,1,8,"Wireless Sensor Network (WSN) technology is being increasingly used for data collection in Critical Infrastructures (CIs). The paper presents an Intrusion Detection System (IDS), which is able to protect a CI from attacks directed to its WSN-based parts. By providing accurate and timely detection of malicious activities, the proposed IDS solution ultimately results in a dramatic improvement in terms of protection, since opportunities are given for performing proper remediation/reconfiguration actions, which counter the attack and/or allow the system to tolerate it. We present the basic ideas, discuss the main implementation issues, and perform a preliminary experimental campaign. Not only have experiments demonstrated the effectiveness of the proposed approach in protecting the system against two very serious attacks to WSNs (namely: sinkhole, and bogus packet), but they have also proved that the stringent requirements (in terms of limited availability of resources) which are typical of current state-of-the-art WSN technologies, are met.",,978-1-4244-8080-7,,10.1109/CRIS.2010.5617547,http://ieeexplore.ieee.org/stamp/stamp.jsp?arnumber=5617547,Critical Information Infrastructures;Critical Infrastructures;Intrusion Detection;Wireless Sensor Networks,Base stations;Routing;Routing protocols;Security;Sensors;Wireless sensor networks,security of data;telecommunication security;wireless sensor networks,bogus packet;critical information infrastructures;intrusion detection system;malicious activities;sinkhole;wireless sensor network,,6,,34,,,20-22 Sept. 2010,,IEEE,IEEE Conference Publications
A distributed network intrusion detection system architecture based on computer stations using GPGPU,"Vokorokos, L.; Ennert, M.; Cajkovsky, M.; Turinska, A.","Dept. of Comput. & Inf., Tech. Univ. of Kosice, Kosice, Slovakia","Intelligent Engineering Systems (INES), 2013 IEEE 17th International Conference on",20131017,2013,,,323,326,"This article deals with the proposal of distributed parallel network system architecture for intrusion detection. The aim is to design model of architecture that will be used for searching, detecting and analyzing intrusions. This proposal of detection system in network will use enormous performance of the GPGPU high-parallel data computing technology which can substitute the most complicated part of the intrusion detection process in NIDS. The model is highly scalable and allows the usage of several most recent trends in the IDS field with GPGPU support. Due to the fast attacks reaction system analyzes all the data in different formats in whole set of attacks and system alerts.",,978-1-4799-0828-8,,10.1109/INES.2013.6632834,http://ieeexplore.ieee.org/stamp/stamp.jsp?arnumber=6632834,,Computational modeling;Computer architecture;Graphics processing units;Hardware;Intrusion detection;Synchronization,graphics processing units;parallel processing;security of data,GPGPU high-parallel data computing technology;IDS field;NIDS;computer stations;distributed network intrusion detection system architecture;distributed parallel network system architecture;fast attacks reaction system;intrusion search;system alerts,,2,,14,,,19-21 June 2013,,IEEE,IEEE Conference Publications
A Model-Based Intrusion Detection System for Smart Meters,"Tabrizi, F.M.; Pattabiraman, K.","Dept. of Electr. & Comput. Eng., Univ. of British Columbia (UBC), Vancouver, BC, Canada","High-Assurance Systems Engineering (HASE), 2014 IEEE 15th International Symposium on",20140306,2014,,,17,24,"Smart meters have gained wide adoption as an integral part of the smart grid. However, their security remains problematic as many attacks are discovered against them. Smart meters are embedded devices that are constrained in terms of computing power and memory. They are also deployed on a large scale which imposes specific requirements (e.g., no false positives) on any IDS developed for them. In this paper, we propose a model-based technique for building intrusion detection systems (IDS) for smart meters, that takes these constraints into account. We implement our IDS on an open source smart meter platform. We show that our IDS imposes little performance overhead, even under severe memory constraints, and effectively detects a wide range of both known and unknown attacks. In comparison, existing IDSs incur unacceptable performance overheads on the meter.",,978-1-4799-3465-2,,10.1109/HASE.2014.12,http://ieeexplore.ieee.org/stamp/stamp.jsp?arnumber=6754583,IDS;security model;selective monitoring,Abstracts;Concrete;Hidden Markov models;Monitoring;Security;Servers;Software,power meters;power system security;security of data;smart meters;smart power grids,memory constraints;model-based intrusion detection system;open source smart meter platform;smart grid,,1,,29,,,9-11 Jan. 2014,,IEEE,IEEE Conference Publications
Distributed port-scan attack in cloud environment,"Deshpande, P.; Aggarwal, A.; Sharma, S.C.; Kumar, P.S.; Abraham, A.","Indian Inst. of Technol. Roorkee, Roorkee, India","Computational Aspects of Social Networks (CASoN), 2013 Fifth International Conference on",20131007,2013,,,27,31,"Cloud Computing is becoming a promising technology for processing a huge chunk of data. Hence, its security aspect has drawn the attentions of researchers and academician. The security of the cloud environment must be reliable as well as scalable. The cloud environment is vulnerable to many security attacks. Attacks can be launched individually or in tandem. In this article, the overview of port-scan attack and the response of IDS are studied. The experimentation is carried out using virtual-box and SNORT, the open-source IDS.",,978-1-4799-1407-4,,10.1109/CASoN.2013.6622595,http://ieeexplore.ieee.org/stamp/stamp.jsp?arnumber=6622595,Cloud computing;Distributed attacks;Firewall;Intrusion Detection System;Port-scan;Security,Intrusion detection;Irrigation;Monitoring;Ports (Computers);Reliability,cloud computing;security of data,IDS;SNORT;cloud computing;cloud environment;data processing;distributed port-scan attack;open-source IDS;security attacks;virtual-box,,0,,17,,,12-14 Aug. 2013,,IEEE,IEEE Conference Publications
Evaluation of Web Security Mechanisms Using Vulnerability & Attack Injection,"Fonseca, J.; Vieira, M.; Madeira, H.","Inst. Polytech. of Guarda, Univ. of Coimbra, Coimbra, Portugal","Dependable and Secure Computing, IEEE Transactions on",20140905,2014,11,5,440,453,"In this paper we propose a methodology and a prototype tool to evaluate web application security mechanisms. The methodology is based on the idea that injecting realistic vulnerabilities in a web application and attacking them automatically can be used to support the assessment of existing security mechanisms and tools in custom setup scenarios. To provide true to life results, the proposed vulnerability and attack injection methodology relies on the study of a large number of vulnerabilities in real web applications. In addition to the generic methodology, the paper describes the implementation of the Vulnerability & Attack Injector Tool (VAIT) that allows the automation of the entire process. We used this tool to run a set of experiments that demonstrate the feasibility and the effectiveness of the proposed methodology. The experiments include the evaluation of coverage and false positives of an intrusion detection system for SQL Injection attacks and the assessment of the effectiveness of two top commercial web application vulnerability scanners. Results show that the injection of vulnerabilities and attacks is indeed an effective way to evaluate security mechanisms and to point out not only their weaknesses but also ways for their improvement.",1545-5971,,,10.1109/TDSC.2013.45,http://ieeexplore.ieee.org/stamp/stamp.jsp?arnumber=6629992,Security;fault injection;internet applications;review and evaluation,Databases;Educational institutions;Input variables;Probes;Security;Software;TV,Internet;SQL;fault diagnosis;security of data;software fault tolerance,SQL Injection attacks;VAIT;Web application security mechanism evaluation;attack injection methodology;fault injection;intrusion detection system;vulnerability injection methodology;vulnerability-&-attack injector tool,,1,,51,,10/11/2013,Sept.-Oct. 2014,,IEEE,IEEE Journals & Magazines
Thwarting attacks on ZigBee - Removal of the KillerBee stinger,"Stelte, B.; Rodosek, G.D.","Fac. of Comput. Sci., Univ. der Bundeswehr Munchen, Neubiberg, Germany","Network and Service Management (CNSM), 2013 9th International Conference on",20140130,2013,,,219,226,"Wireless Sensor Networks (WSNs) have recently emerged as an important research topic. Due to the enormous number of sensor nodes and the constrained resources, specific research challenges can be identified with respect to security. Almost all available commercial and research sensor nodes are equipped with ZigBee transceiver chips, and thus making ZigBee the de-facto standard in WSN communication. Since Joshua Wright's KillerBee Framework was released with its focus on exploring and exploiting the security of ZigBee networks, non security-hardened WSNs increase the risk of being vulnerable against certain attacks such as simple association flooding and packet replay attacks. We propose an anomaly-based approach intrusion detection system (IDS) optimized for ZigBee-based WSN to protect ZigBee-based WSN nodes against KillerBee supported attacks. We describe the KillerBee attack procedure and propose an approach of guarding a ZigBee transceiver. Based on an extended sensor node/network simulation and analysis framework, we demonstrate furthermore how our anomaly-based detection engine can thwart attacks on a ZigBee transceiver.",,,,10.1109/CNSM.2013.6727840,http://ieeexplore.ieee.org/stamp/stamp.jsp?arnumber=6727840,,Cryptography;IEEE 802.15 Standards;Radiation detectors;Transceivers;Wireless sensor networks;Zigbee,Zigbee;computer network security;radio transceivers;wireless sensor networks,IDS;KillerBee framework;WSN communication;ZigBee transceiver chip;anomaly-based approach;anomaly-based detection engine;de-facto standard;intrusion detection system;network security;nonsecurity-hardened WSN;packet replay attack;sensor node-network simulation;thwart attack;wireless sensor network,,0,,17,,,14-18 Oct. 2013,,IEEE,IEEE Conference Publications
