http://ieeexplore.ieee.org/search/searchresult.jsp?download-format=download-csv&bulkSetSize=2000&refinements%3D4291944822%2C4291944246%26ranges%3D2009_2016_p_Publication_Year%26matchBoolean%3Dtrue%26searchField%3DSearch_All_Text%26queryText%3D%28%28%28%28.QT.Lines+of+Code.QT.%29+OR+.QT.LOC.QT.%29+OR+.QT.SLOC.QT.%29+AND+.QT.Intrusion+Detection+System.QT.%29,11/9/2015 20:29,"((((""Lines of Code"") OR ""LOC"") OR ""SLOC"") AND ""Intrusion Detection System"")",IEEE,,,,,,,,,,,,,,,,,,,,,,,,,,
Parsing application layer protocol with commodity hardware for SDN,Hao Li; Chengchen Hu; Junkai Hong; Xiyu Chen; Yuming Jiang,"Xi'an Jiaotong Univ., Xi'an, China","Architectures for Networking and Communications Systems (ANCS), 2015 ACM/IEEE Symposium on",20150521,2015,,,51,61,"The de facto implementation of Software Defined Networking (SDN), i.e., OpenFlow, only parses L2-L4 headers, which limits the use of SDN to employ control intelligence in application layer. In this paper, we advocate content parsing to empower SDN with finer grained control ability over traffic. Specifically, we propose a scalable content parser, called COPY, to identify and parse application layer protocols. COPY creates a distinguishable counting context free grammar (DCCFG) to specify the protocol's semantics in application layer, and translates multiple DCCFGs into one distinguishable counting automaton (DCA). DCA is generated without semantic loss from the single DCCFG, and thus provides accurate and scalable parsing ability. Our experiments show that COPY precisely identifies every packet in a labeled trace. When comparing with other six approaches on the real traces, COPY performs 4.2Gb/s and 24.7Gb/s with single- and eight-thread models, respectively, which improves 20%-860% than others, and consumes acceptable offline overhead in time and space.",,,,10.1109/ANCS.2015.7110120,http://ieeexplore.ieee.org/stamp/stamp.jsp?arnumber=7110120,,Accuracy;Automata;Grammar;Payloads;Protocols;Radiation detectors;Semantics,automata theory;context-free grammars;program compilers;programming language semantics;protocols;software defined networking,COPY;DCA;DCCFG;SDN;application layer protocols;commodity hardware;content parsing;distinguishable counting automaton;distinguishable counting context free grammar;protocol semantics;software defined networking,,0,,38,,,7-8 May 2015,,IEEE,IEEE Conference Publications
An execution-flow based method for detecting Cross-site Scripting attacks,Qianjie Zhang; Hao Chen; Jianhua Sun,"Adv. Internet & Media Lab., Hunan Univ., Changsha, China","Software Engineering and Data Mining (SEDM), 2010 2nd International Conference on",20100809,2010,,,160,165,"We present an execution-flow analysis for JavaScript programs running in a web browser to prevent Cross-site Scripting (XSS) attacks. We construct finite-state automata (FSA) to model the client-side behavior of Ajax applications under normal execution. Our system is deployed in proxy mode. The proxy analyzes the execution flow of client-side JavaScript before the requested web pages arrive at the browser to prevent potentially malicious scripts, which do not conform to the FSA. We evaluate our technique against several real-world applications and the result shows that it protects against a variety of XSS attacks and has an acceptable performance overhead.",,978-1-4244-7324-3,978-89-88678-22-0,,http://ieeexplore.ieee.org/stamp/stamp.jsp?arnumber=5542934,Ajax;FSA;JavaScript;XSS,Application software;Computer languages;Electronic mail;Internet;Java;Learning automata;Monitoring;Protection;Sun;Web pages,,,,0,,18,,,23-25 June 2010,,IEEE,IEEE Conference Publications
Fast and flexible: Parallel packet processing with GPUs and click,"Sun, Weibin; Ricci, Robert","Flux Research Group, University of Utah, School of Computing, Salt Lake City, USA","Architectures for Networking and Communications Systems (ANCS), 2013 ACM/IEEE Symposium on",20131118,2013,,,25,35,"We introduce Snap, a framework for packet processing that outperforms traditional software routers by exploiting the parallelism available on modern GPUs. While obtaining high performance, it remains extremely flexible, with packet processing tasks implemented as simple modular elements that are composed to build fully functional routers and switches. Snap is based on the Click modular router, which it extends by adding new architectural features that support batched packet processing, memory structures optimized for offloading to coprocessors, and asynchronous scheduling with in-order completion. We show that Snap can run complex pipelines at high speeds on commodity PC hardware by building an IP router incorporating both an IDS-like full-packet string matcher and an SDN-like packet classifier. In this configuration, Snap is able to forward 40 million packets per second, saturating four 10 Gbps NICs at packet sizes as small as 128 byes. This represents an increase in throughput of nearly 4x over the baseline Click running comparable elements on the CPU.",,978-1-4799-1640-5,,10.1109/ANCS.2013.6665173,http://ieeexplore.ieee.org/stamp/stamp.jsp?arnumber=6665173,,Graphics processing units;IP networks;Kernel;Parallel processing;Pipelines;Ports (Computers);Throughput,,,,4,,28,,,21-22 Oct. 2013,,IEEE,IEEE Conference Publications
Primary User Emulation attack and their mitigation strategies: A survey,"Naqvi, B.; Rashid, I.; Riaz, F.; Aslam, B.","Nat. Univ. of Sci. & Technol., Islamabad, Pakistan","Information Assurance (NCIA), 2013 2nd National Conference on",20140210,2013,,,95,100,"Cognitive Radio emerged as a solution to solve the spectrum scarcity by allowing unlicensed user to exist with the licensed users of the network whenever the licensed users are in idle state. Cognitive radio since its inception has received a lot of importance as far as research is concerned, however security threats also emerged with this promising technology among which Primary User Emulation (PUE) attack is one. We cover an understanding of the PUE attack in this paper and then discuss existing solutions to mitigate it along with the limitations of the proposed solutions. In end we identify the need of solution to address a case that has not been addressed yet.",,978-1-4799-1287-2,,10.1109/NCIA.2013.6725331,http://ieeexplore.ieee.org/stamp/stamp.jsp?arnumber=6725331,Cognitive Radio Network;Opportunistic access;Primary User Emulation Attack;Sensing,Ad hoc networks;Approximation methods;Bandwidth;Cognitive radio;Emulation;Radio transmitters;Sensors,cognitive radio;telecommunication security,PUE attack;cognitive radio;licensed users;primary user emulation attack;security threats;spectrum scarcity;unlicensed user,,1,,20,,,11-12 Dec. 2013,,IEEE,IEEE Conference Publications
Hardware-Assisted Detection of Malicious Software in Embedded Systems,"Rahmatian, M.; Kooti, H.; Harris, I.G.; Bozorgzadeh, E.","Comput. Sci. Dept., Univ. of California, Irvine, Irvine, CA, USA","Embedded Systems Letters, IEEE",20121220,2012,4,4,94,97,"One of the critical security threats to computer systems is the execution of malware or malicious software. Several intrusion detection systems have been proposed which perform detection analysis in the software using the audit files generated by the operating system. Software-based solutions to this problem are relatively slow, so these techniques can be used forensically, but not in real-time to stop an exploit before it has an opportunity to do damage. We present a technique to implement intrusion detection for secure embedded systems by detecting behavioral differences between the correct system and the malware. The system is implemented using FPGA logic to enable the detection process to be regularly updated to adapt to new malware and changing system behavior.",1943-0663,,,10.1109/LES.2012.2218630,http://ieeexplore.ieee.org/stamp/stamp.jsp?arnumber=6301679,Embedded system security;FPGA;intrusion detection,Field programmable gate arrays;Hardware;Intrusion detection;Malware;Monitoring,embedded systems;field programmable gate arrays;invasive software;operating systems (computers),FPGA logic;audit fíles;computer systems;hardware-assisted malicious software detection;intrusion detection;malware;operating system;secure embedded systems;security threats;software-based solutions,,5,,19,,9/12/2012,Dec. 2012,,IEEE,IEEE Journals & Magazines
HVSM: An In-Out-VM security monitoring architecture in IAAS cloud,Yaqiang Mao; Xujian Chen; Yuan Luo,"Comput. Sci. & Eng. Dept., Shanghai Jiao Tong Univ., Shanghai, China","Information and Network Security, ICINS 2014 - 2014 International Conference on",20150625,2014,,,185,192,"As a basic cloud service model, the Infrastructure-as-aService (IaaS) provides fundamental computing resources for PaaS and SaaS with a guaranteed ability to reduce costs and improve resource efficiency. Virtualization plays a crucial role to support the IaaS. However, it is not safety because of exposing the hosted virtual machines (VMs) to uncontrollable environment. In addition, traditional in-guest security solutions, relying on operation system kernel trustworthiness, are no longer effective to virtual infrastructure. In this paper, we introduce HVSM (Hybrid Virtualization Security Monitor) to deal with above security problems, which is a new In-OutVM hybrid virtualization-aware architecture depending on lightweight, comprehensive and dynamic security monitoring. First, as to Hybrid, HVSM utilizes virtual machine introspection technique to inspect kernel running state of the guest VM (GVM) from outside. Inside the GVM, measure agent (MA) tests and delivers processes' integrity information to security VM (SVM). In succession, MA is in the guard of measure agent keeper (MAK) running in the SVM. Second, dynamically, HVSM combines kernel state information with processes' integrity so as to provide a security report on GVM. Third, a proof-of-concept prototype is implemented using libvmi based on Xen hypervisor. Finally, we evaluate efficiency and the performance overhead of HVSM, which is acceptably low to support real-time monitoring.",,978-1-84919-909-4,,10.1049/cp.2014.1285,http://ieeexplore.ieee.org/stamp/stamp.jsp?arnumber=7133816,Hybrid Security Monitor;IaaS Security;Integrity Measurement;Virtual Machine Introspection;Xen,,cloud computing;cost reduction;multi-agent systems;operating system kernels;resource allocation;security of data;virtual machines;virtualisation,GVM;HVSM;IAAS cloud;MA test;MAK;PaaS;SVM;SaaS;Xen hypervisor;cost reduction;dynamic security monitoring;guest VM;hosted virtual machines;hybrid virtualization security monitor;in-guest security solutions;in-out-VM hybrid virtualization-aware architecture;in-out-VM security monitoring architecture;infrastructure-as-a service;kernel running state;kernel state information;libvmi;measure agent keeper;measure agent test;operation system kernel trustworthiness;process integrity;resource efficiency;security VM;virtual machine introspection technique,,0,,,,,14-16 Nov. 2014,,IET,IET Conference Publications
Design and performance testing of an integrated detection and assessment perimeter system,"Dabling, J.G.; McLaughlin, J.O.; Andersen, J.J.","Intell. Syst. & Controls, Sandia Nat. Labs., Albuquerque, NM, USA","Security Technology (ICCST), 2012 IEEE International Carnahan Conference on",20121231,2012,,,34,42,"Kontek Industries (Kannapolis, NC) and their subsidiary, Stonewater Control Systems (Kannapolis, NC), have entered into a cooperative research and development agreement with Sandia National Laboratories (Albuquerque, NM) to jointly develop and evaluate an integrated perimeter security solution, one that couples access delay with detection and assessment. This novel perimeter solution is designed to be sufficiently flexible for implementation at a wide range of facility types, from high security military or government installations to commercial power plants, to industrial facilities of various kinds. A prototype section of barrier has been produced and installed at the Sandia Exterior Intrusion Sensor Testing Facility in Albuquerque, NM. The prototype was implemented with a robust vehicle barrier and coupled with a variety of detection and assessment solutions to demonstrate both the effectiveness of such a solution, as well as the flexibility of the system. In this implementation, infrared sensors and fence disturbance sensors are coupled with a video motion detection sensor and ground sensors. The ability of the system to properly detect pedestrian or vehicle attempts to bypass, breach, or otherwise defeat the system will be characterized, as well as the Nuisance Alarm Rate.",1071-6572,978-1-4673-2450-2,978-1-4673-2449-6,10.1109/CCST.2012.6393535,http://ieeexplore.ieee.org/stamp/stamp.jsp?arnumber=6393535,NAR;SEIWG;SOA;VMD;detection;machine learning;perimeter security;sensor fusion,Laboratories;Photonics;Poles and towers;Prototypes;Security;Vehicles,alarm systems;infrared detectors;object detection;research and development;sensor fusion;testing;video cameras,PIDAS;access delay;fence disturbance sensors;ground sensors;infrared sensors;integrated perimeter security;nuisance alarm rate;performance testing;perimeter integrated detection and assessment system;research and development;robust vehicle barrier;sensor fusion;video motion detection sensor,,1,,5,,,15-18 Oct. 2012,,IEEE,IEEE Conference Publications
Packets everywhere: The great opportunity for field programmable technology,"Brebner, G.","Xilinx Res. Labs., San Jose, CA, USA","Field-Programmable Technology, 2009. FPT 2009. International Conference on",20100112,2009,,,1,10,"The packet is the atom of the digital revolution: the unit of data communication. The use of packets in networking was first proposed almost 50 years ago, leading ultimately to the Internet as we know it today. As networking has scaled down towards networks on chip, so packets feature for digital communication in the small. As applications have gone digital, so their data has become packetised. Streams of packets, and the processing of these packets, are characteristic of the digital age. It is becoming increasingly necessary to provide numerous packet processing solutions, in order to support diversity and innovation both in services and in underlying infrastructure. In turn, there is a requirement for supplying underlying high-performance architectures that support flexibility, scalability, concurrency, and diversity. These characteristics present a great opportunity for modern field programmable technologies, which offer a very natural basis for providing the necessary high-speed programmable packet processing capabilities. One major barrier for these technologies to overcome is that design, testing and maintenance is very often a low-level, hardware-oriented, experience, requiring specialist skills. A key question is whether the raw capabilities of field programmable devices can be made available to the architect and programmer in a higher-level manner, comparable to best practice in modern software engineering. To supply an initial positive answer, this paper introduces G, a high-level packet-centric language for describing packet processing specifications in an implementation-independent manner, and demonstrates that G can be compiled to give high-performance FPGA-based packet processing components. Compilation involves generating virtual processing architectures tailored to the particular requirements of a G specification. The results affirm the FPGA as a natural packet processing technology that can be programmed in a high-level manner appropriate to a packe- t-oriented mindset.",,978-1-4244-4375-8,978-1-4244-4377-2,10.1109/FPT.2009.5377604,http://ieeexplore.ieee.org/stamp/stamp.jsp?arnumber=5377604,,Best practices;Concurrent computing;Data communication;Digital communication;IP networks;Network-on-a-chip;Programming profession;Scalability;Technological innovation;Testing,field programmable gate arrays,FPGA-based packet processing components;Internet;data communication;digital revolution;field programmable technology;high-level packet-centric language;high-speed programmable packet processing capabilities;natural packet processing technology;packet-oriented mindset;software engineering,,4,,29,,,9-11 Dec. 2009,,IEEE,IEEE Conference Publications
Information Leakage through the Domain Name System,"Rose, S.; Chandramouli, R.; Nakassis, A.","Nat. Inst. for Stand. & Technol., Gaithersburg, MD","Conference For Homeland Security, 2009. CATCH '09. Cybersecurity Applications & Technology",20090324,2009,,,16,21,"The Domain Name System (DNS) is the global lookup service for network resources. It is often the first step in an Internet transaction as well as a network attack since it provides the route map for reaching any resource (e.g., hosts) in any organization irrespective of its geographical and network location. An attacker can query an organizationpsilas DNS as reconnaissance before attacking hosts on a particular network. To minimize the chances of these attacks succeeding, the administrator of an organizationpsilas DNS (called the zone administrator), has various counter measures options in the form of content control, configuration, protocols, operational and infrastructure protection methods. In this paper, we analyze these and discuss their effectiveness and limitations.",,978-0-7695-3568-5,,10.1109/CATCH.2009.10,http://ieeexplore.ieee.org/stamp/stamp.jsp?arnumber=4804423,DNSSEC;Domain Infrastructure Security;Domain Name System,Computer security;Counting circuits;Domain Name System;File servers;IP networks;Network servers;Protection;Reconnaissance;Terrorism;Web server,Internet;protocols;telecommunication network routing;telecommunication security,DNS;Internet transaction;content control;domain name system;global lookup service;information leakage;network attack;network resource;network routing;protocol;zone administrator,,0,,13,,,3-4 March 2009,,IEEE,IEEE Conference Publications
Operating system security by integrity checking and recovery using write-protected storage,"Kaczmarek, J.; Wrobel, M.R.","Fac. of Electron., Telecommun. & Inf., Gdansk Univ. of Technol., Gdansk, Poland","Information Security, IET",20140227,2014,8,2,122,131,"An integrity checking and recovery (ICAR) system is presented here, which protects file system integrity and automatically restores modified files. The system enables files cryptographic hashes generation and verification, as well as configuration of security constraints. All of the crucial data, including ICAR system binaries, file backups and hashes database are stored in a physically write-protected storage to eliminate the threat of unauthorised modification. A buffering mechanism was designed and implemented in the system to increase operation performance. Additionally, the system supplies user tools for cryptographic hash generation and security database management. The system is implemented as a kernel extension, compliant with the Linux security model. Experimental evaluation of the system was performed and showed an approximate 10% performance degradation in secured file access compared to regular access.",1751-8709,,,10.1049/iet-ifs.2012.0346,http://ieeexplore.ieee.org/stamp/stamp.jsp?arnumber=6748546,,,Linux;database management systems;security of data,ICAR system binaries;Linux security model;buffering mechanism;cryptographic hashes generation;file backups;file system integrity;hashes database;integrity checking and recovery system;security constraints;security database management;system security;unauthorised modification;write-protected storage,,1,,,,,Mar-14,,IET,IET Journals & Magazines
Towards Concurrent Data Sampling Using GPU Coprocessing,"Seeger, M.M.; Wolthusen, S.D.","Dept. Secure Services, Center for Adv. Security Res. Darmstadt (CASED), Darmstadt, Germany","Availability, Reliability and Security (ARES), 2012 Seventh International Conference on",20121011,2012,,,557,563,"Host intrusion detection systems operating on the host under observation itself are limited by an adversary's ability to subvert all data collection and the detection and mitigation mechanisms themselves. Although coprocessor architectures have been proposed to avoid this security mechanism integrity problem, they either involve the application of non-standard hardware or rely on host-bound application programming interfaces (API). This is why, so far, they are only used in the field of network intrusion detection. In this paper, we present our results concerning a concurrent host memory sampling mechanism based on direct memory access (DMA) and demonstrate that it is possible to de-couple GPU kernel execution, thereby providing temporary isolation from the host and allowing data sampling actions to be taken without interruption. We present a security analysis of our approach and detail a proof-of-concept implementation of the autonomous concurrent monitoring and sampling system, thus, validating that self-sufficient data sampling using a commodity coprocessor (i.e. a GPU) is indeed possible.",,978-1-4673-2244-7,,10.1109/ARES.2012.92,http://ieeexplore.ieee.org/stamp/stamp.jsp?arnumber=6329231,Autonomous GPU Kernels;Coprocessor;Data Sampling;Intrusion detection,Coprocessors;Graphics processing unit;Hardware;Intrusion detection;Kernel,application program interfaces;computerised monitoring;file organisation;graphics processing units;operating system kernels;security of data,API;DMA;GPU coprocessor architectures;GPU kernel execution decoupling;autonomous concurrent monitoring system;autonomous concurrent sampling system;commodity coprocessor;concurrent host memory sampling mechanism;data collection;direct memory access;host intrusion detection systems;host-bound application programming interfaces;mitigation mechanisms;nonstandard hardware;proof-of-concept implementation,,0,,15,,,20-24 Aug. 2012,,IEEE,IEEE Conference Publications
Design of a flexible high-speed FPGA-based flow monitor for next generation networks,"McGlone, J.; Woods, R.; Marshall, A.; Blott, M.","ECIT, Queens Univ. Belfast, Belfast, UK","Embedded Computer Systems (SAMOS), 2010 International Conference on",20101122,2010,,,37,44,"The evolution of new services and the development of next generation networks is placing severe demands on networks. In order to support emerging services, it is clear that a higher degree of monitoring functionality is needed within networks. One approach is to use the programmability and performance of Field Programmable Gate Array (FPGA) technology to allow distributed monitoring but this present challenges around memory usage and highlights the need for a strategically different approach to how flows are monitored. A novel FPGA-based, programmable IP flow monitor is presented, that permits various forms of network monitoring functionality, specifically monitoring of different classes of traffic, to be performed. A key aspect was to address the traditionally long design times, through the use of a new, experimental, high-level design flow called Packet Xpress which allowed functions to be quickly implemented, providing a twentyfold speed-up in design time. The monitor has been implemented on a Xilinx Virtex-5 based ML506 board and verified in hardware using real Internet traffic traces. The platform allowed us to experiment with various monitoring functions and establish their resource requirements.",,978-1-4244-7936-8,978-1-4244-7938-2,10.1109/ICSAMOS.2010.5642096,http://ieeexplore.ieee.org/stamp/stamp.jsp?arnumber=5642096,FPGAs;high level design;telecomms monitoring,Field programmable gate arrays;Hardware;IP networks;Internet;Monitoring;Next generation networking;Protocols,IP networks;Internet;field programmable gate arrays;logic design;monitoring;telecommunication traffic,FPGA based programmable IP flow monitor;ML506 board;Packet Xpress;Xilinx Virtex-5;field programmable gate array technology;flexible high speed FPGA;next generation network;real Internet traffic tracing,,0,,19,,,19-22 July 2010,,IEEE,IEEE Conference Publications
An intrusion detection sensor for the NetVM virtual processor,"Morandi, O.; Moscardi, G.; Risso, F.","Dipt. di Autom. e Inf., Politec. di Torino, Turin","Information Networking, 2009. ICOIN 2009. International Conference on",20090428,2009,,,1,5,"In the wide scenario of packet processing architectures, the development of ever sophisticated applications faces the challenge of finding a balance between different requirements: ever increasing performance, flexibility, and portability of the software across different platforms and hardware architectures. The Network Virtual Machine (NetVM) aims at responding to such defy by taking into account all these elements and by providing an abstract architecture for developing today's packet processing applications. In order to demonstrate that the NetVM platform can be profitably employed for the development of complex applications, we developed a Snort-like network intrusion detection sensor. In this paper we present its architecture and show that NetVM represents an excellent target for the dynamic generation of packet processing programs.",,978-89-960761-3-1,978-89-960761-3-1,,http://ieeexplore.ieee.org/stamp/stamp.jsp?arnumber=4897261,,Application software;Computer architecture;Coprocessors;Face detection;Hardware;Intrusion detection;Multicore processing;Software performance;Throughput;Virtual machining,IP networks;security of data;virtual machines,NetVM virtual processor;intrusion detection sensor;network virtual machine;packet processing architectures,,0,,16,,,21-24 Jan. 2009,,IEEE,IEEE Conference Publications
