http://ieeexplore.ieee.org/search/searchresult.jsp?download-format=download-csv&bulkSetSize=2000&refinements%3D4291944822%2C4291944246%26ranges%3D2009_2016_p_Publication_Year%26matchBoolean%3Dtrue%26searchField%3DSearch_All_Text%26queryText%3D%28%28%28%28.QT.Lines+of+Code.QT.%29+OR+.QT.LOC.QT.%29+OR+.QT.SLOC.QT.%29+AND+.QT.Intrusion+Detection+System.QT.%29,11/9/2015 20:29,"((((""Lines of Code"") OR ""LOC"") OR ""SLOC"") AND ""Intrusion Detection System"")",IEEE,,,,,,,,,,,,,,,,,,,,,,,,,,
A framework for detection and prevention of novel keylogger spyware attacks,"Wazid, Mohammad; Katal, Avita; Goudar, R.H.; Singh, D.P.; Tyagi, Asit; Sharma, Robin; Bhakuni, Priyanka","Department of CSE, Graphic Era University, Dehradun, India","Intelligent Systems and Control (ISCO), 2013 7th International Conference on",20130321,2013,,,433,438,"Cyber world is susceptible to various attacks, out of which malware attack is the malignant one. It is very difficult to detect and defend. A keylogger spyware contains both scripts keylogger and spyware in a single program. The functionality of this program is that it can capture all key strokes which are pressed by a system user and stores them in a log file, the spyware email this log file to the designer's specified address. It is very harmful for those systems which are used in daily transaction process i.e. online banking system. The prevention of these attacks is necessary. In this paper we have proposed a framework for detection and prevention of novel keylogger spyware attack. It is capable to defend against such kind of attacks.",,978-1-4673-4359-6,,10.1109/ISCO.2013.6481194,http://ieeexplore.ieee.org/stamp/stamp.jsp?arnumber=6481194,Honeypot Base Monitoring;Keylogger Spyware Algorithm;Keylogger Spyware Attack;Keylogger Spyware Detection and Prevention;Keylogger Spyware Monitoring and Inspection Algorithm;Keylogger Spyware Removal Algorithm,Helium;Spyware,,,,1,,15,,,4-5 Jan. 2013,,IEEE,IEEE Conference Publications
Designing Cloud Services Adhering to Government Privacy Laws,"Doelitzscher, F.; Reich, C.; Sulistio, A.","Fac. of Comput. Sci., Hochschule Furtwangen Univ., Germany","Computer and Information Technology (CIT), 2010 IEEE 10th International Conference on",20100916,2010,,,930,935,"Cloud computing delivers on-demand services with flexibility and scalability on a simple pay-per-use basis. However, major concerns regarding to security and privacy hinder a broad adoption by users, especially small- and medium-sized enterprises (SMEs). This is because existing guidelines, IT standards and laws on security and privacy do not take virtual environments into account. Thus, they present a significant challenge for cloud providers to comply with. As a result, the cloud providers are unable to provide SMEs with an assurance. In order to address these privacy and security issues, this paper presents the Cloud Data Security (CloudDataSec) project that aims to design cloud services adhering to government privacy laws. In particular, this paper introduces a six-layer security model for cloud computing and three level of security assurance for SMEs to take advantage of. Finally, Security Management as a Service (SMaaS) modules, as proposed in this paper, enable users to apply necessary security and privacy operations, based on the sensitivity of their data.",,978-1-4244-7547-6,,10.1109/CIT.2010.172,http://ieeexplore.ieee.org/stamp/stamp.jsp?arnumber=5578475,IT compliance;cloud computing;data security;privacy,Cloud computing;Clouds;Data privacy;Encryption;Monitoring;Privacy,Web services;data privacy;law;security of data;small-to-medium enterprises,IT standards;cloud computing;cloud data security project;cloud services;government privacy laws;on-demand services;pay-per-use basis;security management as a service modules;six-layer security model;small and medium-sized enterprises,,5,,26,,,June 29 2010-July 1 2010,,IEEE,IEEE Conference Publications
Parallelizing sequential network applications with customized lock-free data structures,Junchang Wang; Kai Zhang; Bei Hua,"Sch. of Comput. Sci. & Technol., Univ. of Sci. & Technol. of China (USTC), Hefei, China","Communications and Networking in China (CHINACOM), 2012 7th International ICST Conference on",20130124,2012,,,18,23,"Parallelizing fine-grained network applications on general-purpose multi-core architectures is a big challenge, as it requires fast core-to-core synchronization that is not supported for now. This paper proposes a methodology for parallelizing legacy sequential network applications on multi-core architectures with only minor code rewriting. Single Program Multiple Data (SPMD) parallel programming style is used to retain the control flow of sequential code, and then data structures potentially involving data racing are replaced with customized lock-free data structures based on domain knowledge. We evaluate the methodology by parallelizing a sequential TCP SYN flood detection program on Intel Quad processors, and gain inspiring results.",,978-1-4673-2698-8,978-1-4673-2697-1,10.1109/ChinaCom.2012.6417441,http://ieeexplore.ieee.org/stamp/stamp.jsp?arnumber=6417441,Parallel;concurrent programming;customized lock-free data structure;network applications,Arrays;Engines;Floods;IP networks;Memory management;Servers,data structures;multiprocessing systems;parallel architectures;parallel programming;sequential codes;synchronisation,Intel Quad processors;SPMD parallel programming style;customized lock-free data structures;data racing;fast core-to-core synchronization;general-purpose multicore architectures;minor code rewriting;parallelizing fine-grained network applications;parallelizing legacy sequential network applications;parallelizing sequential network applications;sequential TCP SYN flood detection program;sequential code control flow;single program multiple data parallel programming style,,0,,24,,,8-10 Aug. 2012,,IEEE,IEEE Conference Publications
"P<inline-formula><tex-math>$^{2}$</tex-math><alternatives> <inline-graphic xlink:type=""simple"" xlink:href=""holm-ieq1-2382574.gif""/></alternatives></inline-formula>CySeMoL: Predictive, Probabilistic Cyber Security Modeling Language","Holm, H.; Shahzad, K.; Buschle, M.; Ekstedt, M.","Department of Industrial Information and Control Systems, The Royal Institute of Technology, Stockholm, Sweden","Dependable and Secure Computing, IEEE Transactions on",20151109,2015,12,6,626,639,"This paper presents the Predictive, Probabilistic Cyber Security Modeling Language (P<inline-formula><tex-math> $^{2}$</tex-math><alternatives><inline-graphic xlink:type=""simple"" xlink:href=""holm-ieq2-2382574.gif""/></alternatives></inline-formula> CySeMoL), an attack graph tool that can be used to estimate the cyber security of enterprise architectures. P <inline-formula><tex-math>$^{2}$</tex-math><alternatives><inline-graphic xlink:type=""simple"" xlink:href=""holm-ieq3-2382574.gif""/> </alternatives></inline-formula>CySeMoL includes theory on how attacks and defenses relate quantitatively; thus, users must only model their assets and how these are connected in order to enable calculations. The performance of PCySeMoL enables quick calculations of large object models. It has been validated on both a component level and a system level using literature, domain experts, surveys, observations, experiments and case studies.",1545-5971,,,10.1109/TDSC.2014.2382574,http://ieeexplore.ieee.org/stamp/stamp.jsp?arnumber=6990572,Computer security;attack graphs;risk management;security metrics,Computational modeling;Computer architecture;Computer security;Data models;Predictive models;Probabilistic logic,,,,0,,,,12/18/2014,Nov.-Dec. 1 2015,,IEEE,IEEE Journals & Magazines
Vulnerability Analysis in SOA-Based Business Processes,"Lowis, L.; Accorsi, R.","IIG Telematics, Univ. of Freiburg, Freiburg, Germany","Services Computing, IEEE Transactions on",20110825,2011,4,3,230,242,"Business processes and services can more flexibly be combined when based upon standards. However, such flexible compositions practically always contain vulnerabilities, which imperil the security and dependability of processes. Vulnerability management tools require patterns to find or monitor vulnerabilities. Such patterns have to be derived from vulnerability types. Existing analysis methods such as attack trees and FMEA result in such types, yet require much experience and provide little guidance during the analysis. Our main contribution is ATLIST, a new vulnerability analysis method with improved transferability. Especially in service-oriented architectures, which employ a mix of established web technologies and SOA-specific standards, previously observed vulnerability types and variations thereof can be found. Therefore, we focus on the detection of known vulnerability types by leveraging previous vulnerability research. A further contribution in this respect is the, to the best of our knowledge, most comprehensive compilation of vulnerability information sources to date. We present the method to search for vulnerability types in SOA-based business processes and services. Also, we show how patterns can be derived from these types, so that tools can be employed. An additional contribution is a case study, in which we apply the new method to an SOA-based business process scenario.",1939-1374,,,10.1109/TSC.2010.37,http://ieeexplore.ieee.org/stamp/stamp.jsp?arnumber=5560632,SOA-based business processes;Service security and dependability;vulnerability analysis;vulnerability classification.,Business;Monitoring;Operating systems;Runtime;Security;Service oriented architecture;Standards,business data processing;security of data;service-oriented architecture,ATLIST;FMEA;SOA-based business process;attack trees;service-oriented architectures;vulnerability analysis method;vulnerability management tools,,4,,101,,9/2/2010,July-Sept. 2011,,IEEE,IEEE Journals & Magazines
Stream-Oriented Network Traffic Capture and Analysis for High-Speed Networks,"Papadogiannakis, A.; Polychronakis, M.; Markatos, E.P.","Inst. of Comput. Sci., Found. for Res. & Technol.-Hellas, Heraklion, Greece","Selected Areas in Communications, IEEE Journal on",20141127,2014,32,10,1849,1863,"Intrusion detection, traffic classification, and other network monitoring applications need to analyze the captured traffic beyond the network layer to allow for connection-oriented analysis, and achieve resilience to evasion attempts based on TCP segmentation. Existing network traffic capture frameworks, however, provide applications with raw packets and leave complex operations like flow tracking and TCP stream reassembly to application developers. This gap, between what applications need and what systems provide, leads to increased application complexity, longer development time, and most importantly, reduced performance due to excessive data copies between the packet capture subsystem and the stream processing module. This paper presents the Stream capture library (Scap), a network monitoring framework built from the ground up for stream-oriented traffic processing. Based on a kernel module that directly handles flow tracking and TCP stream reassembly, Scap delivers to user-level applications flow-level statistics and reassembled streams by minimizing data movement operations and discarding uninteresting traffic at early stages, while it inherently supports parallel processing on multi-core architectures, and uses advanced capabilities of modern network cards. Our experimental evaluation shows that Scap can capture all streams for traffic rates two times higher than other stream reassembly libraries. Finally, we present the implementation and performance evaluation of four popular network traffic monitoring applications built on top of Scap.",0733-8716,,,10.1109/JSAC.2014.2358831,http://ieeexplore.ieee.org/stamp/stamp.jsp?arnumber=6901242,Traffic monitoring;overload control;packet capture;packet filtering;performance;stream reassembly,Instruction sets;Kernel;Monitoring;Optimization;Packet loss;Protocols,parallel processing;security of data;telecommunication traffic;transport protocols,Scap;Stream capture library;TCP segmentation;TCP stream reassembly;connection-oriented analysis;data movement operations;high-speed network;intrusion detection;multicore architectures;network monitoring;parallel processing;stream-oriented network traffic capture;stream-oriented traffic processing;traffic classification,,0,,54,,9/17/2014,Oct. 2014,,IEEE,IEEE Journals & Magazines
Towards semantic buildings: Goal-driven approach for building automation service allocation and control,"Andrushevich, A.; Staub, M.; Kistler, R.; Klapproth, A.","CEESAR - iHomeLab, Lucerne Univ. of Appl. Sci. & Arts, Horw, Switzerland","Emerging Technologies and Factory Automation (ETFA), 2010 IEEE Conference on",20101118,2010,,,1,6,The idea of applying semantic web technologies to the area of smart homes (SH) and building automation has resulted in a number of research activities and initiatives that have been recently developed. This article starts with an overview of ongoing work towards embedding semantics into home automation services. We then highlight the problems not considered by previous solutions. The core value of the work presented here is contained in a novel goal-driven approach for building automation service allocation and control. A new concept of semantic homes (SeH) and its architectural vision is another significant contribution. The comparison between existing and suggested solutions is rounded off by a use case scenario from the area of ambient assisted living.,1946-0740,978-1-4244-6848-5,,10.1109/ETFA.2010.5641325,http://ieeexplore.ieee.org/stamp/stamp.jsp?arnumber=5641325,,,building management systems;control engineering computing;home automation;semantic Web;software engineering,ambient assisted living;architectural vision;building automation service allocation;goal-driven approach;home automation services;semantic Web technology;semantic buildings;semantic homes;smart homes,,3,,16,,,13-16 Sept. 2010,,IEEE,IEEE Conference Publications
Statistical estimation for Single Linkage Hierarchical Clustering,"Zhu Dekang; Guralnik, D.; Wang Xuezhi; Li Xiang; Moran, B.","Sch. of Electron. Sci. & Eng., Nat. Univ. of Defense Technol., Changsha, China","Cyber Technology in Automation, Control, and Intelligent Systems (CYBER), 2015 IEEE International Conference on",20151005,2015,,,745,750,"Clustering is a key component of most detectors of cyber-attacks, and increasingly, for both theoretical and practical reasons, methods that produce hierarchical clusterings (dendrograms) are being deployed in this context. In particular Single Linkage Hierarchical Clustering (SLHC) is attracting considerable interest. Existing clustering algorithms take no account of uncertainties in the data. In this paper, we derive a statistical model for the estimation of dendrograms, taking into account the uncertainty (through noise or corruption) in the distances among data points. We focus on just the estimation of the hierarchy of partitions afforded by the dendrogram, rather than the heights in the latter. The concept of estimating this ""dendrogram structure"" under SLHC is introduced, and an approximate maximum likelihood estimator (MLE) for the dendrogram structure is described. The proposed concept is demonstrated by a simple Monte Carlo simulation which demonstrates that the proposed MLE method performs better than SLHC in obtaining the correct structure.",,978-1-4799-8728-3,,10.1109/CYBER.2015.7288035,http://ieeexplore.ieee.org/stamp/stamp.jsp?arnumber=7288035,,Clustering algorithms;Clustering methods;Couplings;Maximum likelihood estimation;Measurement;Monte Carlo methods,Monte Carlo methods;maximum likelihood estimation;pattern clustering;statistical analysis,MLE method;Monte Carlo simulation;SLHC;approximate maximum likelihood estimator;data points;data uncertainties;dendrogram structure estimation;distance uncertainty;partition hierarchy estimation;single-linkage hierarchical clustering;statistical estimation,,,,,,,8-12 June 2015,,IEEE,IEEE Conference Publications
Adaptable Intrusion Detection Systems Dedicated to Concurrent Programs: A Petri Net-Based Approach,"Voron, J.-B.; De&#x0301;moulins, C.; Kordon, F.","LIP6, Univ. Pierre & Marie Curie, Paris, France","Application of Concurrency to System Design (ACSD), 2010 10th International Conference on",20100823,2010,,,57,66,"Intrusion detection systems (IDS) are one way to tackle the increasing number of attacks that exploit software vulnerabilities. However, the construction of such a security system is a delicate process involving: (i) the acquisition of the monitored program behavior and its storage in a compact way, (ii) the generation of a monitor detecting deviances in the program behavior. These problems are emphasized when dealing with complex or parallel programs. This paper presents a new approach to automatically generate a dedicated and customized IDS from C sources targeting multi-threaded programs. We use Petri Nets to benefit from a formal description able to compactly describe parallel behaviors. Obtained models can then be enhanced with extra requirements such as resources usage limits or temporal execution bounds by means of observers. We illustrate the benefits of our approach on a recent class of attacks targeting web servers.",1550-4808,978-1-4244-7266-6,978-1-4244-7267-3,10.1109/ACSD.2010.32,http://ieeexplore.ieee.org/stamp/stamp.jsp?arnumber=5552689,IDS;Petri nets;automatic code generation;behavior modeling;observers;security;static analysis,Analytical models;Law;Monitoring;Observers;Petri nets;Runtime,Internet;Petri nets;concurrency control;file servers;multi-threading;security of data,Petri net-based approach;Web servers;adaptable intrusion detection systems;concurrent programs;monitored program behavior acquisition;multithreaded programs;parallel programs;security system;software vulnerability;temporal execution bounds,,0,,21,,,21-25 June 2010,,IEEE,IEEE Conference Publications
Zebu: A Language-Based Approach for Network Protocol Message Processing,"Burgy, L.; Reveillere, L.; Lawall, J.; Muller, G.","Princeton Univ., Princeton, NJ, USA","Software Engineering, IEEE Transactions on",20110728,2011,37,4,575,591,"A network application communicates with other applications according to a set of rules known as a protocol. This communication is managed by the part of the application known as the protocol-handling layer, which enables the manipulation of protocol messages. The protocol-handling layer is a critical component of a network application since it represents the interface between the application and the outside world. It must thus satisfy two constraints: It must be efficient to be able to treat a large number of messages and it must be robust to face various attacks targeting the application itself or the underlying platform. Despite these constraints, the development process of this layer still remains rudimentary and requires a high level of expertise. It includes translating the protocol specification written in a high-level formalism such as ABNF toward low-level code such as C. The gap between these abstraction levels can entail many errors. This paper proposes a new language-based approach to developing protocol-handling layers, to improve their robustness without compromising their performance. Our approach is based on the use of a domain-specific language, Zebu, to specify the protocol-handling layer of network applications that use textual HTTP-like application protocols. The Zebu syntax is very close to that of ABNF, facilitating the adoption of Zebu by domain experts. By annotating the original ABNF specification of a protocol, the Zebu user can dedicate the protocol-handling layer to the needs of a given application. The Zebu compiler first checks the annotated specification for inconsistencies, and then generates a protocol-handling layer according to the annotations. This protocol-handling layer is made up of a set of data structures that represent a message, a parser that fills in these data structures, and various stub functions to access these data structures or drive the parsing of a message.",0098-5589,,,10.1109/TSE.2010.64,http://ieeexplore.ieee.org/stamp/stamp.jsp?arnumber=5487528,Network protocols;domain-specific languages.;message composing;message parsing,Access protocols;Computer bugs;Data structures;Domain specific languages;Electronic mail;IP networks;Network servers;Robustness;Streaming media;Web server,Internet;computational linguistics;formal specification;program compilers;protocols;specification languages;telecommunication computing,ABNF;Internet era;Zebu compiler;Zebu syntax;data structures;domain-specific languages;language-based approach;message parsing;network protocol message processing;protocol specification;protocol-handling layer;textual HTTP-like application protocols,,5,,34,,6/17/2010,July-Aug. 2011,,IEEE,IEEE Journals & Magazines
A Testbed for Evaluating Anomaly Detection Monitors through Fault Injection,"Ceccarelli, A.; Zoppi, T.; Bondavalli, A.; Duchi, F.; Vella, G.","Dept. of Math. & Inf., Univ. of Florence, Florence, Italy","Object/Component/Service-Oriented Real-Time Distributed Computing (ISORC), 2014 IEEE 17th International Symposium on",20140918,2014,,,358,365,"Amongst the features of Service Oriented Architectures (SOAs), their flexibility, dynamicity, and scalability make them particularly attractive for adoption in the ICT infrastructure of organizations. Such features come at the cost of improved difficulty in monitoring the SOA for error detection: i) faults may manifest themselves differently due to services and SOA evolution, and ii) interactions between a service and its monitors may need reconfiguration at each service update. This calls for monitoring solutions that operate at different layers than the application layer (services layer). In this paper we present our ongoing work towards the definition of a monitoring framework for SOAs and services, which relies on anomaly detection performed at the Application Server (AS) and the Operating System (OS) layers to identify events whose manifestation or effect is not adequately described a-priori. Specifically the paper introduces the key concepts of our work and presents the case study built to exercise and set-up our monitor. The case study uses Life ray as application layer and it includes fault injection and data collection instruments to perform extended testing campaigns.",1555-0885,,,10.1109/ISORC.2014.31,http://ieeexplore.ieee.org/stamp/stamp.jsp?arnumber=6899171,SOA;anomaly detection;application server;fault injection;monitoring;testing,Generators;Kernel;Monitoring;Probes;Servers;Service-oriented architecture,fault tolerant computing;operating systems (computers);service-oriented architecture,AS layer;ICT infrastructure;OS layer;SOA;anomaly detection monitors;application server;error detection;fault injection;information and communication technology;operating system;service oriented architectures,,0,,24,,,10-12 June 2014,,IEEE,IEEE Conference Publications
Diversity in cloud systems through runtime and compile-time relocation,"Kanter, M.; Taylor, S.","Thayer Sch. of Eng., Dartmouth Coll., Hanover, NH, USA","Technologies for Homeland Security (HST), 2013 IEEE International Conference on",20140102,2013,,,396,402,"Cloud computing has become popular in recent years due to the cost and resource savings associated with virtual machines using shared resources. Unfortunately, this mode of operation serves as a vulnerability amplifier because each computer executes multiple versions of the same operating code base carrying the same vulnerabilities. This paper explores techniques for the system's run-time loader to generate diversity from a single binary source. In addition, we describe compile-time techniques that can augment and enhance the diversity gained through the run-time system alone. Collectively, the techniques randomize the code and data of the binary eliminating vulnerability amplification. Entropy is used as a measure of diversity and we explore the entropy gained by the techniques under several different assumptions concerning the attackers knowledge of the system. The techniques have been implemented into Bear, a from-scratch hypervisor and microkernel designed to run military cloud applications that require resilience.",,978-1-4799-3963-3,,10.1109/THS.2013.6699037,http://ieeexplore.ieee.org/stamp/stamp.jsp?arnumber=6699037,computer security;information security,Entropy;Geophysical measurement techniques;Ground penetrating radar;Kernel;Programming;Runtime;Virtual machine monitors,cloud computing;military computing;resource allocation,Bear hypervisor;binary source;cloud computing;cloud systems diversity;compile-time relocation;cost savings;entropy;microkernel;military cloud applications;resource savings;runtime loader;shared resources;virtual machines;vulnerability amplification;vulnerability amplifier,,0,,37,,,12-14 Nov. 2013,,IEEE,IEEE Conference Publications
