"An anomaly intrusion detection method using average Hamming distance","Ye Du; Hui-Qiang Wang; Yong-Gang Pang","Coll. of Comput. Sci. & Technol., Harbin Eng. Univ., China","Machine Learning and Cybernetics, 2004. Proceedings of 2004 International Conference on","20050124","2004","5","","2914","2918 vol.5","Intrusion detection plays a significant role in protecting information security. The existing techniques were analyzed, and then an effective method - AHDAD (average Hamming distance-based anomaly intrusion detection) was proposed to learn patterns of Unix processes. Fixed-length sequences of system calls were extracted from traces of programs, and the AHD (average Hamming distance) was calculated to classify normal and abnormal behaviors. The method has some advantages, such as algorithm simplicity, low overhead of time, high accuracy and real-time detection. Experiments on send-mail traces demonstrate that the method can detect intrusive actions accurately.","","0-7803-8403-2","","10.1109/ICMLC.2004.1378530","http://ieeexplore.ieee.org.ezproxy.rit.edu/stamp/stamp.jsp?arnumber=1378530","","Computer science;Data mining;Databases;Educational institutions;Hamming distance;Information security;Information systems;Intrusion detection;Pattern analysis;Protection","Unix;security of data","Unix processes;anomaly intrusion detection method;average Hamming distance;fixed length sequences;information security;real time detection;send mail traces","","0","","14","","","26-29 Aug. 2004","","IEEE","IEEE Conference Publications"
"An Intelligent and Expert Mining Intrusion Detection and Response System","Hooper, E.","Inf. Security Group, Univ. of London, Egham","Digital Information Management, 2006 1st International Conference on","20070604","2007","","","187","192","Intelligent intrusion and detection strategies for reducing false positives and increasing detection within network critical segments of network infrastructures are a major challenge. Current strategies focus on either detection or responses, but often lack both detection and response strategies. This novel approach combines both detection and response strategies involving both real-time analysis and effective statistical analysis of attack and normal traffic. The novel strategy involves a hybrid statistical approach involving Bayesian and Discriminant Analysis Classification. This comprises discriminant analysis of the normal and attack traffic after using Bayes Theorem to evaluate the training data. The results of the statistical analysis is fed into the IDS to reduce misclassification of false positives and distinguish between attacks and false positives in the IDS alert monitor. These intelligent strategies enhance the capability of the IDS to detect and respond to threats and benign traffic in critical segments of network, application and database infrastructures.","","1-4244-0682-X","","10.1109/ICDIM.2007.369351","http://ieeexplore.ieee.org.ezproxy.rit.edu/stamp/stamp.jsp?arnumber=4221888","","Bayesian methods;Classification tree analysis;Computer hacking;Data analysis;Deductive databases;Intelligent networks;Intrusion detection;Monitoring;Statistical analysis;Telecommunication traffic","Bayes methods;data mining;expert systems;pattern classification;security of data;statistical analysis;telecommunication traffic","Bayes theorem;Bayesian analysis;IDS alert monitor;attack traffic;database infrastructures;discriminant analysis classification;expert mining intrusion detection;hybrid statistical approach;intelligent intrusion;network critical segments;network infrastructures;normal traffic;real-time analysis;statistical analysis;training data","","0","","13","","","6-6 Dec. 2006","","IEEE","IEEE Conference Publications"
"IP Traceback Methodology Using Markov Chain and Bloom Filter in 802.16e","Do Hoon Kim; Hoh, P.I.; Yoon, B.","Dept. of Comput. Sci. & Eng., Korea Univ., Seoul","Convergence and Hybrid Information Technology, 2008. ICCIT '08. Third International Conference on","20081118","2008","2","","454","459","Recently, network resource is extremely vulnerable to DDoS attacks which has become a pressing problem due to scarce an efficient method to locate the real attacker. Especially, the more network topology advanced and complex such as 802.16e (WiBro), IP traceback is difficult. According to, in this paper, the IP Traceback methodology using Markov chain based on XOR operation is proposed in 802.16e. Also the paper provides a traceback method including: receiving data including access control router information according to a path of an attacker; filtering the data to hash the data, and storing the resultant hashed information; determining whether the data is normally received on the basis of the hashed information; and predicting a path loss on the basis of the determination result. Therefore, it is possible to perform an accurate IP traceback using a probabilistic packing marking method and a hash-based traceback method.","","978-0-7695-3407-7","","10.1109/ICCIT.2008.274","http://ieeexplore.ieee.org.ezproxy.rit.edu/stamp/stamp.jsp?arnumber=4682283","802.16e;Bloom Filter;IP Traceback;Markov Chain;Probabilistic Packet Marking","Access control;Computer crime;Computer science;IP networks;Information filtering;Information filters;Information technology;Network topology;Pressing;Protocols","IP networks;Markov processes;cryptography;telecommunication network topology;wireless LAN","802.16e;DDoS attacks;IP traceback;Markov chain;WiBro;bloom filter;hash-based traceback;network resource;network topology;probabilistic packing marking","","0","","12","","","11-13 Nov. 2008","","IEEE","IEEE Conference Publications"
"A two-stage technique to improve intrusion detection systems based on data mining algorithms","Fatma, H.; Mohamed, L.","ISG, Univ. of Tunis Tunisia, Tunis, Tunisia","Modeling, Simulation and Applied Optimization (ICMSAO), 2013 5th International Conference on","20130708","2013","","","1","6","An intrusion detection system (IDS) is the fundamental part of the security infrastructure, since it ensures the detection of any suspicious action. Although the detection of intrusions and attacks is the ultimate goal, the huge amount of generated alerts cannot be properly managed by the administrator. In order to improve the accuracy of sensors, we adopt a two-stage technique. The first one aims to generate meta-alerts through clustering and the second one aims to reduce the rate of false alarms using a binary classification of the generated meta-alerts. For the first stage we use two alternatives, self-organizing map (SOM) with k-means algorithm and neural GAS with fuzzy c-means algorithm. For the second stage we use three approaches, SOM with K-means algorithm, support vector machine and decision trees. Based on a public data set and several evaluation criteria, our proposed procedures are evaluated. Results show that our procedures outperform other competitor methods by reducing the rate of false positives.","","978-1-4673-5812-5","","10.1109/ICMSAO.2013.6552542","http://ieeexplore.ieee.org.ezproxy.rit.edu/stamp/stamp.jsp?arnumber=6552542","IDS;alerts;binary classification;clustering;meta-alerts","Classification algorithms;Clustering algorithms;Databases;Silicon;Telecommunication traffic;Testing","data mining;decision trees;fuzzy set theory;pattern classification;pattern clustering;security of data;self-organising feature maps","IDS;SOM;attack detection;binary classification;clustering;data mining algorithm;decision tree;false alarm rate reduction;fuzzy c-means algorithm;intrusion detection system;k-means algorithm;meta-alert;neural GAS;security infrastructure;self-organizing map;support vector machine","","2","","12","","","28-30 April 2013","","IEEE","IEEE Conference Publications"
"MDLcompress for Intrusion Detection: Signature Inference and Masquerade Attack","Evans, S.; Eiland, Earl; Markham, Stephen; Impson, J.; Laczo, Adam","GE Research, Niskayuna, New York","Military Communications Conference, 2007. MILCOM 2007. IEEE","20080222","2007","","","1","7","MDLcompress is a grammar inference algorithm that uses Minimum Description Length principles from the theory of Kolmogorov Complexity and Algorithmic Information Theory to infer a grammar, finding patterns and motifs that aid most in compressing unknown data sets. This technology has been applied to detection of FTP exploits and inference of DNA sequence motifs related to breast cancer. In this paper we apply MDLcompress to infer grammars, and then apply those grammars to identify masquerades in the publicly available Schonlau system call data sets. Compared to similar protocols our system detects anomalous events with comparable performance with the advantage of executing in linear time.","","978-1-4244-1513-7","978-1-4244-1513-7","10.1109/MILCOM.2007.4455304","http://ieeexplore.ieee.org.ezproxy.rit.edu/stamp/stamp.jsp?arnumber=4455304","","Breast cancer;Cancer detection;DNA;Event detection;Genetic communication;Inference algorithms;Information theory;Intrusion detection;Protocols;Sequences","","","","4","1","22","","","29-31 Oct. 2007","","IEEE","IEEE Conference Publications"
"Advances in artificial immune systems","Dasgupta, D.","Memphis Univ., TN","Computational Intelligence Magazine, IEEE","20070319","2006","1","4","40","49","During the last decade, the field of artificial immune system (A1S) is progressing slowly and steadily as a branch of computational intelligence (CI). There has been increasing interest in the development of computational models inspired by several immunological principles. In particular, some are building models mimicking the mechanisms in the biological immune system (BIS) to better understand its natural processes and simulate its dynamical behavior in the presence of antigens/pathogens. Most of the AIS models, however, emphasize designing artifacts - computational algorithms, techniques using simplified models of various immunological processes and functionalities. Like other biologically-inspired techniques, such as artificial neural networks, genetic algorithms, and cellular automata, AISs also try to extract ideas from the BIS in order to develop computational tools for solving science and engineering problems. Although still relatively young, the artificial immune system (AIS) is emerging as an active and attractive, field involving models, techniques and applications of greater diversity","1556-603X","","","10.1109/MCI.2006.329705","http://ieeexplore.ieee.org.ezproxy.rit.edu/stamp/stamp.jsp?arnumber=4129847","","Algorithm design and analysis;Artificial immune systems;Artificial neural networks;Biological system modeling;Biology computing;Buildings;Computational intelligence;Computational modeling;Immune system;Pathogens","artificial immune systems;artificial intelligence","antigens;artificial immune systems;biological immune system;computational intelligence;computational models;dynamical behavior;pathogens","","86","","67","","","Nov. 2006","","IEEE","IEEE Journals & Magazines"
"Multi-dimensional visualization for network forensic analysis","Promrit, N.; Mingkhwan, A.; Simcharoen, S.; Namvong, N.","Fac. of Inf. Technol., King Mongkut''s Univ. of Technol. North Bangkok, Bangkok, Thailand","Networked Computing (INC), 2011 The 7th International Conference on","20111024","2011","","","68","73","This research studies the offense on a computer network with multiple dimensions of network traffic and logs using parallel coordinates to show relationships of various parameters such as user, source ip address, time, destination ip address, destination service and domain name. The aim is to test the hypothesis that this technique is able to identify patterns of attacks and the behavior of offenders. Initially the attacks were simulated by creating text file dataset. The results of the experiment showed that (i) Attacked signatures are various depending on the situation of attack. (ii) Analyst can observe the attacks obviously in details. In addition, researchers proposed-user investigations with visualization time machine for network forensic (UIV) as a tool for analyzing the behavior on a computer network, the results also showed that (iii) it is possible to track an individual's behavior using this tool.","","978-1-4577-1129-9","978-89-88678-43-5","","http://ieeexplore.ieee.org.ezproxy.rit.edu/stamp/stamp.jsp?arnumber=6058947","Network forensic;Network traffic visualization;Parallel coordinates","Calendars;Computer architecture;Computer networks;Data visualization;Electronic mail;Forensics;Servers","IP networks;computer crime;computer forensics;computer network security;data visualisation","IP address;computer network;domain name;multidimensional visualization;network forensic analysis;network traffic;parallel coordinate;text file dataset;visualization time machine","","0","","13","","","26-28 Sept. 2011","","IEEE","IEEE Conference Publications"
"Training MLP neural network to reduce false alerts in IDS","Barapatre, P.; Tarapore, N.Z.; Pukale, S.G.; Dhore, M.L.","Dept. of Comput. Eng., Vishwakarma Inst. of Technol., Pune","Computing, Communication and Networking, 2008. ICCCn 2008. International Conference on","20090224","2008","","","1","7","Due to the tremendous growth of the Internet and Network based services, the severity of network based computer attacks have significantly increased. Thus, IDS play a vital role in network security. Intrusion detection system tries to detect computer attacks by examining various data records, log audits etc. Many existing IDS such as Snort are signature based system. The problem with such a system is that it cannot detect novel attacks whose signature is not available and hence generates a high rate of alerts. In this paper Multilayer Perceptron (MLP) with Back-Propagation algorithm is used to classify attacks. We train and test MLP with KDD99 training dataset. We use KDD99 dataset which is a subset of the DARPA dataset. It is a preprocessed dataset and is most suitable for our system. We analyze the working of MLP by performing various experiments. We observed that MLP Neural network requires large training time. Once it trained, detects known as well as unknown attacks and also reduces false alerts.","","978-1-4244-3594-4","978-1-4244-3595-1","10.1109/ICCCNET.2008.4787714","http://ieeexplore.ieee.org.ezproxy.rit.edu/stamp/stamp.jsp?arnumber=4787714","","Artificial neural networks;Computer networks;Data security;Databases;Information security;Intrusion detection;Multilayer perceptrons;Neural networks;Protection;Telecommunication traffic","backpropagation;computer networks;multilayer perceptrons;security of data","IDS;MLP neural network;back-propagation algorithm;false alerts reduction;intrusion detection system;multilayer perceptron;network based computer attacks","","0","","13","","","18-20 Dec. 2008","","IEEE","IEEE Conference Publications"
"Bloom filter based intrusion detection for smart grid SCADA","Parthasarathy, S.; Kundur, D.","Dept. of Electr. & Comput. Eng., Texas A&M Univ., College Station, TX, USA","Electrical & Computer Engineering (CCECE), 2012 25th IEEE Canadian Conference on","20121022","2012","","","1","6","In this paper, we propose a distributed, light-weight and fast intrusion detection approach suitable for implementation across multiple resource constrained SCADA field devices in the smart grid. The predictable and regular nature of the SCADA communication patterns is exploited to detect intrusions in the field devices. The novel approach is anomaly-based, uses the Bloom filter data structure for memory efficiency and incorporates the physical state of the power system for greater robustness. The proposed method is tested using MODBUS protocol used for communication between a SCADA server and field devices in a SCADA system.","0840-7789","978-1-4673-1431-2","978-1-4673-1432-9","10.1109/CCECE.2012.6334816","http://ieeexplore.ieee.org.ezproxy.rit.edu/stamp/stamp.jsp?arnumber=6334816","Bloom filter;intrusion detection;smart grid SCADA IDS","Coils;Intrusion detection;Power system stability;Protocols;Servers;Training","SCADA systems;field buses;filtering theory;power system protection;protocols;security of data;smart power grids","MODBUS protocol;SCADA communication pattern;SCADA field device;data structure;distributed intrusion detection approach;memory efficiency;power system physical state;smart grid","","4","","9","","","April 29 2012-May 2 2012","","IEEE","IEEE Conference Publications"
"Network Security Situation Assessment Based on Data Fusion","Liu Mixia; Zhang Qiuyu; Zhao Hong; Yu Dongmei","Lanzhou Univ. of Technol., Lanzhou","Knowledge Discovery and Data Mining, 2008. WKDD 2008. First International Workshop on","20080312","2008","","","542","545","Network security situation assessment can project the next behavior of the network by describing the current state. Security events from IDS, firewall, and other security tools are currently growing at a rapid pace. However, most intrusion event researches focus on IDS alerts, overlooking other intrusion evidence from other security tools, or they make simple integration of various security tools not inflecting the whole network state. In this paper, we described network security from the view of system. First, network situation elements are analyzed. Second, we research their correlations and present system architecture of network security situation. Third, multi-sensor correlation algorithms are analyzed that colored Petri net is used for describing the changing of system state after arrival of new events and D-S theory of evidence is used for combining the different evidence. Then, we report the experimental results on the DARPA 2000 DDoS attack scenarios and analyze them. At last, we conclude our work and present next research goal.","","978-0-7695-3090-1","","10.1109/WKDD.2008.35","http://ieeexplore.ieee.org.ezproxy.rit.edu/stamp/stamp.jsp?arnumber=4470456","","Computer networks;Computer security;Data mining;Data security;Educational institutions;Fuses;IP networks;Information security;Intrusion detection;Software tools","Petri nets;authorisation;graph colouring;sensor fusion","DARPA 2000 distributed denial of service attack scenarios;Dempster-Shafer theory;colored Petri net;data fusion;evidence theory;firewall;intrusion detection system;intrusion evidence;multisensor correlation algorithms;network security situation assessment","","1","","6","","","23-24 Jan. 2008","","IEEE","IEEE Conference Publications"
"Time-series infectious disease data analysis using SVM and genetic algorithm","Xiuju Fu; Liew, C.; Soh, H.; Lee, G.; Hung, T.; Lee-Ching Ng","Inst. of High Performance Comput., Singapore","Evolutionary Computation, 2007. CEC 2007. IEEE Congress on","20080107","2007","","","1276","1280","Dengue represents a serious health threat in the Tropics, owing to the year-round presence of Aedes mosquito vectors, and the lack of any anti-viral drugs or vaccines. Climatic factors are important in influencing the incidence of dengue. It is important to determine the relationships between climatic factors and disease incidence trends, which would be helpful for relevant environment and health agencies in planning appropriate pre-emptive control measures. Climatic factors and dengue case records vary over time. It is therefore difficult to justify the time-lag when a climatic factor affects the mosquito-to-human and human-to-mosquito loops. In this paper, we propose to use support vector machine (SVM) classifiers for analyzing the time- series dengue data and genetic algorithm (GA), to determine the time-lags and subset of climatic factors as effective factors influencing the spread of dengue. It is shown that the proposed model is able to detect important climatic factors and their time-lags which affect the disease, and the GA-based SVM classifiers could improve the classification accuracy significantly.","","978-1-4244-1339-3","978-1-4244-1340-9","10.1109/CEC.2007.4424617","http://ieeexplore.ieee.org.ezproxy.rit.edu/stamp/stamp.jsp?arnumber=4424617","","Blood;Data analysis;Diseases;Genetic algorithms;Humans;Support vector machine classification;Support vector machines;Temperature dependence;Temperature distribution;Vaccines","climatology;diseases;genetic algorithms;health care;medical computing;support vector machines;time series","SVM classifier;climatic factors;dengue;disease incidence trend;genetic algorithm;health threat;human-to-mosquito loop;infectious disease data analysis;mosquito-to-human loop;support vector machine;time-series","","0","","28","","","25-28 Sept. 2007","","IEEE","IEEE Conference Publications"
"Network traffic characteristics for detecting future botnets","Chapman, J.P.; Gerhards-Padilla, E.; Govaers, F.","Res. Group Cyber Defense, Fraunhofer FKIE, Bonn, Germany","Communications and Information Systems Conference (MCC), 2012 Military","20121220","2012","","","1","10","Botnets are and are likely to remain the main vehicle for online crime for the foreseeable future. To protect their business models, botnet operators constantly improve their protocols and applications to harden them against detection, analysis and takedown efforts. Our analysis suggest that future botnets will use proper encryption for their protocol messages, rendering them invisible to most deployed network intrusion detection systems. Therefore, we identify properties of botnet communications that will not be obscured by these measures. This allows us to design features which can be derived by measuring these properties and used as input to an approach for detecting systems infected with a botnet client. First measurements on network traffic generated by legitimate applications and a botnet client suggest that our features are capable of reliably discriminating between the two.","","978-1-4673-1422-0","","","http://ieeexplore.ieee.org.ezproxy.rit.edu/stamp/stamp.jsp?arnumber=6387926","botnet;intrusion detection;netflow","Cryptography;Feature extraction;Intrusion detection;Malware;Payloads;Protocols;Servers","computer crime;computer network security;cryptographic protocols;telecommunication traffic","botnet communication;botnet detection;business model protection;encryption;legitimate applications;network intrusion detection system;network traffic characteristics;network traffic measurement;online crime;protocol messages","","0","","21","","","8-9 Oct. 2012","","IEEE","IEEE Conference Publications"
"An Efficient TCP Reassembler Mechanism for Layer7-aware Network Intrusion Detection/Prevention Systems","Hanaoka, M.; Kono, K.; Shimamura, M.; Yamaguchi, S.","Keio Univ., Keio","Computers and Communications, 2007. ISCC 2007. 12th IEEE Symposium on","20071112","2007","","","79","86","Exploiting layer/ context is an effective approach to improving the accuracy of detecting malicious messages in network intrusion detection/prevention systems (NIDS/NIPSs). Unfortunately layerl-aware NIDS/NIPSs pose crucial implementation issues because they require full TCP/IP reassembly without losing (1) complete prevention, (2) performance, (3) application transparency, or (4) transport transparency. To the best of our knowledge, none of the existing approaches meet all of these requirements. Our store-through does this by forwarding each out-of-order or IP-fragmented packet immediately after copying it even if it has not been checked yet. Although the forwarded packet might turn out to be a part of an attack, the store-through can successfully defend against the attack by blocking one of the subsequent packets. Testing of a prototype in linux kernel 2.4.30 demonstrated that the overhead of our mechanism is negligible compared with that of a simple IP forwarder even with the presence of out-of-order packets.","1530-1346","978-1-4244-1520-5","978-1-4244-1521-2","10.1109/ISCC.2007.4381605","http://ieeexplore.ieee.org.ezproxy.rit.edu/stamp/stamp.jsp?arnumber=4381605","","Delay;Intrusion detection;Kernel;Linux;Out of order;Protocols;Prototypes;TCPIP;Telecommunication traffic;Throughput","IP networks;security of data;transport protocols","IP-fragmented packet;Linux kernel;TCP reassembler mechanism;application transparency;network intrusion detection;network prevention system;transport transparency","","2","","25","","","1-4 July 2007","","IEEE","IEEE Conference Publications"
