"Intrusion detection based on SVM and decision fusion","Rui-xia Zhang; Zhen-rong Deng; Wen-hui Zhang; Guo-Jian Zhi","Sch. of Comput. & Control, GuiLin Univ. of Electron. Technol., Guilin, China","Intelligent Computing and Integrated Systems (ICISS), 2010 International Conference on","20101203","2010","","","87","90","Feature selection and classifier are two important issues in intrusion detection to achieve high performance. This paper proposes intrusion detection scheme based on feature selection with different feature selection methods. Then the extracted features are employed by Support Vector Machine (SVM) for classification. But in fact, single classifier doesn't attain satisfying performance. To address the problem, independent classification outcomes are aggregated through different decision fusion strategy. To examine the feasibility of the scheme, several experiments have been done on dataset in KDD-99. Results indicate the high detection accuracy for intrusion attacks and low false alarm rate of the reliable system.","","978-1-4244-6834-8","","10.1109/ICISS.2010.5656732","http://ieeexplore.ieee.org.ezproxy.rit.edu/stamp/stamp.jsp?arnumber=5656732","D-S evidence theory;SVM;decision fusion;feature selection;intrusion detection","Computers;Distributed databases;Machine learning;Support vector machines;Wavelet analysis","pattern classification;security of data;support vector machines","SVM;decision fusion strategy;feature classifier;feature selection;intrusion attacks;intrusion detection;reliable system;support vector machine","","0","","15","","","22-24 Oct. 2010","","IEEE","IEEE Conference Publications"
"Load Balancing for Flow-Based Parallel Processing Systems in CMP Architecture","Tingwen Liu; Yong Sun; Zhibin Zhang; Li Guo","Inst. of Comput. Technol., Chinese Acad. of Sci., Beijing, China","Global Telecommunications Conference, 2009. GLOBECOM 2009. IEEE","20100304","2009","","","1","7","Load balancing is critical to the performance of parallel processing systems. It is more difficult for network systems such as NIDS and Web Servers, because they must preserve flow order. But traditional flow-based load balancing schemes of network parallel processing systems, such as LLF, cost much resource and introduce lots of communication overhead. With the rapid popularization of multi-core system, it is a good choice to apply NIDS in CMP architecture to achieve higher performance. Some companies have taken the first step. Their scheduling algorithm operates at a custom NIC based on FPGA technology. LLF algorithm can't be used in such environment because it needs much more memory than NIC owns. In this paper, we propose a scheduling scheme that re-maps the new arrival flows when the system is unbalanced. To make effective adjustments we design a new triggering policy based on waiting lengths and their difference. Compared with LLF, our algorithm costs about 5% memory to get the same performance.","1930-529X","978-1-4244-4148-8","","10.1109/GLOCOM.2009.5425276","http://ieeexplore.ieee.org.ezproxy.rit.edu/stamp/stamp.jsp?arnumber=5425276","","Computer architecture;Costs;Field programmable gate arrays;Hardware;Internet;Intrusion detection;Load management;Parallel processing;Wavelength division multiplexing;Web server","Internet;field programmable gate arrays;file servers;parallel processing;resource allocation;telecommunication security","CMP architecture;FPGA technology;LLF algorithm;NIDS;communication overhead;flow-based load balancing;flow-based parallel processing;load balancing;multi-core system;network intrusion detection system;scheduling algorithm;web servers","","0","","18","","","Nov. 30 2009-Dec. 4 2009","","IEEE","IEEE Conference Publications"
"On Detecting Camouflaging Worm","Wei Yu; Xun Wang; Calyam, P.; Dong Xuan; Wei Zhao","Dept. of Comput. Sci., Texas A&M Univ., College Station, TX","Computer Security Applications Conference, 2006. ACSAC '06. 22nd Annual","20061226","2006","","","235","244","Active worms pose major security threats to the Internet. In this paper, we investigate a new class of active worms, i.e., camouflaging worm (C-Worm in short). The C-Worm has the capability to intelligently manipulate its scan traffic volume over time, thereby camouflaging its propagation from existing worm detection systems. We analyze characteristics of the C-Worm and conduct a comprehensive comparison between its traffic and non-worm traffic. We observe that these two types of traffic are barely distinguishable in the time domain, however, their distinction is clear in the frequency domain, due to the recurring manipulative nature of the C-Worm. Motivated by our observations, we design a novel spectrum-based scheme to detect the C-Worm. Our scheme uses the power spectral density (PSD) distribution of the scan traffic volume and its corresponding spectral flatness measure (SFM) to distinguish the C-Worm traffic from non-worm traffic. We conduct extensive performance evaluations on our proposed detection scheme against the C-Worm. The performance data clearly demonstrates that our proposed scheme can effectively detect the C-Worm propagation","1063-9527","0-7695-2716-7","","10.1109/ACSAC.2006.36","http://ieeexplore.ieee.org.ezproxy.rit.edu/stamp/stamp.jsp?arnumber=4041170","","Computer crime;Computer science;Computer worms;Density measurement;Frequency domain analysis;Power measurement;Security;Software performance;Volume measurement;Web and internet services","Internet;invasive software","Internet;camouflaging worm detection;power spectral density distribution;spectral flatness measure","","3","","26","","","Dec. 2006","","IEEE","IEEE Conference Publications"
"Research and Design of NIDS Based on Linux Firewall","Zongpu Jia; Shufen Liu; Guowei Wang","Sch. of Comput. Sci. & Technol., Jilin Univ., Changchun","Pervasive Computing and Applications, 2006 1st International Symposium on","20070129","2006","","","556","560","Firewall has many shortages, such as it cannot keep away interior attacks, it cannot provide a consistent security strategy, and it has a single bottleneck spot and invalid spot, etc. Intrusion detection system (IDS) also has many defects, such as low detection ability, lack of effective response mechanism, poor manageability, etc. If firewall and IDS are integrated, the cooperation of them can implement the network security to a great extent: on the one hand, IDS monitors the network, provides a real- time detection of attacks from the interior and exterior, and automatically informs firewall and dynamically alters the rules of firewall once an attack is found; on the other hand, firewall loads dynamic rules to hold up the intrusion, controls the data traffic of IDS and provides the security protection of IDS. Based on constructing firewall with Iptables in the environment of Linux OS, the respective characters of firewall and IDS are analyzed. Then, the viewpoint of integrating firewall and IDS to realize the network security is proposed, and the application and algorithm of intrusion detection are systemically analyzed and designed","","1-4244-0326-x","1-4244-0326-x","10.1109/SPCA.2006.297482","http://ieeexplore.ieee.org.ezproxy.rit.edu/stamp/stamp.jsp?arnumber=4079053","Iptables;Linux;firewall;network intrusion detection;network security","Access control;Algorithm design and analysis;Communication system security;Computer science;Data security;Information filtering;Information filters;Intrusion detection;Linux;Protection","Linux;authorisation;computer networks;telecommunication security","Iptables;Linux OS;Linux firewall;network security;network-based intrusion detection system;security protection","","0","","12","","","3-5 Aug. 2006","","IEEE","IEEE Conference Publications"
"Binary PSO and random forests algorithm for PROBE attacks detection in a network","Malik, A.J.; Shahzad, W.; Khan, F.A.","Nat. Univ. of Comput. & Emerging Sci., Islamabad, Pakistan","Evolutionary Computation (CEC), 2011 IEEE Congress on","20110714","2011","","","662","668","During the past few years, huge amount of network attacks have increased the requirement of efficient network intrusion detection techniques. Different classification techniques for identifying various attacks have been proposed in the literature. In this paper we propose and implement a hybrid classifier based on binary particle swarm optimization (BPSO) and random forests (RF) algorithm for the classification of PROBE attacks in a network. PSO is an optimization method which has a strong global search capability and is used for fine-tuning of the features whereas RF, a highly accurate classifier, is used here for classification. We demonstrate the performance of our technique using KDD99Cup dataset. We also compare the performance of our proposed classifier with eight other well-known classifiers and the results show that the performance achieved by the proposed classifier is much better than the other approaches.","Pending","978-1-4244-7834-7","","10.1109/CEC.2011.5949682","http://ieeexplore.ieee.org.ezproxy.rit.edu/stamp/stamp.jsp?arnumber=5949682","Intrusion Detection;PROBE attacks;Particle Swarm Optimization;Random Forests","Classification algorithms;Feature extraction;Intrusion detection;Particle swarm optimization;Probes;Radio frequency;Vegetation","computer network security;particle swarm optimisation","PROBE attacks detection;binary PSO;binary particle swarm optimization;classification technique;global search capability;hybrid classifier;network attacks;network intrusion detection;random forest algorithm","","3","","21","","","5-8 June 2011","","IEEE","IEEE Conference Publications"
"Android Security: A Survey of Issues, Malware Penetration, and Defenses","Faruki, P.; Bharmal, A.; Laxmi, V.; Ganmoor, V.; Gaur, M.S.; Conti, M.; Rajarajan, M.","Comput. Eng. Dept., Malaviya Nat. Inst. of Technol. (MNIT), Jaipur, India","Communications Surveys & Tutorials, IEEE","20150519","2015","17","2","998","1022","Smartphones have become pervasive due to the availability of office applications, Internet, games, vehicle guidance using location-based services apart from conventional services such as voice calls, SMSes, and multimedia services. Android devices have gained huge market share due to the open architecture of Android and the popularity of its application programming interface (APIs) in the developer community. Increased popularity of the Android devices and associated monetary benefits attracted the malware developers, resulting in big rise of the Android malware apps between 2010 and 2014. Academic researchers and commercial antimalware companies have realized that the conventional signature-based and static analysis methods are vulnerable. In particular, the prevalent stealth techniques, such as encryption, code transformation, and environment-aware approaches, are capable of generating variants of known malware. This has led to the use of behavior-, anomaly-, and dynamic-analysis-based methods. Since a single approach may be ineffective against the advanced techniques, multiple complementary approaches can be used in tandem for effective malware detection. The existing reviews extensively cover the smartphone OS security. However, we believe that the security of Android, with particular focus on malware growth, study of antianalysis techniques, and existing detection methodologies, needs an extensive coverage. In this survey, we discuss the Android security enforcement mechanisms, threats to the existing security enforcements and related issues, malware growth timeline between 2010 and 2014, and stealth techniques employed by the malware authors, in addition to the existing detection methods. This review gives an insight into the strengths and shortcomings of the known research methodologies and provides a platform, to the researchers and practitioners, toward proposing the next-generation Android security, analysis, and malware detection techniques.","1553-877X","","","10.1109/COMST.2014.2386139","http://ieeexplore.ieee.org.ezproxy.rit.edu/stamp/stamp.jsp?arnumber=6999911","Android Malware;Android malware;Behavioral Analysis;Dynamic Analysis;Obfuscation;Static Analysis;Stealth Malwar;behavioral analysis;dynamic analysis;obfuscation;static analysis;stealth malware","Androids;Google;Humanoid robots;Malware;Smart phones;Tutorials","Android (operating system);application program interfaces;invasive software;mobile computing;program diagnostics;smart phones","API;Android device;Android malware application;Internet;SMS;application programming interface;dynamic-analysis-based method;location-based service;malware detection techniques;malware penetration;multimedia services;next-generation Android security enforcement mechanism;office application;prevalent stealth techniques;signature-based analysis method;smartphone OS security;static analysis method;static analysis methods;vehicle guidance;voice call","","0","","143","","2014-12-30","Secondquarter 2015","","IEEE","IEEE Journals & Magazines"
"Android privacy","Te-En Wei; Jeng, A.B.; Hahn-Ming Lee; Chih-How Chen; Chin-Wei Tien","Dept. of Comput. Sci. & Inf. Eng., Nat. Taiwan Univ. of Sci. & Technol., Taipei, Taiwan","Machine Learning and Cybernetics (ICMLC), 2012 International Conference on","20121124","2012","5","","1830","1837","Due to technological progress, today's mobile phones have evolved into technically and functionally sophisticated smartphones which have more in common with computers than with the conventional phones. As a result of their popularity and functionality, smartphones are a burgeoning target for malicious activities In Android privacy; we undertake two aspects such as user and developer. For users, a known fact in Android mobile, any app can be downloaded from Android Market without accessing a significant quantity of personal data which is different in App Store. For app developers, the App Store's method acquires developed app need to be signed using a private encryption key. Furthermore, several privacy related data such as personal information, IMEI, and location which are leaks already existing in Android Smartphone for a while. In this paper, we explain what kind of data is at risk and how to acquire them programmatically without the user's permission. We will focus on how to obtain the data illicitly which are of Android privacy concerns and the categorization of these Android privacy issues. For example, mobile number, email accounts, keyboard cache entries, browser searches and the most recent location are sensitive data attractive to the attackers. This paper also shows how we use the Android API to perform our Spyware to obtain the sensitive information. Some attack scenarios and recommendations are also presented.","2160-133X","978-1-4673-1484-8","","10.1109/ICMLC.2012.6359654","http://ieeexplore.ieee.org.ezproxy.rit.edu/stamp/stamp.jsp?arnumber=6359654","Android;Malware;Privacy;Security;Smartphone;Spyware","Abstracts;Androids;Humanoid robots;Privacy;Spyware","application program interfaces;data privacy;private key cryptography;smart phones","Android API;Android market;Android mobile;Android privacy;Android smartphone;App store method;developer;malicious activities;mobile phones;private encryption key;smartphones;spyware;user","","0","","15","","","15-17 July 2012","","IEEE","IEEE Conference Publications"
"A Framework for Evaluating Intrusion Detection Architectures in Advanced Metering Infrastructures","Cardenas, A.A.; Berthier, R.; Bobba, R.B.; Huh, J.H.; Jetcheva, J.G.; Grochocki, D.; Sanders, W.H.","Univ. of Texas at Dallas, Richardson, TX, USA","Smart Grid, IEEE Transactions on","20140214","2014","5","2","906","915","The scale and complexity of Advanced Metering Infrastructure (AMI) networks requires careful planning for the deployment of security solutions. In particular, the large number of AMI devices and the volume and diversity of communication expected to take place on the various AMI networks make the role of intrusion detection systems (IDSes) critical. Understanding the trade-offs for a scalable and comprehensive IDS is key to investing in the right technology and deploying sensors at optimal locations. This paper reviews the benefits and costs associated with different IDS deployment options, including either centralized or distributed solution. A general cost-model framework is proposed to help utilities (AMI asset owners) make more informed decisions when selecting IDS deployment architectures and managing their security investments. We illustrate how the framework can be applied through case studies, and highlight the interesting cost/benefit trade-offs that emerge.","1949-3053","","","10.1109/TSG.2013.2291004","http://ieeexplore.ieee.org.ezproxy.rit.edu/stamp/stamp.jsp?arnumber=6740891","AMI;architecture;intrusion detection;threat model","Intelligent sensors;Intrusion detection;Monitoring;Peer-to-peer computing;Wireless sensor networks","costing;metering;power grids;power meters;power system economics;power system planning;power system security;safety systems","AMI network;IDS deployment option;advanced metering infrastructure network;cost-benefit trade-off;general cost-model framework;intrusion detection architecture;planning;power grid;security solution","","2","","24","","","March 2014","","IEEE","IEEE Journals & Magazines"
"Visualization of complex attacks and state of attacked network","Yelizarov, A.; Gamayunov, D.","Dept. of Comput. Math. & Cybern., Moscow State Univ., Moscow, Russia","Visualization for Cyber Security, 2009. VizSec 2009. 6th International Workshop on","20100108","2009","","","1","9","This paper deals with the visualization of complex attacks. Â¿Complex attacksÂ¿ is used here to denote the type of attack which consists of a sequence of related events, namely a multistep, DDoS attack and alike. While there are numerous systems to visualize events that occur in the network, most of them are too complex to perceive, and require several visualization modes. This work presents a technique whereby the operator, using visualization alone, is able to display the full picture of events occurring in the network. The main feature of this method is the high recognition ratio of complex attacks as the sequence of constituent common events.","","978-1-4244-5413-6","","10.1109/VIZSEC.2009.5375527","http://ieeexplore.ieee.org.ezproxy.rit.edu/stamp/stamp.jsp?arnumber=5375527","C.2.0 [Computer-Communication Networks]: General — Security and Protection;C.2.3 [Computer-Communication Networks]: Network Operations — Network Monitoring;H.5.2 [Information Systems]: Information Interfaces and Presentation — User Interfaces;complex attacks;network security;visualization","Computer crime;Computer displays;Computer interfaces;Computer networks;Computer security;Cybernetics;Information security;Intrusion detection;Mathematics;Visualization","computer network security","DDoS attack;complex attack recognition ratio;complex attacks visualization","","2","","10","","","11-11 Oct. 2009","","IEEE","IEEE Conference Publications"
"Research on the application of honeypot technology in intrusion detection system","Xiangfeng Suo; Xue Han; Yunhui Gao","Heihe Univ., Heihe, China","Advanced Research and Technology in Industry Applications (WARTIA), 2014 IEEE Workshop on","20141206","2014","","","1030","1032","Detailed introduction of the related knowledge of honeypot and intrusion detection technology. From the adaptability, effectiveness and scalability to a detailed analysis of the current intrusion detection system in the existing problems and the honeypot technology is applied to the advantages of the system in Intrusion Detection System, At the same time put forward a detection model and describes the main functions of the model and the system structure based on the intrusion honeypot technology.","","","","10.1109/WARTIA.2014.6976452","http://ieeexplore.ieee.org.ezproxy.rit.edu/stamp/stamp.jsp?arnumber=6976452","Honeypot technology;Intrusion detection;Network","Adaptation models;Computer hacking;Data models;Intrusion detection;Real-time systems;Safety","security of data","intrusion detection system;intrusion honeypot technology","","0","","6","","","29-30 Sept. 2014","","IEEE","IEEE Conference Publications"
"Research on virtual three dimensional reconstruction system for medical slices image","Ye XiuFen; Wang Zhenhua","Coll. Of Autom., Harbin Eng. Univ., Harbin, China","Control Conference (CCC), 2014 33rd Chinese","20140915","2014","","","4797","4801","Traditional medical reconstruction system mainly aims at processing medical CT images with clear boundaries. As for those sequence slice images with subtle and unclear boundaries, manual segmentation algorithm are usually adopted. However, they reduce the efficiency greatly. In this paper, we have conducted a series of deep study on these issues, and propose an image segmentation method which combines the algorithm of region growing and linear interpolation method between images. At the same time, research on the accelerating algorithm of three-dimensional (3D) reconstruction has also been conducted, and a 3D spatial filtering method is proposed to filter the 3D reconstruction model. The experimental results show that with the methods mentioned above, the reconstruction effect is improved, and its applicability becomes broader and efficiency becomes higher.","","","","10.1109/ChiCC.2014.6895751","http://ieeexplore.ieee.org.ezproxy.rit.edu/stamp/stamp.jsp?arnumber=6895751","3D spatial filtering;linear interpolation;region growing;three-dimensional3D reconstruction","Algorithm design and analysis;Image segmentation;Interpolation;Isosurfaces;Medical diagnostic imaging;Three-dimensional displays","image reconstruction;image segmentation;interpolation;medical image processing;spatial filters","3D reconstruction model;3D spatial filtering method;image segmentation method;linear interpolation method;medical CT image processing;medical slices image;region growing algorithm;sequence slice image;virtual 3D reconstruction system","","0","","8","","","28-30 July 2014","","IEEE","IEEE Conference Publications"
"RangeTree: A Feature Selection Algorithm for C4.5 Decision Tree","Hui Zhu; Siyu Chen; Lexiang Zhu; Hui Li; Xiaofeng Chen","State Key Lab. of Integrated Service Networks, Xidian Univ., Xi'an, China","Intelligent Networking and Collaborative Systems (INCoS), 2013 5th International Conference on","20131015","2013","","","17","22","In order to conduct fine-grained network management in mobile network, Traffic Classification or Detection is widely used to divide network traffic into different classes, according to their source applications. Many techniques are exploited in Traffic Classification. Among them, machine learning has grown considerably attention because of its accuracy. Feature selection chooses feature combinations for machine learning algorithms, and has significant influence on the accuracy and efficiency. To discover optimal features, all possible combinations need to be evaluated by testing real classifiers. With numerous features, feature selection can cost an abundance of time and computational resources. This paper proposes a feature selection algorithm for C4.5 Decision Tree. This algorithm utilizes structural characteristics of C4.5 algorithm to exclude some of the combinations without actually testing the classifiers. The simulation results demonstrate that the algorithm can reduce the number of tests in seeking the optimal feature combination.","","","","10.1109/INCoS.2013.13","http://ieeexplore.ieee.org.ezproxy.rit.edu/stamp/stamp.jsp?arnumber=6630283","C4.5 Decision Tree;Feature Selection;Machine Learning;Traffic Classification","Accuracy;Classification algorithms;Decision trees;Machine learning algorithms;Testing;Training;Upper bound","decision trees;learning (artificial intelligence);mobile communication;telecommunication computing","C4.5 decision tree;RangeTree algorithm;feature selection algorithm;fine-grained network management;machine learning;mobile network;traffic classification;traffic detection","","1","","18","","","9-11 Sept. 2013","","IEEE","IEEE Conference Publications"
"Improved Edit Distance Method for System Call Anomaly Detection","Qian Quan; Wu Jinlin; Zhu Wei; Xin Mingjun","Sch. of Comput. Eng. &amp; Sci., Shanghai Univ., Shanghai, China","Computer and Information Technology (CIT), 2012 IEEE 12th International Conference on","20121224","2012","","","1097","1102","Edit distance has been widely used in different areas to evaluate the similarity between strings of characters. In this paper, the improved edit distance is applied into the short sequence anomaly detection, a kind of host security area. Some modifications for original edit distance including the position exchange and the shortest distance algorithm are described in detail. Through experiment, it shows that the edit distance based anomaly detection method is proved to be more stable and better detection precision than the classical sequence analysis STIDE method.","","978-1-4673-4873-7","","10.1109/CIT.2012.223","http://ieeexplore.ieee.org.ezproxy.rit.edu/stamp/stamp.jsp?arnumber=6392060","Anomaly detection;Edit distance;Intrusion detection;STIDE","Algorithm design and analysis;Computers;Hamming distance;Hidden Markov models;Libraries;Pattern matching","security of data;string matching","character strings;improved edit distance method;position exchange algorithm;short sequence anomaly detection;shortest distance algorithm;similarity evaluation;system call anomaly detection","","1","","12","","","27-29 Oct. 2012","","IEEE","IEEE Conference Publications"
