"A Real Time Adaptive Intrusion Detection Alert Classifier for High Speed Networks","Sallay, H.; Ammar, A.; Ben Saad, M.; Bourouis, S.","Al Imam Mohammad Ibn Saud Islamic Univ. (IMSIU), Riyadh, Saudi Arabia","Network Computing and Applications (NCA), 2013 12th IEEE International Symposium on","20131010","2013","","","73","80","With the emergence of High Speed Network (HSN), the manual intrusion alert detection become an extremely laborious and time-consuming task since it requires an experienced skilled staff in security fields and need a deep analysis. In addition, the batch model of alert management is no longer adequate given that labeling is a continuous time process since incoming intrusion alerts are often collected continuously in time. Furthermore, the static model is no longer appropriate due to the fluctuation nature of the number of alerts incurred by Internet traffic fluctuation nature. This paper proposes an efficient real time adaptive intrusion detection alert classifier dedicated for high speed network. Our classifier is based an online self-trained SVM algorithm with several learning strategies and execution modes. We evaluate our classifier against three different data-sets and the performance study shows an excellent results in term of accuracy and efficiency. The predictive local learning strategy presents a good tradeoff between accuracy and time processing. In addition, it does not involve a human intervention which make it an excellent solution that satisfy high speed network alert management challenges.","","978-0-7695-5043-5","","10.1109/NCA.2013.16","http://ieeexplore.ieee.org.ezproxy.rit.edu/stamp/stamp.jsp?arnumber=6623644","Alert classification;High speed network;Intrusion detection;Online and self-training learning;SVM","Accuracy;High-speed networks;Intrusion detection;Measurement;Real-time systems;Support vector machines;Testing","Internet;computer network security;learning (artificial intelligence);pattern classification;real-time systems;support vector machines;telecommunication traffic","HSN;Internet traffic fluctuation;batch model;continuous time process;execution modes;high speed network alert management;online self-trained SVM algorithm;predictive local learning strategy;real time adaptive intrusion detection alert classifier","","1","","31","","","22-24 Aug. 2013","","IEEE","IEEE Conference Publications"
"An Intellilgent Infrastructure Strategy to Improving the Performance and Detection Capability of Intrusion Detection Systems","Hooper, E.","Information Security Group, University of London, Royal Holloway, Egham, Surrey, TW20 OEX, UK. E. Hooper@rhul.ac.uk, ehooper@aya.yale.edu","Securecomm and Workshops, 2006","20070515","2006","","","1","10","Network and host Intrusion Detection Systems (IDS) are used to identify suspicious network traffic. However, a high percentage of alerts generated by such systems are liable to be false positives. False positives create considerable administrative overheads, since these alerts typically require manual intervention from a network administrator In order to reduce the number of false positives, we propose a novel infrastructure approach involving what we call network quarantine channels. The network quarantine channels and associated techniques are used to perform further interaction with hosts that have been identified as the source of suspicious traffic. The network quarantine channels are used to provide a more accurate assessment of the potential attacks sent by suspicious hosts, before sending the final status of the alerts to the IDS monitor for the network administrator's response.","","1-4244-0423-1","1-4244-0423-1","10.1109/SECCOMW.2006.359566","http://ieeexplore.ieee.org.ezproxy.rit.edu/stamp/stamp.jsp?arnumber=4198826","","Data analysis;Frequency;Information security;Intrusion detection;Prototypes;Remote monitoring;Telecommunication traffic","","","","0","","36","","","Aug. 2006","","IEEE","IEEE Conference Publications"
"Developing a Host Intrusion Prevention System by Using Data Mining","Al-Hamami, A.H.; Alawneh, T.","","Advanced Computer Science Applications and Technologies (ACSAT), 2012 International Conference on","20130516","2012","","","409","413","Intrusion Prevention Systems (IPS) is the most important solution for providing a high level of security all over the networks today. IPS is evolving recently in a way that is expected eventually to replace other security solutions such as firewalls and anti-viruses. To over come the static signature detecting mechanism to identify intruders that exists in all host based IPSs which in turn needs to be updated from time to time to insure the most accurate detection. In this paper we introduce a four tier host based IPS that uses data mining technique, namely decision tree, as a detecting mechanism. The input parameters for the prior decision tree algorithm are the most infected or targeted computer resources by intruders, instead of a static signature database. Three test scenarios were performed to investigate the ability of the proposed IPS to classify intruders correctly.","","978-1-4673-5832-3","","10.1109/ACSAT.2012.103","http://ieeexplore.ieee.org.ezproxy.rit.edu/stamp/stamp.jsp?arnumber=6516390","Intrusion prevention system;and information security;data mining;decision tree;intruder","","computer network security;data mining;decision trees;digital signatures","computer resources;data mining;decision tree algorithm;four-tier host-based IPS;host intrusion prevention system;input parameters;intruder classification;intruder identification;static signature database;static signature detection mechanism","","0","","18","","","26-28 Nov. 2012","","IEEE","IEEE Conference Publications"
"Research on algorithm of user query frequent itemsets mining","Yong Zhong; Xiao-lin Qin","Inf. Sci. & Techol. Inst., Nanjing Univ. of Aeronaut. & Astronaut., China","Machine Learning and Cybernetics, 2004. Proceedings of 2004 International Conference on","20050124","2004","3","","1671","1676 vol.3","An algorithm of mining database user query profiles of transaction level is presented. The algorithm changes the computing method of the support and confidence in association rules mining by adding query structure and attribute relations to the computation. Since there is no causal relationship in the access of attributes in queries, the method is more appropriate to describe user query behaviors than itemsets used by association rules. The method can be used in database intrusion detection system to prevent database from illegal intrusions effectively. Realization, performance and application of the algorithm are discussed in the paper.","","0-7803-8403-2","","10.1109/ICMLC.2004.1382044","http://ieeexplore.ieee.org.ezproxy.rit.edu/stamp/stamp.jsp?arnumber=1382044","","Association rules;Data mining;Data security;Information science;Intrusion detection;Itemsets;Machine learning algorithms;Power system security;Space technology;Transaction databases","data mining;query languages;query processing;security of data","association rules;database intrusion detection system;query structure;transaction level;user query behaviors;user query frequent itemsets mining algorithm","","2","","11","","","26-29 Aug. 2004","","IEEE","IEEE Conference Publications"
"A multi-class SLIPPER system for intrusion detection","Zhenwei Yu; Tsai, J.J.P.","Dept. of Comput. Sci., Univ. of Illinois","Computer Software and Applications Conference, 2004. COMPSAC 2004. Proceedings of the 28th Annual International","20041018","2004","","","212","217 vol.1","Varied data mining techniques have been developed for intrusion detection. However, it is unclear which data mining technique is most effective. In this paper, we present our research work in developing a Multi-Class SLIPPER (MC-SLIPPER) system for intrusion detection to learn whether we can get benefit from boosting based learning algorithm. The key idea is to use the available binary SLIPPER as a basic module, which is a rule learner based on confidence-rated boosting. Multiple arbitral strategies based on prediction confidence are proposed to arbitrate results from all binary SLIPPER modules. Our system is evaluated on the KDDCUP'99 intrusion detection dataset. The experimental results show that we get best performance using a 5-7-5 BP neural network; and the performance using other arbitral strategies are better than the winner of the contest does in term of misclassification cost (MC)","0730-3157","0-7695-2209-2","","10.1109/CMPSAC.2004.1342829","http://ieeexplore.ieee.org.ezproxy.rit.edu/stamp/stamp.jsp?arnumber=1342829","","Boosting;Computer science;Computer security;Costs;Data mining;Data security;Error analysis;Intrusion detection;Learning systems;Neural networks","backpropagation;data mining;neural nets;pattern classification;security of data","BP neural network;KDDCUP'99 intrusion detection dataset;Multi-Class SLIPPER system;boosting based learning algorithm;confidence-rated boosting;data mining;intrusion detection;misclassification cost;rule learner","","3","","14","","","28-30 Sept. 2004","","IEEE","IEEE Conference Publications"
"Exploiting Frequent Episodes in Weighted Suffix Tree to Improve Intrusion Detection System","Min-Feng Wang; Yen-Ching Wu; Meng-Feng Tsai","Nat. Central Univ., Jhongli","Advanced Information Networking and Applications - Workshops, 2008. AINAW 2008. 22nd International Conference on","20080403","2008","","","1246","1252","In this paper we proposed a weighted suffix tree and find out it can improve the intrusion detection system (IDS). We firstly focus on the analysis of computer kernel system call, and discover some meaningful information from the unorganized system call sequences. We design a weighted suffix tree algorithm which derives from the concept of suffix tree algorithm for string matching, which then allows to mine the frequent episodes in order to get ordered frequent patterns. We therefore apply these rules to detect malicious attacks, and it shows our IDS still has a good ability to detect intrusion when we use fewer rules.","","978-0-7695-3096-3","","10.1109/WAINA.2008.144","http://ieeexplore.ieee.org.ezproxy.rit.edu/stamp/stamp.jsp?arnumber=4483090","","Algorithm design and analysis;Application software;Computer science;Cryptography;Data mining;Information analysis;Intrusion detection;Kernel;Monitoring;Operating systems","data mining;operating system kernels;security of data;trees (mathematics)","computer kernel system call;frequent episodes mining;intrusion detection system;string matching;weighted suffix tree","","0","1","26","","","25-28 March 2008","","IEEE","IEEE Conference Publications"
"A framework for detecting anomalies in HTTP traffic using instance-based learning and k-nearest neighbor classification","Kirchner, M.","Dept. Secure Inf. Syst., Upper Austria Univ. of Appl. Sci., Hagenberg, Austria","Security and Communication Networks (IWSCN), 2010 2nd International Workshop on","20100701","2010","","","1","8","Attacks against web applications and web-based services that use HTTP as a communication protocol pose a serious threat to today's information technology infrastructures. A common countermeasure is to apply misuse detection and prevention systems that compare the contents of HTTP traffic against signatures of known attacks, as it is for example done by web application firewalls. A serious drawback of these systems is the fact that the used signatures often are not tailored for the individual web applications to be protected. Furthermore, signatures can often be circumvented by rewriting attacks into different forms, resulting in successful exploitation and circumvention of a misuse detection or prevention system. This paper presents the design and implementation of an anomaly detection framework for HTTP traffic that operates without signatures of known attacks. It rather learns normal usage patterns of web-based applications by inspecting full HTTP request and response contents. The results are then used for anomaly detection. The framework automatically adjusts to the applications to be monitored, derives normal usage patterns and compares subsequent HTTP traffic to the built knowledge base.","","978-1-4244-6938-3","978-1-4244-6939-0","10.1109/IWSCN.2010.5497997","http://ieeexplore.ieee.org.ezproxy.rit.edu/stamp/stamp.jsp?arnumber=5497997","","Computerized monitoring;Condition monitoring;Information systems;Information technology;Java;Pattern analysis;Protection;Protocols;Testing;Web server","Internet;learning (artificial intelligence);pattern classification;security of data","HTTP traffic;Web application firewalls;Web applications;Web-based services;anomaly detection;instance-based learning;k-nearest neighbor classification;misuse detection system;misuse prevention system","","1","","13","","","26-28 May 2010","","IEEE","IEEE Conference Publications"
"Intrepid MicroTrack leaky cable sensor","Harman, R.K.","Southwest Microwave Inc., Tempe, AZ, USA","Security Technology, 2002. Proceedings. 36th Annual 2002 International Carnahan Conference on","20021210","2002","","","191","197","Intrepid MicroTrack is the first leaky coaxial cable sensor to utilize FM CW radar techniques to detect and locate intruders. The first leaky coaxial cable sensor, introduced at the 1976 Carnahan Conference in Lexington, Kentucky, used pulse radar techniques to detect and locate intruders. Since then, there have been numerous papers on CW leaky cable sensors that detect, but do not locate intruders. Like Southwest Microwave's MicroPoint, the acoustic cable sensor introduced at the 1994 Carnahan conference, MicroTrack offers several new features, including the ability to precisely locate intruders. These features greatly improve sensor performance. This paper describes the technology and its broad range of applications including buried, surface and barrier mounted. MicroTrack is an ultra wide band (UWB) HF terrain-following radar. FM CW radar techniques are well known and have been widely used in radio altimeters and police radar for many years. However, it is only with the advent of low cost direct digital synthesis (DDS) chips, high speed and high resolution analog to digital converters (ADC) and digital processing components that it is now practical to apply FM CW radar techniques to leaky cables. MicroTrack uses a fast Fourier transform (FFT) to translate the swept frequency response into precise target location. The frequency diversity associated with the ultra wide bandwidth assures uniform detection along the length of the sensor cable. MicroTrack complies with radio regulatory requirements for low power swept frequency field disturbance sensors in the HF band.","","0-7803-7436-3","","10.1109/CCST.2002.1049250","http://ieeexplore.ieee.org.ezproxy.rit.edu/stamp/stamp.jsp?arnumber=1049250","","Acoustic pulses;Acoustic sensors;Acoustic signal detection;Coaxial cables;Hafnium;Leak detection;Microwave sensors;Radar detection;Sensor phenomena and characterization;Ultra wideband radar","CW radar;access control;coaxial cables;fast Fourier transforms;radar applications;radar signal processing;sensors","FM CW radar techniques;Intrepid MicroTrack leaky coaxial cable sensor;barrier mounted applications;buried applications;digital processing components;fast Fourier transform;high speed high resolution analog to digital converters;intruder detection;intruder location;low cost direct digital synthesis chips;low power swept frequency field disturbance sensors;precise target location;radio regulatory requirements;surface applications;swept frequency response translation;ultra wide band HF terrain following radar","","4","2","6","","","2002","","IEEE","IEEE Conference Publications"
"A Typical Set Method of Intrusion Detection Technology Base on Computer Audit Data","Xuetao, Duan; Jia Chunfu; Yubing, Fu","","Computational Intelligence and Security, 2007 International Conference on","20080104","2007","","","687","691","The signature database of intrusion detection system is usually built by the short sequences of system call. The real-time efficiency and accuracy of intrusion detection is greatly influenced by the scale of signature database and the approach of intrusion data analysis. In this paper, a typical set method is provided to compress the normal signature database. Using the data set of UNM CERT sendmail for testing, the feasibility of typical set method is validated, and a proper rate of typical set for intrusion detection is proposed. Meanwhile, the LSM (Linux Security Modules) framework is presented to hook system calls and other audit data from operation system to build intrusion detection system signature database and identify intrusion activity. A system service process oriented detection idea is also introduced to make the intrusion detection more pertinent and accurate. Abnormal detection experiments results show good performance of our intrusion detection method.","","0-7695-3072-9","978-0-7695-3072-7","10.1109/CIS.2007.89","http://ieeexplore.ieee.org.ezproxy.rit.edu/stamp/stamp.jsp?arnumber=4415432","","Data security;Databases;Entropy;Information systems;Information technology;Information theory;Intrusion detection;Linux;Random variables;Telecommunication traffic","","","","0","","12","","","15-19 Dec. 2007","","IEEE","IEEE Conference Publications"
"A credible network intrusion detection system based on grid","Shuying Zhang; Shufen Liu; Yue Gao; Jianmei Ge; Limin Wang","Coll. of Comput. Sci. & Technol., Jilin Univ., Changchun, China","Wireless Communications, Networking and Information Security (WCNIS), 2010 IEEE International Conference on","20100805","2010","","","528","532","Through the in-depth study on the grid and intrusion detection technology, a credible network intrusion detection system based on grid is proposed in this paper. The system deploys in the grid environment and adopts intrusion detection technology of the improved SOM neural network. To improve data collection efficiency, a rules-based means is used in data collection and processing. For the sake of realizing load balancing among the data analyzing nodes, an integrated scheduling algorithm of the task assignment based on the resource usable degree and credibility degree is used. In order to reduce alarm quantity, an alarm synthetic algorithm based on rules of similar degree and relevance degree is adopted. Experimental results show that the intrusion detection system can not only obtain better detection efficiency but also realize the load balance of resource use.","","978-1-4244-5850-9","","10.1109/WCINS.2010.5541835","http://ieeexplore.ieee.org.ezproxy.rit.edu/stamp/stamp.jsp?arnumber=5541835","credibility;grid;intrusion detection;neural network","Algorithm design and analysis;Communication system security;Computer science;Data analysis;Electronic mail;Information analysis;Information security;Intrusion detection;Load management;Scheduling algorithm","","","","0","","10","","","25-27 June 2010","","IEEE","IEEE Conference Publications"
"Using classification techniques for creation of predictive intrusion detection model","Almutairi, A.; Parish, D.","Sch. of Electron., Electr. & Syst. Eng., Loughborough Univ., Loughborough, UK","Internet Technology and Secured Transactions (ICITST), 2014 9th International Conference for","20150212","2014","","","223","228","Intrusion Detection System have been successful to prevent attacks on network resources, but the problem is that they are not adaptable in cases where new attacks are made i.e. they need human intervention for investigating new attacks. This paper proposes the creation of predictive intrusion detection model that is based on usage of classification techniques such as decision tree and Bayesian techniques. The system is trained using a 66% of randomly selected connections in as a subset of the KDD'99 intrusion detection data set. The training model is created by a trained classifier and then used to classify the remaining 34% subset of the KDD'99 intrusion detection dataset in order to report on the effectiveness of the model. The results show that based on a selected set of features extracted using subset evaluation algorithm for classifiers and a best-first search mechanism, that decision tree algorithm J48 based on C4.5 provides 99.95% of correctly classified instances and is better than the Naïve Bayes technique. Also found was that false positives using Naïve Bayes are high for Probing and Remote to Local attack categories. Finally, all classes based training model creation strategy using decision tree algorithm has been found effective.","","","","10.1109/ICITST.2014.7038810","http://ieeexplore.ieee.org.ezproxy.rit.edu/stamp/stamp.jsp?arnumber=7038810","Bayes algorithm;Classification;Data mining;Decision tree;Intrusion detection;Snort","Classification algorithms;Data models;Decision trees;Intrusion detection;Predictive models;Training","Bayes methods;computer network security;decision trees;feature extraction;pattern classification;search problems","Bayesian techniques;KDD'99 intrusion detection data set;Naïve Bayes;best-first search mechanism;classification techniques;decision tree;decision tree algorithm J48;feature extraction;local attack categories;network resources;predictive intrusion detection model","","0","","22","","","8-10 Dec. 2014","","IEEE","IEEE Conference Publications"
"Autom atic Profiling and Behavior Prediction of Computer System Users","Monroy, J.; Becerra, J.A.; Bellas, F.; Duro, R.J.; Lopez-Pena, F.","Integrated Group for Eng. Res., Univ. of La Coruna","Measurement Systems for Homeland Security, Contraband Detection and Personal Safety, Proceedings of the 2006 IEEE International Workshop on","20070226","2006","","","62","66","Detecting changes in the behavior of users can serve as an indicator of malicious or damaging misuse in many services; including the possible usurpation of a regular user identity by an intruder. For these purposes, approaches based on the profiling of users are not as common as those based on the analysis of the system behavior. This paper presents a method for automatically profiling and subsequently predicting the behavior of computer system users. The method is based on evolutionary profiling agents evolving in real time in order to dynamically provide a profile for each subject under analysis. The paper presents some experimental results from real data providing scheduled time and the real effective use of resources made by users of a high performance computing (HPC) center. The resulting profiling turns out to be very good for most users and the consequential relative error between prediction and effective activities appears as an effective parameter in detecting both changes in user behavior and user identity usurpation","","1-4244-0241-7","1-4244-0241-7","10.1109/MSHS.2006.314353","http://ieeexplore.ieee.org.ezproxy.rit.edu/stamp/stamp.jsp?arnumber=4107733","Behavior prediction;agents;evolutionary algorithms;neural networks;profiling","Ear;Electrical capacitance tomography;Ovens","evolutionary computation;human factors;multi-agent systems;neural nets;user modelling","HPC center;artificial cognitive agents;artificial neural networks;automatic profiling;behavior prediction;computer system users;evolutionary profiling agents;high performance computing;intrusion detection;system behavior","","1","","6","","","18-19 Oct. 2006","","IEEE","IEEE Conference Publications"
"Quantitative Intrusion Intensity Assessment Using Important Feature Selection and Proximity Metrics","Sang Min Lee; Dong Seong Kim; YoungHyun Yoon; Jong Sou Park","Dept. of Comput. Eng., Korea Aerosp. Univ., Seoul, South Korea","Dependable Computing, 2009. PRDC '09. 15th IEEE Pacific Rim International Symposium on","20091231","2009","","","127","134","The problem of previous approaches in anomaly detection in intrusion detection system (IDS) is to provide only binary detection result; intrusion or normal. This is a main cause of high false rates and inaccurate detection rates in IDS. In this paper, we propose a new approach named quantitative intrusion intensity assessment (QIIA). QIIA exploits feature selection and proximity metrics computation so that it provides intrusion (or normal) quantitative intensity value. It is capable of representing how an instance of audit data is proximal to intrusion or normal in the form of a numerical value. Prior to applying QIIA to audit data, we perform feature selection and parameters optimization of detection model in order not only to decrease the overheads to process audit data but also to enhance detection rates. QIIA then is performed using random forest (RF) and it generates proximity metrics which represent the intrusion intensity in a numerical way. The numerical values are used to determine whether unknown audit data is intrusion or normal. We carry out several experiments on KDD 1999 dataset and show the evaluation results.","","978-0-7695-3849-5","","10.1109/PRDC.2009.29","http://ieeexplore.ieee.org.ezproxy.rit.edu/stamp/stamp.jsp?arnumber=5368241","Feature Selection;Intrusion Detection System;Paramter Optimizations;Proximity Metrics;Random Forests","Aerospace engineering;Educational institutions;Hidden Markov models;Information security;Intrusion detection;Radio frequency;Support vector machine classification;Support vector machines;Telecommunication computing;USA Councils","security of data;software metrics","KDD 1999 dataset;feature selection;inaccurate detection rates;intrusion detection system;proximity metrics;proximity metrics computation;quantitative intensity value;quantitative intrusion intensity assessment;random forest","","0","","20","","","16-18 Nov. 2009","","IEEE","IEEE Conference Publications"
