http://ieeexplore.ieee.org.ezproxy.rit.edu/search/searchresult.jsp?download-format=download-csv&bulkSetSize=2000&refinements%3D4291944822%2C4291944246%26ranges%3D1998_2016_p_Publication_Year%26matchBoolean%3Dtrue%26searchField%3DSearch_All_Text%26queryText%3D%28%28%28%28%28%28.QT.DarpaIDE.QT.%29+OR+.QT.Darpa1998.QT.%29+OR+.QT.Darpa98.QT.%29+OR+.QT.1998+Darpa+Intrusion+Detection+Evaluation.QT.%29+OR+.QT.Darpa+Intrusion+Detection+Evaluation.QT.%29+AND+.QT.Intrusion+Detection+System.QT.%29,11/20/2015 17:23,"((((((""DarpaIDE"") OR ""Darpa1998"") OR ""Darpa98"") OR ""1998 Darpa Intrusion Detection Evaluation"") OR ""Darpa Intrusion Detection Evaluation"") AND ""Intrusion Detection System"")",IEEE
Flow Anomaly Detection in Firewalled Networks,"Chapple, M.J.; Wright, T.E.; Winding, R.M.","Notre Dame Univ., IN","Securecomm and Workshops, 2006",20070515,2006,,,1,6,"Most contemporary intrusion detection systems rely upon comprehensive signature databases containing the characteristics of known attacks, leaving them unable to detect novel attacks. In this paper, we propose the flow anomaly detection system (FADS), an anomaly detection system based upon the analysis of network flow data in controlled environments. We show that the standard deviation and interquartile range techniques produce a manageable number of alerts when applied to this data and demonstrate the effectiveness of the system through analysis of case studies. We also demonstrate that FADS' performance is sufficient to facilitate implementation as an anomaly detection system",,1-4244-0423-1,1-4244-0423-1,10.1109/SECCOMW.2006.359576,http://ieeexplore.ieee.org.ezproxy.rit.edu/stamp/stamp.jsp?arnumber=4198836,,Bandwidth;Computer crime;Control systems;Databases;Flow production systems;Intelligent networks;Intrusion detection;Production systems;Statistical analysis;Web and internet services,authorisation;computer networks,comprehensive signature databases;firewalled networks;flow anomaly detection system;interquartile range techniques;intrusion detection systems;network flow data,,2,,14,,,Aug. 28 2006-Sept. 1 2006,,IEEE,IEEE Conference Publication
Data preprocessing for distance-based unsupervised Intrusion Detection,"Said, D.; Stirling, L.; Federolf, P.; Barker, K.","Dept. of Comput. Sci., Univ. of Calgary, Calgary, AB, Canada","Privacy, Security and Trust (PST), 2011 Ninth Annual International Conference on",20110804,2011,,,181,188,"Since Intrusion Detection Systems (IDSs) operate in real-time, they should be light-weighted to detect intrusions as fast as possible. Distance-based Outlier Detection (DBOD) is one of the most widely-used techniques for detecting outliers due to its simplicity and efficiency. Additionally, DBOD is an unsupervised approach which overcomes the problem of the lack of training datasets with known intrusions. However, since IDSs usually have high-dimensional datasets, using DBOD becomes subject to the curse of the dimensionality problem. Furthermore, intrusion datasets should be normalized before calculating pair-wise distance between observations. The purpose of this research is conduct a comparative study among different normalization methods in conjunction with a well-known feature extraction technique; Principle Component Analysis (PCA). Therefore, the efficiency of these methods as data preprocessing techniques can be investigated when applying DBOD to detect intrusions. Experiments were performed using two kinds of distance metrics; Euclidean distance and Mahalanobis distance. We further examined the PCA using 7 threshold values to indicate the number of Principle components to consider according to their total contribution in the variability of features. These approaches have been evaluated using the KDD Cup 1999 intrusion detection (KDD-Cup) dataset. The main purpose of this study is to find the best attribute normalization method along with the correct threshold value for PCA so that a fast unsupervised IDS can discover intrusions effectively. The results recommended using the Log normalization method combined the Euclidean distance while performing PCA.",,978-1-4577-0582-3,,10.1109/PST.2011.5971981,http://ieeexplore.ieee.org.ezproxy.rit.edu/stamp/stamp.jsp?arnumber=5971981,,Equations;Euclidean distance;Feature extraction;Intrusion detection;Principal component analysis;Training,principal component analysis;security of data;unsupervised learning,DBOD;Euclidean distance;IDS;Mahalanobis distance;PCA;data preprocessing;dimensionality problem;distance based outlier detection;distance based unsupervised intrusion detection;feature extraction technique;principle component analysis,,1,,29,,,19-21 July 2011,,IEEE,IEEE Conference Publication
Minimax Probability Machine Classifier with Feature Extraction by Kernel Pca for Intrusion Detection,Zhenguo Chen; Hongde Ren; Xingjing Du,"Dept. of Comput. Sci. & Technol., North China Inst. of Sci. & Technol., Beijing","Wireless Communications, Networking and Mobile Computing, 2008. WiCOM '08. 4th International Conference on",20081118,2008,,,1,4,"In this paper, we synthetically applied kernel principal component analysis method and minimax probability machine to the intrusion detection. The intrusion features were extracted by kernel principal component analysis (KPCA) and followed by minimax probability machine (MPM) for classification. The dataset kddcup99 is our experiment data, our algorithm is compared with the algorithm which applies the support vector machine and minimax probability machine without application of feature extraction to intrusion detection. The experiment result has shown that the minimax probability machine classifier with feature extraction by KPCA can greatly reduce the training time and will not degrade the classifiers' performance.",,978-1-4244-2107-7,978-1-4244-2108-4,10.1109/WiCom.2008.1101,http://ieeexplore.ieee.org.ezproxy.rit.edu/stamp/stamp.jsp?arnumber=4679009,,Computer vision;Data mining;Degradation;Feature extraction;Intrusion detection;Kernel;Minimax techniques;Principal component analysis;Support vector machine classification;Support vector machines,feature extraction;minimax techniques;pattern classification;principal component analysis;security of data;support vector machines,feature extraction;intrusion detection;kernel principal component analysis;minimax probability machine classifier;support vector machine,,0,,8,,,12-14 Oct. 2008,,IEEE,IEEE Conference Publication
A diversity creation method for ensemble based classification: Application in intrusion detection,"Majidi, F.; Mirzaei, H.; Iranpour, T.; Foroughi, F.","Islamic azad Univ., Mobarakeh","Cybernetic Intelligent Systems, 2008. CIS 2008. 7th IEEE International Conference on",20090306,2008,,,1,5,"Vulnerabilities in common security components such as firewalls are inevitable. Intrusion Detection Systems (IDS) are used as another wall to protect computer systems and to identify corresponding vulnerabilities. This paper presents a new ensemble-based method for intrusion detection. This method uses feature transformation to create the needed diversity between base classifiers. In other words, first different sets of features are created by mapping the original features into new spaces where the samples are well separated, and then each base classifier is trained on one of these newly created features sets. The proposed method for constructing an ensemble of classifiers is a general method which may be used in any classification problem. KDD-99 dataset is used to evaluate the proposed method and the results are compared with some recent works in the literature using the same dataset. The results of comparing the performance of the proposed method with other alternative classification methods are encouraging.",,978-1-4244-2914-1,978-1-4244-2915-8,10.1109/UKRICIS.2008.4798935,http://ieeexplore.ieee.org.ezproxy.rit.edu/stamp/stamp.jsp?arnumber=4798935,Intrusion detection;classifier ensemble;diversity creation;feature transformation,Condition monitoring;Data security;Diversity methods;Gaussian distribution;Internet;Intrusion detection;Pattern analysis;Statistical analysis;Statistical distributions;Testing,pattern classification;security of data,computer systems;diversity creation method;ensemble based classification;feature transformation;intrusion detection systems,,0,,16,,,9-10 Sept. 2008,,IEEE,IEEE Conference Publication
A multiple objective optimization based echo state network tree and application to intrusion detection,Ding Hai-yan; Pei Wen-jiang; He Zhen-ya,"Southeast Univ., Nanjing, China","VLSI Design and Video Technology, 2005. Proceedings of 2005 IEEE International Workshop on",20050906,2005,,,443,446,"Echo state network tree (ESNTree) is proposed in this paper. ESNTree changes the activation function of the hidden layer and modifies the initialization method of echo state network (ESN). If the number of input features is too large, genetic algorithm is used to extract better features. Thus the complexity of input feature space can be reduced. On the other hand, a divide-and-conquer method is used. Decision tree and ESN are combined to decrease the complexity of the classifier and make the classifier more comprehensible and more interpretable. Experiments show that ESNTree achieves better performance than neural network tree (NNTree). ESNTree has been applied to intrusion detection successfully.",,0-7803-9005-9,,10.1109/IWVDVT.2005.1504645,http://ieeexplore.ieee.org.ezproxy.rit.edu/stamp/stamp.jsp?arnumber=1504645,,Classification tree analysis;Data security;Decision trees;Feature extraction;Genetic algorithms;Helium;Intrusion detection;Neural networks;Reservoirs;Web and internet services,Internet;divide and conquer methods;genetic algorithms;telecommunication security;trees (mathematics),Internet;divide-and-conquer method;echo state network tree;genetic algorithm;intrusion detection;multiple objective optimization,,0,,13,,,28-30 May 2005,,IEEE,IEEE Conference Publication
Support Vector Machines Improved by Artificial Immunisation Algorithm for Intrusion Detection,Zhenguo Chen; Guanghua Zhang,"Dept. of Comput. Sci. & Technol., North China Inst. of Sci. & Technol., Beijing, China","Information Engineering and Computer Science, 2009. ICIECS 2009. International Conference on",20091228,2009,,,1,4,"In this paper, a new intrusion detection method based on support vector machines improved by artificial immunization algorithm is presented. Support vector machines (SVM) has been well recognized as a powerful computational tool for problems with nonlinearity had high dimensionalities. Right setting parameters are very crucial to learning results and generalization ability of SVM. But empirical parameters are used frequently in SVM RFE, this has hampered its efficiency in practical application. Artificial immunisation algorithm (AIA) is a new intelligent algorithm which integrates global search with local search, and can effectively overcome the prematurity and slow convergence speed of traditional genetic algorithm. To improve the capability of the SVM classifier, The artificial immunisation algorithm is applied to optimize the parameter of SVM in this paper. The experimental result shows that the intrusion detection based on support vector machines improved by artificial immunisation algorithm can give higher recognition accuracy than the general SVM.",,978-1-4244-4994-1,,10.1109/ICIECS.2009.5366324,http://ieeexplore.ieee.org.ezproxy.rit.edu/stamp/stamp.jsp?arnumber=5366324,,Computer science;Data security;Educational institutions;Information science;Intrusion detection;Machine learning algorithms;Power engineering and energy;Power engineering computing;Support vector machine classification;Support vector machines,genetic algorithms;security of data;support vector machines,SVM;artificial immunisation algorithm;genetic algorithm;intrusion detection;support vector machines,,1,,15,,,19-20 Dec. 2009,,IEEE,IEEE Conference Publication
A comparative study of techniques for intrusion detection,"Mukkamala, S.; Sung, A.H.","Dept. of Comput. Sci., New Mexico Tech, USA","Tools with Artificial Intelligence, 2003. Proceedings. 15th IEEE International Conference on",20031208,2003,,,570,577,"Due to increasing incidents of cyber attacks and heightened concerns for cyber terrorism, implementing effective intrusion detection systems (IDSs) is an essential task for protecting cyber security--as well as physical security because of the great dependence on networked computers for the operational control of various infrastructures. Building effective IDSs, unfortunately, has remained an elusive goal owing to the great technical challenges involved; and applied AI techniques are increasingly being utilized in attempts to overcome the difficulties. This paper presents a comparative study of using support vector machines (SVMs), artificial neural networks (ANNs), multivariate adaptive regression splines (MARS) and linear genetic programs (LGPs) for intrusion detection. We investigate and compare the performance of IDSs based on the mentioned techniques, with respect to a well-known set of intrusion evaluation data gathered by Lincoln Labs. Through a variety of experiments and analysis, it is found that, with appropriately chosen population size, program size, crossover rate and mutation rate, LGPs outperform other techniques in terms of detection accuracy at the expense of time. SVMs outperform MARS and ANNs in three critical aspects of intrusion detection: accuracy, training time, and testing time.",1082-3409,0-7695-2038-3,,10.1109/TAI.2003.1250243,http://ieeexplore.ieee.org.ezproxy.rit.edu/stamp/stamp.jsp?arnumber=1250243,,Artificial intelligence;Computer networks;Computer security;Control systems;Intrusion detection;Mars;Physics computing;Protection;Support vector machines;Terrorism,Internet;authorisation;computer crime;genetic algorithms;neural nets;safety systems;splines (mathematics);support vector machines,ANN;IDS;Lincoln Labs;MARS;SVM;artifical neural network;artificial intelligence;cyber attack;cyber security;cyber terrorism;information security;intrusion detection;intrusion evaluation data;linear genetic program;multivariate adaptive regression splines;network computer;physical security;support vector machine,,13,,26,,,3-5 Nov. 2003,,IEEE,IEEE Conference Publication
Fuzzy c-Means Sub-Clustering with Re-sampling in Network Intrusion Detection,"Zainal, A.; Samaon, D.F.; Maarof, M.A.; Shamsuddin, S.M.","Fac. of Comput. Sci. & Inf. Syst., Univ. Teknol. Malaysia, Skudai, Malaysia","Information Assurance and Security, 2009. IAS '09. Fifth International Conference on",20091009,2009,1,,683,686,"Both supervised and unsupervised learning are popularly used to address the classification problem in anomaly intrusion detection. The classical and challenging task in intrusion detection is how to identify and classify new attacks or variants of normal traffic. Though the classification rate is not at par with supervised approach, unsupervised approach is not affected by the unknown attacks. Inspired by the success of bagging technique used in prediction, the study deployed similar re-sampling strategy by splitting the training data into half. Data was obtained from KDDCup 1999 dataset. The finding shows that re-sampling improves performance of fuzzy c-means sub-clustering.",,978-0-7695-3744-3,,10.1109/IAS.2009.333,http://ieeexplore.ieee.org.ezproxy.rit.edu/stamp/stamp.jsp?arnumber=5283185,Fuzzy c-Means;intrusion detection;resampling and subclustering,Bagging;Clustering algorithms;Computer science;Computer security;Fuzzy systems;Information security;Intrusion detection;Partitioning algorithms;Testing;Unsupervised learning,security of data;telecommunication traffic;unsupervised learning,KDDCup 1999 dataset;bagging technique;fuzzy c-means subclustering algorithm;network intrusion detection;network traffic;resampling strategy;unsupervised learning,,0,,9,,,18-20 Aug. 2009,,IEEE,IEEE Conference Publication
A novel intrusion detection method based on clonal selection clustering algorithm,Ji-Qing Xian; Feng-Hua Lang; Xian-Lun Tang,"Fac. of Autom., Chongqing Univ. of Posts & Telecommun., China","Machine Learning and Cybernetics, 2005. Proceedings of 2005 International Conference on",20051107,2005,6,,3905,3910 Vol. 6,"This paper presents a novel unsupervised fuzzy clustering method based on clonal selection algorithm for anomaly detection in order to solve the problem of fuzzy k-means algorithm which is much more sensitive to the initialization and easy to fall into local optimization. This method can quickly obtain the global optimal clustering with clonal operator which combines the evolutionary search, global search, stochastic search and local search. And then detect abnormal network behavioral patterns with fuzzy detection algorithm. Experimental results on the data set of KDD99 show that this method can detect unknown intrusions with lower time complexity and higher detection rate.",,0-7803-9091-1,,10.1109/ICMLC.2005.1527620,http://ieeexplore.ieee.org.ezproxy.rit.edu/stamp/stamp.jsp?arnumber=1527620,Anomaly detection;artificial immune;clonal selection algorithm;fuzzy clustering;fuzzy k-means algorithm;genetic algorithm,Automation;Clustering algorithms;Clustering methods;Detection algorithms;Fuzzy sets;Genetic algorithms;Intrusion detection;Machine learning;Stochastic processes;Training data,computational complexity;fuzzy set theory;genetic algorithms;pattern clustering;security of data;stochastic processes;unsupervised learning,abnormal network behavioral pattern detection;anomaly detection;artificial immune algorithm;clonal selection clustering algorithm;evolutionary search;fuzzy detection algorithm;genetic algorithm;global search;intrusion detection method;local search;stochastic search;unsupervised fuzzy k-means clustering method,,7,,13,,,18-21 Aug. 2005,,IEEE,IEEE Conference Publication
A Fuzzy Clustering Approach for Intrusion Detection,QingPeng Zeng; ShuiXiu Wu,"Sch. of Inf. Eng., NanChang Univ., NanChang, China","Web Information Systems and Mining, 2009. WISM 2009. International Conference on",20091231,2009,,,728,732,"Detection of intrusion attacks is an important issue in network security, now fuzzy set theory has been applied to many fields, therefore, research into fuzzy clustering method for knowledge is significant not only to theory, but also to application. the Fuzzy Possibility C-Means Algorithm for intrusion detection is adopted in this paper, the experiments with KDD Cup 1999 data demonstrate that our proposed method achieves 91.00% average detection rate, and the false positive rate ranges from 0.50% to 1.80%, the total performance evaluation is outperforms the RIPPER method.",,978-0-7695-3817-4,,10.1109/WISM.2009.150,http://ieeexplore.ieee.org.ezproxy.rit.edu/stamp/stamp.jsp?arnumber=5369318,Fuzzy Clustering;Fuzzy Possibility C-Means Algorithm;Intrusion Detection;RIPPER,Clustering algorithms;Computer networks;Computer security;Data engineering;Fuzzy set theory;Fuzzy sets;Fuzzy systems;Information security;Intrusion detection;Knowledge engineering,fuzzy set theory;pattern clustering;possibility theory;security of data,fuzzy clustering;fuzzy possibility C-means algorithm;fuzzy set theory;intrusion attack detection;network security,,1,,15,,,7-8 Nov. 2009,,IEEE,IEEE Conference Publication
Hybrid rule mining based on fuzzy GNP and probabilistic classification for intrusion detection,"Nannan Lu; Mabu, S.; Wenjing Li; Hirasawa, K.","Grad. Sch. of Inf., Waseda Univ., Fukuoka, Japan","SICE Annual Conference 2010, Proceedings of",20101014,2010,,,2614,2619,"With increasing Internet popularity, network security has become a serious problem recently. Therefore, a variety of algorithms have been devoted to this challenge. Genetic Network Programming is a newly developed evolutionary algorithm with directed graph gene structures, which has been applied to data mining for intrusion detection systems and has shown that it provides good performances in intrusion detection. In this paper, a hybrid rule mining algorithm based on Fuzzy GNP and probabilistic classification has been proposed. Hybrid rule mining uses fuzzy class association rule mining algorithm to extract rules with different classes. Then, using different class rules and the classification of data is done probabilistically. The hybrid methods showed excellent results by the simulation experiments.",,978-1-4244-7642-8,,,http://ieeexplore.ieee.org.ezproxy.rit.edu/stamp/stamp.jsp?arnumber=5602487,Fuzzy GNP;Fuzzy class association rule;Genetic Network Programming;Hybrid rule;Intrusion detection;Probabilistic classification,Accuracy;Association rules;Databases;Economic indicators;Intrusion detection;Probabilistic logic,data mining;directed graphs;genetic algorithms;pattern classification;probability;security of data,directed graph gene structures;evolutionary algorithm;fuzzy GNP;genetic network programming;hybrid rule mining;intrusion detection;probabilistic classification,,0,,10,,,18-21 Aug. 2010,,IEEE,IEEE Conference Publication
Distributed investigations of intrusion detection data on the grid,"Joldos, M.; Muntean, I.L.","Comput. Sci. Dept., Tech. Univ. of Cluj-Napoca, Cluj-Napoca, Romania","Roedunet International Conference (RoEduNet), 2011 10th",20110822,2011,,,1,4,"In this paper we demonstrate the use of grid-based computing in revealing aspects of intrusion detection data which were difficult to reveal some years ago due to constrained computing resources. Exploiting the grids for their computing resources can rapidly turn into a tedious task, entailing solid technical knowledge about the grid. Grid application (and) frameworks are the category of tools that make the use of the grid much simplified for the scientist with interest solely on the computing resources. Mining security data is a task, we believe, that can be better served using the grid. Here, we attempt to reveal new insights in intrusion detection data, such as the well known KDDCUP'99 data set.",2068-1038,978-1-4577-1233-3,,10.1109/RoEduNet.2011.5993703,http://ieeexplore.ieee.org.ezproxy.rit.edu/stamp/stamp.jsp?arnumber=5993703,Data mining;Grid computing;Intrusion detection;KDD data set,Data mining;Intrusion detection;Legged locomotion;Machine learning;Middleware;Software,data mining;grid computing;security of data,data security mining;grid-based computing;intrusion detection data,,0,,21,,,23-25 June 2011,,IEEE,IEEE Conference Publication
A fuzzy logic based expert system as a network forensics,Jung-Sun Kim; Dong-Geun Kim; Bong-Nam Noh,"Dept. of Comput. Sci., Chonnam Nat. Univ., Gwangju, South Korea","Fuzzy Systems, 2004. Proceedings. 2004 IEEE International Conference on",20050110,2004,2,,879,884 vol.2,"The field of digital forensic science emerged as a response to the growth of computer crimes. Digital forensics is the art of discovering and retrieving information about a crime in such a way to make a digital evidence admissible in court. Network forensics is digital forensic in networked environments. However, the amount of network traffic is huge and might crash the traffic capture system if left unattended. Not all the information captured or recorded can be useful for analysis or evidence. The more the network traffic, the harder the network analyzing. Therefore, we need an effective and automated analyzing system for network forensics. We propose a fuzzy logic based expert system for network forensics that can analyze computer crimes in networked environments and make digital evidences automatically. This system can provide an analyzed information for forensic experts and reduce the time and cost of forensic analysis.",1098-7584,0-7803-8353-2,,10.1109/FUZZY.2004.1375521,http://ieeexplore.ieee.org.ezproxy.rit.edu/stamp/stamp.jsp?arnumber=1375521,,Art;Computer crashes;Computer crime;Costs;Digital forensics;Expert systems;Fuzzy logic;Information analysis;Information retrieval;Telecommunication traffic,computer crime;expert systems;fuzzy logic;fuzzy systems;information retrieval;telecommunication traffic,automated analyzing system;computer crimes;crime information retrieving;digital evidences;digital forensic science;expert system;forensic experts;fuzzy logic;network forensics;network traffic;traffic capture system,,0,,12,,,25-29 July 2004,,IEEE,IEEE Conference Publication
