http://ieeexplore.ieee.org.ezproxy.rit.edu/search/searchresult.jsp?download-format=download-csv&bulkSetSize=2000&refinements%3D4291944822%2C4291944246%26ranges%3D1998_2016_p_Publication_Year%26matchBoolean%3Dtrue%26searchField%3DSearch_All_Text%26queryText%3D%28%28%28%28%28%28.QT.DarpaIDE.QT.%29+OR+.QT.Darpa1998.QT.%29+OR+.QT.Darpa98.QT.%29+OR+.QT.1998+Darpa+Intrusion+Detection+Evaluation.QT.%29+OR+.QT.Darpa+Intrusion+Detection+Evaluation.QT.%29+AND+.QT.Intrusion+Detection+System.QT.%29,11/20/2015 17:23,"((((((""DarpaIDE"") OR ""Darpa1998"") OR ""Darpa98"") OR ""1998 Darpa Intrusion Detection Evaluation"") OR ""Darpa Intrusion Detection Evaluation"") AND ""Intrusion Detection System"")",IEEE
IDEA: A New Intrusion Detection Data Source,"Mahoney, W.; Sousan, W.","Univ. of Nebraska at Omaha, Omaha","Information Security and Assurance, 2008. ISA 2008. International Conference on",20080507,2008,,,15,19,"In the context of computer systems, an intrusion is generally considered to be a harmful endeavor to prevent others from legitimate use of that system, to obtain data which is not normally available to the intruder, or to plant data or disrupt data already existent on the machines. Traditionally intrusion detection has relied on two data sources: various log files which record user's activity, and network traffic which contains potential threats. This research presents a system which we call IDEA; the Intrusion DEtection Automata system. We utilize a third source of data for intrusion detection in the form of an instrumented process. Open source software is recompiled using a modified compiler we have created, and the resulting executable program generates the data as it runs. An external monitoring facility then checks the behavior of the program against known good execution paths. These paths are specified either using a domain specific language and hand-written rules, or by running the software in a learning mode and capturing the normal behavior for later comparison.",,978-0-7695-3126-7,,10.1109/ISA.2008.32,http://ieeexplore.ieee.org.ezproxy.rit.edu/stamp/stamp.jsp?arnumber=4511526,instrumentation;intrusion detection;open-source,Automata;Computerized monitoring;DSL;Domain specific languages;Information security;Instruments;Intrusion detection;Open source software;Operating systems;Telecommunication traffic,security of data,computer systems;data source;intrusion detection automata system;network traffic,,1,,17,,,24-26 April 2008,,IEEE,IEEE Conference Publication
Intrusion Detection Method Based on Wavelet Neural Network,Jianjing Sun; Han Yang; Jingwen Tian; Fan Wu,"Dept. of Autom. Control, Beijing Union Univ., Beijing","Knowledge Discovery and Data Mining, 2009. WKDD 2009. Second International Workshop on",20090202,2009,,,851,854,"Aimed at the intrusion behaviors are characterized with uncertainty, complexity, diversity and dynamic tendency and the advantages of wavelet neural network (WNN), an intrusion detection method based on WNN is presented in this paper. Moreover, we adopt a algorithm of reduce the number of the wavelet basic function by analysis the sparseness property of sample data which can optimize the wavelet network in a large extent, and the learning algorithm based on the gradient descent was used to train network. We discussed and analyzed the impact factor of intrusion behaviors. With the ability of strong nonlinear function approach and fast convergence rate of WNN, the intrusion detection method based on WNN can detect various intrusion behaviors rapidly and effectively by learning the typical intrusion characteristic information. The experimental result shows that this intrusion detection method is feasible and effective.",,978-0-7695-3543-2,,10.1109/WKDD.2009.214,http://ieeexplore.ieee.org.ezproxy.rit.edu/stamp/stamp.jsp?arnumber=4772068,intrusion behaviors;intrusion detection;network security;wavelet neural network,Artificial intelligence;Artificial neural networks;Convergence;Data mining;Information security;Intrusion detection;Neural networks;Uncertainty;Wavelet analysis;Wavelet transforms,convergence of numerical methods;gradient methods;learning (artificial intelligence);nonlinear functions;security of data;wavelet transforms,fast convergence rate;gradient descent method;intrusion detection;learning algorithm;nonlinear function;sparseness property;wavelet neural network training,,1,,10,,,23-25 Jan. 2009,,IEEE,IEEE Conference Publication
Optimization of Massive Pattern Queries by Dynamic Configuration Morphing,"Laptev, N.; Zaniolo, C.","Univ. of California, Los Angeles, CA, USA","Data Engineering (ICDE), 2012 IEEE 28th International Conference on",20120702,2012,,,917,928,"Complex pattern queries play a critical role in many applications that must efficiently search databases and data streams. Current techniques support the search for multiple patterns using deterministic or non-deterministic automata. In practice however, the static pattern representation does not fully utilize available system resources, subsequently suffering from poor performance. Therefore a low overhead auto-reconfigurable automaton is needed that optimizes pattern matching performance. In this paper, we propose a dynamic system that entails the efficient and reliable evaluation of a very large number of pattern queries on a resource constrained system under changing stress-load. Our system prototype, Morpheus, pre-computes several query pattern representations, named templates, which are then morphed into a required form during run-time. Morpheus uses templates to speed up dynamic automaton reconfiguration. Results from empirical studies confirm the benefits of our approach, with three orders of magnitude improvement achieved in the overall pattern matching performance with the help of dynamic reconfiguration. This is accomplished only with a modest increase in amortized memory usage.",1063-6382,978-1-4673-0042-1,,10.1109/ICDE.2012.52,http://ieeexplore.ieee.org.ezproxy.rit.edu/stamp/stamp.jsp?arnumber=6228144,,Automata;Doped fiber amplifiers;Dynamic scheduling;Engines;Equations;Optimization;Pattern matching,data structures;deterministic automata;pattern matching;query processing,autoreconfigurable automaton;data stream;database searching;deterministic automata;dynamic automaton reconfiguration;dynamic configuration morphing;massive pattern query optimization;nondeterministic automata;pattern matching;query pattern representation;resource constrained system;static pattern representation,,1,,29,,,1-5 April 2012,,IEEE,IEEE Conference Publication
Intrusion Detection Method Based on Classify Support Vector Machine,Meijuan Gao; Jingwen Tian; Mingping Xia,"Coll. of Autom., Beijing Union Univ., Beijing, China","Intelligent Computation Technology and Automation, 2009. ICICTA '09. Second International Conference on",20091016,2009,2,,391,394,"Aimed at the network intrusion behaviors are characterized with uncertainty, complexity, diversity and dynamic tendency and the advantages of support vector machine (SVM), an intrusion detection method based on classify SVM is presented in this paper. The SVM network structure for intrusion detection is established, and use the genetic algorithm (GA) to optimize SVM parameters, thereby enhancing the convergence rate and the detection accuracy. We discussed and analyzed the affect factors of network intrusion behaviors. With the ability of strong self-learning and well generalization of SVM, the intrusion detection method based on classify SVM can detect various intrusion behaviors rapidly and effectively by learning the typical intrusion characteristic information. The experimental result shows that this intrusion detection method is feasible and effective.",,978-0-7695-3804-4,,10.1109/ICICTA.2009.330,http://ieeexplore.ieee.org.ezproxy.rit.edu/stamp/stamp.jsp?arnumber=5287883,genetic algorithm;intrusion behaviors;intrusion detection;support vector machine,Artificial intelligence;Artificial neural networks;Automation;Educational institutions;Genetic algorithms;Intelligent networks;Intrusion detection;Support vector machine classification;Support vector machines;Uncertainty,convergence;genetic algorithms;pattern classification;security of data;support vector machines,SVM classification;SVM network structure;SVM parameters;convergence rate;genetic algorithm;intrusion characteristic information;intrusion detection;network intrusion behavior;strong self-learning;support vector machine,,2,,12,,,10-11 Oct. 2009,,IEEE,IEEE Conference Publication
Comparing performance of binary-coded detectors and constraint-based detectors,"Haiyu Hou; Dozier, G.V.","Dept. of Comput. Sci. & Software Eng., Auburn Univ., AL, USA","Evolutionary Computation, 2004. CEC2004. Congress on",20040903,2004,1,,772,777 Vol.1,"Artificial immune systems can be used to detect intrusion by classifying network activities as normal or abnormal. High detection rates and low false positive rates are two necessary features of successful AIS. Strong detectors are the basis of creating a successful AIS. Some preliminary experiments showed its promise to encode detectors in the form of data triples. Currently, there are two types of detectors: binary-coded and constraint-based. This paper compares the two types of detectors using simulated network traffic data. The results show that constraint-based detectors perform better than binary-coded detectors.",,0-7803-8515-2,,10.1109/CEC.2004.1330937,http://ieeexplore.ieee.org.ezproxy.rit.edu/stamp/stamp.jsp?arnumber=1330937,,Adaptive algorithm;Artificial immune systems;Computer science;Detectors;Immune system;Intrusion detection;Pattern matching;Software engineering;Telecommunication traffic;Traffic control,authorisation;binary codes;computer networks;evolutionary computation;telecommunication security;telecommunication traffic,adaptive algorithms;artificial immune systems;binary-coded detectors;constraint-based detectors;evolutionary algorithm;intrusion detection;network classification;network traffic,,1,,14,,,19-23 June 2004,,IEEE,IEEE Conference Publication
Detecting new forms of network intrusion using genetic programming,"Wei Lu; Traore, I.","Dept. of Electr. & Comput. Eng., Victoria Univ., BC, Canada","Evolutionary Computation, 2003. CEC '03. The 2003 Congress on",20040524,2003,3,,2165,2172 Vol.3,"How to find and detect novel or unknown network attacks is one of the most important objectives in current intrusion detection systems. In this paper, a rule evolution approach based on genetic programming (GP) for detecting novel attacks on network is presented and four genetic operators namely reproduction, mutation, crossover and dropping condition operators are used to evolve new rules. New rules are used to detect novel or known network attacks. A training and testing dataset proposed by DARPA is used to evolve and evaluate these new rules. The proof of concept implementation shows that the rule generated by GP has a low false positive rate (FPR), a low false negative rate (FNR) and a high rate of detecting unknown attacks. Moreover, the rule base composed of new rules has high detection rate (DR) with low false alarm rate (FAR).",,0-7803-7804-0,,10.1109/CEC.2003.1299940,http://ieeexplore.ieee.org.ezproxy.rit.edu/stamp/stamp.jsp?arnumber=1299940,,Artificial intelligence;Biological cells;Data structures;Databases;Event detection;Genetic algorithms;Genetic mutations;Genetic programming;Intrusion detection;Testing,authorisation;genetic algorithms;telecommunication security,DARPA;crossover;detection rate;dropping condition operators;false alarm rate;false negative rate;false positive rate;genetic operators;genetic programming;intrusion detection systems;mutation;network attacks;network intrusion;reproduction;rule evolution approach;testing dataset;training dataset,,3,,15,,,8-12 Dec. 2003,,IEEE,IEEE Conference Publication
A Finite Context Intrusion Prediction Model for Cloud Systems with a Probabilistic Suffix Tree,"Kholidy, H.A.; Yousof, A.M.; Erradi, A.; Abdelwahed, S.; Ali, H.A.","Comput. Sci. & Eng., Qatar Univ., Doha, Qatar","Modelling Symposium (EMS), 2014 European",20150713,2014,,,526,531,"The success of the cloud computing paradigm depends on how effectively the cloud infrastructures will be able to instantiate and dynamically maintain computing platforms that meet Quality of Service (QoS) requirements. Most of the current security technologies do not provide early warnings about future ongoing attacks. This paper introduces new techniques in prediction model that is built based on Variable Order Markov Model and Probabilistic Suffix Tree. The proposed model uses a risk assessment model to evaluate the overall risk in the cloud system. According to our experiments on DARPA 2000 dataset, the prediction model has successfully signaled early warning alerts 58.983 minutes before the launching of the LLDDoS1.0 attack and 43.93 minutes before the launching of the LLDDoS2.0. This gives the system administrator or an autonomic system ample time to take corrective action.",,978-1-4799-7411-5,,10.1109/EMS.2014.90,http://ieeexplore.ieee.org.ezproxy.rit.edu/stamp/stamp.jsp?arnumber=7154055,cloud computing; security; privacy; intrusion detection systems; intrusion prediction; variable order markov model; probabilistic suffix tree,Computational modeling;Context modeling;Hidden Markov models;Markov processes;Predictive models;Probabilistic logic;Training,Markov processes;cloud computing;probability;quality of service;risk management;security of data;software fault tolerance;trees (mathematics),DARPA 2000 dataset;LLDDoS1.0 attack;LLDDoS2.0;QoS requirements;autonomic system;cloud computing paradigm;cloud infrastructures;cloud systems;finite context intrusion prediction model;overall risk evaluation;probabilistic suffix tree;quality-of-service requirements;risk assessment model;variable order Markov model,,1,,15,,,21-23 Oct. 2014,,IEEE,IEEE Conference Publication
Detection of Unknown Computer Worms Activity Based on Computer Behavior using Data Mining,"Moskovitch, R.; Gus, I.; Pluderman, S.; Stopel, D.; Feher, C.; Glezer, C.; Yuval Shahar; Elovici, Y.","Deutsche Telekom Labs., Ben-Gurion Univ., Be''er Sheva","Computational Intelligence and Data Mining, 2007. CIDM 2007. IEEE Symposium on",20070604,2007,,,202,209,"Detecting unknown worms is a challenging task. Extant solutions, such as anti-virus tools, rely mainly on prior explicit knowledge of specific worm signatures. As a result, after the appearance of a new worm on the Web there is a significant delay until an update carrying the worm's signature is distributed to anti-virus tools. During this time interval a new worm can infect many computers and cause significant damage. We propose an innovative technique for detecting the presence of an unknown worm, not necessarily by recognizing specific instances of the worm, but rather based on the computer measurements. We designed an experiment to test the new technique employing several computer configurations and background applications activity. During the experiments 323 computer features were monitored. Four feature selection techniques were used to reduce the amount of features and four classification algorithms were applied on the resulting feature subsets. Our results indicate that using this approach resulted in exceeding 90% mean accuracy, and for specific unknown worms accuracy reached above 99%, using just 20 features while maintaining a low level of false positive rate.",,1-4244-0705-2,,10.1109/CIDM.2007.368873,http://ieeexplore.ieee.org.ezproxy.rit.edu/stamp/stamp.jsp?arnumber=4221297,,Computational intelligence;Computer worms;Computerized monitoring;Data mining;Delay;File systems;Intrusion detection;Laboratories;Operating systems;Software packages,data mining;invasive software,World Wide Web;background application activity;computer behavior;computer configurations;computer measurements;computer worm detection;data mining;feature selection,,1,,31,,,March 1 2007-April 5 2007,,IEEE,IEEE Conference Publication
Active learning to improve the detection of unknown computer worms activity,"Moskovitch, R.; Nissim, N.; Englert, R.; Elovici, Y.","Deutche Telekom Labs., Ben Gurion Univ., Beer Sheva","Information Fusion, 2008 11th International Conference on",20080926,2008,,,1,8,"Detecting unknown worms is a challenging task. We propose an innovative technique for detecting the presence of an unknown worm based on the computer measurements extracted from the operating system. We designed an experiment to test the new technique employing several computer configurations and background applications activity. During the experiments 323 computer features were monitored. Four feature selection measures were used to reduce the number of features. We applied support vector machines on the resulting feature subsets. In addition, we used active learning as a selective sampling method to increase the performance of the classifier and improve its robustness in noisy data. Our results indicate that using the proposed approach resulted in a mean accuracy in excess of 90%, and for specific unknown worms accuracy reached above 94%, using just 20 features while maintaining a low false positive rate.",,978-3-8007-3092-6,978-3-00-024883-2,,http://ieeexplore.ieee.org.ezproxy.rit.edu/stamp/stamp.jsp?arnumber=4632425,Active Learning;Classification;Malcode Detection;Support Vector Machines,,computer viruses;invasive software;learning (artificial intelligence);operating systems (computers);sampling methods;support vector machines,active learning;computer worms activity;feature selection;operating system;selective sampling method;support vector machines;unknown worms detection,,0,,28,,,June 30 2008-July 3 2008,,IEEE,IEEE Conference Publication
Protecting Run-Time Filters for Network Intrusion Detection Systems,"Valgenti, V.C.; Hai Sun; Min Sik Kim","Petabi, Inc., Irvine, CA, USA","Advanced Information Networking and Applications (AINA), 2014 IEEE 28th International Conference on",20140619,2014,,,116,122,"Network Intrusion Detection Systems (NIDS) examine millions of network packets searching for malicious traffic. Multi-gigabit line-speeds combined with growing databases of rules lead to dropped packets as the load exceeds the capacity of the device. Several areas of research have attempted to mitigate this problem through improving packet inspection efficiency, increasing resources, or reducing the examined population. A popular method for reducing the population examined is to employ run-time filters that can provide a quick check to determine that a given network packet cannot match a particular rule set. While this technique is an excellent method for reducing the population under examination, rogue elements can trivially bypass such filters with specially crafted packets and render the run-time filters effectively useless. Since the filtering comes at the cost of extra processing a filtering solution could actually perform worse than a non-filtered solution under such pandemic circumstances. To defend against such attacks, it is necessary to consider run-time filters as an independent anomaly detector capable of detecting attacks against itself. Such anomaly detection, together with judicious rate-limiting of traffic forwarded to full packet inspection, allows the detection, logging, and mitigation of attacks targeted at the filters while maintaining the overall improvements in NIDS performance garnered from using run-time filters.",1550-445X,978-1-4799-3629-8,,10.1109/AINA.2014.19,http://ieeexplore.ieee.org.ezproxy.rit.edu/stamp/stamp.jsp?arnumber=6838655,Deep Packet Inspection;Filters;IDS;Intrusion Detection;Network Security;Run-time Filters;Security,Automata;Detectors;Inspection;Intrusion detection;Limiting;Matched filters;Sociology,filters;security of data;telecommunication traffic,NIDS performance;anomaly detector;crafted packets;filtering solution;malicious traffic;multigigabit line-speeds;network intrusion detection systems;network packets;packet inspection;run-time filters;run-time filters protection,,0,,19,,,13-16 May 2014,,IEEE,IEEE Conference Publication
Network Intrusion Detection Method Based on High Speed and Precise Genetic Algorithm Neural Network,Jingwen Tian; Meijuan Gao,"Dept. of Autom. Control, Beijing Union Univ., Beijing","Networks Security, Wireless Communications and Trusted Computing, 2009. NSWCTC '09. International Conference on",20090505,2009,2,,619,622,"Aimed at the network intrusion behaviors are characterized with uncertainty, complexity, diversity and dynamic tendency and the advantages of neural network, an intrusion detection method based on high speed and precise genetic algorithm neural network is presented in this paper. The high speed and precise genetic algorithm neural network is combined the adaptive and floating-point code genetic algorithm with BP network which has higher accuracy and faster convergence speed. We construct the network structure, and give the algorithm flow. We discussed and analyzed the impact factor of intrusion behaviors. With the ability of strong self-learning and faster convergence of high speed and precise genetic algorithm neural network, the network intrusion detection method can detect various intrusion behaviors rapidly and effectively by learning the typical intrusion characteristic information. The experimental result shows that this intrusion detection method is feasible and effective.",,978-1-4244-4223-2,,10.1109/NSWCTC.2009.228,http://ieeexplore.ieee.org.ezproxy.rit.edu/stamp/stamp.jsp?arnumber=4908545,Network;genetic algorithm;intrusion detection;neural network,Artificial intelligence;Artificial neural networks;Computer networks;Convergence;Genetic algorithms;Information security;Intrusion detection;Neural networks;Uncertainty;Wireless communication,backpropagation;genetic algorithms;neural nets;security of data,BP network;floating-point code genetic algorithm;intrusion behaviors;network intrusion detection method;neural network,,1,,9,,,25-26 April 2009,,IEEE,IEEE Conference Publication
Finding the vocabulary of program behavior data for anomaly detection,"Michael, C.C.",,"DARPA Information Survivability Conference and Exposition, 2003. Proceedings",20030422,2003,1,,152,163 vol.1,"Application-based anomaly detectors construct a base-line model of normal application behavior, and deviations from that behavior are interpreted as signs of a possible intrusion. But current anomaly detectors monitor application behavior at a high level of detail, and many irrelevant variations in that behavior can cause false alarms. This paper discusses the preprocessing of audit data ultimately used by application-based anomaly detection systems. The goal is to create a more abstract picture of program behavior filtering out many irrelevant details. Our specific approach automatically identifies repeating sub-sequences of behavior events and sequences of events that always occur together. The main benefit of this preprocessing technique can be used with a wide variety of program-based anomaly detectors, but we present empirical results showing how it improves the performance of the well-known stide anomaly detection system.",,0-7695-1897-4,,10.1109/DISCEX.2003.1194881,http://ieeexplore.ieee.org.ezproxy.rit.edu/stamp/stamp.jsp?arnumber=1194881,,Data analysis;Detectors;Filtering;Information analysis;Information systems;Intrusion detection;Monitoring;Object detection;Performance analysis;Vocabulary,auditing;security of data,application-based anomaly detection systems;application-based anomaly detectors;audit data preprocessing;baseline model;intrusion;normal application behavior;program behavior data vocabulary;repeating sub-sequences,,2,,27,,,22-24 April 2003,,IEEE,IEEE Conference Publication
