http://ieeexplore.ieee.org.ezproxy.rit.edu/search/searchresult.jsp?download-format=download-csv&bulkSetSize=2000&refinements%3D4291944822%2C4291944246%26ranges%3D1998_2016_p_Publication_Year%26matchBoolean%3Dtrue%26searchField%3DSearch_All_Text%26queryText%3D%28%28%28%28%28%28.QT.DarpaIDE.QT.%29+OR+.QT.Darpa1998.QT.%29+OR+.QT.Darpa98.QT.%29+OR+.QT.1998+Darpa+Intrusion+Detection+Evaluation.QT.%29+OR+.QT.Darpa+Intrusion+Detection+Evaluation.QT.%29+AND+.QT.Intrusion+Detection+System.QT.%29,11/20/2015 17:23,"((((((""DarpaIDE"") OR ""Darpa1998"") OR ""Darpa98"") OR ""1998 Darpa Intrusion Detection Evaluation"") OR ""Darpa Intrusion Detection Evaluation"") AND ""Intrusion Detection System"")",IEEE
Conservative vs. Optimistic Parallelization of Stateful Network Intrusion Detection,"Schuff, D.L.; Yung Ryn Choe; Pai, V.S.","Purdue Univ. West Lafayette, West Lafayette, IN","Performance Analysis of Systems and software, 2008. ISPASS 2008. IEEE International Symposium on",20080507,2008,,,32,43,"This paper presents and experimentally analyzes the performance of three parallelization strategies for the popular open-source Snort network intrusion detection system (NIDS). The parallelizations include 2 conservative variants and 1 optimistic scheme. The conservative strategy parallelizes inspection at the level of TCP/IP flows, as any potential inter-packet dependences are confined to a single flow. The flows are partitioned among threads, and each flow is processed in-order at one thread. A second variation reassigns flows between threads to improve load balance but still requires that only one thread process a given flow at a time. The flow-concurrent scheme provides good performance for 3 of the 5 network packet traces studied, reaching as high as 4.1 speedup and 3.1 Gbps inspection rate on a commodity 8-core server. Dynamic reassignment does not improve performance scalability because it introduces locking overheads that offset any potential benefits of load balancing. Neither conservative version can achieve good performance, however, without enough concurrent networkflows. For this case, this paper presents an optimistic parallelization that exploits the observation that not all packets from a flow are actually connected by dependences. This system allows a single flow to be simultaneously processed by multiple threads, stalling if an actual dependence is found. The optimistic version has additional overheads that reduce speedup by 25% for traces with flow concurrency, but its benefits allow one additional trace to see substantial speedup (2.4 on five cores).",,978-1-4244-2232-6,978-1-4244-2233-3,10.1109/ISPASS.2008.4510736,http://ieeexplore.ieee.org.ezproxy.rit.edu/stamp/stamp.jsp?arnumber=4510736,,Concurrent computing;Inspection;Intrusion detection;Load management;Network servers;Open source software;Performance analysis;Scalability;TCPIP;Yarn,computer networks;concurrency control;public domain software;resource allocation;security of data;telecommunication security;transport protocols,TCP-IP flow;conservative parallelization;flow concurrency;flow concurrent scheme;flow partitioning;flow reassignment;inspection parallelization;interpacket dependence;load balancing;network packet;open-source Snort network intrusion detection system;optimistic parallelization;stateful network intrusion,,4,,22,,,20-22 April 2008,,IEEE,IEEE Conference Publication
NBTRL: A Software Platform for Network Background Traffic Replay Based on Log,Zhao Kuo; Tang Kuo; Chu Jianfeng; Hu Liang,"Jilin Univ., Changchun","Control Conference, 2007. CCC 2007. Chinese",20071015,2007,,,607,611,"While the use of intrusion detection system (IDS), which monitors passively specific computing resources, and reports anomalous or intrusive activities, is becoming ubiquitous in today's network, evaluating IDS performance has been found to be challenging. Most IDS testing approaches are faced with selections with regard to their use of background traffic, which plays an important role in IDS testing. This paper presents the design and implementation of NBTRL, a software platform for network background traffic replay based on log files applied to IDS testing. NBTRL consists of information extraction module, packet preprocessing module and replay module. This software platform can extract traffic information from log files, control the speed of background traffic replay, process truncated packets, modify MAC address or IP address of packets, and provide a flexible and reusable experimental environment for IDS testing.",,978-7-81124-055-9,978-7-900719-22-5,10.1109/CHICC.2006.4347201,http://ieeexplore.ieee.org.ezproxy.rit.edu/stamp/stamp.jsp?arnumber=4347201,IDS Testing;Log;Traffic Replay,Communication system traffic control;Computer displays;Computer networks;Data mining;Information security;Intrusion detection;Pervasive computing;Software testing;Telecommunication traffic;Traffic control,information retrieval;program testing;security of data,IDS testing;NBTRL;information extraction module;intrusion detection system;network background traffic replay;packet preprocessing module;replay module;software platform,,1,,25,,,July 26 2007-June 31 2007,,IEEE,IEEE Conference Publication
Integration of virtualization technology into network security laboratory,"Peng Li; Mohammed, T.","East Carolina Univ., Greenville, NC","Frontiers in Education Conference, 2008. FIE 2008. 38th Annual",20081222,2008,,,S2A-7,S2A-12,"Distance education has witnessed a tremendous growth in the past decade. Advances in Internet technologies have made it possible to deliver not only lectures, but also hands-on labs remotely. Virtualization technology enables multiple virtual machines and their applications to run simultaneously on a single physical computer. This eliminates the need to have multiple physical machines host diverse operating systems typically deployed in remote network security labs. In preparation for a course on intrusion detection systems (IDS), the instructor creates pre-configured virtual machines and network trace files for studentspsila use. These virtual machines are then installed by the students on their personal computers at home and used to conduct lab exercises. The virtual lab approach is different from the centralized remote laboratory because students run the lab on their own computers and do not depend on the remote servers. Additionally, the virtual environments allow rapid changes to be made to the lab exercises or environments thus allowing instruction with up-to-date technologies. Furthermore, the burden of maintaining centralized physical labs has been lifted from the institutionpsilas shoulders. Our approach to decentralized virtual lab-based distance education has been well received by our students.",0190-5848,978-1-4244-1969-2,978-1-4244-1970-8,10.1109/FIE.2008.4720550,http://ieeexplore.ieee.org.ezproxy.rit.edu/stamp/stamp.jsp?arnumber=4720550,Decentralized Remote Laboratory;Distance Education;Network Security;Virtual Machine,Application software;Application virtualization;Distance learning;Internet;Intrusion detection;Laboratories;Microcomputers;Operating systems;Physics computing;Virtual machining,Internet;computer science education;distance learning;security of data;student experiments;virtual machines,Internet;distance education;intrusion detection system course;operating system;personal computer;remote network security laboratory;virtual machine;virtualization technology,,2,,13,,,22-25 Oct. 2008,,IEEE,IEEE Conference Publication
Online Naive Bayes classification for network intrusion detection,"Gumus, F.; Sakar, C.O.; Erdem, Z.; Kursun, O.","Dept. of Comput. Eng., Istanbul Univ., Istanbul, Turkey","Advances in Social Networks Analysis and Mining (ASONAM), 2014 IEEE/ACM International Conference on",20141016,2014,,,670,674,"Intrusion detection system (IDS) is an important component to ensure network security. In this paper we build an online Naive Bayes classifier to discriminate normal and bad (intrusion) connections on KDD 99 dataset for network intrusion detection. The classifier starts with a small number of training examples of normal and bad classes; then, as it classifies the rest of the samples one at a time, it continuously updates the mean and the standard deviations of the features (IDS variables). We present experimental results of parameter updating methods and their parameters for the online Naive Bayes classifier. The obtained results show that our proposed method performs comparably to the simple incremental update.",,,,10.1109/ASONAM.2014.6921657,http://ieeexplore.ieee.org.ezproxy.rit.edu/stamp/stamp.jsp?arnumber=6921657,KDD 99 intrusion detection;exponentially weighted moving average;online learning Naive Bayes,Conferences;Educational institutions;Intrusion detection;Probes;Social network services;Standards;Training,Bayes methods;computer network security;data mining;learning (artificial intelligence);pattern classification,IDS;KDD 99 dataset;network intrusion detection system;online Naive Bayes classification;online Naive Bayes classifier;parameter updating methods;standard deviations,,0,,8,,,17-20 Aug. 2014,,IEEE,IEEE Conference Publication
Mathematical analysis of sensor fusion for intrusion detection systems,"Thomas, C.; Balakrishnan, N.","SERC, IISc","Communication Systems and Networks and Workshops, 2009. COMSNETS 2009. First International",20090331,2009,,,1,10,Fusion of multiple intrusion detection systems results in a more reliable and accurate detection for a wider class of intrusions. The paper presented here introduces the mathematical basis for sensor fusion and provides enough support for the acceptability of sensor fusion in performance enhancement of intrusion detection systems. The sensor fusion system is characterized and modeled with no knowledge of the intrusion detection systems and the intrusion detection data. The theoretical analysis is supported with an experimental illustration with three of the available intrusion detection systems using the DARPA 1999 evaluation data set.,,978-1-4244-2912-7,978-1-4244-2913-4,10.1109/COMSNETS.2009.4808852,http://ieeexplore.ieee.org.ezproxy.rit.edu/stamp/stamp.jsp?arnumber=4808852,Intrusion Detection Systems;Sensor Fusion,Computer networks;Computerized monitoring;Data analysis;Detectors;Intrusion detection;Mathematical analysis;Performance loss;Power system modeling;Power system reliability;Sensor fusion,mathematical analysis;security of data;sensor fusion,intrusion detection system;mathematical analysis;sensor fusion,,0,,22,,,5-10 Jan. 2009,,IEEE,IEEE Conference Publication
Use of rule base data mining algorithm for intrusion detection,"Elekar, K.; Waghmare, M.M.; Priyadarshi, A.","Dept. of Comput. Eng., Dattakala Fac. of Eng., Pune, India","Pervasive Computing (ICPC), 2015 International Conference on",20150416,2015,,,1,5,"Due increased growth of Internet, number of network attacks has been increased. Which emphasis need for intrusion detection systems(IDS) for secureing network. In this process network traffic is analyzed and monitored for detecting security flaws. Many researchers working on number of data mining techniques for developing an intrusion detection system. For detecting the intrusion, the network traffic can be classified into normal and anomalous. In this paper we have evaluated five rule base classification algorithms namely Decision Table, JRip, OneR, PART, and ZeroR. The comparison of these rule based classification algorithms is presented in this paper based upon their performance metrics using WEKA tools and KDD-CUP dataset to find out the best suitable algorithm available. The classification performance is evaluated using crossvalidation and test dataset. Considering overall higher correct and lower false attack detection PART classifier performs better than other classifiers.",,,,10.1109/PERVASIVE.2015.7087051,http://ieeexplore.ieee.org.ezproxy.rit.edu/stamp/stamp.jsp?arnumber=7087051,Classification;Data Mining;DecisionTable;IDS;Intrusion Detection;JRip;KDD CUP dataset;Network Security;OneR;PART;WEKA;ZeroR,Classification algorithms;Computers;Data mining;Decision trees;Intrusion detection;Probes,Internet;computer network security;data mining;decision tables;knowledge based systems;pattern classification;telecommunication traffic,IDS;Internet;JRip;OneR;PART;ZeroR;decision table;higher correct attack detection;intrusion detection system;lower false attack detection;network attacks;network security;network traffic analysis;network traffic classification;performance metrics;rule base classification algorithm;rule base data mining algorithm;security flaw detection,,0,,31,,,8-10 Jan. 2015,,IEEE,IEEE Conference Publication
Increasing Overall Network Security by Integrating Signature-Based NIDS with Packet Filtering Firewall,"Salehi, H.; Shirazi, H.; Moghadam, R.A.","Inf. Services Corp., Payam Noor Univ., Tehran, Iran","Artificial Intelligence, 2009. JCAI '09. International Joint Conference on",20090707,2009,,,357,362,"Today network intrusion detection and intrusion prevention system (NIDS/IPS) are considered as one of the hottest topics in computer security. On the other side firewalls have optimized several times and different types have been introduced. Today by integrating NIDS and firewall a new product comes to the market, which is called IPS. IPSs protect information systems from unauthorized access, damage or disruption. They are installed on network primary point and perform deep packet inspection (6 layers) so the hardware should be fast enough to sit almost invisibly within the network. This policy requires expensive hardware which is based on multiple server processor technology. It also needs appropriate changes in network design and policies. The cost may not be so reasonable for medium and small size companies. In this paper we are going to implement some kind of integration between signature-based NIDS and packet filtering firewalls which would increase the overall security by a reasonable cost in compare with modern IPSs. We try to conclude this by optimizing snort as a famous open source NIDS with a sample firewall program in Linux which is implemented by means of IPTABLES commands. The data is transferred in standard XML format. We also test the model by standard DARPA99 data sets and the results are satisfied.",,978-0-7695-3615-6,,10.1109/JCAI.2009.12,http://ieeexplore.ieee.org.ezproxy.rit.edu/stamp/stamp.jsp?arnumber=5159015,Firewall;IPS;NIDS;Security;Snort,Computer security;Costs;Data security;Filtering;Hardware;Information systems;Inspection;Intrusion detection;Network servers;Protection,Internet;Linux;XML;authorisation;digital signatures;telecommunication security;transport protocols,IPS;IPTABLES command;IPV4;Linux;XML format;intrusion prevention system;multiple server processor technology;network intrusion detection system;network primary point;network security;signature-based NIDS with packet filtering firewall;snort-open source NIDS,,0,,17,,,25-26 April 2009,,IEEE,IEEE Conference Publication
A distributed agent-based approach to intrusion detection using the lightweight PCC anomaly detection classifier,"Zongxing Xie; Quirino, T.; Mei-Ling Shyu; Shu-Ching Chen; LiWu Chang","Dept. of Electr. & Comput. Eng., Miami Univ., Coral Gables, FL","Sensor Networks, Ubiquitous, and Trustworthy Computing, 2006. IEEE International Conference on",20060619,2006,1,,8 pp.,,"In this paper, a novel agent-based distributed intrusion detection system (IDS) is proposed, which integrates the desirable features provided by the distributed agent-based design methodology with the high accuracy and speed response of the principal component classifier (PCC). Experimental results have shown that the PCC lightweight anomaly detection classifier outperforms other existing anomaly detection algorithms such as the KNN and LOF classifiers. In order to assess the performance of the PCC classifier on a real network environment, the relative assumption model together with feature extraction techniques are used to generate normal and anomalous traffic in a LAN testbed. Finally, scalability and response performance of the proposed system are investigated through the simulation of the proposed communication architecture. The simulation results demonstrate a satisfactory linear relationship between the degradation of response performance and the scalability of the system",,0-7695-2553-9,,10.1109/SUTC.2006.1636211,http://ieeexplore.ieee.org.ezproxy.rit.edu/stamp/stamp.jsp?arnumber=1636211,,Degradation;Design methodology;Detection algorithms;Feature extraction;Intrusion detection;Local area networks;Scalability;Telecommunication traffic;Testing;Traffic control,feature extraction;local area networks;pattern classification;principal component analysis;real-time systems;security of data;software agents;telecommunication security;telecommunication traffic,IDS;LAN testbed;PCC;anomaly detection algorithm;communication architecture;distributed agent-based approach;feature extraction technique;intrusion detection system;local area network;network traffic;principal component classifier;real network environment;scalability,,3,,22,,,5-7 June 2006,,IEEE,IEEE Conference Publication
A framework for detecting network-based code injection attacks targeting Windows and UNIX,"Andersson, Stig; Clark, A.; Mohay, G.; Schatz, B.; Zimmermann, J.","Inf. Security Inst., Queensland Univ. of Technol., Brisbane, Qld.","Computer Security Applications Conference, 21st Annual",20060103,2005,,,10 pp.,58,"Code injection vulnerabilities continue to prevail. Attacks of this kind such as stack buffer overflows and heap buffer overflows account for roughly half of the vulnerabilities discovered in software every year. The research presented in this paper extends earlier work in the area of code injection attack detection in UNIX environments. It presents a framework for detecting new or previously unseen code injection attacks in a heterogeneous networking environment and compares code injection attack and detection strategies used in the UNIX and Windows environments. The approach presented is capable of detecting both obfuscated and clear text attacks, and is suitable for implementation in the Windows environment. A prototype intrusion detection system (IDS) capable of detecting code injection attacks, both clear text attacks and obfuscated attacks, which targets Windows systems is presented",1063-9527,0-7695-2461-3,,10.1109/CSAC.2005.5,http://ieeexplore.ieee.org.ezproxy.rit.edu/stamp/stamp.jsp?arnumber=1565234,,Application software;Australia;Buffer overflow;Computer architecture;Information security;Intrusion detection;Jacobian matrices;Monitoring;Prototypes;Taxonomy,operating systems (computers);security of data,UNIX;Windows system;clear text attack;code injection vulnerability;heap buffer overflow;heterogeneous network;intrusion detection system;network code injection attack detection;obfuscated attack;software vulnerability;stack buffer overflow,,2,1,12,,,5-9 Dec. 2005,,IEEE,IEEE Conference Publication
Implementation of a DNA-based anomaly identification system utilizing associative string processor (ASP),"Trabelsi, Z.; Hamdy, R.","Coll. of Inf. Technol., United Arab Emirates Univ., Al-Ain, United Arab Emirates","Computer Systems and Applications (AICCSA), 2010 IEEE/ACS International Conference on",20100927,2010,,,1,8,"The genetic material that encodes the unique characteristics of each individual, such as gender, eye color, and other human features is the well-known DNA. In this work, we introduce an anomaly intrusion detection system, built on the notion of a DNA sequence or gene, which is responsible for the normal network traffic patterns. Subsequently, the system detects suspicious activities by searching the normal behavior DNA sequence through string matching. Conversely, string matching is a computationally intensive task and can be converted into a potential bottleneck without high-speed processing. Furthermore, conventional software implemented string matching algorithms have not kept pace with the ever increasing network speeds. As a result, we adopt a monitoring phase that is hardware implemented with the intention that DNA pattern matching is performed at wire-speed. Finally, we provide the details of our FPGA implementation of the bioinformatics-based string matching technique. The associative string processor (ASP) is an associative memory-based micro-architecture with long fixed-length words that can be partially searched. We show that the proposed micro-architecture can handle fixed-length patterns at a rate of more than one character per cycle.",,978-1-4244-7716-6,,10.1109/AICCSA.2010.5586949,http://ieeexplore.ieee.org.ezproxy.rit.edu/stamp/stamp.jsp?arnumber=5586949,CAM;DNA computing;FPGA;Network Intrusion Detection;anomaly identification;bioinformatics;pattern matching,Artificial neural networks;DNA,biocomputing;computer network security;content-addressable storage;field programmable gate arrays;string matching,DNA based anomaly identification system;DNA pattern matching;DNA sequence;FPGA implementation;anomaly intrusion detection system;associative memory based microarchitecture;associative string processor;bioinformatics;genetic material;network traffic patterns;string matching,,0,,15,,,16-19 May 2010,,IEEE,IEEE Conference Publication
Packet- vs. session-based modeling for intrusion detection systems,"Caulkins, B.D.; Lee, J.; Wang, M.","Dept. of Modeling & Simulation, Central Florida Univ., Orlando, FL, USA","Information Technology: Coding and Computing, 2005. ITCC 2005. International Conference on",20050516,2005,1,,116,121 Vol. 1,"In today's interconnected networks, intrusion detection systems (IDSs), encryption devices, firewalls and other hardware and software solutions are critical in providing complete security solutions for corporations and government agencies. Many IDS variants exist which allow security personnel to identify attack network packets primarily through the use of signature detection where the IDS recognizes attack packets due to their well-known signatures as those packets cross the network's gateway threshold. However, anomaly-based ID systems identify normal traffic within a network and report abnormal behavior. We report the findings of our research in the area of anomaly-based intrusion detection systems using data-mining techniques to create a decision tree model of our network using the 1999 DARPA intrusion detection evaluation data set. After the model was created, we gathered data from our local campus network and scored the new data through the model using both packet-based and session-based modeling and compare the results.",,0-7695-2315-3,,10.1109/ITCC.2005.222,http://ieeexplore.ieee.org.ezproxy.rit.edu/stamp/stamp.jsp?arnumber=1428447,,Computer networks;Cryptography;Data security;Detectors;Internet;Intrusion detection;Protection;Radar detection;Telecommunication traffic;Traffic control,data mining;decision trees;packet switching;security of data;telecommunication security,DARPA intrusion detection evaluation data set;anomaly-based ID systems;anomaly-based intrusion detection systems;attack network packets;attack packets;data-mining techniques;decision tree model;encryption devices;firewalls;gateway threshold;interconnected networks;local campus network;normal traffic;packet-based modeling;session-based modeling;signature detection,,1,,12,,,4-6 April 2005,,IEEE,IEEE Conference Publication
Analysis of fuzzy class association rule mining based on Genetic Network Programming,"Ci Chen; Mabu, S.; Chuan Yue; Shimada, K.; Hirasawa, K.","Grad. Sch. of Inf., Waseda Univ., Fukuoka, Japan","ICCAS-SICE, 2009",20091113,2009,,,3480,3484,"Classification rule mining is a practical data mining technique widely used in real world. In the previous work, we have put forward a fuzzy class association rule mining method based on genetic network programming and applied it to network intrusion detection system which proved its efficiency and advantage. In this paper, a detailed comparison not only between fuzzy class association rule minings(FCARMs) with fixed fuzzy membership functions and with evolved fuzzy membership functions, but also between FCARMs with and without probability node transition are carried out. The aim of this paper is to provide experimental analysis on the characteristics of FCARMs with different implementations. Experimental results conducted on real world database, KDD99Cup and DAPRA98 database from MIT Lincoln Laboratory, are studied to verify the comparison.",,978-4-907764-34-0,978-4-907764-33-3,,http://ieeexplore.ieee.org.ezproxy.rit.edu/stamp/stamp.jsp?arnumber=5335109,classification;fuzzy class association rule;fuzzy membership function;genetic network programming;network intrusion detection;probability transition,Association rules;Data mining;Databases;Economic indicators;Electronic mail;Fuzzy systems;Genetic mutations;Information analysis;Intrusion detection;Production systems,data mining;fuzzy set theory;genetic algorithms;probability;security of data,DAPRA98 database;FCARM;KDD99Cup database;MIT Lincoln Laboratory;data mining technique;fuzzy class association rule mining;fuzzy membership function;genetic network programming;network intrusion detection system;probability node transition,,1,,10,,,18-21 Aug. 2009,,IEEE,IEEE Conference Publication
