"Low cost weather station with remote control","Krejcar, O.","Dept. of Inf. Technol., Univ. of Hradec Kralove, Hradec Kralove, Czech Republic","Applied Machine Intelligence and Informatics (SAMI), 2012 IEEE 10th International Symposium on","20120531","2012","","","463","468","This work describes use a PC to control home weather station and visualization measuring data via applications written in programming language C# with communications via USB or RS232. Weather station is capable of measure temperature up to five temperature sensors DS18B20, wind speed via measuring turbine with optical encoder, the intensity of illumination via light sensitive element and finally is able to detect an approaching thunderstorm by measuring atmospheric charge. The station also disposing eight galvanic separation switch outputs, whose function in the supplied software set to customer requirements. Visualization is done in the charts for each measured quantity and also in arranged the panel, depicting the actual situation.","","978-1-4577-0196-2","","10.1109/SAMI.2012.6209011","http://ieeexplore.ieee.org.ezproxy.rit.edu/stamp/stamp.jsp?arnumber=6209011","Digital Outputs;Measure input quantity;USB/RS232;Vizualization;Weather station","Atmospheric measurements;Data visualization;Meteorology;Switches;Temperature measurement;Temperature sensors","data visualisation;geophysics computing;meteorological instruments;peripheral interfaces;telecontrol;temperature measurement;temperature sensors;thunderstorms;velocity measurement","C# programming language;DS18B20 temperature sensors;RS232;USB;atmospheric charge measurement;galvanic separation switch outputs;illumination intensity;light sensitive element;low cost home weather station control;measuring data visualization;measuring turbine;optical encoder;remote control;temperature measurement;wind speed measurement","","1","","9","","","26-28 Jan. 2012","","IEEE","IEEE Conference Publications"
"A Kernel Level VFS Logger for Building Efficient File System Intrusion Detection System","Alam Ansari, M.S.; Chattopadhayay, A.; Das, S.","Nat. Inst. of Technol., Durgapur, India","Computer and Network Technology (ICCNT), 2010 Second International Conference on","20100601","2010","","","273","279","For any file, the modification, access and creation date and time stamp (MAC DTS) is a major parameter, which if preserved properly can be used to gain crucial evidence about activities on the file. Activities on a file system is generally protected by access control mechanism specific to the operating system; discretionary or mandatory access control mechanism being the most common ones. Generally, access control mechanisms deal with allow or deny a based rule (for access to a file) which even extends to role based access control in some cases. This directly implies that access protection mechanism is generally tightly coupled with almost all operating systems. Still, intrusion is a common phenomenon. This paper analyzes and measures the performance of our previously defined approach for efficient file system intrusion detection system. This paper also establishes how this approach can be complementary to existing access control mechanism for Linux kernel 2.6.x.","","978-0-7695-4042-9","978-1-4244-6962-8","10.1109/ICCNT.2010.47","http://ieeexplore.ieee.org.ezproxy.rit.edu/stamp/stamp.jsp?arnumber=5474493","Access and Creation Date and Time stamp (MAC DTS);Host Based Intrusion Detection System (HIDS);Loadable Kernel Module (LKM);Modification;System calls;Virtual File System (VFS)","Access control;Computer networks;File systems;Intrusion detection;Kernel;Linux;Operating systems;Performance analysis;Protection;Security","authorisation;file organisation","Linux kernel 2.6.x;access control mechanism;date stamp;file access;file creation;file modification;file system intrusion detection system;kernel level VFS logger;time stamp;virtual file system","","2","","12","","","23-25 April 2010","","IEEE","IEEE Conference Publications"
"Modeling and analysis of interaction of two mutualistic symbiosis worms","Yu Yao; Xiaodong Feng; Fuxiang Gao; Ge Yu","Coll. of Inf. Sci. & Eng., Northeastern Univ., Shenyang, China","Measurement, Information and Control (ICMIC), 2013 International Conference on","20140306","2013","02","","767","771","Internet worm attacks reduce the network security and cause economic losses. As different kinds of worms spread in the Internet, the interactions among them have strong impact on the propagation of worms. In order to eliminate the negative effect, it is necessary to characterize these interaction behaviors. Accounting for these factors, a model with two mutualistic symbiosis worms is proposed in this paper. The stability of the infection-free equilibrium and positive equilibrium are discussed. Through theoretical analysis, the stability conditions are obtained mathematically. Numerical results from the experiment are in favor of the theoretical analysis. It also indicates that the mutualistic symbiosis worms indeed promote each other's spread in the Internet, which is helpful to design strategies to control the spread of worms.","","978-1-4799-1390-9","","10.1109/MIC.2013.6758077","http://ieeexplore.ieee.org.ezproxy.rit.edu/stamp/stamp.jsp?arnumber=6758077","mutualistic symbiosis worms;numerical simulation;propagation model;stability","Adaptation models;Computational modeling;Educational institutions;Equations;Grippers;Jacobian matrices;Mathematical model","Internet;invasive software","Internet worm attacks;infection-free equilibrium;mutualistic symbiosis worms;positive equilibrium","","0","","10","","","16-18 Aug. 2013","","IEEE","IEEE Conference Publications"
"Deterministic Finite Automata for pattern matching in FPGA for intrusion detection","BabuKaruppiah, A.; Rajaram, S.","Velammal Coll. of Eng. & Technol., Madurai, India","Computer, Communication and Electrical Technology (ICCCET), 2011 International Conference on","20110502","2011","","","167","170","Intrusion detection has been at the center of intense research in the last decade owing to the rapid increase of sophisticated attacks on computer systems. Network Intrusion Detection Systems (NIDS) detect and prevent numerous security threats in network traffic. Recent Network Intrusion Detection Systems (NIDS) use regular expressions to represent suspicious or malicious character sequences in packet payloads in a more efficient way. They require high-speed packet processing providing a challenging case study for pattern matching using regular expressions. This paper presents an efficient method for finding matches to a given regular expression in a given text using FPGAs. This paper introduces a Deterministic Finite Automata (DFA) method of hardware implementation to support regular expressions.","","978-1-4244-9393-7","","10.1109/ICCCET.2011.5762461","http://ieeexplore.ieee.org.ezproxy.rit.edu/stamp/stamp.jsp?arnumber=5762461","Network Intrusion Detection System;Nondeterministic Finite Automata;Regular Expression","Automata;Computers;Doped fiber amplifiers;Field programmable gate arrays;Hardware;Intrusion detection;Pattern matching","deterministic automata;field programmable gate arrays;finite automata;security of data;telecommunication traffic","FPGA;deterministic finite automata;network intrusion detection system;network traffic;packet processing;pattern matching;security threat","","2","","17","","","18-19 March 2011","","IEEE","IEEE Conference Publications"
"A novel boosting-based anomaly detection scheme","Hang-Hang Tong; Chong-Rong Li; Jing-Rui He; Quang-Anh Tran; Hai-Xin Duan; Xing Li","Dept. of Autom., Tsinghua Univ., Beijing, China","Machine Learning and Cybernetics, 2005. Proceedings of 2005 International Conference on","20051107","2005","5","","3199","3203 Vol. 5","As a crucial issue in computer network security, anomaly detection is receiving more and more attention from both application and theoretical point of view. In this paper, by introducing boosting technique, a novel anomaly detection scheme is proposed. On the whole, the proposed scheme is based on Ada-Boost and can be viewed as an extension of Ada-Boost in terms of both probability density estimation (PDE) and confidence area estimation (CAE). Different kinds of base learners are adopted and investigated in the proposed scheme. Systematic experimental results on DARPA 1999 dataset validate the effectiveness of the proposed scheme.","","0-7803-9091-1","","10.1109/ICMLC.2005.1527494","http://ieeexplore.ieee.org.ezproxy.rit.edu/stamp/stamp.jsp?arnumber=1527494","Anomaly detection;base learner;boosting;confidence area estimation;probability density estimation","Automation;Boosting;Computer aided engineering;Computer networks;Electronic mail;Helium;Internet;Intrusion detection;Machine learning;Telecommunication traffic","computer networks;estimation theory;learning (artificial intelligence);probability;security of data;telecommunication security","Ada-Boost;anomaly detection;base learner;computer network security;confidence area estimation;probability density estimation","","0","","15","","","18-21 Aug. 2005","","IEEE","IEEE Conference Publications"
"Applying feature selection to payload-based Web Application Firewalls","Torrano-Gimenez, C.; Hai Thanh Nguyen; Alvarez, G.; Petrovic, S.; Franke, K.","Inst. de Fis. Aplic., Consejo Super. de Investig. Cientificas, Madrid, Spain","Security and Communication Networks (IWSCN), 2011 Third International Workshop on","20140609","2011","","","75","81","Web Application Firewalls (WAFs) analyze the HTTP traffic in order to protect Web applications from attacks. To be effective, WAFs need to analyze the payload of the packets. One of the techniques used for intrusion detection is to extract features from the payload by means of n-grams. An n-gram is a subsequence of n items from a given sequence. The number of n-grams is 256 to the nth power. Since it grows exponentially with n, the curse of dimensionality and computational complexity problem arise. In this paper we propose to apply feature selection in order to reduce the number of features extracted by n-grams and thus to improve the effectiveness of WAFs. We conduct experiments on our own HTTP data set. After extracting n-grams from this data set, we apply the Generic-Feature-Selection (GeFS) measure for intrusion detection [5] to select important features. We use four different classifiers to test the detection accuracy before and after feature selection. The experiments show that we can remove more than 95% of irrelevant and redundant features from the original data set (and thus improve the performance by more than 80% on average), while reducing only slightly (by less than 6%) the accuracy of WAFs.","","","","10.1109/IWSCN.2011.6827720","http://ieeexplore.ieee.org.ezproxy.rit.edu/stamp/stamp.jsp?arnumber=6827720","Web application firewall;Web attack detection;feature selection;intrusion detection systems;machine learning algorithms;n-grams","Accuracy;Correlation;Data mining;Feature extraction;Intrusion detection;Optimization;Payloads","Internet;computational complexity;firewalls;telecommunication traffic","GeFS;HTTP traffic;WAF;computational complexity;data set;dimensionality;generic-feature-selection measure;intrusion detection;n-grams;payload-based Web application firewalls","","1","","22","","","18-20 May 2011","","IEEE","IEEE Conference Publications"
"A selective parameter-based evolutionary technique for network intrusion detection","Baig, Z.A.; Khan, S.; Ahmed, S.; Sqalli, M.H.","Dept. of Comput. Eng., King Fahd Univ. of Pet. & Miner., Dhahran, Saudi Arabia","Intelligent Systems Design and Applications (ISDA), 2011 11th International Conference on","20120102","2011","","","65","71","Network intrusion detection has remained a field of rigorous research over the past few years. Advances in computing performance, in terms of processing power and storage, have allowed the use of resource-intensive intelligent algorithms, to detect intrusive activities, in a timely manner. Genetic Algorithms have emerged as a powerful domain-independent technique to facilitate searching of the most effective set of rules, to differentiate between normal and anomalous network traffic. The scope of research for developing cutting-edge and effective GA-based intrusion detection systems, has rapidly expanded to keep pace with variant attack types, increasingly witnessed from the adversary class. In this paper, we propose a GA-based technique for effectively identifying network intrusion attempts, and clearly differentiating these from normal network traffic. The performance of the proposed scheme is studied and analyzed on the KDD-99 intrusion benchmark data set. We performed a simulation-based analysis of the proposed scheme, with results strengthening our findings, and providing us directions for future work.","2164-7143","978-1-4577-1676-8","","10.1109/ISDA.2011.6121632","http://ieeexplore.ieee.org.ezproxy.rit.edu/stamp/stamp.jsp?arnumber=6121632","Genetic Algorithm;Intrusion Detection Systems;KDD-99 Dataset","Biological cells;Data models;Genetic algorithms;Intelligent systems;Intrusion detection;Testing;Training","computer network security;genetic algorithms;telecommunication traffic","KDD-99 intrusion;computing performance;domain-independent technique;genetic algorithm;intrusion detection system;network intrusion detection;network traffic;resource-intensive intelligent algorithm;selective parameter-based evolutionary technique","","0","","17","","","22-24 Nov. 2011","","IEEE","IEEE Conference Publications"
"ICCSNA2010 volume 1 content","","","Communication Systems, Networks and Applications (ICCSNA), 2010 Second International Conference on","20100930","2010","1","","vi","xiii","Presents the table of contents of the proceedings.","","978-1-4244-7475-2","","10.1109/ICCSNA.2010.5588797","http://ieeexplore.ieee.org.ezproxy.rit.edu/stamp/stamp.jsp?arnumber=5588797","","","","","","0","","","","","June 29 2010-July 1 2010","","IEEE","IEEE Conference Publications"
"A Novel Approach for Rogue Access Point Detection on the Client-Side","Nikbakhsh, S.; Manaf, A.B.A.; Zamani, M.; Janbeglou, M.","Adv. Inf. Sch., Univ. Teknol. Malaysia, Kuala Lumpur, Malaysia","Advanced Information Networking and Applications Workshops (WAINA), 2012 26th International Conference on","20120419","2012","","","684","687","There is a big risk for public Wi-Fi users being tricked into connecting to rogue access points. Rogue access point is one of the most serious threats in WLAN, since it exposes a large number of users to MITM and evil twin attack. In this paper we propose a practical method that warns users to avoid connecting to the rogue access points. Proposed method compares the gateways and the routes that a packet travels to determine whether an access point is legitimate or not. This method can easily detect Man-In-The-Middle and evil twin attack without any assistance from the WLAN operator.","","978-1-4673-0867-0","","10.1109/WAINA.2012.108","http://ieeexplore.ieee.org.ezproxy.rit.edu/stamp/stamp.jsp?arnumber=6185342","MITM attack;Rogue access point (RAP);evil twin;wireless security","Communication system security;IEEE 802.11 Standards;IP networks;Monitoring;Security;Wireless networks","internetworking;radio access networks;telecommunication network routing;telecommunication security;wireless LAN","MITM;WLAN operator;evil twin attack;gateways;man-in-the-middle detection;packet travels routes;public Wi-Fi users;rogue access point detection","","2","","17","","","26-29 March 2012","","IEEE","IEEE Conference Publications"
"Intrusion Monitoring in Process Control Systems","Valdes, A.; Cheung, S.","Comput. Sci. Lab., SRI Int., Menlo Park, CA","System Sciences, 2009. HICSS '09. 42nd Hawaii International Conference on","20090120","2009","","","1","7","To protect process control networks from cyber intrusions, preventive security measures such as perimeter defenses (for example, network firewalls and demilitarized zones) and secure versions of process control network protocols have been increasingly adopted or proposed. Although system hardening and fixing known vulnerabilities of existing systems are crucial to secure process control systems, intrusion monitoring is essential to ensure that the preventive measures are not compromised or bypassed. Our approach involves a multilayer security architecture for monitoring process control systems to achieve accurate and effective situational awareness. Also, we leverage some of the characteristics of process control systems such as the regularity of network traffic patterns to perform intrusion detection, with the potential to detect unknown attacks. To facilitate human analysts to gain a better understanding of anomalous network traffic patterns, we present a visualization tool that supports multiple user-customizable views and animation for analyzing network packet traces.","1530-1605","978-0-7695-3450-3","","10.1109/HICSS.2009.273","http://ieeexplore.ieee.org.ezproxy.rit.edu/stamp/stamp.jsp?arnumber=4755529","","Communication system traffic control;Computer security;Humans;Intrusion detection;Monitoring;Nonhomogeneous media;Pattern analysis;Process control;Protection;Protocols","data visualisation;process control;production engineering computing;security of data","anomalous network traffic;hardening fixing;human analysts;intrusion detection;intrusion monitoring;multilayer security architecture;multiple user-customizable views;network traffic patterns;preventive security measures;process control systems;situational awareness;system hardening;visualization tool","","2","","13","","","5-8 Jan. 2009","","IEEE","IEEE Conference Publications"
"Research on anomaly behavior blocking method for desktop security","Wang Jing; Sun Chao-Yi; Feng Li; Zhou Ti","Wuhan Digital Eng. Inst., Wuhan, China","Computer Application and System Modeling (ICCASM), 2010 International Conference on","20101104","2010","4","","V4-67","V4-71","Anti-virus software is a most common method for protecting the security of Desktop operating system. However, they fall prey to a number of shortcomings such as fully depend on and need to update the virus-database frequently, long scanning time, and their inability to prevent the unknown attacks. Aiming at these, in this paper we propose a novel anomaly behavior blocking approach based on the process behavior reflected in operating system kernel, and introduce an adaptive sliding window to trace the whole process behavior sequence dynamically, two security indices, Normal-Density and Abnormal-Density are also put forward to evaluate the security status of process. By introducing them into the Network Entropy theory, we can make certain the blocking occasion and the blocking granularity accurately. Compared to the traditional blocking models based on fixed window, the experimental results show that this approach can block malicious behavior more effectively as well as drastically.","","978-1-4244-7235-2","978-1-4244-7237-6","10.1109/ICCASM.2010.5620464","http://ieeexplore.ieee.org.ezproxy.rit.edu/stamp/stamp.jsp?arnumber=5620464","Abnormal-Density;Normal-Density;behavior blocking;desktop security;network theory;sliding window","Manganese;Tin","computer viruses;operating systems (computers)","adaptive sliding window;anomaly behavior blocking method;antivirus software;desktop operating system security;network entropy theory;operating system kernel;scanning time;virus database update","","0","","12","","","22-24 Oct. 2010","","IEEE","IEEE Conference Publications"
"Intrusion detection in MANETS - the second wall of defense","Nadkarni, K.; Mishra, A.","Dept. of Comput. Sci., Blacksburg, VA, USA","Industrial Electronics Society, 2003. IECON '03. The 29th Annual Conference of the IEEE","20040405","2003","2","","1235","1238 Vol.2","Wireless mobile ad hoc networks (popularly known as MANETs) have been the focus of research in recent times. Rapid and infrastructure-less deployment in emergency and military situations make these networks unique. However, certain inherently vulnerable characteristics lead to security concerns, which can prove especially damaging in sensitive situations like military operations. Intrusion prevention measures are not guaranteed to work all the time since unrelenting attackers can eventually break them down. An intrusion detection scheme (IDS) monitors a network and looks for intrusions, thus forming a second wall of defense. In this paper, we have proposed a misuse detection -based IDS for MANETs. Our protocol-independent design makes use of a self-adjusting threshold scheme and detects a priori known attack patterns with over 90% accuracy and is generally insensitive to false alarms. Experimental validation has provided significant results about non-degradability of network performance with our IDS incorporated for security enhancements.","","0-7803-7906-3","","10.1109/IECON.2003.1280229","http://ieeexplore.ieee.org.ezproxy.rit.edu/stamp/stamp.jsp?arnumber=1280229","","Broadcasting;Communication system security;Computer science;Intelligent networks;Intrusion detection;Military computing;Mobile ad hoc networks;Routing protocols;Time measurement;Wireless sensor networks","ad hoc networks;mobile radio;protocols;telecommunication security","MANET;attack patterns;denial of service attacks;destination-sequenced distance-vector protocol;intrusion detection scheme;replay attack;self-adjusting threshold scheme;wireless mobile ad hoc networks","","2","","7","","","2-6 Nov. 2003","","IEEE","IEEE Conference Publications"
"An Intrusion Detection Algorithm for Wireless Sensor Network Based on Trust Management Module","Min Lin; Shi Nan; Liu Yue; Li Ning","Sch. of Comput. &amp; Inf. Eng., Henan Univ., Kaifeng, China","Internet Technology and Applications, 2010 International Conference on","20100909","2010","","","1","4","In order to detect various kinds of malicious attacks in wireless sensor networks we proposed a Trust Model based intrusion detection scheme which meets the efficient lightweight and flexible property in this paper. It makes use of some nodes with high trust degree to monitor the whole cluster decreasing the huge power consumption and prolonging life of the whole networks. We propose an algorithm for detecting a series of attacks in WSNs by applying Modified Cumulative Sum (CuSum) algorithm to detect anomalies which good fits the demands and restrictions of WSNs. The alarming module shields false alarm messages sent by malicious nodes through the Trust Model. We show through experiments with real data that our algorithm can decrease the false alarm rate and increase the detection accuracy rate compared with existing intrusion detection schemes while lowering the power consumption.","","978-1-4244-5142-5","978-1-4244-5143-2","10.1109/ITAPP.2010.5566441","http://ieeexplore.ieee.org.ezproxy.rit.edu/stamp/stamp.jsp?arnumber=5566441","","Clustering algorithms;Communication system security;Computers;Educational institutions;Intrusion detection;Wireless communication;Wireless sensor networks","telecommunication security;wireless sensor networks","alarm messages;alarming module;detection accuracy rate;false alarm rate;intrusion detection algorithm;malicious attacks;malicious nodes;modified cumulative sum algorithm;trust management module;wireless sensor network","","1","","7","","","20-22 Aug. 2010","","IEEE","IEEE Conference Publications"
"CluClas: Hybrid clustering-classification approach for accurate and efficient network classification","Fahad, A.; Alharthi, K.; Tari, Z.; Almalawi, A.; Khalil, I.","Sch. of Comput. Sci. & IT, RMIT Univ., Melbourne, VIC, Australia","Local Computer Networks (LCN), 2014 IEEE 39th Conference on","20141016","2014","","","168","176","The traffic classification is the foundation for many network activities, such as Quality of Service (QoS), security monitoring, Lawful Interception and Intrusion Detection Systems (IDS). A recent statistics-based approach to address the unsatisfactory results of traditional port-based and payload-based approaches has attracted attention. However, the presence of non-informative attributes and noise instances degrade the performance of this approach. Thus, to address this problem, in this paper, we propose a hybrid clustering-classification approach (called CluClas) to improve the accuracy and efficiency of network traffic classification by selecting informative attributes and representative instances. An extensive empirical study on four traffic data sets shows the effectiveness of our proposed approach.","","978-1-4799-3778-3","","10.1109/LCN.2014.6925769","http://ieeexplore.ieee.org.ezproxy.rit.edu/stamp/stamp.jsp?arnumber=6925769","","Accuracy;Clustering algorithms;Data models;Hidden Markov models;Measurement;Testing;Training","computer network performance evaluation;pattern classification;pattern clustering;statistical analysis;telecommunication traffic","CluClas;hybrid clustering-classification approach;informative attribute selection;network traffic classification accuracy improvement;network traffic classification efficiency improvement;noise instances;noninformative attributes;performance degradation;representative instances;security statistics-based approach","","0","","32","","","8-11 Sept. 2014","","IEEE","IEEE Conference Publications"
