"Table of contents","","","Design and Diagnostics of Electronic Circuits and Systems, 2007. DDECS '07. IEEE","20070904","2007","","","7","12","Presents the table of contents of the proceedings.","","1-4244-1161-0","","10.1109/DDECS.2007.4295245","http://ieeexplore.ieee.org.ezproxy.rit.edu/stamp/stamp.jsp?arnumber=4295245","","","","","","0","","","","","11-13 April 2007","","IEEE","IEEE Conference Publications"
"Deterministic and Authenticated Flow Marking for IP Traceback","Foroushani, V.A.; Zincir-Heywood, A.N.","Fac. of Comput. Sci., Dalhousie Univ., Halifax, NS, Canada","Advanced Information Networking and Applications (AINA), 2013 IEEE 27th International Conference on","20130617","2013","","","397","404","In this paper, we present a novel approach to IP trace back - Deterministic Flow Marking (DFM) - which allows the victim to trace back the origin of incorrect or spoofed source addresses up to the attacker node, even if the attack has been originated from a network behind a NAT or a proxy server. DFM is scalable and simple to implement, it is capable of tracing thousands of simultaneous distributed attacks in near real time. Moreover, it has a small footprint, resulting in low processing and memory overhead at the victim machines and edge routers. Additionally, DFM provides an optional authentication, so that a compromised router cannot forge markings of other uncompromised routers. Our results show that DFM can reach to ~99% trace back rate with no false positives.","1550-445X","978-1-4673-5550-6","978-0-7695-4953-8","10.1109/AINA.2013.60","http://ieeexplore.ieee.org.ezproxy.rit.edu/stamp/stamp.jsp?arnumber=6531783","Authenticated Flow Marking;DDoS Attacks;Deterministic Flow Marking;Flow Base IP Traceback;Security","Educational institutions;IP networks;Image edge detection;Internet;Network interfaces;Niobium;Probabilistic logic","Internet;computer network security;protocols","DFM;IP traceback;Internet protocol;authenticated flow marking;authentication;deterministic flow marking;distributed attack;edge router","","0","","32","","","25-28 March 2013","","IEEE","IEEE Conference Publications"
"A Finite Context Intrusion Prediction Model for Cloud Systems with a Probabilistic Suffix Tree","Kholidy, H.A.; Yousof, A.M.; Erradi, A.; Abdelwahed, S.; Ali, H.A.","Comput. Sci. & Eng., Qatar Univ., Doha, Qatar","Modelling Symposium (EMS), 2014 European","20150713","2014","","","526","531","The success of the cloud computing paradigm depends on how effectively the cloud infrastructures will be able to instantiate and dynamically maintain computing platforms that meet Quality of Service (QoS) requirements. Most of the current security technologies do not provide early warnings about future ongoing attacks. This paper introduces new techniques in prediction model that is built based on Variable Order Markov Model and Probabilistic Suffix Tree. The proposed model uses a risk assessment model to evaluate the overall risk in the cloud system. According to our experiments on DARPA 2000 dataset, the prediction model has successfully signaled early warning alerts 58.983 minutes before the launching of the LLDDoS1.0 attack and 43.93 minutes before the launching of the LLDDoS2.0. This gives the system administrator or an autonomic system ample time to take corrective action.","","978-1-4799-7411-5","","10.1109/EMS.2014.90","http://ieeexplore.ieee.org.ezproxy.rit.edu/stamp/stamp.jsp?arnumber=7154055","cloud computing; security; privacy; intrusion detection systems; intrusion prediction; variable order markov model; probabilistic suffix tree","Computational modeling;Context modeling;Hidden Markov models;Markov processes;Predictive models;Probabilistic logic;Training","Markov processes;cloud computing;probability;quality of service;risk management;security of data;software fault tolerance;trees (mathematics)","DARPA 2000 dataset;LLDDoS1.0 attack;LLDDoS2.0;QoS requirements;autonomic system;cloud computing paradigm;cloud infrastructures;cloud systems;finite context intrusion prediction model;overall risk evaluation;probabilistic suffix tree;quality-of-service requirements;risk assessment model;variable order Markov model","","1","","15","","","21-23 Oct. 2014","","IEEE","IEEE Conference Publications"
"Malware injection in wireless networks","Kacic, M.; Hanacek, P.; Henzl, M.; Jurnecka, P.","FIT, Brno Univ. of Technol., Brno, Czech Republic","Intelligent Data Acquisition and Advanced Computing Systems (IDAACS), 2013 IEEE 7th International Conference on","20131114","2013","01","","483","487","Nowadays we use the 802.11i standard, which is considered safe for now. In 2010, the Hole 196 vulnerability of Group Transient Key was discovered, which allows an undetectable insider ARP poisoning attack. On this ground we have founded the possibility of malware injection into wireless communication with purpose of avoiding intrusion detection system. This paper describes creation and injection of valid 802.11i frames with malware payload. We also discuss its impact on users at home and wide corporate wireless network.","","978-1-4799-1426-5","","10.1109/IDAACS.2013.6662732","http://ieeexplore.ieee.org.ezproxy.rit.edu/stamp/stamp.jsp?arnumber=6662732","Group key vulnerability;Malware injection;Wireless network security","Cryptography;Malware;Payloads;Protocols;Standards;Wireless networks","invasive software;radio networks;telecommunication security;wireless LAN","802.11i standard;ARP poisoning attack;Hole 196 vulnerability;group transient key;intrusion detection system;malware injection;malware payload;wide corporate wireless network;wireless communication","","2","","13","","","12-14 Sept. 2013","","IEEE","IEEE Conference Publications"
"The Design of a Generic Intrusion-Tolerant Architecture for Web Servers","Saidane, Ayda; Nicomette, V.; Deswarte, Y.","Dept. of Inf. & Commun. Technol., Univ. of Trento, Trento","Dependable and Secure Computing, IEEE Transactions on","20090210","2009","6","1","45","58","Nowadays, more and more information systems are connected to the Internet and offer Web interfaces to the general public or to a restricted set of users. Such openness makes them likely targets for intruders, and conventional protection techniques have been shown insufficient to prevent all intrusions in such open systems. This paper proposes a generic architecture to implement intrusion-tolerant Web servers. This architecture is based on redundancy and diversification principles in order to increase the system resilience to attacks: usually, an attack targets a particular software, running on a particular platform, and fails on others. The architecture is composed of redundant proxies that mediate client requests to a redundant bank of diversified application servers. The redundancy is deployed here to increase system availability and integrity. To improve performance, adaptive redundancy is applied: the redundancy level is selected according to the current alert level. The architecture can be used for static servers, that is, for Web distribution of stable information (updated offline) and for fully dynamic systems where information updates are executed immediately on an online database. The feasibility of this architecture has been demonstrated by implementing an example of a travel agency Web server, and the first performance tests are satisfactory, both for request execution times and recovery after incidents.","1545-5971","","","10.1109/TDSC.2008.1","http://ieeexplore.ieee.org.ezproxy.rit.edu/stamp/stamp.jsp?arnumber=4429182","Security;Web servers;and protection;integrity","","Internet;client-server systems;data integrity;fault tolerant computing;file servers;open systems;redundancy;security of data","Internet;Web interface;Web server;adaptive redundancy;client-server system;data integrity;diversification principle;information system;intrusion-tolerant architecture;open system;system availability","","12","","27","","2008-02-02","Jan.-March 2009","","IEEE","IEEE Journals & Magazines"
"Energy-based adaptation in simulations of survivability of ad hoc communication","Raciti, M.; Cucurull, J.; Nadjm-Tehrani, S.","Dept. of Comput. & Inf. Sci., Linkoping Univ., Linko&#x0308;ping, Sweden","Wireless Days (WD), 2011 IFIP","20111212","2011","","","1","7","Mobile wireless handheld devices can support ad hoc communication when infrastructure systems are overloaded or not available. Unfortunately, the constrained capacity of their batteries and the energy inefficiency inherent to the ad hoc communication poses a challenge causing a short lifetime. Protocols and application layer services, such as security, can be designed (offline) to do an efficient use of the resources. Realtime adaptation can further minimise their impact on the energy consumption, increasing the network lifetime thus extending the availability of network communication. In this paper, we propose an energy-aware adaption component for an Intrusion Detection System (IDS) in mobile ad hoc networks (MANET). The component is in charge of adjusting the parameters of the IDS based on the current energy level, using the trade-off between the node's response to attacks and the energy consumption induced by the IDS. The approach is based on a model for accounting CPU energy consumption in network simulation, which has been implemented in an existing IDS in ns-3. Simulations demonstrate that the adaption has a positive impact on the battery life time, increasing it by 14%, without deteriorating the network-wide performance of the IDS.","2156-9711","978-1-4577-2027-7","978-1-4577-2026-0","10.1109/WD.2011.6098216","http://ieeexplore.ieee.org.ezproxy.rit.edu/stamp/stamp.jsp?arnumber=6098216","Adaptation;CPU model;energy modelling;energy-awareness;intrusion detection;survivability","Ad hoc networks;Adaptation models;Batteries;Energy consumption;Power demand;Protocols;Security","mobile ad hoc networks;mobile handsets;protocols;security of data;telecommunication network reliability","CPU energy consumption;IDS;MANET;NS3 simulation;application layer service;attack node response;energy inefficiency;energy-aware adaption component;intrusion detection system;mobile ad hoc network;mobile wireless handheld device;network communication availability;network lifetime;protocol;survivability simulation","","1","","27","","","10-12 Oct. 2011","","IEEE","IEEE Conference Publications"
"Exploiting Artificial Immune systems to detect unknown DoS attacks in real-time","Dawei Wang; Longtao He; Yibo Xue; Yingfei Dong","Nat. Comput. network Emergency Response Tech. Team/Coordination Center of China, Beijing, China","Cloud Computing and Intelligent Systems (CCIS), 2012 IEEE 2nd International Conference on","20131114","2012","02","","646","650","DoS is still one of the most serious attacks on the Internet. Payload-based approaches are effective to known DOS attacks but are unable to be deployed on high-speed networks. To address this issue, flow-based DOS detection schemes have been proposed for highspeed networks as an effective supplement of payload-based solutions. However, existing flow-based solutions have serious limitations in detecting unknown attacks and efficiently identifying real attack flows buried in the background traffic. In addition, existing solutions also have difficulty to adapt to attack dynamics. To address these issues, this paper proposes a flow-based DOS detection scheme based on Artificial Immune systems. We adopt a tree structure to store flow information such that we can effectively extract useful features from flow information for better detecting DoS attacks. We employ Neighborhood Negative Selection (NNS) as the detection algorithm to detect unknown DoS attacks, and identify attack flows from massive traffic. Because the strong tolerance of NNS, the proposed solution is able to quickly adapt attack dynamics. The experimental results show that this solution is able to effectively detect unknown DoS attack flows and identify attack flows from background traffic. Meanwhile, the theoretical analysis demonstrates that this system can extract flow features more effectively.","","978-1-4673-1855-6","","10.1109/CCIS.2012.6664254","http://ieeexplore.ieee.org.ezproxy.rit.edu/stamp/stamp.jsp?arnumber=6664254","Artificial immune;DoS attack;Flow;Intrusion detection","Artificial neural networks;Computer crime;Data mining;Detectors;Feature extraction;IP networks;Protocols","Internet;artificial immune systems;computer network security;real-time systems;telecommunication traffic","DoS attack flows;DoS attacks;Internet;NNS;artificial immune systems;attack dynamics;background traffic;detection algorithm;flow information;flow-based DOS detection schemes;flow-based solutions;high-speed networks;neighborhood negative selection;payload-based approaches;payload-based solutions;real attack flows;tree structure","","0","","14","","","Oct. 30 2012-Nov. 1 2012","","IEEE","IEEE Conference Publications"
"Application of Unbalanced Data Approach to Network Intrusion Detection","Zhao Yueai; Chen Junjie","Inst. of Comput. Sci. & Software, Taiyuan Univ. of Sci. & Technol., Taiyuan, China","Database Technology and Applications, 2009 First International Workshop on","20090818","2009","","","140","143","In view of the current problems of HNIDS (high-speed network intrusion detection system), such as high packet loss rate, slow pace of testing for attacks and unbalanced data for detection. This paper presents a novel approach for HNIDS by taking two-stage strategy with load balancing model. In the on-line phase, the system captures the packets from network and split into small according the type of protocol, then detected intrusion through each sensor. In the off-line, training dataset are used to build model, which can detected intrusion. We discuss different approaches to unbalanced data, empirically evaluate the SMOTE over-sampling approaches, AdaBoost and random forests algorithm. We also discuss the approaches for selecting features. Finally report our experimental results over the KDD'99 datasets. The results show that SMOTE and the AdaBoost algorithm by using random forests as weak learner not only can provides better performance to small class, but also has lower build model time.","","978-0-7695-3604-0","","10.1109/DBTA.2009.116","http://ieeexplore.ieee.org.ezproxy.rit.edu/stamp/stamp.jsp?arnumber=5207794","Adaboost;SMOTE;ensemble learning;networks intrusion detection;random forests;unbalanced data","Application software;Computer science;High-speed networks;Intrusion detection;Load management;Load modeling;Phase detection;Protocols;Sensor systems;Telecommunication traffic","computer networks;protocols;resource allocation;security of data;telecommunication security","AdaBoost algorithm;HNIDS;SMOTE oversampling;high-speed network intrusion detection system;load balancing;protocol;random forest algorithm;unbalanced data","","1","","8","","","25-26 April 2009","","IEEE","IEEE Conference Publications"
"MUTON: Detecting Malicious Nodes in Disruption-Tolerant Networks","Yanzhi Ren; Mooi Choo Chuah; Jie Yang; Yingying Chen","Dept. of ECE, Stevens Inst. of Technol., Hoboken, NJ, USA","Wireless Communications and Networking Conference (WCNC), 2010 IEEE","20100708","2010","","","1","6","The Disruption Tolerant Networks (DTNs) are vulnerable to insider attacks, in which the legitimate nodes are compromised and the adversary modifies the delivery metrics of the node to launch harmful attacks in the networks. The traditional detection approaches of secure routing protocols can not address such kind of insider attacks in DTNs. In this paper, we propose a mutual correlation detection scheme (MUTON) for addressing these insider attacks. MUTON takes into consideration of the transitive property when calculating the packet delivery probability of each node and correlates the information collected from other nodes. We evaluated our approach through extensive simulations using both Random Way Point and Zebranet mobility models. Our results show that MUTON can detect insider attacks efficiently with high detection rate and low false positive rate.","1525-3511","978-1-4244-6396-1","","10.1109/WCNC.2010.5506574","http://ieeexplore.ieee.org.ezproxy.rit.edu/stamp/stamp.jsp?arnumber=5506574","","Ad hoc networks;Base stations;Chaotic communication;Communications Society;Disruption tolerant networking;History;Mission critical systems;Peer to peer computing;Probability;Routing protocols","ad hoc networks;routing protocols;telecommunication security","MUTON;Zebranet mobility models;ad hoc networks;disruption-tolerant networks;malicious node detection;mutual correlation detection scheme;packet delivery probability;random way point model;routing protocols","","7","","10","","","18-21 April 2010","","IEEE","IEEE Conference Publications"
"Decoupling policy from configuration in campus and enterprise networks","Feamster, N.; Nayak, A.; Hyojoon Kim; Clark, R.; Mundada, Y.; Ramachandran, A.; bin Tariq, M.","Sch. of Comput. Sci., Georgia Tech, Atlanta, GA, USA","Local and Metropolitan Area Networks (LANMAN), 2010 17th IEEE Workshop on","20100708","2010","","","1","6","This paper surveys our ongoing work on the use of software-defined networking to simplify two acute policy problems in campus and enterprise network operations: access control and information flow control. We describe how the current coupling of high-level policy with low-level configuration makes these problems challenging today. We describe the specific policy problems faced by campus and enterprise network operators; illustrate our approach, which leverages recent trends in separating the network's “control plane” from the data plane; and show how this approach can be applied to simplify these two enterprise network management tasks. We also describe our ongoing deployment efforts to build a campus network testbed where trial designs can be deployed and evaluated. We close with a summary of current and future research challenges for solving challenges within enterprise networks within the context of this new paradigm.","1944-0367","978-1-4244-6067-0","","10.1109/LANMAN.2010.5507162","http://ieeexplore.ieee.org.ezproxy.rit.edu/stamp/stamp.jsp?arnumber=5507162","","Cloud computing;Computer architecture;Cost function;IP networks;Jacobian matrices;Local area networks;Logic;Resource management;Web and internet services;Wide area networks","business communication;software radio;telecommunication network management;telecommunication security","access control;campus network;decoupling policy;enterprise network management tasks;enterprise network operator;information flow control;software defined network","","2","","17","","","5-7 May 2010","","IEEE","IEEE Conference Publications"
"Using Patch Management Tools to Enhance the Signature Customization for IDS Based on Vulnerability Scanner","Badawy, M.A.; El-Fishawy, N.A.; Elshakankiry, O.","","Information Technology: New Generations (ITNG), 2014 11th International Conference on","20140602","2014","","","529","533","Signature customization is a technique to help the misuse network based IDS to select an appropriate signature for the protected hosts. Additionally, it eliminates unnecessary signature matching in order to enhance the detection capabilities for the NIDS. This paper assesses the effectiveness of depending only on vulnerability scanners to perform signature customization. In addition, it introduces the integration of vulnerability scanners with patch management tools to limit the number of false positive and false negative customizations. The results show that adding the patch management tools to the integration between the NIDS and vulnerability scanners can reduce the false signature customization. The proposed system will insure tuning accuracy for average of 30% of all shielded rules in the original signature customization system, accordingly improving the overall detection efficiency for the IDS.","","978-1-4799-3187-3","","10.1109/ITNG.2014.78","http://ieeexplore.ieee.org.ezproxy.rit.edu/stamp/stamp.jsp?arnumber=6822251","NIDS;Snort;Vulnerability assessment;WSUS;risk assessment","Accuracy;Computer architecture;Computers;Intrusion detection;NIST;Software","computer network security;digital signatures","NIDS;false negative customizations;false positive customizations;intrusion detection system;network based IDS;patch management tools;signature customization system;signature matching;vulnerability scanners","","0","","12","","","7-9 April 2014","","IEEE","IEEE Conference Publications"
"Pre-decoded CAMs for efficient and high-speed NIDS pattern matching","Sourdis, I.; Pnevmatikatos, D.","Dept. of Electron. & Comput. Eng., Crete Tech. Univ., Chania, Greece","Field-Programmable Custom Computing Machines, 2004. FCCM 2004. 12th Annual IEEE Symposium on","20041213","2004","","","258","267","In this paper we advocate the use of pre-decoding for CAM-based pattern matching. We implement an FPGA based sub-system for NIDS (Snort) pattern matching using a combination of techniques. First, we reduce the area cost of character matching using (i) character pre-decoding before they are compared in the CAM line, and (ii) efficient shift register implementation using the SRL16 Xilinx cell. Then we achieve high operating frequencies by (iii) using ne grain pipelining for faster circuits and (iv) decoupling the data distribution network from the processing components. Our results show that for matching more than 18,000 characters (the entire SNORT rule set) our implementation requires an area cost of less than 1.1 logic cells per matched character, achieving an operating frequency of about 375 MHz (3 Gbps) on a Virtex2 device. When using quad parallelism to increase the matching throughput, the area cost of a single matched character is reduced to less than one logic cell for a throughput of almost 10 Gbps.","","0-7695-2230-0","","10.1109/FCCM.2004.46","http://ieeexplore.ieee.org.ezproxy.rit.edu/stamp/stamp.jsp?arnumber=1364636","","CADCAM;Cams;Computer aided manufacturing;Costs;Field programmable gate arrays;Frequency;Intrusion detection;Logic devices;Pattern matching;Throughput","content-addressable storage;decoding;field programmable gate arrays;memory architecture;security of data;shift registers;string matching","CAM based pattern matching;FPGA based subsystem;SRL16 Xilinx cell;Snort rule set;Virtex2 device;character matching;character predecoding;data distribution network;faster circuits;grain pipelining;network intrusion detection system;predecoded CAM;processing components;shift register","","84","2","16","","","20-23 April 2004","","IEEE","IEEE Conference Publications"
"Modeling network attacks for scenario construction","Al-Mamory, S.O.; Hongli Zhang; Abbas, A.R.","Harbin Inst. of Technol., Harbin","Neural Networks, 2008. IJCNN 2008. (IEEE World Congress on Computational Intelligence). IEEE International Joint Conference on","20080926","2008","","","1495","1502","The Intrusion detection system (IDS) is a security technology that attempts to identify network intrusions. Defending against multistep intrusions which prepare for each other is a challenging task. In this paper, the Context-Free Grammar (CFG) was used to describe the multistep attacks using alerts classes. Based on the CFGs, the modified LR parser was employed to generate the parse trees of the scenarios presented in the alerts. Instead of searching all the received alerts for those that prepare for a new alert, we only search for the latest alertpsilas type of each scenario. Consequently, the proposed system has an attractive time complexity. The experiments were performed on two different sets of network traffic traces, using different open-source and commercial IDSs. The detected scenarios are represented by Correlation Graphs (CGs). The experimental results show that the CFG can describe multistep attacks explicitly and the modified LR parser, based on the CFG, can construct scenarios successfully.","1098-7576","978-1-4244-1820-6","978-1-4244-1821-3","10.1109/IJCNN.2008.4633994","http://ieeexplore.ieee.org.ezproxy.rit.edu/stamp/stamp.jsp?arnumber=4633994","","Neural networks","computational complexity;context-free grammars;security of data;tree searching","alert class;context-free grammar;correlation graph;intrusion detection system;modified LR parser;network attack modeling;scenario construction;security technology;time complexity;tree searching","","0","","25","","","1-8 June 2008","","IEEE","IEEE Conference Publications"
"Table of contents","","","Electro/Information Technology, 2007 IEEE International Conference on","20071105","2007","","","iii","x","Presents the table of contents of the proceedings.","","978-1-4244-0940-2","","10.1109/EIT.2007.4374552","http://ieeexplore.ieee.org.ezproxy.rit.edu/stamp/stamp.jsp?arnumber=4374552","","","","","","0","","","","","17-20 May 2007","","IEEE","IEEE Conference Publications"
