"Octopus-IIDS: An anomaly based intelligent intrusion detection system","Mafra, P.M.; Moll, V.; da Silva Fraga, J.; Santin, A.O.","Autom. & Syst. Dept. (DAS), Fed. Univ. of Santa Catarina (UFSC), Florianopolis, Brazil","Computers and Communications (ISCC), 2010 IEEE Symposium on","20100812","2010","","","405","410","The intrusion detection systems (IDS) are designed to identify unwanted attempts at manipulating, accessing or disabling of computer systems, mainly through a network, such as the Internet. Additionally, the IDSs can perform other functions like intrusion prevention (IPS), including proactive functions. A recurrent problem in intrusion detection systems is the difficulty to distinguish legitimate access from attacks. A lot of conventional IDSs are signature based, although they do not identify variations of these attacks nor new attacks. This paper presents an intrusion detection system model based on the behavior of network traffic through the analysis and classification of messages. Two artificial intelligence techniques named Kohonen neural network (KNN) and support vector machine (SVM) are applied to detect anomalies. These techniques are used in sequence to improve the system accuracy, identifying known attacks and new attacks, in real time. The paper also makes an analysis of the features used to classify data in order to define which of them are really relevant for each class of attack defined in our experiments.","1530-1346","978-1-4244-7754-8","","10.1109/ISCC.2010.5546735","http://ieeexplore.ieee.org.ezproxy.rit.edu/stamp/stamp.jsp?arnumber=5546735","Artifitial Neural Network;Internet Security;Intrusion Detection System;Support Vector Machine","Artificial neural networks;Detectors;Intrusion detection;Neurons;Probes;Support vector machines;Training","","","","8","","21","","","22-25 June 2010","","IEEE","IEEE Conference Publications"
"A survey on threats in routing security in manet for trust management using SMC protocols","Joshi, S.; Mishra, D.K.","Sri Aurobindo Inst. of Technol., Indore, India","Wireless and Optical Communications Networks (WOCN), 2012 Ninth International Conference on","20121022","2012","","","1","6","The Mobile ad hoc networks served as explanatory facts on various issues and challenges to learn threats in security of wireless data. This data is actually moves around various components of ad hoc network to perform various operations. The confliction comes when a data is associated with multiple components and reflects the different outputs inside the network. Then it vanish many legitimate operations and creates nuisance or misconduct with participating nodes. Trust overlay can describe respective policies to opt a node to communicate data inside a network. The applications of SMC protocols showed a great impact and useful derivations to compute the secure result at various levels. Further, the various frontiers of infrastructure less networks are in keen interest to serve better with minimal delay in transmission of packets. That means the probability of occurrences of packet drops can also be address with respect to various attacks and countermeasures. This work emphasizes on inside view in an ad hoc network to find and eliminate various security threats to rectify nuisance created by multi association of freely moving data.","2151-7681","978-1-4673-1988-1","","10.1109/WOCN.2012.6335557","http://ieeexplore.ieee.org.ezproxy.rit.edu/stamp/stamp.jsp?arnumber=6335557","Ad hoc networks;security;smc protocols;trust management","Mobile ad hoc networks;Peer to peer computing;Routing;Routing protocols;Security","mobile ad hoc networks;mobility management (mobile radio);probability;routing protocols;telecommunication security","MANET;SMC protocols;mobile ad hoc networks;packet drop occurrence probability;packet transmission;routing security;security threat elimination;trust management;trust overlay;wireless data security","","0","","11","","","20-22 Sept. 2012","","IEEE","IEEE Conference Publications"
"A Multipath Reliable Routing for detection and isolation of malicious nodes in MANET","Somasundaram, D.; Marimuthu, R.","Dept. of MCA, Dr. Mahalingam Coll. of Eng. & Technol., Pollachi","Computing, Communication and Networking, 2008. ICCCn 2008. International Conference on","20090224","2008","","","1","8","For the protection of both routing and data forwarding operations, a network layer security solution has been provided as a solution for various security attacks in ad hoc networks. In this paper, to develop a security framework has been proposed. This security framework involves: detection of malicious nodes by the destination node, isolation of malicious nodes by discarding the path and prevention data packets by using dispersion techniques. We propose to develop a multipath reliable routing (MRR) algorithm, which determines a set of node-disjoint reliable paths. The paths are arranged in the descending order of their reliability index. Data packets are dispersed and transmitted simultaneously through the reliable disjoint paths. The primary reliable path sends the information packet containing the transmission information. At the destination, if there is mismatch between the transmission information and the data packets received, a negative feedback is sent back to the source that includes the particulars of the affected paths. The affected paths are then removed from the list of node-disjoint paths by the source. The destination can recover the data effectively by attaining reliability, since the data packets are dispersed along multiple paths using an efficient dispersion algorithm. Our simulation result shows that, when compared with existing scheme, our framework reduces overhead and delay, at the same time increasing the packet delivery ratio.","","978-1-4244-3594-4","978-1-4244-3595-1","10.1109/ICCCNET.2008.4787688","http://ieeexplore.ieee.org.ezproxy.rit.edu/stamp/stamp.jsp?arnumber=4787688","Detection;Dispersion;Malicious;Multipath;Reliable","Ad hoc networks;Data security;Dispersion;Intrusion detection;Isolation technology;Mobile ad hoc networks;Protection;Routing;Spread spectrum communication;Wireless networks","ad hoc networks;mobile radio;telecommunication network reliability;telecommunication network routing;telecommunication security","MANET;data forwarding operations;dispersion techniques;efficient dispersion algorithm;malicious node detection;malicious node isolation;mobile ad hoc networks;multipath reliable routing algorithm;negative feedback;network layer security solution;node-disjoint reliable paths;packet delivery ratio;reliability index;security attacks","","3","","17","","","18-20 Dec. 2008","","IEEE","IEEE Conference Publications"
"Multi-agent cooperative intrusion response in mobile adhoc networks","Ping, Yi; Futai, Zou; Xinghao, Jiang; Jianhua, Li","School of Information Security Engineering, Shanghai Jiao tong Univ., Shanghai 200030, P. R. China; State Key Lab. of Information Security, Graduate School of Chinese Academy of Sciences, Beijing 100049, P. R. China","Systems Engineering and Electronics, Journal of","20120117","2007","18","4","785","794","The nature of adhoc networks makes them vulnerable to security attacks. Many security technologies such as intrusion prevention and intrusion detection are passive in response to intrusions in that their countermeasures are only to protect the networks, and there is no automated network-wide counteraction against detected intrusions. the architecture of cooperation intrusion response based multi-agent is propose. The architecture is composed of mobile agents. Monitor agent resides on every node and monitors its neighbor nodes. Decision agent collects information from monitor nodes and detects an intrusion by security policies. When an intruder is found in the architecture, the block agents will get to the neighbor nodes of the intruder and form the mobile firewall to isolate the intruder. In the end, we evaluate it by simulation.","","","","10.1016/S1004-4132(08)60021-3","http://ieeexplore.ieee.org.ezproxy.rit.edu/stamp/stamp.jsp?arnumber=6071687","computer networks;intrusion detection;intrusion response;mo bile agent;mobile adhoc networks;security","Computer architecture;Fires;Intrusion detection;Mobile communication;Mobile computing;Monitoring","","","","0","","","","","Dec. 2007","","BIAI","BIAI Journals & Magazines"
"Using a Fuzzy Inference System to Reduce False Positives in Intrusion Detection","Spathoulas, G.P.; Katsikas, S.K.","Dept. of Technol. Educ. & Digital Syst., Univ. of Piraeus, Piraeus, Greece","Systems, Signals and Image Processing, 2009. IWSSIP 2009. 16th International Conference on","20091228","2009","","","1","4","Even if intrusion detection systems have marginally improved in the past few years, they still face the problem of high false positives rate. In this paper we propose the use of a fuzzy inference system, which filters out false positives, without missing on any of the detected attacks. The design of the system is based on meta-alerts, which carry special information about the nature of alerts. The system has been tested against the DARPA dataset and has exhibited a significant reduction (83%) of false positives.","","978-1-4244-4530-1","978-1-4244-4530-1","10.1109/IWSSIP.2009.5367701","http://ieeexplore.ieee.org.ezproxy.rit.edu/stamp/stamp.jsp?arnumber=5367701","","Digital systems;Educational technology;Face detection;Filtering;Filters;Fuzzy logic;Fuzzy systems;Intrusion detection;Neural networks;System testing","fuzzy reasoning;security of data","false positive;fuzzy inference system;intrusion detection;meta-alert","","0","","17","","","18-20 June 2009","","IEEE","IEEE Conference Publications"
"Design and implementation of open framework for Policy-Based Network Access Control","Chitpinityon, S.; Sanguanpong, S.; Koht-arsa, K.; Chuchuay, J.","Office of Comput. Services, Kasetsart Univ., Bangkok, Thailand","Security Technology, 2009. 43rd Annual 2009 International Carnahan Conference on","20091113","2009","","","68","71","Currently, the number of users accessing to the network is significantly increasing which requires a tightly control based on the organization policy. Network access control (NAC) is an essential tool focuses on checking and granting permission. In general, NAC requires specific network devices which may not work with the existing devices. In this paper, a Policy-Based Network Access Control framework has been proposed. The framework defines a set of communication between distinctive devices, regardless of brands, in the system. Moreover, the proposed NAC offers more control to the existing generic network equipments.","","978-1-4244-4169-3","978-1-4244-4170-9","10.1109/CCST.2009.5335564","http://ieeexplore.ieee.org.ezproxy.rit.edu/stamp/stamp.jsp?arnumber=5335564","Network Access Control;Policy;Security;component","Access control;Access protocols;Communication system security;Computer networks;Detectors;Event detection;Intrusion detection;Permission;Phase change materials;Switches","authorisation","network equipment;open framework;organization policy;policy-based network access control","","1","","6","","","5-8 Oct. 2009","","IEEE","IEEE Conference Publications"
"A Survey of Connection-Chains Detection Techniques","Almulhem, A.; Traore, I.","Univ. of Victoria, Victoria","Communications, Computers and Signal Processing, 2007. PacRim 2007. IEEE Pacific Rim Conference on","20070924","2007","","","219","222","A connection-chain is a set of connections created by sequentially logging into a series of hosts, known as stepping-stones. It provides an effective scheme for attackers to manually interact with a victim machine without disclosing their true origin. The victim will only identify the last host in the chain, while the true origin is hidden behind a series of stepping-stones. Addressing connection-chains poses challenges for researchers in the field of computer security. Accordingly, several approaches have been proposed in the literature. In this paper, we review those approaches and classify them according to a proposed taxonomy.","","978-1-4244-1189-4","1-4244-1190-4","10.1109/PACRIM.2007.4313215","http://ieeexplore.ieee.org.ezproxy.rit.edu/stamp/stamp.jsp?arnumber=4313215","","Computer crime;Computer hacking;Computer security;Cryptography;Fluid flow measurement;Frequency measurement;Payloads;Performance evaluation;Taxonomy;Timing","Internet;security of data","computer security;connection-chains detection techniques;sequentially logging;stepping-stones;taxonomy","","0","","21","","","22-24 Aug. 2007","","IEEE","IEEE Conference Publications"
"A Slow Intelligent Approach for the Improvement of Intrusion Detection and Prevention System","Colace, F.; De Santo, M.; Ferrandino, S.","DIEII, Univ. degli Studi di Salerno, Fisciano, Italy","Innovative Mobile and Internet Services in Ubiquitous Computing (IMIS), 2012 Sixth International Conference on","20120910","2012","","","130","137","Computer network security is a fashionable and fast-moving field. In the last decade many methodologies and tools have been developed for improving the security of networks and their hosts, but the resources used to deal with the problem often do not yield results commensurate with costs. In the last period the adoption of Network Intrusion Prevention Systems promises to represent an effective line of defense against a variety of attacks that could compromise the security and proper functioning of an enterprise information system. This paper introduces a Network Intrusion Prevention System based on Ontological and Slow Intelligence approach. By the use of Ontology the proposed Network Intrusion Prevention System will analyze the input semantically while will improve over the time sharing knowledge among other similar systems or experts according to the Slow Intelligence approach. A first prototype of the environment has been developed and first experimental results have been showed.","","978-1-4673-1328-5","","10.1109/IMIS.2012.128","http://ieeexplore.ieee.org.ezproxy.rit.edu/stamp/stamp.jsp?arnumber=6296844","Intrusion Detection System;Network Security;Ontology;Slow Intelligence Approach","Correlation;Knowledge based systems;Ontologies;Security;Semantics;Servers","computer network security;information systems;ontologies (artificial intelligence)","computer network security;enterprise information system;intrusion detection system improvement;network intrusion prevention system improvement;ontological approach;slow intelligent approach;time sharing knowledge improvement","","1","","","","","4-6 July 2012","","IEEE","IEEE Conference Publications"
"Immune feedback control computing in a class of intelligent information immunity system","Yajing Zhang; Diantong Liu; Diantong Liu","Inst. of Comput. Sci. & Technol., Yantai Univ., Yantai, China","Natural Computation (ICNC), 2010 Sixth International Conference on","20100923","2010","6","","2871","2875","Based on biological immune and response mechanism, method of immune feedback control for a class of intelligent information immune system is suggested. The mathematic model are discussed. The experiment that is in a class of intrusion detection system is made. Shown by results, the method of immune feedback control provides a dynamitic detecting way and keeps stability and self-adaptivity. It is verified to be feasible.","","978-1-4244-5958-2","","10.1109/ICNC.2010.5584522","http://ieeexplore.ieee.org.ezproxy.rit.edu/stamp/stamp.jsp?arnumber=5584522","component;immune feedback;immune response;information immune;intelligent system","Cloning;Computers;Feedback control;Immune system;Pathogens;Vaccines","artificial immune systems;feedback;fuzzy set theory;information systems;security of data","immune feedback control;intelligent information immunity system;intrusion detection system","","0","","5","","","10-12 Aug. 2010","","IEEE","IEEE Conference Publications"
"Alert Fusion Based on Cluster and Correlation Analysis","Shisong Xiao; Yugang Zhang; Xuejiao Liu; Jingju Gao","Dept. of Comput. Sci., Huazhong Normal Univ., Wuhan","Convergence and Hybrid Information Technology, 2008. ICHIT '08. International Conference on","20080909","2008","","","163","168","For the purpose of reducing redundant alerts and false alerts as well as recognizing complicated attack scenarios, a multilevel model of alert fusion is presented. This model fuses alerts layer upon layer through primary alert reduction, alert verification, alert clustering and alert correlation. In order to construct accurate and complete attack sensors, in the phase of alert clustering, this paper proposes alert correlation method based on the similarity between alert attributes as well as based on prerequisites and consequences of attacks. The experimental results show that the model is effective and efficient in fusing large numbers of alerts.","","978-0-7695-3328-5","","10.1109/ICHIT.2008.197","http://ieeexplore.ieee.org.ezproxy.rit.edu/stamp/stamp.jsp?arnumber=4622819","Alert Fusion;cluster;correlation;network security","Computer crime;Computer science;Correlation;Entropy;Fuses;Information analysis;Information technology;Intrusion detection;Proposals;Sensor phenomena and characterization","correlation methods;fuzzy set theory;pattern clustering;security of data;sensor fusion","alert clustering;alert correlation;alert fusion;alert reduction;alert verification;data security;fuzzy clustering","","4","","19","","","28-30 Aug. 2008","","IEEE","IEEE Conference Publications"
"Identifying context of text documents using NaÃ¯ve Bayes classification and Apriori association rule mining","Kulkarni, A.R.; Tokekar, V.; Kulkarni, P.","Cummins Coll. of Eng. for Women, Pune, India","Software Engineering (CONSEG), 2012 CSI Sixth International Conference on","20121110","2012","","","1","4","Huge amount of unstructured data is available in the form of text documents. Ranking these text documents by considering their context will be very useful in information retrieval. We propose classification of abstracts by considering their context using NaiÌˆve Bayes classifier and Apriori association rule algorithm - i.e. Context Based Naive Bayesian and Apriori (CBNBA). In proposed approach, we initially classify the documents using NaiÌˆve Bayes. We find the context of an abstract by looking for associated terms which help us understand the focus of the abstract and interpret the information beyond simple keywords. The results indicate that context based classification increases accuracy of classification to great extent and in turn discovers different contexts of the documents. Further this approach can found to be very useful for applications beyond abstract classification where word speaks very little and lead to ambiguous state but context can lead you to right decision/classification.","","978-1-4673-2174-7","","10.1109/CONSEG.2012.6349477","http://ieeexplore.ieee.org.ezproxy.rit.edu/stamp/stamp.jsp?arnumber=6349477","","Abstracts;Association rules;Classification algorithms;Computer networks;Context;Operating systems;Training","Bayes methods;abstracting;data mining;information retrieval;pattern classification;text analysis","Apriori association rule mining;CBNBA;NaiÌˆve Bayes classification;abstract classification;context based Naive Bayesian and Apriori;context based classification;context identification;information retrieval;text document ranking;unstructured data","","1","","14","","","5-7 Sept. 2012","","IEEE","IEEE Conference Publications"
"On the completeness of attack mutation algorithms","Rubin, S.; Jha, S.; Miller, B.P.","Dept. of Comput. Sci., Wisconsin Univ., Madison, WI","Computer Security Foundations Workshop, 2006. 19th IEEE","20060731","2006","","","14 pp.","56","An attack mutation algorithm takes a known instance of an attack and transforms it into many distinct instances by repeatedly applying attack transformations. Such algorithms are widely used for testing intrusion detection systems. We investigate the notion of completeness of a mutation algorithm: its capability to generate all possible attack instances from a given set of attack transformations. We define the notion of a Phi-complete mutation algorithm. Given a set of transformations Phi, an algorithm is complete with respect to Phi, if it can generate every instance that the transformations in Phi derive. We show that if the rules in Phi are uniform and reversible then a Phi-complete algorithm exists. Intuitively speaking, uniform and reversible transformations mean that we can first exclusively apply transformations that simplify the attack, then exclusively apply transformations that complicate it, and still get all possible instances that are derived by the rules in Phi. Although uniformity and reversibility may appear severe restrictions, we show that common attack transformations are indeed uniform and reversible. Therefore, our Phi-complete algorithm can be incorporated into existing testing tools for intrusion detection systems. Furthermore, we show that a Phi-complete algorithm is useful, not only for testing purposes, but also for determining whether two packet traces are two different mutations of the same attack","1063-6900","0-7695-2615-2","","10.1109/CSFW.2006.21","http://ieeexplore.ieee.org.ezproxy.rit.edu/stamp/stamp.jsp?arnumber=1648707","","Computer security;Conferences;Encoding;Feeds;Genetic mutations;Intrusion detection;Pattern matching;System testing;TCPIP;Uniform resource locators","security of data","Phi-complete mutation algorithm;attack mutation algorithms;attack transformations;intrusion detection systems;reversible transformations;transformations Phi;uniform transformations","","0","13","29","","","0-0 0","","IEEE","IEEE Conference Publications"
"Detecting packet modification attack by misbehaving router","Patil, R.; Tahiliani, M.P.","Nat. Inst. of Technol. Karnataka, Surathkal, India","Networks & Soft Computing (ICNSC), 2014 First International Conference on","20140925","2014","","","113","118","The next generation Internet supports dynamic deployment of different protocols and heterogeneous applications. To support this, routers in next generation computer networks use general purpose programmable packet processors. The customization of routers introduces increased vulnerabilities and attacks that allow potential attackers to compromise the router. Since network routers play a key role in todays network data transport, they became an interesting targets for attackers. An attacker can mount different attacks like denial-of-service or man-in-the-middle by intelligently dropping, modifying or diverting packets arriving at a compromised router. In this paper, we considered the problem of detecting packet modification attack which is performed by an attacker through misbehaving router. Since it is necessary to differentiate malicious packet modification from regular packet modification, detecting such an attack is challenging task. We proposed a controller-based packet modification misbehavior detection technique that excellently detects malicious packet modification by using a hash-based comparison of incoming and outgoing packets of the router. Experiments were carried out using Mininet Simulator and based on the results obtained, we observe that our proposed technique unambiguously detects the malicious packet modification.","","978-1-4799-3485-0","","10.1109/CNSC.2014.6906649","http://ieeexplore.ieee.org.ezproxy.rit.edu/stamp/stamp.jsp?arnumber=6906649","","IP networks;Monitoring;Network topology;Routing protocols;Software;Switches","Internet;computer network security;cryptographic protocols;routing protocols","Internet supports;Mininet simulator;computer networks;controller-based packet modification misbehavior detection technique;denial of service attacks;diverting packets;dropping packets;hash-based comparison;heterogeneous applications;malicious packet modification;man-in-the-middle;misbehaving router;modifying packets;network data transport;network routers;packet modification attack detection;programmable packet processors;protocols applications;regular packet modification","","0","","11","","","19-20 Aug. 2014","","IEEE","IEEE Conference Publications"
