"Research on E-Government System Network Security Based on Immune Agent","Zhang Bo-ping; Zhang Yong","Coll. of Comput. &amp; Technol., Xuchang Univ., Xuchang, China","E-Business and E-Government (ICEE), 2010 International Conference on","20100930","2010","","","703","706","This paper creates a new E-Government security framework based on Immune Agent, and it describes a new deployment policy of E-Government network system based on Immune Agent. On the theoretical basis, this thesis elaborates the detailed design and implementation of a particular E-Government network system. To meet the needs of practical security and provide strong protection, the system is developed by adopting the new model and algorithm. It is already been in use.","","978-0-7695-3997-3","","10.1109/ICEE.2010.183","http://ieeexplore.ieee.org.ezproxy.rit.edu/stamp/stamp.jsp?arnumber=5591674","E-Government;Immune Agent;Network Security;Software Framework","Decision making;Detectors;Electronic government;Immune system;Intrusion detection;Monitoring","government data processing;multi-agent systems;security of data","e-government network system;immune agent;network security","","0","","8","","","7-9 May 2010","","IEEE","IEEE Conference Publications"
"Architecting for the Cloud: A Systematic Review","Breivold, H.P.; Crnkovic, I.; Radosevic, I.; Balatinac, I.","ABB Corp. Res., Vasteras, Sweden","Computational Science and Engineering (CSE), 2014 IEEE 17th International Conference on","20150129","2014","","","312","318","Cloud Computing has emerged as a new paradigm in the field of network-based services within many industrial and application domains. The major benefits that it provides in terms of IT efficiency and business agility represent a huge competitive advantage for an organization. However, building new services in the cloud or designing cloud-based solutions into existing business context in general is a complex decision process involving many factors. In this paper, we undertake a systematic review to obtain an overview of the existing studies in designing cloud-based solutions. In particular, we investigate the main challenges and concerns when building cloud-based architectures and different architectural approaches and design considerations that are proposed in literatures to meet these specific concerns. The search strategy identified 72 studies that were catalogued as primary studies for this review after using multi-step selection process. The main challenges and concerns are classified into four main categories: security and trustworthiness, elasticity, portability and interoperability, and cloud resilience. We have also categorized studies that describe architectural approaches and design considerations when architecting for the cloud. Implications for research and practice are presented as well.","","978-1-4799-7980-6","","10.1109/CSE.2014.85","http://ieeexplore.ieee.org.ezproxy.rit.edu/stamp/stamp.jsp?arnumber=7023596","Cloud Computing;cloud-based architecture;concerns","Architecture;Business;Cloud computing;Computer architecture;Data mining;Elasticity;Security","business data processing;cloud computing;organisational aspects;security of data;trusted computing","IT efficiency;application domains;business agility;business context;cloud computing;cloud resilience;cloud-based architectures;cloud-based solutions;complex decision process;design considerations;industrial domains;multistep selection process;network-based services;organization;security;systematic review;trustworthiness","","0","","16","","","19-21 Dec. 2014","","IEEE","IEEE Conference Publications"
"[Front matter]","","","Advanced Computational Intelligence (ICACI), 2012 IEEE Fifth International Conference on","20130218","2012","","","1","18","Conference proceedings front matter may contain various advertisements, welcome messages, committee or program information, and other miscellaneous conference information. This may in some cases also include the cover art, table of contents, copyright statements, title-page or half title-pages, blank pages, venue maps or other general information relating to the conference that was part of the original conference proceedings.","","978-1-4673-1743-6","","10.1109/ICACI.2012.6463371","http://ieeexplore.ieee.org.ezproxy.rit.edu/stamp/stamp.jsp?arnumber=6463371","","","","","","0","","","","","18-20 Oct. 2012","","IEEE","IEEE Conference Publications"
"2012 International Conference on Devices, Circuits and Systems (ICDCS)","","","Devices, Circuits and Systems (ICDCS), 2012 International Conference on","20120423","2012","","","1","748","Provides the entire conference content.","","978-1-4577-1545-7","","10.1109/ICDCSyst.2012.6188784","http://ieeexplore.ieee.org.ezproxy.rit.edu/stamp/stamp.jsp?arnumber=6188784","","CMOS integrated circuits;CMOS technology;Field programmable gate arrays;MESFETs;MOSFETs;Optical imaging;Random access memory","","","","0","","","","","15-16 March 2012","","IEEE","IEEE Conference Publications"
"Linux security modules: general security support for the linux kernel","Wright, C.; Cowan, C.; Morris, J.; Smalley, S.; Kroah-Hartman, G.","WireX Communications,Inc.","Foundations of Intrusion Tolerant Systems, 2003 [Organically Assured and Survivable Information Systems]","20040219","2003","","","213","226","<div style=""font-variant: small-caps; font-size: .9em;"">First Page of the Article</div><img class=""img-abs-container"" style=""width: 95%; border: 1px solid #808080;"" src=""/xploreAssets/images/absImages/01264934.png"" border=""0"">","","0-7695-2057-X","","10.1109/FITS.2003.1264934","http://ieeexplore.ieee.org.ezproxy.rit.edu/stamp/stamp.jsp?arnumber=1264934","","Access control;Communication system security;Control systems;Kernel;Linux;Operating systems;Permission;Protection","","","","60","","46","","","2003","","IEEE","IEEE Conference Publications"
"Table of contents - Volume 4","","","Natural Computation, 2009. ICNC '09. Fifth International Conference on","20091228","2009","4","","v","xiv","Presents the table of contents of the proceedings.","","978-0-7695-3736-8","","10.1109/ICNC.2009.777","http://ieeexplore.ieee.org.ezproxy.rit.edu/stamp/stamp.jsp?arnumber=5362654","","","","","","0","","","","","14-16 Aug. 2009","","IEEE","IEEE Conference Publications"
"Cyber Security and Privacy Issues in Smart Grids","Liu, Jing; Xiao, Yang; Li, Shuhui; Liang, Wei; Chen, C. L. Philip","Department of Computer Science, The University of Alabama, Tuscaloosa, AL 35487 USA","Communications Surveys & Tutorials, IEEE","20121026","2012","14","4","981","997","Smart grid is a promising power delivery infrastructure integrated with communication and information technologies. Its bi-directional communication and electricity flow enable both utilities and customers to monitor, predict, and manage energy usage. It also advances energy and environmental sustainability through the integration of vast distributed energy resources. Deploying such a green electric system has enormous and far-reaching economic and social benefits. Nevertheless, increased interconnection and integration also introduce cyber-vulnerabilities into the grid. Failure to address these problems will hinder the modernization of the existing power system. In order to build a reliable smart grid, an overview of relevant cyber security and privacy issues is presented. Based on current literatures, several potential research fields are discussed at the end of this paper.","1553-877X","","","10.1109/SURV.2011.122111.00145","http://ieeexplore.ieee.org.ezproxy.rit.edu/stamp/stamp.jsp?arnumber=6129371","AMI;SCADA;accountability;privacy;security;smart grid","Computer security;IEC standards;Privacy;Protocols;Smart grids","","","","39","","116","","2012-01-11","Fourth Quarter 2012","","IEEE","IEEE Journals & Magazines"
"Coping with Node Misbehaviors in Ad Hoc Networks: A Multi-dimensional Trust Management Approach","Wenjia Li; Joshi, A.; Finin, T.","Dept. of Comput. Sci. & Electr. Eng., Univ. of Maryland, Baltimore County, Baltimore, MD, USA","Mobile Data Management (MDM), 2010 Eleventh International Conference on","20100621","2010","","","85","94","Nodes in Mobile Ad hoc Networks (MANETs) are required to relay data packets to enable communication between other nodes that are not in radio range with each other. However, whether for selfish or malicious reasons, a node may fail to cooperate during the network operations or even attempt to disturb them, both of which have been recognized as misbehaviors. Various trust management schemes have been studied to assess the behaviors of nodes so as to detect and mitigate node misbehaviors inMANETs. Most of existing schemes model a node's trustworthiness along a single dimension, combining all of the available evidence to calculate a single, scalar trust metric. A single measure, however, may not be expressive enough to adequately describe a node's trustworthiness in many scenarios. In this paper, we describe a multi-dimensional framework to evaluate the trustworthiness of MANET node from multiple perspectives. Our scheme evaluates trustworthiness from three perspectives: collaboration trust, behavioral trust, and reference trust. Different types of observations are used to independently derive values for these three trust dimensions. We present simulation results that illustrate the effectiveness of the proposed scheme in several scenarios.","","978-1-4244-7075-4","","10.1109/MDM.2010.57","http://ieeexplore.ieee.org.ezproxy.rit.edu/stamp/stamp.jsp?arnumber=5489228","Misbehavior;Mobile Ad hoc Network;Multi-dimensional trust;Security","Ad hoc networks;Batteries;Computer network management;Computer science;Conference management;Engineering management;Mobile ad hoc networks;Mobile computing;Radio spectrum management;Relays","","","","8","","26","","","23-26 May 2010","","IEEE","IEEE Conference Publications"
"Architectures for intrusion tolerant database systems","Peng Liu","Pennsylvania State University","Foundations of Intrusion Tolerant Systems, 2003 [Organically Assured and Survivable Information Systems]","20040219","2003","","","3","13","<div style=""font-variant: small-caps; font-size: .9em;"">First Page of the Article</div><img class=""img-abs-container"" style=""width: 95%; border: 1px solid #808080;"" src=""/xploreAssets/images/absImages/01264924.png"" border=""0"">","","0-7695-2057-X","","10.1109/FITS.2003.1264924","http://ieeexplore.ieee.org.ezproxy.rit.edu/stamp/stamp.jsp?arnumber=1264924","","Computer architecture;Computer networks;Computer vision;Database systems;Face detection;Hardware;Pervasive computing;Protection;Security;Transaction databases","","","","1","","47","","","2003","","IEEE","IEEE Conference Publications"
"Social network anomaly and attack patterns analysis","Limsaiprom, P.; Tantatsanawong, P.","Dept. of Comput., Silpakorn Univ., Nakorn Pathom, Thailand","Networked Computing (INC), 2010 6th International Conference on","20100614","2010","","","1","6","The anomaly and attack patterns using data mining have attracted in recent years. The social network anomaly and attack patterns analysis is focused in this research. The data mining system is developed with a cluster algorithm by distance measure and K-Means clustering method to analyze a large amount of IDS log data of social network to discover unknown social network anomaly and attack patterns. The analysis is computed the model and evaluate with test set shows four attackers' patterns (i) attackers from social network group 2 attempt to execute an arbitrary program on infected systems, (ii) an anomaly pattern came from social network group 1, 5, 6, and 7, (iii) remote attacker from social network group 1 can gain control of vulnerable systems, and (iv) Denial of Service came from social network group 3 and 4. The data mining tools reveal useful insights which are the anomaly and attack patterns. They are applied as a guide to further investigation of social network behaviors.","","978-1-4244-6986-4","978-89-88678-20-6","","http://ieeexplore.ieee.org.ezproxy.rit.edu/stamp/stamp.jsp?arnumber=5484847","anomaly and attack;clustering;data mining;social network","Algorithm design and analysis;Clustering algorithms;Clustering methods;Computer networks;Data mining;Gain control;Intrusion detection;Pattern analysis;Social network services;System testing","","","","0","","13","","","11-13 May 2010","","IEEE","IEEE Conference Publications"
"Security Event Management System based on Mobile Agent Technology","Wang Jingxin; Wang Zhiying; Daikui","Nat. Univ. of Defense Technol., Changsha","Intelligence and Security Informatics, 2007 IEEE","20070625","2007","","","166","171","Current information security prevention system has some disadvantages, such as the singleness of the data source, the imperfectness of the architecture and the absence of alert information post-processing. To address these, we present a framework for security event management based on mobile agent technology. In the framework, various agents are designed for different functions and roles, and these agents can communicate and collaborate securely. By virtue of the autonomy, mobility, inferential capability and social ability of the mobile agent, the numerous security events which may appear at many locations in the network can be efficiently detected, verified by the sensor agent and the verification agent. Furthermore, the correlation agent can correlate the purified security events globally based on the temporal relation, the causal relation, the spatial relation and statistics relations among them. We select Aglet as the platform and develop a security event management system (SEMS). Finally, through some multi-step attack scenarios, the effectiveness and the advantages of the mobile agent technology used for security event management have been verified.","","","1-4244-1329-X","10.1109/ISI.2007.379550","http://ieeexplore.ieee.org.ezproxy.rit.edu/stamp/stamp.jsp?arnumber=4258691","mobile agent;security event;security event correlation;security event management system (SEMS)","Availability;Collaboration;Data security;Design optimization;Event detection;Information security;Intrusion detection;Mobile agents;Statistics;Technology management","mobile agents;security of data","causal relation;correlation agent;information security prevention system;mobile agent technology;multistep attack scenario;security event management system;sensor agent;spatial relation;statistical relation;temporal relation;verification agent","","0","","5","","","23-24 May 2007","","IEEE","IEEE Conference Publications"
"Intrusion Detection System for network security in synchrophasor systems","Yang, Y.; McLaughlin, K.; Sezer, S.; Littler, T.; Pranggono, B.; Brogan, P.; Wang, H.F.","Queen's Univ. of Belfast, Belfast, UK","Information and Communications Technologies (IETICT 2013), IET International Conference on","20131003","2013","","","246","252","Synchrophasor systems will play a significant role in next generation Smart Grid monitoring, protection and control. However, these systems also introduce a multitude of potential vulnerabilities and cyber threats from malicious attackers or disgruntled employees, which may cause erroneous situational awareness or severe damage. This paper proposes a Synchrophasor Specific Intrusion Detection System (SSIDS) for malicious cyber attacks and unintended misuse. The SSIDS involves a heterogeneous whitelist and behaviour-based approach to detect known and unknown attacks. The paper investigates and simulates reconnaissance, Man-in-the-Middle (MITM) and Denial-of-Service (DoS) attacks against a practical synchrophasor system that is used to validate the effectiveness of the proposed SSIDS detection tool. In contrast to previous research in this area that generally has investigated known attacks, this research actively considers the operational features of the IEEE C37.118 protocol and presents a more comprehensive and general solution to deal with not only known attacks but also unknown attacks.","","","978-1-84919-653-6","10.1049/cp.2013.0059","http://ieeexplore.ieee.org.ezproxy.rit.edu/stamp/stamp.jsp?arnumber=6617502","Intrusion Detection;Network Security;Synchrophasor System","","computer network security;phasor measurement;power engineering computing;protocols;smart power grids","IEEE C37.118 protocol;SSIDS;SSIDS detection tool;behaviour-based approach;denial-of-service attacks;heterogeneous whitelist;malicious cyber attacks;man-in-the-middle attack;network security;smart grid control;smart grid monitoring;smart grid protection;synchrophasor specific intrusion detection system;synchrophasor systems;unintended misuse","","2","","","","","27-29 April 2013","","IET","IET Conference Publications"
"VSCF: A Vote-based Secure Cluster Formation Scheme","Wen Cheng Yang; Yiying Zhang; Kee Bum Kim; Dong Sub Kim; Min Yu Cui; Ming Xue; Myong-Soon Park","Korea Univ., Seoul","Networking, Sensing and Control, 2008. ICNSC 2008. IEEE International Conference on","20080520","2008","","","1174","1178","In some industrial areas, wireless sensor network (WSN) is widely used. Hierarchical cluster-based architecture is a common type which has some extraordinary performance on energy-saving and special applications. However, because of its special character, two-level architecture, the cluster heads (CHs) easily become the targets of enemy. Although traditional secure approaches can provide some network security, they are not sufficient to solve the problems which the enemy nodes, which own the correct keys of networks, initial some inside attacks. Especially, if they successfully become the CHs, the whole network security will be threatened. In this paper, we propose a vote-based cluster formation scheme to choose the nodes, which own both highest credit and enough power, to be the CH candidates for the next round, thus reduce the probability of malicious nodes becoming the CHs and securely form the cluster.","","978-1-4244-1685-1","978-1-4244-1686-8","10.1109/ICNSC.2008.4525394","http://ieeexplore.ieee.org.ezproxy.rit.edu/stamp/stamp.jsp?arnumber=4525394","","Computer architecture;Computer industry;Computer science;Data security;Gas industry;Military computing;Power engineering and energy;Protocols;Routing;Wireless sensor networks","probability;telecommunication security;wireless sensor networks;workstation clusters","CH candidates;VSCF scheme;cluster heads;malicious node probability;network security;two-level architecture;vote-based secure cluster formation scheme;wireless sensor network","","0","","14","","","6-8 April 2008","","IEEE","IEEE Conference Publications"
"A Design and Implement of IPS Based on Snort","Jianrong Xi","Weinan Teachers'' Univ. Center of Eetwork Eng. Technol., Weinan Teachers'' Univ., Weinan, China","Computational Intelligence and Security (CIS), 2011 Seventh International Conference on","20120112","2011","","","771","773","With the development of application based on Internet, network security highlights its place increasing. Firewall and IDS are the equipment often used in Internet, but both of them can not run automatically. If we can reconfigure the firewall using the result of IDS, the security must be enhanced to a high level. In this paper, we designed an intrusion prevent system (IPS) based on Snort and Net filter by researching kernel codes of Snort and Net filter. The policy control module of the system was written in Multi-thread technologies. Meanwhile, the Algorithm of IDS and rule set of firewall was optimized to improve system efficiency. The system can block the attack source by dynamically modify firewall rules according to IDS.","","978-1-4577-2008-6","","10.1109/CIS.2011.175","http://ieeexplore.ieee.org.ezproxy.rit.edu/stamp/stamp.jsp?arnumber=6128231","IPS;firewall;intrusion detection;policy control;security policy","Fires;Intrusion detection;Kernel;Linux;Process control;Protocols","Internet;authorisation;computer networks;telecommunication security","IPS;Internet;Net filter;Snort;attack source;firewall rules;intrusion prevent system;kernel codes;multithread technology;network security;policy control module;rule set;system efficiency","","1","","7","","","3-4 Dec. 2011","","IEEE","IEEE Conference Publications"
"An efficient control flow security analysis approach for binary executables","Wang Chunlei; Zhao Gang; Dai Yiqi","Dept. of Comput. Sci. & Technol., Tsinghua Univ., Beijing, China","Computer Science and Information Technology, 2009. ICCSIT 2009. 2nd IEEE International Conference on","20090911","2009","","","272","276","This paper proposes a control flow based security analysis approach for binary executables. Through deeply investigating the theory of control flow security, we develop the Control Flow Security Model (CFSM) which includes the formal definitions for program semantics and security properties for control flow. CFSM specifies that program execution dynamically follows only certain paths, in accordance with a statically declared security properties specified as Control Flow Constraint Specification (CFCS). We have proposed an efficient control flow security analysis algorithm for verifying that a particular control flow model satisfies the associated security properties. Our work contributes to bridging the gap between abstract specifications of control flow security properties and actual control flow security analysis for binary executables. The effectiveness and the practical usefulness of the approach are exemplified by an illustrative analysis of heap overflow vulnerability.","","978-1-4244-4519-6","978-1-4244-4520-2","10.1109/ICCSIT.2009.5234950","http://ieeexplore.ieee.org.ezproxy.rit.edu/stamp/stamp.jsp?arnumber=5234950","control flow security;formal method;security property;software analysis;software vulnerability","Buffer overflow;Computer science;Computer security;Data analysis;Data security;Data structures;Flow graphs;Optimizing compilers;Safety;Software performance","data flow analysis;data flow graphs;formal specification;program verification;programming language semantics;security of data","binary executable;control flow constraint specification;control flow security analysis approach;dynamic program execution;formal definition;program semantics","","1","","28","","","8-11 Aug. 2009","","IEEE","IEEE Conference Publications"
"Amethyst: automatic alarm assessment for perimeter intrusion detection systems (PIDS)","Sands, L.","Home Office, Police Scientific Development Branch, United Kingdom","Intelligence Distributed Surveillance Systems, IEE Symposium on (Ref. No. 2003/10062)","20040524","2003","","","4/1","4/7","<div style=""font-variant: small-caps; font-size: .9em;"">First Page of the Article</div><img class=""img-abs-container"" style=""width: 95%; border: 1px solid #808080;"" src=""/xploreAssets/images/absImages/01300128.png"" border=""0"">","","","","","http://ieeexplore.ieee.org.ezproxy.rit.edu/stamp/stamp.jsp?arnumber=1300128","","","","","","0","","","","","26 Feb. 2003","","IET","IET Conference Publications"
"On SCADA control system command and response injection and intrusion detection","Wei Gao; Morris, T.; Reaves, B.; Richey, D.","Dept. of Electr. & Comput. Eng., Mississippi State Univ., Starkville, MS, USA","eCrime Researchers Summit (eCrime), 2010","20110210","2010","","","1","9","SCADA systems are widely used in critical infrastructure sectors, including electricity generation and distribution, oil and gas production and distribution, and water treatment and distribution. SCADA process control systems are typically isolated from the internet via firewalls. However, they may still be subject to illicit cyber penetrations and may be subject to cyber threats from disgruntled insiders. We have developed a set of command injection, data injection, and denial of service attacks which leverage the lack of authentication in many common control system communication protocols including MODBUS, DNP3, and EtherNET/IP. We used these exploits to aid in development of a neural network based intrusion detection system which monitors control system physical behavior to detect artifacts of command and response injection attacks. Finally, we present intrusion detection accuracy results for our neural network based IDS which includes input features derived from physical properties of the control system.","2159-1237","978-1-4244-7760-9","","10.1109/ecrime.2010.5706699","http://ieeexplore.ieee.org.ezproxy.rit.edu/stamp/stamp.jsp?arnumber=5706699","SCADA control system;cyber security;intrusion detection","Chemicals;Ethernet networks;IP networks;Monitoring;Protocols;Registers;Security","SCADA systems;authorisation;computer crime;critical infrastructures;neural nets","DNP3;EtherNET/IP;Internet;MODBUS;SCADA control system;control system communication protocol;critical infrastructure sector;cyber threat;data injection;denial of service attack;electricity generation;firewall;intrusion detection;neural network;oil and gas production;water distribution;water treatment","","15","","14","","","18-20 Oct. 2010","","IEEE","IEEE Conference Publications"
