"Orthogonal Expansion of Port-scanning Packets","Kikuchi, H.; Kobori, T.; Terada, M.","Sch. of Inf. & Telecommun. Eng., Tokai Univ., Hiratsuka, Japan","Network-Based Information Systems, 2009. NBIS '09. International Conference on","20091208","2009","","","321","326","Observation of port-scan packets performed over the Internet is involved with so many parameters including time, port numbers, source and destination addresses. There are some common port numbers to which many malicious codes likely use to scan, but a relationship between port numbers and the malicious codes are not clearly identified. In this paper, we propose a new attempt to figure characteristics of port-scans observed from distributed many sensors. Our method allows (1) analysis of sensors with few significant factors extracted from an orthogonal expansion of port-scan packets, rather than taking care of all possible statistics of port numbers, (2) compression of packets data, computed by linear combination of limited number of orthogonal factors, and (3) approximation of number of scanning packets at arbitrarily specified sensor and ports, made from statistical correlation between port numbers. We also evaluate the accuracy of our proposed approximation algorithm based on actually observed packets.","","978-1-4244-4746-6","978-0-7695-3767-2","10.1109/NBiS.2009.82","http://ieeexplore.ieee.org.ezproxy.rit.edu/stamp/stamp.jsp?arnumber=5349884","PCA;port-scan","Approximation algorithms;Data mining;Electronic mail;Information systems;Internet;Principal component analysis;Sensor phenomena and characterization;Statistical analysis;Statistical distributions;Telecommunication traffic","Internet;data compression;distributed sensors;security of data","Internet;approximation algorithm;distributed sensors;orthogonal factors;packet data compression;port-scanning packets","","0","","15","","","19-21 Aug. 2009","","IEEE","IEEE Conference Publications"
"The Study of Instruction Detection Systems Based on the Network Data Environment","Jinsong Pan","Coll. of Comput. Sci., Yangtze Univ., Jingzhou, China","e-Business and Information System Security (EBISS), 2010 2nd International Conference on","20100527","2010","","","1","3","With high speed development of the internet, network security is increasingly outstanding. In the large-scale high-traffic network environment, the traditional technologies for network-based intrusion detection system can not satisfy the needs for real-time processing for the growing network traffic. This paper presented a NetFlow based anomaly intrusion detection system. In addition, guidelines to properly configure and setup network device to minimize the possibilities that network attacks come from inside are also proposed. We propose an inexpensive and easy to implement way to perform the anomaly type intrusion detection based on the NetFlow information exported from the routers or other network probes. Our system can detect several types of network attack from inside or outside and perform counter maneuver accordingly.","","978-1-4244-5893-6","978-1-4244-5895-0","10.1109/EBISS.2010.5473746","http://ieeexplore.ieee.org.ezproxy.rit.edu/stamp/stamp.jsp?arnumber=5473746","","Databases;Flowcharts;Intrusion detection;Packet switching;Payloads;Probes;Protocols;Search engines;Statistical analysis;Switches","Internet;protocols;security of data;telecommunication network routing;telecommunication traffic","Internet;NetFlow based anomaly intrusion detection system;instruction detection systems;network attack;network data environment;network protocol;network security;network traffic","","0","","4","","","22-23 May 2010","","IEEE","IEEE Conference Publications"
"Intrusion detection system using Honey Token based Encrypted Pointers to mitigate cyber threats for critical infrastructure networks","Asif, M.K.; Al-Harthi, Y.S.","Dept. of Electr. Eng., King Saud Univ., Riyadh, Saudi Arabia","Systems, Man and Cybernetics (SMC), 2014 IEEE International Conference on","20141204","2014","","","1266","1270","Recent advancements in cyberspace impose a greater threat to the security of critical infrastructure than ever before. The scale of damage that could be done on these infrastructures by well-planned cyber-attacks is enormous. Most of the research work done for the security of these critical infrastructures focuses on conventional security measures. In this paper, we designed an Intrusion Detection System (IDS) that is based on the novel approach of Honey Token based Encrypted Pointers to prevent critical infrastructure networks from cyber-attacks particularly from zero day cyber threats. These honey tokens inside the frame will serve as a trap for the attacker. All nodes operating within the working domain of critical infrastructure network are divided into four different pools. This division is based according to their computational power and level of vulnerability. These pools are provided with different levels of security measures within the network. IDS use different number of Honey Tokens (HT) per frame for every different pool. Moreover every pool uses different types of encryption schemes (AES-128,192,256) etc. We use critical infrastructure network of 64 nodes for our simulations. We analyzed the performance of IDS in terms of True Positive and False Negative Alarms. Finally we test this IDS through Network Penetration Testing (NPT). This NPT is accomplished by putting the critical infrastructure network of 64 nodes directly under the zero day cyber-attacks and then we analyze the behavior of the IDS under such realistic conditions. The IDS is designed in such a way that it not only detects the intrusions but also recovers the entire zero day attack using reverse engineering approach.","","","","10.1109/SMC.2014.6974088","http://ieeexplore.ieee.org.ezproxy.rit.edu/stamp/stamp.jsp?arnumber=6974088","Critical Infrastructure Networks;Cyber Security;Cyber Space;Cyber Threats;Cyber Warfare;DNP3;Distributed Sensor Networks;Encrypted Pointers;Honey Token;Industrial Communication Protocol;Industrial Networks;Information Infrastructure;Information Security;Intelligence Infrastructure;Intrusion Detection System;SCADA Command and Control System;Zero Day Attacks","Databases;Encryption;Generators;Intrusion detection;Protocols","computer network security;critical infrastructures;cryptography;reverse engineering","IDS;NPT;critical infrastructure networks;cyber-attacks;encryption schemes;false negative alarms;honey token based encrypted pointers;intrusion detection system;network penetration testing;reverse engineering approach;true positive alarms;zero day cyber threats","","0","1","20","","","5-8 Oct. 2014","","IEEE","IEEE Conference Publications"
"On Security Attacks in HealthcareWSNs Implemented on 802.15.4 Beacon Enabled Clusters","Misic, J.; Amini, F.; Khan, M.","","Consumer Communications and Networking Conference, 2007. CCNC 2007. 4th IEEE","20070515","2007","","","741","745","<div style=""font-variant: small-caps; font-size: .9em;"">First Page of the Article</div><img class=""img-abs-container"" style=""width: 95%; border: 1px solid #808080;"" src=""/xploreAssets/images/absImages/04199239.png"" border=""0"">","","1-4244-0667-6","","10.1109/CCNC.2007.151","http://ieeexplore.ieee.org.ezproxy.rit.edu/stamp/stamp.jsp?arnumber=4199239","","Communication system security;Cryptography;Data security;Energy management;Information security;Information systems;Medical information systems;Medical services;Wireless sensor networks;ZigBee","","","","1","","14","","","Jan. 2007","","IEEE","IEEE Conference Publications"
"Enhancing Dependability through Quantum Entanglement In a Real-Time Distributed System","Yao-Hsin Chou; I-Ming Tsai; Sy-Yen Kuo","Department of Electrical Engineering, National Taiwan University, No. 1, Sec. 4, Roosevelt Road, Taipei, Taiwan, 106","Nanotechnology, 2006. IEEE-NANO 2006. Sixth IEEE Conference on","20061030","2006","2","","859","862","Alice and Bob play beach volleyball as teammates. When the opponent starts to serve, they both run toward the ball and show their intentions by shouting ""It's mine"". However, sometimes they collide with each other and sometimes neither of them attempts to receive the ball. In both cases they will blame each other for having made the same decisions. This can be formulated as a dependability problem as follows. Two processors jointly provide a real-time service which can be completed by exactly one processor. Assuming each processor is allowed to announce only one-bit information to decide which one to process the job, inevitably some of the jobs will get lost if only classical resources are used. In this paper, we show if these two processors share quantum entanglement, not only the system dependability can be enhanced; the faulty processor can also be identified.","","1-4244-0077-5","","10.1109/NANO.2006.247795","http://ieeexplore.ieee.org.ezproxy.rit.edu/stamp/stamp.jsp?arnumber=1717245","","Buildings;Complexity theory;Fault diagnosis;Physics;Power system modeling;Power system reliability;Quantum computing;Quantum entanglement;Real time systems;Telephony","","","","1","","12","","","17-20 June 2006","","IEEE","IEEE Conference Publications"
"An evolutionary fuzzy genetic and Naïve Bayesian approach for multivariate data classification","Pal, B.; Aktar, M.; Mahmud, F.; Zuhori, S.T.","Dept. of Comput. Sci. & Eng., Rajshahi Univ. of Eng. & Technol., Rajshahi, Bangladesh","Computer and Information Technology (ICCIT), 2014 17th International Conference on","20150402","2014","","","20","24","Over past few decades, statistical and soft-computing techniques have become an emerging research area for machine learning problems. Fuzzy logic with better generalization capability and rapport with reality is being used in classification problems immensely. In this paper a fuzzy rule based classification system is modeled as a combinatorial optimization problem. Thus the optimization power of Genetic Algorithm has been applied to select a small number of significant fuzzy rules for a compact classification system applied to multivariate dataset classification. The hybrid algorithm is used here to predict cellular localization sites of proteins in yeast. Two different fitness measures were taken to evaluate the rules generated by the algorithm during evolution process. Than the performance of Fuzzy Genetic algorithm with better fitness measure is compared to the performance of Naïve Bayesian approach to accurately detect and classify patterns. The performance analysis includes testing on train as well as test dataset, created from original dataset. It is found that the fuzzy genetic algorithm with the fitness measure based on data mining support-confidence framework performs better compared to other fitness measure but in terms of classification Naïve Bayesian technique is much more reliable.","","","","10.1109/ICCITechn.2014.7073108","http://ieeexplore.ieee.org.ezproxy.rit.edu/stamp/stamp.jsp?arnumber=7073108","Classification;Fuzzy;Genetic Algorithm;Machine learning;Naïve Bayes","Accuracy;Genetic algorithms;Genetics;Niobium;Pragmatics;Sociology;Training","Bayes methods;biology computing;combinatorial mathematics;data mining;fuzzy logic;fuzzy reasoning;fuzzy set theory;generalisation (artificial intelligence);genetic algorithms;learning (artificial intelligence);pattern classification;proteins","Naïve Bayesian approach;cellular localization sites;combinatorial optimization problem;data mining support-confidence framework;evolution process;evolutionary fuzzy genetic algorithm;fuzzy logic;fuzzy rule based classification system;generalization capability;machine learning problems;multivariate dataset classification;pattern classification;pattern detection;performance analysis;proteins;soft-computing techniques;statistical techniques;yeast","","0","","15","","","22-23 Dec. 2014","","IEEE","IEEE Conference Publications"
"ISP-operated protection of home networks with FIDRAN","Hess, A.; Schafer, G.","Telecommun. Networks Group, Technische Univ. Berlin, Germany","Consumer Communications and Networking Conference, 2004. CCNC 2004. First IEEE","20040419","2004","","","41","46","In order to fight against the increasing number of network security incidents due to mal-protected home networks permanently connected to the Internet via DSL, TV cable or similar technologies, we propose that Internet service providers (ISP) operate and manage intrusion prevention systems (IPS) which are to a large extend executed on the consumer's gateway to the Internet (e.g., DSL router). The paper analyses the requirements of ISP-operated intrusion prevention systems and presents our approach for an IPS that runs on top of an active networking environment and is automatically configured by a vulnerability scanner. We call the system FIDRAN (Flexible Intrusion Detection and Response framework for Active Networks). The system autonomously analyses the home network and correspondingly configures the IPS. Furthermore, our system detects and adjusts itself to changes in the home network (new service, new host, etc.). First performance comparisons show that our approach - while offering more flexibility and being able to support continuous updating by active networking principles - competes well with the performance of conventional intrusion prevention systems like Snort-Inline.","","0-7803-8145-9","","10.1109/CCNC.2004.1286830","http://ieeexplore.ieee.org.ezproxy.rit.edu/stamp/stamp.jsp?arnumber=1286830","","Cable TV;Communication cables;DSL;Home automation;IP networks;Intrusion detection;Protection;Software quality;Technology management;Web and internet services","Internet;computer crime;home computing;telecommunication security","ISP-operated intrusion prevention systems;Internet service providers;Snort-Inline;active networks;flexible intrusion detection;gateway;home network protection;network security;vulnerability scanner","","1","","12","","","5-8 Jan. 2004","","IEEE","IEEE Conference Publications"
"eXpert-BSM: a host-based intrusion detection solution for Sun Solaris","Lindqvist, U.; Porras, P.A.","Syst. Design Lab., SRI Int., Menlo Park, CA, USA","Computer Security Applications Conference, 2001. ACSAC 2001. Proceedings 17th Annual","20020807","2001","","","240","251","eXpert-BSM is a real time forward-reasoning expert system that analyzes Sun Solaris audit trails. Based on many years of intrusion detection research, eXpert-BSM's knowledge base detects a wide range of specific and general forms of misuse, provides detailed reports and recommendations to the system operator, and has a low false-alarm rate. Host-based intrusion detection offers the ability to detect misuse and subversion through the direct monitoring of processes inside the host, providing an important complement to network-based surveillance. Suites of eXpert-BSMs may be deployed throughout a network, and their alarms managed, correlated, and acted on by remote or local subscribing security services, thus helping to address issues of decentralized management. Inside the host, eXpert-BSM is intended to operate as a true security daemon for host systems, consuming few CPU cycles and very little memory and secondary storage. eXpert-BSM has been available for download on the Internet since April 2000, and has been successfully deployed in several production environments.","","0-7695-1405-7","","10.1109/ACSAC.2001.991540","http://ieeexplore.ieee.org.ezproxy.rit.edu/stamp/stamp.jsp?arnumber=991540","","Data security;Electronic switching systems;Expert systems;Intrusion detection;Laboratories;Remote monitoring;Secure storage;Sun;Surveillance;Trademarks","computer network management;expert systems;network operating systems;security of data;system monitoring","Internet;Sun Solaris;audit trails;decentralized management;eXpert-BSM;host-based intrusion detection;knowledge base;misuse;real time forward-reasoning expert system;security daemon;security services;system operator","","6","35","23","","","10-14 Dec. 2001","","IEEE","IEEE Conference Publications"
"Using Network Motifs to Identify Application Protocols","Allan, E.G.; Turkett, W.H.; Fulp, E.W.","Dept. of Comput. Sci., Wake Forest Univ., Winston-Salem, NC, USA","Global Telecommunications Conference, 2009. GLOBECOM 2009. IEEE","20100304","2009","","","1","7","Identifying application types in network traffic is a difficult problem for administrators who must secure and manage network resources, further complicated by the use of encrypted protocols and nonstandard port numbers. This paper takes a unique approach to this problem by modeling and analyzing application graphs, structures which describe the application-level (e.g., HTTP, FTP) communications between hosts. These graphs are searched for motifs: recurring, significant patterns of interconnections that can be used to help determine the network application in use. Motif-based analysis has been applied predominantly to biological networks to hypothesize key functional regulatory units, but never to network traffic as it is here. For the proposed method, a description of each node is generated based on its participation in statistically significant motifs. These descriptions, or profiles, are data points in multidimensional space that are used as input to a k-nearest neighbor (k-NN) classifier to predict the application. This work also compares the performance of motif-based analysis to an alternative profile type based on ""traditional"" graph measures such as path lengths, clustering coefficients and centrality measures. The results show that motif profiles perform better than traditional profiles, and are able to correctly identify the actions of 85% of the hosts examined across seven protocols.","1930-529X","978-1-4244-4148-8","","10.1109/GLOCOM.2009.5425781","http://ieeexplore.ieee.org.ezproxy.rit.edu/stamp/stamp.jsp?arnumber=5425781","","Application software;Cryptography;Data security;Information security;Length measurement;Network servers;Peer to peer computing;Protocols;Resource management;Telecommunication traffic","cryptography;telecommunication traffic;transport protocols","FTP;HTTP;application graphs;application protocols;encrypted protocols;k-nearest neighbor classifier;motif-based analysis;network motifs;network resources;network traffic","","1","","21","","","Nov. 30 2009-Dec. 4 2009","","IEEE","IEEE Conference Publications"
"An improved network intrusion detection technique based on k-means clustering via Naïve bayes classification","Sharma, Sanjay Kumar; Pandey, Pankaj; Tiwari, Susheel Kumar; Sisodia, Mahendra Singh","Department of Computer Science &amp; Engineering, Oriental Institute of Science &amp; Technology, Bhopal, India","Advances in Engineering, Science and Management (ICAESM), 2012 International Conference on","20120614","2012","","","417","422","As network attacks have increased in number and severity over the past few years, intrusion detection system (IDS) is increasingly becoming a critical component to secure the network. Due to large volumes of security audit data as well as complex and dynamic properties of intrusion behaviors, optimizing performance of IDS becomes an important open problem that is receiving more and more attention from the research community. Intrusion poses a serious security risk in a network environment. The ever growing new intrusion types pose a serious problem for their detection. The human labeling of the available network audit data instances is usually tedious, time consuming and expensive. In this paper, we apply one of the efficient data mining algorithms called k-means clustering via naïve bayes classification for anomaly based network intrusion detection. Experimental results on the KDD cup'99 data set show the novelty of our approach in detecting network intrusion. It is observed that the proposed technique performs better in terms of Detection rate when applied to KDD'99 data sets compared to a naïve bayes based approach.","","978-1-4673-0213-5","","","http://ieeexplore.ieee.org.ezproxy.rit.edu/stamp/stamp.jsp?arnumber=6215635","Detection Rate and False Positive Rates;K-Means Clustering;Naïve Bayesian Classification;Network Intrusion Detection;ROC graph","Classification algorithms;Clustering algorithms;Companies;Humans;Labeling;Probes;Security","","","","1","","15","","","30-31 March 2012","","IEEE","IEEE Conference Publications"
"Embedded Port Scanner (EPSS) System using linux and Single Board Computer","Ahmed, N.; Khalib, Z.I.A.; Ahmed, R.B.; Ghossoon, W.M.; Sudin, S.; Asi, S.","Sch. of Comput. & Commun. Eng., Univ. Malaysia Perlis, Kangar","Electronic Design, 2008. ICED 2008. International Conference on","20090220","2008","","","1","5","This paper presents our effort and to realize possible usage on embedded Linux platform for Intrusion Detection (Port Scan). The approach was to develop software which performs port scan using half-open and udp technique. The software is then executed on a Linux based Single Board Computer (SBC) which runs TS-Linux 2.4.23 kernel developed by Technology System (TS). It is interesting enough to find that regardless of the limitation of processing power, the system performance on the embedded platform is at par with other port scanners running on a much better performance PC. The findings indicate that low end embedded Linux platform is suitable for network security application and it is marketable at a lower cost with the extra benefit of portability.","","978-1-4244-2315-6","978-1-4244-2315-6","10.1109/ICED.2008.4786717","http://ieeexplore.ieee.org.ezproxy.rit.edu/stamp/stamp.jsp?arnumber=4786717","Embedded System;Intrusion Detection System;Network defense;Port Scan","Application software;Computer networks;Computer security;Embedded computing;Embedded system;Hardware;Intrusion detection;Linux;Operating systems;Power system security","Linux;embedded systems;image scanners;microcomputers;security of data","Port Scan;TS-Linux 2.4.23 kernel;embedded system;intrusion detection;network defense;single board computer;technology system","","0","","14","","","1-3 Dec. 2008","","IEEE","IEEE Conference Publications"
"A multi-core based DDoS detection method","Dongqi Wang; Zhu yufu; Jia Jie","Comput. Center, Northeastern Univ., Shenyang, China","Computer Science and Information Technology (ICCSIT), 2010 3rd IEEE International Conference on","20100907","2010","4","","115","118","It is becoming increasing difficult to implement an effective DDoS Defense System, because (1) the raising sophistication of DDoS attack requires more complex analysis to detect, (2) internet traffic grows bigger and bigger which needs more powerful system to monitor. Taking advantages of the great improvement in multi-core technology, a multi-core based DDoS detection system (MIFDDS) is proposed in this work. MIFDDS was the redesign of the IP flow based DDoS detection system (IFDDS) [1]. In MIFDDS, multi-core methodology was used to achieve high detecting efficiency. Experimental results show that: MIFDDS maintained the good detection precision of IFDDS and increased detecting speed; MIFDDS consumed more RAM but not too much; MIFDDS also improved CPU's efficiency.","","978-1-4244-5537-9","","10.1109/ICCSIT.2010.5564969","http://ieeexplore.ieee.org.ezproxy.rit.edu/stamp/stamp.jsp?arnumber=5564969","DDoS;IP flow;detection;multi-core;neural network","","Internet;multiprocessing systems;protocols;random-access storage;security of data;telecommunication traffic","CPU efficiency;DDoS defense system;DDoS detection method;IP flow;Internet traffic;RAM;distributed denial of service;multicore technology","","1","","13","","","9-11 July 2010","","IEEE","IEEE Conference Publications"
"The Research and Design of the Intelligent Security Defendable Software's Cooperative Framework","Jin-Dong Wang; Wei-Wei Cao; Kun Wang; Heng-Wei Zhang","Inst. of Electron. Technol., PLA Univ. of Inf. Eng., Zhengzhou","Business and Information Management, 2008. ISBIM '08. International Seminar on","20090626","2008","2","","273","276","Coordinated defense is one of network security technology development directions, and how to make security systems work cooperatively is a critical problem. So uniform coordinated working mechanisms and policies are necessary. In Intelligent Security Defendable Software (ISDS), Execution Components can work cooperatively and implement coordinated tasks, and they need uniform commands. Hence coordinated-control has become very critical to ISDS. In order to make components in ISDS work cooperatively, combining with the characteristics of ISDS, a cooperative framework is presented in this paper, and the design of the Command Component (CC)is discussed in particular. The framework combines component technology, cooperative working and artificial intelligent, which has security, cooperatively and extensibility.","","978-0-7695-3560-9","","10.1109/ISBIM.2008.152","http://ieeexplore.ieee.org.ezproxy.rit.edu/stamp/stamp.jsp?arnumber=5116473","Component technology;Cooperative framework;Intelligent Security Defendable Software;Network security","Artificial intelligence;Automatic control;Computer architecture;Design engineering;Event detection;Information management;Information security;Intelligent networks;Programmable logic arrays;Seminars","artificial intelligence;groupware;security of data","artificial intelligent;command component;component technology;cooperative framework;cooperative working;coordinated defense;execution components;intelligent security defendable software;network security technology","","0","","6","","","19-19 Dec. 2008","","IEEE","IEEE Conference Publications"
