"A Study on Intrusion Detection Based on Data Mining","Song Naiping; Zhou Genyuan","Sch. of Comput. Eng., Jiangsu Teachers Univ. of Technol., Changzhou, China","Information Science and Management Engineering (ISME), 2010 International Conference of","20100916","2010","1","","135","138","This paper, in view of the problems in traditional intrusion detection systems, proposes data mining techniques be applied to intrusion detection system. The commonly used data mining algorithms are discussed; then a data mining-based intrusion detection system model is constructed, the architecture and main functions of which are described as well.","","978-1-4244-7669-5","978-1-4244-7670-1","10.1109/ISME.2010.47","http://ieeexplore.ieee.org.ezproxy.rit.edu/stamp/stamp.jsp?arnumber=5573765","data mining;intrusion detection;model","Algorithm design and analysis;Association rules;Classification algorithms;Computers;Data models;Intrusion detection","computer network security;data mining","data mining technique;intrusion detection system","","2","","7","","","7-8 Aug. 2010","","IEEE","IEEE Conference Publications"
"An Adaptive Multi-channel Approach for Real-Time Multimedia Wireless Sensor Networks","Corte&#x0301;s, A.; Pe&#x00F1;a, N.M.; Labrador, M.A.","Fac. de Ing. de la Univ. de los Andes en Bogota, Univ. Surcolombiana de Neiva, Neiva, Colombia","Latin America Transactions, IEEE (Revista IEEE America Latina)","20101007","2010","8","4","370","376","Many wireless sensor network applications could be substantially improved if they enhance the description of the events transmitting scalar sensor data along with audio and video. For example, an intrusion detection system would reduce the number of false positives if, in addition to the alarm, the system would also transmitted a picture or video of the intruder. The problem is how to overcome the known limitations of current wireless sensor networks to support multimedia applications in terms of throughput, delay and jitter while being energy efficient. This paper presents LEMR-multichannel, an extension of LEMR for real-time applications over wireless sensor networks to address these issues. LEMR-multichannel takes advantage of the delay, jitter and energy-efficiency of LEMR, and includes an energyefficient new dynamic duty cycle multi-channel medium access mechanism that uses the different channels available in the single transceiver device to enhance the throughput capability of the network. Simulation experiments demonstrate the superiority of LEMR-multichannel in terms of these performance metrics when compared with well-known protocols, such as LEMR, S-MAC, TMAC and SCP-MAC.","1548-0992","","","10.1109/TLA.2010.5595126","http://ieeexplore.ieee.org.ezproxy.rit.edu/stamp/stamp.jsp?arnumber=5595126","Cross-layer design;Energy;Jitter;Latency;MAC;Multimedia;Routing;Throughput;Wireless Sensor Network","Irrigation;Jitter;Multimedia communication;Silicon compounds;Streaming media;Synchronization;Wireless sensor networks","multimedia communication;real-time systems;wireless sensor networks","LEMR-multichannel;adaptive multi-channel approach;dynamic duty cycle multi-channel medium access mechanism;real-time multimedia wireless sensor networks","","1","","14","","","Aug. 2010","","IEEE","IEEE Journals & Magazines"
"Efficient face detection and recognition using block independent component analysis and clustering","Vaidehi, V.; Gayathri, K.; Vignesh, S.","Dept. of Inf. Technol., Anna Univ., Chennai, India","Recent Trends in Information Technology (ICRTIT), 2011 International Conference on","20110804","2011","","","561","566","This paper presents an efficient image retrieval system called BICA-C for face recognition. This system takes an image as an input query and retrieves images based on its image content. Content Based Image Retrieval (CBIR) is an approach for retrieving semantically-relevant images from an image database based on extracted image features. Block Independent Component Analysis (B-ICA) is a popular feature extraction method. This paper proposes a scheme to enhance the performance of B-ICA based feature extraction by the utilization of k-means clustering technique. The proposed scheme consists of two stages. First stage is the offline training process where the extracted features in the database is clustered using k-means clustering and then the second stage is the online testing where the obtained query image is compared with the clustered images and is classified as intruder or authenticated person based on the similarity measure.","","978-1-4577-0588-5","","10.1109/ICRTIT.2011.5972434","http://ieeexplore.ieee.org.ezproxy.rit.edu/stamp/stamp.jsp?arnumber=5972434","Block Independent Component Analysis (B-ICA);Content Based Image Retrieval (CBIR);Face Recognition;K-means clustering","Face;Face recognition;Feature extraction;Image retrieval;Training","content-based retrieval;face recognition;feature extraction;image retrieval;independent component analysis;pattern clustering","BICA-C;authenticated person;block independent component analysis;content based image retrieval;face detection;face recognition;image content;image database;image feature extraction;intruder;k-means clustering technique;offline training process;online testing;query image;semantically relevant image retrieval","","1","","11","","","3-5 June 2011","","IEEE","IEEE Conference Publications"
"On the Contribution of Preamble to Information Hiding in Mimicry Attacks","Kayacik, H.G.; Zincir-Heywood, A.N.","Fac. of Comput. Sci., Dalhousie Univ., Halifax, NS","Advanced Information Networking and Applications Workshops, 2007, AINAW '07. 21st International Conference on","20070827","2007","1","","632","638","In this paper, we aim to determine the significance of different stages of an attack, namely the preamble and the exploit, on an achieved anomaly rate. To this end, we analyze four Unix applications that have been used by the previous researchers against Stide anomaly detector. Our results show that the effect of the preamble on the anomaly rate is much greater when the size of the preamble component of an attack is greater than the size of the exploit component. Furthermore, we investigate the impact of training set selection and the length of sliding window on detector performance.","","978-0-7695-2847-2","","10.1109/AINAW.2007.269","http://ieeexplore.ieee.org.ezproxy.rit.edu/stamp/stamp.jsp?arnumber=4221128","Information hiding;anomaly detection;benchmarking","Application software;Buffer overflow;Computer science;Data analysis;Databases;Detectors;Information analysis;Performance analysis;Security;Training data","Unix;benchmark testing;data encapsulation;security of data;software performance evaluation","Stide anomaly detector;Unix applications;anomaly detection;benchmarking;information hiding;mimicry attacks;training set selection","","2","","9","","","21-23 May 2007","","IEEE","IEEE Conference Publications"
"Intrusion Detection System for Power-Aware OLSR","Dutta, C.B.; Biswas, U.","Dept. of CSE, Univ. of Kalyani, Nadia, India","Computational Intelligence and Networks (CINE), 2015 International Conference on","20150305","2015","","","142","147","Optimized Link State Routing (OLSR) is a standard proactive routing protocol for Wireless Sensor Network (WSN). OLSR uses two kinds of the control messages: Hello and Topology Control (TC). As these messages are un-authenticated, OLSR is prone to several attacks namely, black hole, wormhole, Gray hole etc. This paper is focused at Sleep Deprivation Torture Attack on OLSR. Sleep deprivation attack is one of the most interesting attack in layer 2 where the attacker tries to use a low energy node until all its energy is exhausted and the node goes into permanent sleep. This attack is also possible in routing level. In OLSR low energy node declare their status through willingness property of HELLO message. Using this information an attacker node can choose that low energy node deliberately and forward all traffic through that node. This leads to low energy node in a permanent sleep mode. In this paper we propose a specification based Intrusion Detection System (IDS) for that type of attack. The performance of the propose algorithm is studied by Network Simulator (NS2) and effectiveness of the propose scheme, along with a comparison with existing techniques is demonstrated.","2375-5822","978-1-4799-7548-8","","10.1109/CINE.2015.35","http://ieeexplore.ieee.org.ezproxy.rit.edu/stamp/stamp.jsp?arnumber=7053818","Energy efficiency;Intrusion Detection System (IDS);Optimized Link State routing (OLSR);Sleep Deprivation Torture Attack;Wireless Sensor Network (WSN)","Batteries;Energy efficiency;Monitoring;Routing;Routing protocols;Sensors;Wireless sensor networks","routing protocols;security of data;telecommunication network topology;telecommunication power management;wireless sensor networks","control messages;intrusion detection system;low energy node;network simulator;optimized link state routing;permanent sleep mode;power-aware OLSR;proactive routing protocol;sleep deprivation torture attack;topology control;wireless sensor network","","0","","17","","","12-13 Jan. 2015","","IEEE","IEEE Conference Publications"
"A Cross-Layer Approach for Prioritized Frame Transmissions of MPEG-4 Over the IEEE 802.11 and IEEE 802.11e Wireless Local Area Networks","Yang Xiao; Yan Zhang; Nolen, M.; Deng, J.H.; Jingyuan Zhang","Dept. of Comput. Sci., Univ. of Alabama, Tuscaloosa, AL, USA","Systems Journal, IEEE","20111121","2011","5","4","474","485","In this paper, we study MPEG-4 transmissions over the IEEE 802.11 wireless local area networks (WLANs). First, we provide a simulation of MPEG-4 using OPNET over the WLANs in terms of throughput, impacts of multiple MPEG-4 streams, and compression rate on throughput. Our simulation results show that a higher throughput does not always yield a better quality MPEG-4 video. We further observe that if an I frame of MPEG 4 video is lost, the next N-1 frames (all P and B frames) are useless [where N is the total number of frames contained within one group of picture (GoP)]. Furthermore, we observe that the I, P, and B frames are in decreasing order of importance. Therefore, we propose a cross-layer approach to improve MPEG-4 trans missions over WLANs. In the proposed approach: 1) P and B frames will be discarded by the MPEG-4 decoder at the receiver's medium access control (MAC) layer if the corresponding I fame is lost; 2) the individual MPEG-4 frames are prioritized at the MAC layer so that I frames have a higher priority than P frames, which have a higher priority than the B frames; 3) each frame (I, B, P) has a time deadline field so that if the deadline cannot be reached, the frame and other related P and B frames in the same GoP are deleted without further transmissions/re-transmissions; and 4) if the delay between an I frame and the next P frame is too long, then it may be better to drop the least important B frames in an attempt to allow the video to catch up. Finally, we study MPEG-4 transmissions over the IEEE 802.11e WLANs, and we adopt a measurement admission control scheme for IEEE 802.lie. Our results show the advantages of the proposed scheme.","1932-8184","","","10.1109/JSYST.2011.2165596","http://ieeexplore.ieee.org.ezproxy.rit.edu/stamp/stamp.jsp?arnumber=6017093","Cross-layer design;IEEE 80211;IEEE 80211e;MPEG-4;WiFi;wireless local area networks","Cross layer design;IEEE 802.11e Standard;MPEG 4 Standard;Throughput;Wireless LAN","access protocols;data communication;video signal processing;wireless LAN","IEEE 802.11e wireless local area network;MPEG-4 transmission;MPEG-4 video;OPNET;compression rate;cross layer approach;group of picture;medium access control;prioritized frame transmission","","8","","19","","2011-09-12","Dec. 2011","","IEEE","IEEE Journals & Magazines"
"Addressing Security Issues by Means of Intrusion Confinement","Robles, R.J.; Tai-hoon Kim","Sch. of Multimedia, Hannam Univ., Daejeon","Ubiquitous Multimedia Computing, 2008. UMC '08. International Symposium on","20081024","2008","","","222","225","Security has emerged as the biggest threat to information systems. System protection mechanisms such as access controls can be fooled by authorized but malicious users, masqueraders, and misfeasors. As a result, serious damage can be caused either because many intrusions are never detected or because the average detection latency is too long. In this paper, we define intrusion confinement thru isolation to address such security issue, its importance and finally present an isolation protocol.","","978-0-7695-3427-5","","10.1109/UMC.2008.52","http://ieeexplore.ieee.org.ezproxy.rit.edu/stamp/stamp.jsp?arnumber=4656549","","Access control;Computer displays;Information security;Information systems;Intrusion detection;Isolation technology;Multimedia computing;Multimedia systems;Protocols;Telecommunication traffic","authorisation;information systems","access controls;information systems;intrusion confinement;isolation protocol;security;system protection mechanisms","","0","","5","","","13-15 Oct. 2008","","IEEE","IEEE Conference Publications"
"Efficient and effective NIDS for cloud virtualization environment","Chih-Hung Lin; Chin-Wei Tien; Hsing-Kuo Pao","CyberTrust Technol. Inst. Inst. for Inf. Ind., Taipei, Taiwan","Cloud Computing Technology and Science (CloudCom), 2012 IEEE 4th International Conference on","20130204","2012","","","249","254","While more and more digital application services move to the cloud virtualization environment, the network security challenges are equally striking. In general, these network attacks can be detected by deploying network intrusion detection systems (NIDSs) to the cloud platform. As clients in the cloud can create many virtual machines (VMs) to run their services privately, all detection rules are usually loaded into NIDSs to avoid any oversight, and cause damage to the performance of NIDS. This work presents a new architecture for building an efficient NIDS to the cloud virtualization environment. By resolving the virtual system information from operating systems' kernel map in hypervisor layer, the services in the cloud can be identified exactly and the required detection rules can be adopted dynamically. The experiment results show that the proposed NIDS is efficient and effective.","","978-1-4673-4511-8","978-1-4673-4509-5","10.1109/CloudCom.2012.6427583","http://ieeexplore.ieee.org.ezproxy.rit.edu/stamp/stamp.jsp?arnumber=6427583","Cloud computing;Network intrusion detection system;Virtualization","Cloud computing;Data structures;Kernel;Linux;Virtual machine monitors;Virtualization","cloud computing;computer network performance evaluation;computer network security;operating system kernels;virtual machines;virtualisation","NIDS performance degradation;VM;cloud platform;cloud virtualization environment;detection rules;digital application services;hypervisor layer;network attack detection;network intrusion detection system;network security;operating system kernel map;virtual machines;virtual system information","","1","","18","","","3-6 Dec. 2012","","IEEE","IEEE Conference Publications"
"Secure access for MANET using authorization enforcement facility","Gowthami; Sangeetha","Dept. of Comput. Sci. & Eng., Kongu Eng. Coll., Perundurai, India","Information Communication and Embedded Systems (ICICES), 2013 International Conference on","20130425","2013","","","212","216","As MANETs are highly vulnerable to attacks due to its dynamic infrastructure, there may occur several attacks. Among those attacks routing attack is the most severe one. To systematically cope up with this routing attack, Risk Aware Response Mechanism is used. In these mechanism IDS is used which detects malicious activities caused by malicious nodes, Based on the risk of attack, temporary decision is made whether isolation is needed or not. IDS used in risk aware response mechanism is static based approach. Hence rule set in IDS has to be updated often by the network administrator if there are any new emerging attacks. In this paper, we propose a Authorization Enforcement Facility which uses risk as an input to determine how much a source node can be trusted. AEF considers both static approach as well as dynamic conditions in order to achieve better security and allow only secure communication to takes place between source and destination.","","978-1-4673-5786-9","","10.1109/ICICES.2013.6508360","http://ieeexplore.ieee.org.ezproxy.rit.edu/stamp/stamp.jsp?arnumber=6508360","Authorization Enforcement Facility;Intrusion Detection System;Mobile Adhoc Networks;Risk Aware;security","Intrusion detection;Mobile ad hoc networks;Peer-to-peer computing;Routing;Routing protocols","authorisation;computer network security;mobile ad hoc networks;telecommunication network routing","IDS;MANET;authorization enforcement facility;dynamic conditions;dynamic infrastructure;malicious nodes;network administrator;risk aware response mechanism;routing attack;secure access;static based approach;temporary decision","","0","","13","","","21-22 Feb. 2013","","IEEE","IEEE Conference Publications"
"Towards Cloud-Based Analytics-as-a-Service (CLAaaS) for Big Data Analytics in the Cloud","Zulkernine, F.; Martin, P.; Ying Zou; Bauer, M.; Gwadry-Sridhar, F.; Aboulnaga, A.","Sch. of Comput., Queen's Univ., Kingston, ON, Canada","Big Data (BigData Congress), 2013 IEEE International Congress on","20130916","2013","","","62","69","Data Analytics has proven its importance in knowledge discovery and decision support in different data and application domains. Big data analytics poses a serious challenge in terms of the necessary hardware and software resources. The cloud technology today offers a promising solution to this challenge by enabling ubiquitous and scalable provisioning of the computing resources. However, there are further challenges that remain to be addressed such as the availability of the required analytic software for various application domains, estimation and subscription of necessary resources for the analytic job or workflow, management of data in the cloud, and design, verification and execution of analytic workflows. We present a taxonomy for analytic workflow systems to highlight the important features in existing systems. Based on the taxonomy and a study of the existing analytic software and systems, we propose the conceptual architecture of CLoud-based Analytics-as-a-Service (CLAaaS), a big data analytics service provisioning platform, in the cloud. We outline the features that are important for CLAaaS as a service provisioning system such as user and domain specific customization and assistance, collaboration, modular architecture for scalable deployment and Service Level Agreement.","","978-0-7695-5006-0","","10.1109/BigData.Congress.2013.18","http://ieeexplore.ieee.org.ezproxy.rit.edu/stamp/stamp.jsp?arnumber=6597120","AaaS;Analytics;CLAaaS;analysis;cloud;scientific workflow management system;service;taxonomy;workflow","Collaboration;Data handling;Data storage systems;Data visualization;Information management;Software;Taxonomy","cloud computing;data analysis;workflow management software","CLAaaS;analytic software;analytic workflow systems;analytics service provisioning platform;cloud based analytics as a service;cloud technology;computing resources;data analytics;knowledge discovery;modular architecture;scalable deployment;scalable provisioning;service level agreement;service provisioning system;software resources","","4","","29","","","June 27 2013-July 2 2013","","IEEE","IEEE Conference Publications"
"Intrusion detection based on multi-layer minimax probability machine classifier","Fang Liu; Zhen-Guo Chen","Sch. of Comput. Sci. & Technol., Xidian Univ., Xi''an, China","Machine Learning and Cybernetics, 2004. Proceedings of 2004 International Conference on","20050124","2004","4","","2580","2585 vol.4","The minimax probability machine (MPM) constructs a classifier, which provides a worst-case bound on the probability of misclassification of future data points based on reliable estimates of means and covariance matrices of the classes from the training data points, and achieves the comparative performance and the same complexity of time with a state-of-the-art classifier, the support vector machine. To improve the limited performance of minimax probability machine in training time, a new multi-layer classifier model based on MPM ensemble with boosting is proposed and is applied to intrusion detection in this paper. After illustrating our model with a representative dataset and applying it to the real-world network datasets KDD Cup 1999, simulations show that the intrusion detection system based on multi-layer minimax probability machine achieves the comparative performance with the support vector machine and with less training time.","","0-7803-8403-2","","10.1109/ICMLC.2004.1382239","http://ieeexplore.ieee.org.ezproxy.rit.edu/stamp/stamp.jsp?arnumber=1382239","","Boosting;Computer science;Covariance matrix;Detectors;Hidden Markov models;Intrusion detection;Minimax techniques;Probability;Support vector machine classification;Support vector machines","minimax techniques;pattern classification;probability;security of data;support vector machines","KDD Cup 1999 datasets;covariance matrices;intrusion detection;multilayer minimax probability machine classifier;probability;support vector machine;worst-case bound","","0","","12","","","26-29 Aug. 2004","","IEEE","IEEE Conference Publications"
"Identifying important features for intrusion detection using support vector machines and neural networks","Sung, A.H.; Mukkamala, S.","Dept. of Comput. Sci., New Mexico Inst. of Min. & Technol., Socorro, NM, USA","Applications and the Internet, 2003. Proceedings. 2003 Symposium on","20030228","2003","","","209","216","Intrusion detection is a critical component of secure information systems. This paper addresses the issue of identifying important input features in building an intrusion detection system (IDS). Since elimination of the insignificant and/or useless inputs leads to a simplification of the problem, faster and more accurate detection may result. Feature ranking and selection, therefore, is an important issue in intrusion detection. We apply the technique of deleting one feature at a time to perform experiments on SVMs and neural networks to rank the importance of input features for the DARPA collected intrusion data. Important features for each of the 5 classes of intrusion patterns in the DARPA data are identified. It is shown that SVM-based and neural network based IDSs using a reduced number of features can deliver enhanced or comparable performance. An IDS for class-specific detection based on five SVMs is proposed.","","0-7695-1872-9","","10.1109/SAINT.2003.1183050","http://ieeexplore.ieee.org.ezproxy.rit.edu/stamp/stamp.jsp?arnumber=1183050","","Computer crime;Computer science;Computer vision;Information systems;Intrusion detection;Local area networks;Neural networks;Support vector machines;TCPIP;Telecommunication traffic","Internet;learning (artificial intelligence);learning automata;neural nets;security of data;telecommunication security","DARPA data;Internet security;experiments;feature ranking;feature selection;intrusion detection;neural networks;performance;secure information systems;support vector machines","","67","","18","","","27-31 Jan. 2003","","IEEE","IEEE Conference Publications"
"Multi-version attack recovery for workflow systems","Meng Yu; Peng Liu; Wanyu Zang","Sch. of Inf. Sci. & Technol., Pennsylvania State Univ., University Park, PA, USA","Computer Security Applications Conference, 2003. Proceedings. 19th Annual","20040108","2003","","","142","150","Workflow systems are popular in daily business processing. Since vulnerabilities cannot be totally removed from a system, recovery from successful attacks is unavoidable. We focus on attacks that inject malicious tasks into workflow management systems. We introduce practical techniques for on-line attack recovery, which include rules for locating damage and rules for execution order. In our system, an independent intrusion detection system reports identified malicious tasks periodically. The recovery system detects all damage caused by the malicious tasks and automatically repairs the damage according to dependency relations. Without multiple versions of data objects, recovery tasks may be corrupted by executing normal tasks when we try to run damage analysis and normal tasks concurrently. We address the problem by introducing multiversion data objects to reduce unnecessary blocking of normal task execution and improve the performance of the whole system. We analyze the integrity level and performance of our system. The analytic results demonstrate guidelines for designing such kinds of systems.","","0-7695-2041-3","","10.1109/CSAC.2003.1254319","http://ieeexplore.ieee.org.ezproxy.rit.edu/stamp/stamp.jsp?arnumber=1254319","","Access control;Application software;Computer crashes;Computer security;Guidelines;Intrusion detection;Performance analysis;Transaction databases;Workflow management software","business data processing;security of data;system recovery;workflow management software","data object;intrusion detection system;multiversion attack recovery;on-line attack recovery;workflow management system","","3","","15","","","8-12 Dec. 2003","","IEEE","IEEE Conference Publications"
