"A Danger Model Based Anomaly Detection Method for Wireless Sensor Networks","Kui Zhang","Coll. of Comput. Sci. & Technol., Wuhan Univ. of Sci. & Technol., Wuhan, China","Knowledge Acquisition and Modeling, 2009. KAM '09. Second International Symposium on","20091228","2009","1","","11","14","Wireless sensor network (WSN) is the hot research subject in the field of network technologies currently, and its security problem also attracts more attentions. Especially, intrusion detection in wireless sensor networks remains an open problem. In this paper, we study a novel danger model based anomaly detection algorithm for wireless sensor networks. The danger model is built on a sensitive tissue(ST). The sensitive tissue consists of a population of sensitive cells(SCs) that are abstracted characteristics from a node of wireless sensor networks which are sensitive to attacks. ST plays a role as an interface between problems and immune cells for danger recognition and estimation. The results of the application of this novel model to the detection of the syscalls data show that the model is valid.","","978-0-7695-3888-4","","10.1109/KAM.2009.7","http://ieeexplore.ieee.org.ezproxy.rit.edu/stamp/stamp.jsp?arnumber=5362168","anomaly detection;danger model;wireless sensor networks","Biological system modeling;Biomedical monitoring;Data security;Detection algorithms;Immune system;Information security;Intrusion detection;Protection;Remote monitoring;Wireless sensor networks","security of data;telecommunication computing;wireless sensor networks","danger model based anomaly detection method;immune cells;sensitive cells;sensitive tissue;syscalls data detection;wireless sensor networks","","1","","17","","","Nov. 30 2009-Dec. 1 2009","","IEEE","IEEE Conference Publications"
"Optimizing Network Anomaly Detection Scheme Using Instance Selection Mechanism","Yang Li; Tian-Bo Lu; Li Guo; Zhi-Hong Tian; Lin Qi","Inst. of Comput. Technol., Chinese Acad. of Sci., Beijing, China","Global Telecommunications Conference, 2009. GLOBECOM 2009. IEEE","20100304","2009","","","1","7","Network anomaly detection is a classically difficult research topic in intrusion detection. However, existing research has been solely focused on the detection algorithm. An important issue that has not been well studied so far is the selection of normal training data for network anomaly detection algorithm, which is highly related to the detection performance and computational complexity. Based on our previous proposed TCM-KNN (Transductive Confidence Machines for K-Nearest Neighbors) anomaly detection method, which can detect anomalies with high detection rate and low false positive rate, we develop an instance selection mechanism for TCM-KNN based on EFCM (Extended Fuzzy C-Means) clustering algorithm in this paper, aiming at limiting the size of training dataset, thus reducing the computational cost of TCM-KNN and boosting its detection performance. We report the experimental results over real network traffic. The results demonstrate the instance selection method presented in this paper is effective for TCM-KNN and thus optimizing it as an effectively lightweight network anomaly detection scheme.","1930-529X","978-1-4244-4148-8","","10.1109/GLOCOM.2009.5425547","http://ieeexplore.ieee.org.ezproxy.rit.edu/stamp/stamp.jsp?arnumber=5425547","","Boosting;Computational efficiency;Computers;Detection algorithms;Educational institutions;Intrusion detection;Mobile computing;Optimization methods;Telecommunication traffic;Testing","computational complexity;fuzzy set theory;security of data","computational complexity;extended fuzzy C-means clustering algorithm;instance selection mechanism;intrusion detection;network anomaly detection scheme;transductive confidence machines for K-nearest neighbors","","1","","30","","","Nov. 30 2009-Dec. 4 2009","","IEEE","IEEE Conference Publications"
"BriGuard: a lightweight indoor intrusion detection system based on infrared light spot displacement","Leibo Liu; Weilong Zhang; Chenchen Deng; Shouyi Yin; Shaojun Wei","Nat. Lab. for Inf. Sci. & Technol., Tsinghua Univ., Beijing, China","Science, Measurement & Technology, IET","20150423","2015","9","3","306","314","Indoor intrusion detection systems are widely implemented in many special departments and environments. Owing to the special target market, several specific features of such systems are required including high accuracy, high performance, high concealment and ease of deployment. In this study, the authors proposed an infrared light spot displacement-based surveillance system for indoor intrusion detection. This system, named BriGuard, shares a similar idea with radar. A 940 nm infrared light beam goes through an optical diffraction grating to generate light spot matrix imagery in the view of a complementary metal oxide semiconductor image sensor. The coordinates of the light spots are extracted and recorded. When someone enters the monitored area, the imaging plane changes and leads to a variation of the pre-recorded light spots coordinates. The light beam is modulated in order to be distinguished from the light in the environment. The lightweight algorithms require little computation power and data storage. BriGuard achieves a nearly zero false detection rate while covering a distance up to 10 m. It can process 30 full HD (1920  1080) frames per second. More importantly, because of unnoticeable infrared lights and very small form factor, the whole detection equipment is very hard to observe.","1751-8822","","","10.1049/iet-smt.2013.0171","http://ieeexplore.ieee.org.ezproxy.rit.edu/stamp/stamp.jsp?arnumber=7089380","","","CMOS image sensors;diffraction gratings;infrared detectors;infrared imaging;optical modulation;security of data;video surveillance","BriGuard;complementary metal oxide semiconductor image sensor;form factor;infrared light spot displacement-based surveillance system;light beam modulation;light spot matrix image generation;light spots coordinates extraction;lightweight algorithm;lightweight indoor intrusion detection system;optical diffraction grating;radar;wavelength 940 nm;zero false detection rate","","0","","","","","5 2015","","IET","IET Journals & Magazines"
"Intrusion Detection for Encrypted Web Accesses","Yamada, A.; Miyake, Y.; Takemori, K.; Studer, A.; Perrig, A.","KDDI R&D Labs. Inc., Saitama","Advanced Information Networking and Applications Workshops, 2007, AINAW '07. 21st International Conference on","20070827","2007","1","","569","576","As various services are provided as web applications, attacks against web applications constitute a serious problem. Intrusion detection systems (IDSes) are one solution, however, these systems do not work effectively when the accesses are encrypted by protocols. Because the IDSes inspect the contents of a packet, it is difficult to find attacks by the current IDS. This paper presents a novel approach to anomaly detection for encrypted web accesses. This approach applies encrypted traffic analysis to intrusion detection, which analyzes contents of encrypted traffic using only data size and timing without decryption. First, the system extracts information from encrypted traffic, which is a set comprising data size and timing for each web client. Second, the accesses are distinguished based on similarity of the information and access frequencies are calculated. Finally, malicious activities are detected according to rules generated from the frequency of accesses and characteristics of HTTP traffic. The system does not extract private information or require enormous pre-operation beforehand, which are needed in conventional encrypted traffic analysis. We show that the system detects various attacks with a high degree of accuracy, adopting an actual dataset gathered at a gateway of a network and the DARPA dataset.","","978-0-7695-2847-2","","10.1109/AINAW.2007.212","http://ieeexplore.ieee.org.ezproxy.rit.edu/stamp/stamp.jsp?arnumber=4221118","","Cryptography;Data mining;Intrusion detection;Laboratories;Network servers;Protocols;Research and development;Telecommunication traffic;Timing;Web server","Internet;cryptography","HTTP traffic;Web client;anomaly detection;encrypted Web accesses;encrypted traffic analysis;intrusion detection systems","","5","1","23","","","21-23 May 2007","","IEEE","IEEE Conference Publications"
"An Integrated Fuzzy Ants and Artificial Immune Recognition System for Anomaly Detection","Srinoy, S.; Kurutach, W.","Dept. of Comput. Sci., Suan Dusit Rajabhat Univ., Bangkok","SICE-ICASE, 2006. International Joint Conference","20070226","2006","","","5464","5469","A computer system intrusion is seen as any set of actions that attempt to compromise the integrity, confidentiality or availability of a resource. The introduction to networks and the Internet caused great concern about the protection of sensitive information and have resulted in many computer security research efforts during the past few years. This paper highlights a novel approach for detecting intrusion based on bio-inspired algorithm. The intrusion detection model combines the fuzzy ants clustering algorithm and artificial immune recognition algorithm to maximize detection accuracy and minimize computational complexity. The implemented system has been tested on the training data set from DARPA DATA SET by MIT Lincoln Laboratory on intrusion. The applicability of the proposed method and the enhanced security it provides are discussed","","89-950038-4-7","89-950038-5-5","10.1109/SICE.2006.315604","http://ieeexplore.ieee.org.ezproxy.rit.edu/stamp/stamp.jsp?arnumber=4108759","Artificial Immune Recognition System;Fuzzy ants;anomaly detection","Availability;Clustering algorithms;Computational complexity;Computer security;Fuzzy systems;IP networks;Immune system;Intrusion detection;Protection;System testing","artificial immune systems;computational complexity;fuzzy set theory;pattern clustering;security of data","anomaly detection;artificial immune recognition system;bio-inspired algorithm;computational complexity;computer security;fuzzy ants clustering algorithm;intrusion detection model","","0","","22","","","18-21 Oct. 2006","","IEEE","IEEE Conference Publications"
"Identification of the mineral oil fluorescence spectroscopy based on the PCA and ICA-SVM","Lv Jiangtao; Gu Zhenpu","Dept. of Autom. Eng., Northeastern Univ. at Qinhuangdao, Qinhuangdao, China","Signal Processing Systems (ICSPS), 2010 2nd International Conference on","20100823","2010","2","","V2-246","V2-249","Three-dimensional fluorescence spectroscopy technology is often used to identify the kind of the mineral oil. The dimension of it is high which cause the characteristic of the oil style-book are difficult to be maintained by the simple formula. In this paper, the principal component analysis (PCA) is used to reduce the dimensions of the spectroscopy. The independent component analysis (ICA) is used to do the matrix decomposition from the perspective of independence to extract the main feature of the spectroscopy data processed by the PCA. The support vector machine (SVM) is used to assort the main characteristic root books which are abstracted by the ICA. The species identification of the mineral oil will be realized by it. The identification result is visualized by the parallel coordinate's graph. The experiment results show that it is effective to extract the main feature of the spectroscopy. The classify speed is greatly increased. The identification of the oils can be realized with high discrimination which is 99.12%.","","978-1-4244-6892-8","978-1-4244-6893-5","10.1109/ICSPS.2010.5555503","http://ieeexplore.ieee.org.ezproxy.rit.edu/stamp/stamp.jsp?arnumber=5555503","ICA;PCA;SVM;mineral oil;three-dimensional fluorescence spectroscopy recognition","Feature extraction;Fluorescence;Minerals;Petroleum;Principal component analysis;Spectroscopy;Support vector machines","chemical engineering computing;feature extraction;fluorescence spectroscopy;matrix decomposition;oils;petroleum;principal component analysis;support vector machines","feature extraction;independent component analysis;matrix decomposition;mineral oil fluorescence spectroscopy;parallel coordinate graph;principal component analysis;spectroscopy data;support vector machine;three dimensional fluorescence spectroscopy technology","","0","","9","","","5-7 July 2010","","IEEE","IEEE Conference Publications"
"Cyber security: Threats, reasons, challenges, methodologies and state of the art solutions for industrial applications","Razzaq, Abdul; Hur, Ali; Ahmad, H Farooq; Masood, Muddassar","School of Electrical Engineering and Computer Science (SEECS) National University of Sciences and Technology, Islamabad, Pakistan","Autonomous Decentralized Systems (ISADS), 2013 IEEE Eleventh International Symposium on","20130504","2013","","","1","6","Cyber Civilization has become an important source of information sharing and professional activities like business, banking transactions, shopping, services and advertisement. With the exponentially increase in usage of cyberspace, cybercriminal actives are also increase exponentially. The basic reasons is that with the inception of world wide web, the web applications were also getting popularity for data storing and data sharing, irrespective of the user. With the passage of time web applications were getting more complex with rapid increase in their design faults, creating the surfing of internet totally unsafe. More than 90 percent web applications have some kind of design or development fault which can be easily exploited by the cyber criminals. These faults in web application can help criminals in getting the illegal access to trade secrets of any business. Sometime the web application may not be posing threat but the technology used in these applications become the root cause and put the application to the risk of illegal access. Presently the social networks, Internet connected mobile devices, individual privacy, and the online connectivity of entities such as banks are the most enticing targets for cyber criminals. In this survey we highlight the common cyber threats and detailed analysis of existing system and methodology used for its industrial solutions. Some important some industrial application also analyzed this paper.","","978-1-4673-5069-3","","10.1109/ISADS.2013.6513420","http://ieeexplore.ieee.org.ezproxy.rit.edu/stamp/stamp.jsp?arnumber=6513420","Cyber security;Cyber threat;Web Security Solution","Business;Computer crime;Computers;Internet;Ontologies","","","","0","","42","","","6-8 March 2013","","IEEE","IEEE Conference Publications"
"An adaptive multiparty protocol for secure data protection","Qingkai Ma; Liangliang Xiao; I-Ling Yen; Manghui Tu; Bastani, F.","Dept. of Criminal Justice, Utica Coll., NY, USA","Parallel and Distributed Systems, 2005. Proceedings. 11th International Conference on","20051114","2005","1","","43","49 Vol. 1","To better protect information systems, computation time data protection needs to be considered such that even when the system is partially compromised, the security of the system is still assured. Secure multiparty computation approaches provides a possible solution for computation time data protection, but are too costly (in communication) to be practical. In this paper, we design an adaptive multi-level secure computation algorithm with the goals of reducing the average communication overheads. The adaptive algorithm runs a less secure protocol to reduce the communication overhead when there is no threat. The system adapts to a more secure but less efficient protocol when security threat is detected. Thus, the system yields better performance at normal execution time while still assures security protection at the presence of security threats.","1521-9097","0-7695-2281-5","","10.1109/ICPADS.2005.69","http://ieeexplore.ieee.org.ezproxy.rit.edu/stamp/stamp.jsp?arnumber=1531105","","Communication system security;Computer science;Data security;Information security;Information systems;Internet;Intrusion detection;Protection;Protocols;Scattering","information systems;protocols;security of data","adaptive multilevel secure computation;adaptive multiparty protocol;information systems;secure data protection;secure protocol","","2","","19","","","20-22 July 2005","","IEEE","IEEE Conference Publications"
"Offloading IDS Computation to the GPU","Jacob, N.; Brodley, C.","Dept. of Comput. Sci., Tufts Univ., Medford, MA","Computer Security Applications Conference, 2006. ACSAC '06. 22nd Annual","20061226","2006","","","371","380","Signature-matching intrusion detection systems can experience significant decreases in performance when the load on the IDS-host increases. We propose a solution that off-loads some of the computation performed by the IDS to the graphics processing unit (GPU). Modern GPUs are programmable, stream-processors capable of high-performance computing that in recent years have been used in non-graphical computing tasks. The major operation in a signature-matching IDS is matching values seen operation to known black-listed values, as such, our solution implements the string-matching on the GPU. The results show that as the CPU load on the IDS host system increases, PixelSnort's performance is significantly more robust and is able to outperform conventional Snort by up to 40%","1063-9527","0-7695-2716-7","","10.1109/ACSAC.2006.35","http://ieeexplore.ieee.org.ezproxy.rit.edu/stamp/stamp.jsp?arnumber=4041182","","Central Processing Unit;Computer crashes;Computer graphics;Computer science;Educational institutions;Floods;Intrusion detection;Jacobian matrices;Operating systems;Robustness","coprocessors;security of data","GPU;graphics processing unit;signature-matching intrusion detection system","","15","6","39","","","Dec. 2006","","IEEE","IEEE Conference Publications"
"Multi-pattern signature matching for hardware network intrusion detection systems","Haoyu Song; Lockwood, J.W.","Dept. of Comput. Sci. & Eng., Washington Univ., St. Louis, MO, USA","Global Telecommunications Conference, 2005. GLOBECOM '05. IEEE","20060123","2005","3","","5 pp.","","Network intrusion detection system (NIDS) performs deep inspections on the packet payload to identify, deter and contain the malicious attacks over the Internet. It needs to perform exact matching on multi-pattern signatures in real time. In this paper we introduce an efficient data structure called extended Bloom filter (EBF) and the corresponding algorithm to perform the multi-pattern signature matching. We also present a technique to support long signature matching so that we need only to maintain a limited number of supported signature lengths for the EBFs. We show that at reasonable hardware cost we can achieve very fast and almost time-deterministic exact matching for thousands of signatures. The architecture takes the advantages of embedded multi-port memories in FPGAs and can be used to build a full-featured hardware-based NIDS.","","0-7803-9414-3","","10.1109/GLOCOM.2005.1577937","http://ieeexplore.ieee.org.ezproxy.rit.edu/stamp/stamp.jsp?arnumber=1577937","","Costs;Data structures;Hardware;IP networks;Information filtering;Information filters;Inspection;Intrusion detection;Matched filters;Payloads","Internet;data structures;field programmable gate arrays;handwriting recognition;nonlinear filters;pattern matching;security of data","FPGA;Internet;data structure;extended Bloom filter;hardware network intrusion detection systems;malicious attacks;multipattern signature matching;packet payload;time-deterministic exact matching","","10","7","16","","","28 Nov.-2 Dec. 2005","","IEEE","IEEE Conference Publications"
"Intrusion detection using error correcting output code based ensemble","AbdElrahman, S.M.; Abraham, A.","Fac. of Comput. Sci. & Inf. Technol., Sudan Univ. of Sci. & Technol., Khartoum, Sudan","Hybrid Intelligent Systems (HIS), 2014 14th International Conference on","20150416","2014","","","181","186","Intrusion Detection System is an essential part in computer security. Researchers have proposed many methods but most of them suffer from low detection rates and high false alarm rates. In this paper, we try to tackle the class imbalance problem, increase detection rates for each class and minimize false alarms in intrusion detection system. We test the performance of seven classifiers using Bagging and AdaBoost ensemble methods. We proposed a new hybrid ensemble for intrusion detection based on Error Correcting Output Code (ECOC) approach.","","978-1-4799-7632-4","","10.1109/HIS.2014.7086194","http://ieeexplore.ieee.org.ezproxy.rit.edu/stamp/stamp.jsp?arnumber=7086194","Error Correcting Output Code (ECOC);Intrusion Detection;ensemble","Accuracy;Bagging;Biological system modeling;Intrusion detection;Learning systems;Support vector machines;Vegetation","error correction codes;learning (artificial intelligence);security of data","AdaBoost ensemble method;ECOC approach;bagging ensemble;class imbalance problem;computer security;detection rate;error correcting output code approach;error correcting output code based ensemble;false alarm rate;hybrid ensemble;intrusion detection system","","0","","17","","","14-16 Dec. 2014","","IEEE","IEEE Conference Publications"
"Web Anomaly Detection System for Mobile Web Client","Sung-Min Jang; Yoo-Hun Won","Hongik Univ., Seoul","Future Generation Communication and Networking (FGCN 2007)","20080107","2007","2","","543","547","Careless development of Web applications has often caused occurrence of new Web-based attacks. The signature-based intrusion detection system cannot detect these attacks as it seems to lack the capability to deal with such various new intrusions. As a result, it is necessary to research and develop new types of detection methods that can detect new intrusions as well as protect the system from previous well-known attacks. In this paper, we propose a web anomaly detection system. This system can detect suspicious Web traffic using an HTTP traffic pattern analysis and the URI field information analysis of the HTTP packet. We also demonstrate the feasibility of the proposed system by implementing the system and showing some reasonable results.","","0-7695-3048-6","","10.1109/FGCN.2007.232","http://ieeexplore.ieee.org.ezproxy.rit.edu/stamp/stamp.jsp?arnumber=4426301","","Computer crime;Engines;Face detection;Intrusion detection;Pattern analysis;Pattern matching;Performance analysis;Protection;Telecommunication traffic;Traffic control","Internet;authorisation;client-server systems;digital signatures;mobile computing;telecommunication security;telecommunication traffic","HTTP traffic pattern analysis;Internet firewalls;Web anomaly detection system;Web traffic;mobile Web client;signature-based intrusion detection system","","1","","17","","","6-8 Dec. 2007","","IEEE","IEEE Conference Publications"
"The impact of enclave network devices to the tactical inter-service architecture","Lundberg, M.; Xinyu Wang; Ertekin, E.; Rhodes, D.","Booz Allen Hamilton, Evanston, IL, USA","MILITARY COMMUNICATIONS CONFERENCE, 2012 - MILCOM 2012","20130128","2012","","","1","6","United States Department of Defense (DoD) Services (e.g., Army, Navy, Air Force) deploy different network devices in their enclave networks. These devices provide edge network functions such as information assurance, plain text routing, admission and congestion control, and TCP performance enhancements. Due to the different enclave network implementations in different Service networks, interoperability issues arise when connecting enclave networks between different Services. This paper describes tactical user enclave network implementations within the DoD's Global Information Grid, and how these networks currently achieve interoperable connectivity by backhauling traffic to fixed gateways connected to the Defense Information Systems Network (DISN) core. This paper examines three gateway options, including a cipher text gateway, a plain text gateway, and a Joint plain text gateway for providing interoperable inter-Service connectivity within the tactical environment. We provide qualitative comparisons of these architecture options and provide recommendations for their use in creating an interoperable tactical architecture.","2155-7578","978-1-4673-1729-0","","10.1109/MILCOM.2012.6415600","http://ieeexplore.ieee.org.ezproxy.rit.edu/stamp/stamp.jsp?arnumber=6415600","","Cryptography;Interoperability;Joints;Logic gates;Performance evaluation;Routing;Silicon","cryptography;grid computing;internetworking;military communication;open systems;telecommunication traffic;text analysis","DISN core;DoD global information grid;DoD services;United States Department of Defense;backhauling traffic;cipher text gateway;defense information systems network;edge network function;enclave network devices;interoperability;joint plain text gateway;plain text gateway;service networks;tactical interservice architecture;tactical user enclave network","","0","","9","","","Oct. 29 2012-Nov. 1 2012","","IEEE","IEEE Conference Publications"
"Table of contents - Volume 2","","","Artificial Intelligence and Computational Intelligence (AICI), 2010 International Conference on","20101203","2010","2","","v","xii","Presents the table of contents of the proceedings.","","978-1-4244-8432-4","","10.1109/AICI.2010.367","http://ieeexplore.ieee.org.ezproxy.rit.edu/stamp/stamp.jsp?arnumber=5655018","","","","","","0","","","","","23-24 Oct. 2010","","IEEE","IEEE Conference Publications"
