"Direction finding of a compromised node in a spread-spectrum network","Torrieri, D.","","MILITARY COMMUNICATIONS CONFERENCE, 2012 - MILCOM 2012","20130128","2012","","","1","6","When a spread-spectrum receiver in a network discovers that it is processing a jamming signal transmitted by a compromised node, its first response is to attempt to identify the compromised node. In this paper, an adaptive array is used to find the direction to the jamming source despite the presence of interference signals transmitted by both legitimate network nodes and external sources. Unlike other direction-finding algorithms, the desired-signal classification (DESIC) algorithm requires no information or special assumptions about the interference signals to effectively cancel them and find the desired direction. Simulation experiments show that the DESIC algorithm provides an excellent performance in many scenarios, even when the received signals cannot be resolved by the widely used MUSIC algorithm.","2155-7578","978-1-4673-1729-0","","10.1109/MILCOM.2012.6415599","http://ieeexplore.ieee.org.ezproxy.rit.edu/stamp/stamp.jsp?arnumber=6415599","","Arrays;Direction of arrival estimation;Fading;Interference;Monitoring;Multiple signal classification;Vectors","jamming;radio receivers;signal classification;spread spectrum communication","DESIC algorithm;MUSIC algorithm;adaptive array;compromised node;desired-signal classification;direction finding;interference signals;jamming signal;jamming source;spread-spectrum network;spread-spectrum receiver","","1","","11","","","Oct. 29 2012-Nov. 1 2012","","IEEE","IEEE Conference Publications"
"Embedded Intrusion Detection and Authority Management System","Jian-Xia Wang; Wan-Zhen Zhou; Yun-Feng Xu","Coll. of Inf. Sci. & Eng., Hebei Univ. of Sci. & Technol., Shijiazhuang","Computer Science and Software Engineering, 2008 International Conference on","20081222","2008","3","","982","985","In order to monitor network transmission effectively and safely and detect suspicious behavior in the network, the intrusion detection software was solidified in embedded hardware development board based on the SBC84620. The system adopted real-time Linux operating system used in the field of industrial widely, achieved real-time detection and prevention to hacking attack including port scans, buffer overflow attacks, backdoor attack, DOS attacks, and other information-gathering network, and so on, reduced development costs, increased data processing speed.","","978-0-7695-3336-0","","10.1109/CSSE.2008.639","http://ieeexplore.ieee.org.ezproxy.rit.edu/stamp/stamp.jsp?arnumber=4722507","Authority Management;Embedded;Intrusion Detection","Buffer overflow;Computer crime;Embedded software;Hardware;Intrusion detection;Linux;Monitoring;Operating systems;Real time systems;Software safety","Linux;computer networks;microprocessor chips;security of data","DOS attacks;SBC84620;authority management system;backdoor attack;buffer overflow attacks;embedded intrusion detection;hacking attack;network transmission;real-time Linux operating system","","0","","4","","","12-14 Dec. 2008","","IEEE","IEEE Conference Publications"
"Security Rules Specification and Analysis Based on Passive Testing","Mallouli, W.; Bessayah, F.; Cavalli, A.; Benameur, A.","","Global Telecommunications Conference, 2008. IEEE GLOBECOM 2008. IEEE","20081208","2008","","","1","6","Security is a critical issue in dynamic and open distributed environments such as network-based services or wireless networks. To ensure that a certain level of security is maintained in such environments, the system behavior has to be restrained by a security policy in order to regulate the nature and the context of actions that can be performed within the system, according to specific roles. In this paper, we propose a passive testing approach that permits to check whether a system respects its security policy. To reach this goal, we specify this policy using 'Nomad' formal language which is based on deontic and temporal logics. This language is well adapted to passive testing methods that aim to analyze collected system execution traces in order to give a verdict about their conformity with to the system security requirements. Finally, we apply our methodology to an industrial case study provided by SAP group to demonstrate its reliability.","1930-529X","978-1-4244-2324-8","","10.1109/GLOCOM.2008.ECP.400","http://ieeexplore.ieee.org.ezproxy.rit.edu/stamp/stamp.jsp?arnumber=4698175","","Automatic testing;Data security;Formal languages;Formal specifications;Information security;Logic testing;Monitoring;System testing;Telecommunications;Wireless networks","formal languages;formal specification;program testing;security of data;systems analysis;temporal logic","'Nomad' formal language;deontic logics;network-based services;passive testing;security rules analysis;security rules specification;temporal logics;wireless networks","","1","","17","","","Nov. 30 2008-Dec. 4 2008","","IEEE","IEEE Conference Publications"
"PID-Based Feature Weight Learning and Its Application in Intrusion Detection","Qian Quan; Cai Yu-hua; Wu Yue","Sch. of Comput. Eng. & Sci., Shanghai Univ., Shanghai, China","Computer Science and Information Engineering, 2009 WRI World Congress on","20090724","2009","5","","570","574","In case-based reasoning (CBR), cases are generally represented by features. Different features have different importance, which are often described by weights. So how to adaptively learning weights of different features is a very key issue in CBR, which impact directly the quality and performance of case extraction. Currently, in most practical CBR systems, the feature weights are given by domain experts subjectively. In this paper, we propose a PID operator-based feature weight learning method based on the fundamental theory of the control system. PID-based feature weighting method is a self-adaptive method, which utilizing the similar neural network architecture to construct the case base. Through designing 3 kinds of adjusting operators: Proportional, integral and derivative operator (PID), and each operator with different properties: reactive, prudent and sensitive, we can adjust the feature weight from different point of views, such as the current adjust results, the history results or the last two results. In order to evaluate the effectiveness of the method, the experiment of network anomaly detection is conducted and the experimental results show that all 3 operators are effective which can converge the intrusion detection system into a stable state in relative small iterations.","","978-0-7695-3507-4","","10.1109/CSIE.2009.355","http://ieeexplore.ieee.org.ezproxy.rit.edu/stamp/stamp.jsp?arnumber=5170599","Feature Weight Learning;Intrusion Detection;PID operators","Application software;Computer science;Control systems;Costs;History;Indexing;Intrusion detection;Learning systems;Neural networks;Three-term control","adaptive control;case-based reasoning;learning (artificial intelligence);learning systems;neurocontrollers;security of data;self-adjusting systems;stability;three-term control","CBR system;PID-based feature weight learning method;adaptively learning weight;case-based reasoning;domain expert;intrusion detection system;network anomaly detection;neural network architecture;proportional-integral-and-derivative operator;self-adaptive method;stable state","","0","","16","","","March 31 2009-April 2 2009","","IEEE","IEEE Conference Publications"
"Real-time intrusion detection for ad hoc networks","Stamouli, I.; Argyroudis, P.G.; Tewari, H.","Dept. of Comput. Sci., Dublin Univ., Ireland","World of Wireless Mobile and Multimedia Networks, 2005. WoWMoM 2005. Sixth IEEE International Symposium on a","20050627","2005","","","374","380","A mobile ad hoc network is a collection of nodes that are connected through a wireless medium and form rapidly changing topologies. The widely accepted existing routing protocols designed to accommodate the needs of such self-organised networks do not address possible threats aimed at the disruption of the protocol itself. The assumption of a trusted environment is not one that can be realistically expected; hence several efforts have been made towards the design of a secure routing protocol for ad hoc networks. The main problems with this approach are that it requires changes to the underlying routing protocol and that manual configuration of the initial security associations cannot be completely avoided. We propose RIDAN, a novel architecture that uses knowledge-based intrusion detection techniques to detect, in real-time, attacks that an adversary can perform against the routing fabric of a mobile ad hoc network. Our system is designed to take countermeasures minimising the effectiveness of an attack and maintaining the performance of the network within acceptable limits. RIDAN does not introduce any changes to the underlying routing protocol since it operates as an intermediate component between the network traffic and the utilised protocol with minimum processing overhead. We have developed a prototype that was evaluated in AODV-enabled networks using the ns-2 network simulator.","","0-7695-2342-0","","10.1109/WOWMOM.2005.85","http://ieeexplore.ieee.org.ezproxy.rit.edu/stamp/stamp.jsp?arnumber=1443525","","Ad hoc networks;Computer science;Data security;Educational institutions;Intrusion detection;Mobile ad hoc networks;Network topology;Routing protocols;Telecommunication traffic;Traffic control","ad hoc networks;knowledge based systems;minimisation;mobile computing;mobile radio;routing protocols;security of data;telecommunication computing;telecommunication network topology;telecommunication security","knowledge-based techniques;minimisation;mobile ad hoc networks;network topologies;real-time intrusion detection;secure routing protocol","","12","","14","","","13-16 June 2005","","IEEE","IEEE Conference Publications"
"The Method of Classified Danger Sensed for Windows Process Intrusion Detection","Fei Xu; Chengyu Tan; Yi Zheng; Ming Geng","Sch. of Comput. Sci., Wuhan Univ., Wuhan, China","Management of e-Commerce and e-Government, 2009. ICMECG '09. International Conference on","20091006","2009","","","469","472","Once the computer system is intruded, the change from normal to abnormal is a gradual procedure. Setting up a calculating model based on danger theory for danger signal during the procedure will improve the accuracy and efficiency of artificial immune system (AIS) greatly. In this paper, the method of classified danger sensed (MCDS) for windows process intrusion detection based on danger theory is proposed. This method divides the processpsilas behavior parameters into two types: numeric and non-numeric types, using the functionpsilas difference and correlation coefficient to analyze the rule and relevance of numeric parameterspsila change, and evaluating the degree of danger of non-numeric parameters by analyzing the danger level and time relationship (TR) of data. Based on these methods, we establish calculating models of numeric and non-numeric danger signals separately, finally give the definition and calculating method of ""danger degree"".","","978-0-7695-3778-8","","10.1109/ICMeCG.2009.72","http://ieeexplore.ieee.org.ezproxy.rit.edu/stamp/stamp.jsp?arnumber=5280069","Artificial Immune System;Danger Sensed;Information Security;Intrusion Detection","Artificial immune systems;Clouds;Computer science;Conference management;Data analysis;Electronic government;Information security;Intrusion detection;Numerical models;Statistical analysis","artificial immune systems;operating systems (computers);security of data","Windows process intrusion detection;artificial immune system;computer system;danger theory model;method-of-classified danger sensed","","0","","8","","","16-19 Sept. 2009","","IEEE","IEEE Conference Publications"
"Using Hilbert-Huang Transform to Characterize Intrusions in Computer Networks","Weihong Wang; Kai Pei; Xiaogang Jin","Zhejiang Univ. of Technol., Hangzhou","Natural Computation, 2007. ICNC 2007. Third International Conference on","20071105","2007","5","","749","753","As there is a rapid rampancy of malicious intrusion, people pay more attentions to the network security. This paper presents a new method based on Hilbert-Huang trans- form (HHT) to characterize intrusions that can detect many kinds of intrusion according to the number of packets. This paper demonstrates the usefulness of such a method to differentiate abnormal data from normal data. Experiments are performed using intrusion detection data sets and tested for validation. Some results are reported along with analysis and concluding remarks.","","978-0-7695-2875-5","","10.1109/ICNC.2007.801","http://ieeexplore.ieee.org.ezproxy.rit.edu/stamp/stamp.jsp?arnumber=4344938","","Artificial intelligence;Computer networks;Computer science;Computer security;Data security;Educational institutions;Intrusion detection;Programming;Space technology;Testing","Hilbert transforms;computer networks;security of data","Hilbert-Huang transform;computer networks;intrusion detection data sets;malicious intrusion;network security","","0","","13","","","24-27 Aug. 2007","","IEEE","IEEE Conference Publications"
"Realization of product quality and food security internet public opinion supervision system","Wang Su; Liang Meiyu; Gao Tian; Du Junping","Beijing Key Lab. of Intell. Telecommun. Software & Multimedia, Beijing Univ. of Posts & Telecommun., Beijing, China","Intelligent Control and Automation (WCICA), 2010 8th World Congress on","20100823","2010","","","2735","2740","This paper presents the outline, composition, key technologies, structure and the function as well as the actual operating conditions for the Internet public opinion supervision system for product quality and food safety. The system combines the vertical search engine technology and the network information mining technology and carries on the filtration, collection and compiling of the English report, prediction information and reviews, etc. The system runs well and satisfies the requirement for product quality and food safety Internet public opinion supervision.","","978-1-4244-6712-9","","10.1109/WCICA.2010.5554839","http://ieeexplore.ieee.org.ezproxy.rit.edu/stamp/stamp.jsp?arnumber=5554839","information collection;information extraction;supervision system","Crawlers;Data mining;Databases;HTML;Internet;Search engines;Web pages","Internet;data mining;production management;search engines","Internet;food security;network information mining technology;product quality realization;public opinion supervision system;search engine","","0","","14","","","7-9 July 2010","","IEEE","IEEE Conference Publications"
"A new scheme for detecting misbehaving zone manager with collaborative honesty neighbours","Pakzad, F.; Rafsanjani, M.K.; Saeid, A.B.","Arak Branch, Dept. of Comput. Eng., Islamic Azad Univ., Arak, Iran","Ubi-media Computing (U-Media), 2010 3rd IEEE International Conference on","20100809","2010","","","108","112","In these years, many IDS (intrusion detection system) researches have tended to hierarchical and distributed architecture or hybrid architecture. However, in most of these architectures, monitoring nodes is supposed to be valid nodes in order to initiate IDS and response systems. So, if these nodes have been misbehavior nodes then they can send false information to other nodes or report an innocent node as destructive. In our proposed scheme, a hierarchical distributed model of multi-level intrusion detection is presented to overcome the shortcomings of existing intrusion detection techniques. The network is divided to zones with one zone manager which is monitoring on cluster heads in its zone, but the most important problem is how can recognize the trustworthiness of zone manager which is done by honest neighbors of zone manager. These honest neighbors prevent false accusations, and also allow manager if it is wrongly misbehaving, but if manger repeats its misbehaving then it will lose its management degree.","","978-1-4244-6708-2","","10.1109/UMEDIA.2010.5543917","http://ieeexplore.ieee.org.ezproxy.rit.edu/stamp/stamp.jsp?arnumber=5543917","","Authentication;Collaboration;Computer architecture;Cryptography;Distributed computing;Intrusion detection;Mobile ad hoc networks;Monitoring;Routing;Spread spectrum communication","computer network management;computer network security;groupware;open systems","collaborative honest neighbour;distributed architecture;hierarchical architecture;hybrid architecture;intrusion detection system;management degree;zone manager","","0","","12","","","5-6 July 2010","","IEEE","IEEE Conference Publications"
"DKSM: Subverting Virtual Machine Introspection for Fun and Profit","Bahram, S.; Xuxian Jiang; Zhi Wang; Grace, M.; Jinku Li; Srinivasan, D.; Junghwan Rhee; Dongyan Xu","North Carolina State Univ., Raleigh, NC, USA","Reliable Distributed Systems, 2010 29th IEEE Symposium on","20101109","2010","","","82","91","Virtual machine (VM) introspection is a powerful technique for determining the specific aspects of guest VM execution from outside the VM. Unfortunately, existing introspection solutions share a common questionable assumption. This assumption is embodied in the expectation that original kernel data structures are respected by the untrusted guest and thus can be directly used to bridge the well-known semantic gap. In this paper, we assume the perspective of the attacker, and exploit this questionable assumption to subvert VM introspection. In particular, we present an attack called DKSM (Direct Kernel Structure Manipulation), and show that it can effectively foil existing VM introspection solutions into providing false information. By assuming this perspective, we hope to better understand the challenges and opportunities for the development of future reliable VM introspection solutions that are not vulnerable to the proposed attack.","1060-9857","978-0-7695-4250-8","","10.1109/SRDS.2010.39","http://ieeexplore.ieee.org.ezproxy.rit.edu/stamp/stamp.jsp?arnumber=5623380","Direct Kernel Structure Manipulation;Introspection;Virtualization","Data structures;Kernel;Malware;Monitoring;Reliability;Semantics;Switches","data structures;security of data;virtual machines","direct kernel structure manipulation;kernel data structures;virtual machine introspection","","23","","25","","","Oct. 31 2010-Nov. 3 2010","","IEEE","IEEE Conference Publications"
"E-Risk Management through Self Insurance: An Option Model","Arunabha Mukhopadhyay; Binay Bhushan Chakrabarti; Saha, D.; Ambuj Mahanti","Inst. of Manage., Calcutta","System Sciences, 2007. HICSS 2007. 40th Annual Hawaii International Conference on","20070129","2007","","","158b","158b","E-business organizations are under constant threat of their business being disrupted by hackers, viruses and a host of malicious attackers. This would lead to loses to the tune of millions. To ensure self-protection, they spend millions of dollars on firewalls, anti-virus, intrusion detection systems, digital signature and encryption. Nonetheless, a new virus or a clever hacker can easily compromise these deterrents. Organizations should resort to self e-risk insurance as a supplementary mechanism to reduce these individual financial losses. In this paper we propose two option modes for self- e-risk insurance, for hedging e-risk. The first is an exchange traded model, comprising of a long asset, long put and short call. The second is an over the counter model using a long call","1530-1605","","0-7695-2755-8","10.1109/HICSS.2007.192","http://ieeexplore.ieee.org.ezproxy.rit.edu/stamp/stamp.jsp?arnumber=4076698","e-commerce;e-risk;option model;security breach;self-insurance.","Computer crime;Computer hacking;Conference management;Data security;Hardware;Insurance;Internet;Intrusion detection;Network servers;USA Councils","business data processing;insurance data processing;risk management;security of data","digital signature;e-business organization;e-risk management;e-risk self insurance;encryption;intrusion detection system","","0","","21","","","Jan. 2007","","IEEE","IEEE Conference Publications"
"A methodology for evaluating runtime support in network processors","Xin Huang; Wolf, T.","Dept. of Electr. & Comput. Eng., Massachusetts Univ., Amherst, MA","Architecture for Networking and Communications systems, 2006. ANCS 2006. ACM/IEEE Symposium on","20080725","2006","","","113","122","Modern network processor systems require the ability to adapt their processing capabilities at runtime to changes in network traffic. Traditionally, network processor applications have been optimized for a single static workload scenario, but recently several approaches for run-time adaptation have been proposed. Comparing these approaches and developing novel run-time support algorithms is difficult due to the multicore system-on-a-chip nature of network processors. In this paper, we present a model for network processors that can aid in evaluating different run-time support systems. The model considers workload characteristics of applications and network traffic. We use a queuing network abstraction to model different runtime systems. We illustrate the effectiveness of this model by comparing the performance of two existing workload adaptation algorithms.","","978-1-59593-580-9","","","http://ieeexplore.ieee.org.ezproxy.rit.edu/stamp/stamp.jsp?arnumber=4579529","network processors;runtime management;workload partitioning and mapping","Application software;Concurrent computing;Multicore processing;Network servers;Partitioning algorithms;Permission;Runtime;System-on-a-chip;Telecommunication traffic;Traffic control","Internet;performance evaluation;queueing theory;system-on-chip;telecommunication network routing;telecommunication traffic","multicore system-on-a-chip;network processors;network traffic;queuing network;run-time adaptation;runtime support","","0","3","32","","","3-5 Dec. 2006","","IEEE","IEEE Conference Publications"
"Integrating Security with QoS in Next Generation Networks","Taleb, T.; Aoul, Y.H.; Benslimane, A.","NEC Eur. Ltd., Heidelberg, Germany","Global Telecommunications Conference (GLOBECOM 2010), 2010 IEEE","20110110","2010","","","1","5","Along with recent Internet security threats, different security measures have emerged. Whilst these security schemes ensure a level of protection against such threats, they sometimes have significant impact on perceived Quality of Service (QoS). There is thus need to retrieve ways for an efficient integration of security requirements with their QoS counterparts. In this paper, we devise a Quality of Protection framework that tunes between security requirements and QoS using a multi-attribute decision making model. The performance of the proposed approach is evaluated and verified via a use case study using computer simulations.","1930-529X","978-1-4244-5636-9","978-1-4244-5637-6","10.1109/GLOCOM.2010.5683321","http://ieeexplore.ieee.org.ezproxy.rit.edu/stamp/stamp.jsp?arnumber=5683321","","Delay;Grippers;IPTV;Monitoring;Quality of service;Security","Internet;decision making;next generation networks;quality of service;security of data;telecommunication security","Internet security threat;QoS;multiattribute decision making model;network security;next generation networks;quality of protection framework;quality of service","","0","","14","","","6-10 Dec. 2010","","IEEE","IEEE Conference Publications"
"Intrusion detection through artificial neural networks","de Lima, I.V.M.; Degaspari, J.A.; Sobral, J.B.M.","Comput. Sci. Program, Fed. Univ. of Santa Catarina, Florianopolis","Network Operations and Management Symposium, 2008. NOMS 2008. IEEE","20080826","2008","","","867","870","The main problem with rule-based intrusion detection systems is the update discrepancy in their knowledge base, in relation the continuous differentiated forms of intrusion. Those IDSs basically work based on the misuse detection method, which monitors network and computers for known attack patterns. This article shows the build of a prototype for a network intrusion detection system, that uses an artificial neural network as a detection mechanism. In the network training and learning phases, which are an adaptive process, the knowledge base of IDS Snort was applied. The built IDSs allow the detection of an acceptable proportion of variants of intrusion, beyond the already known intrusion forms. This last characteristic presents expressive advantages comparing to intrusion detection systems purely based on rules, because it dismisses the use of an extensive knowledge base and solves the false negative and false positive problems, through the fine adjustment of weights, given by the variation of the acceptation rate in the network output, when the network is trained.","1542-1201","978-1-4244-2065-0","978-1-4244-2066-7","10.1109/NOMS.2008.4575234","http://ieeexplore.ieee.org.ezproxy.rit.edu/stamp/stamp.jsp?arnumber=4575234","","Artificial neural networks;Computer displays;Computer networks;Computer science;Intrusion detection;Monitoring;Neural networks;Packaging;Protection;Prototypes","computer networks;knowledge based systems;learning (artificial intelligence);neural nets;security of data;telecommunication security","IDS Snort;adaptive process;artificial neural network;intrusion detection;knowledge base;learning phase;network training","","0","","15","","","7-11 April 2008","","IEEE","IEEE Conference Publications"
"Program at a glance","","","Computers and Communications (ISCC), 2013 IEEE Symposium on","20140306","2013","","","000101","000119","Provides a schedule of conference events and a listing of which papers were presented in each session.","","","","10.1109/ISCC.2013.6754931","http://ieeexplore.ieee.org.ezproxy.rit.edu/stamp/stamp.jsp?arnumber=6754931","","","","","","0","","","","","7-10 July 2013","","IEEE","IEEE Conference Publications"
