"Optimal Index Policies for Anomaly Localization in Resource-Constrained Cyber Systems","Cohen, K.; Qing Zhao; Swami, A.","Dept. of Electr. & Comput. Eng., Univ. of California, Davis, Davis, CA, USA","Signal Processing, IEEE Transactions on","20140721","2014","62","16","4224","4236","The problem of anomaly localization in a resource-constrained cyber system is considered. Each anomalous component of the system incurs a cost per unit time until its anomaly is identified and fixed. Different anomalous components may incur different costs depending on their criticality to the system. Due to resource constraints, only one component can be probed at each given time. The observations from a probed component are realizations drawn from two different distributions depending on whether the component is normal or anomalous. The objective is a probing strategy that minimizes the total expected cost, incurred by all the components during the detection process, under reliability constraints. We consider both independent and exclusive models. In the former, each component can be abnormal with a certain probability independent of other components. In the latter, one and only one component is abnormal. We develop optimal index policies under both models. The proposed index policies apply to a more general case where a subset (more than one) of the components can be probed simultaneously. The problem under study also finds applications in spectrum scanning in cognitive radio networks and event detection in sensor networks.","1053-587X","","","10.1109/TSP.2014.2332982","http://ieeexplore.ieee.org.ezproxy.rit.edu/stamp/stamp.jsp?arnumber=6844162","Anomaly localization;composite hypothesis testing;sequential hypothesis testing;sequential probability ratio test (SPRT)","Approximation methods;Computational modeling;Delays;Indexes;Optimization;Search problems;Testing","indexing;probability;reliability;resource allocation;security of data","anomalous components;anomaly localization;cognitive radio networks;event detection;optimal index policies;probing strategy;reliability constraints;resource-constrained cyber systems;sensor networks;spectrum scanning","","3","","32","","2014-06-25","Aug.15, 2014","","IEEE","IEEE Journals & Magazines"
"Experimental results of cross-site exchange of web content Anomaly Detector alerts","Boggs, N.; Hiremagalore, S.; Stavrou, A.; Stolfo, S.J.","Dept. of Comput. Sci., Columbia Univ., New York, NY, USA","Technologies for Homeland Security (HST), 2010 IEEE International Conference on","20101203","2010","","","8","14","We present our initial experimental findings from the collaborative deployment of network Anomaly Detection (AD) sensors. Our system examines the ingress http traffic and correlates AD alerts from two administratively disjoint domains: Columbia University and George Mason University. We show that, by exchanging packet content alerts between the two sites, we can achieve zero-day attack detection capabilities with a relatively small number of false positives. Furthermore, we empirically demonstrate that the vast majority of common abnormal data represent attack vectors rather than false positives. We posit that cross-site collaboration enables the automated detection of common abnormal data which are likely to ferret out zero-day attacks with high accuracy and minimal human intervention.","","978-1-4244-6047-2","","10.1109/THS.2010.5655103","http://ieeexplore.ieee.org.ezproxy.rit.edu/stamp/stamp.jsp?arnumber=5655103","","Computational modeling;Correlation;Data models;Detectors;Humans;Web server","Internet;security of data","Web content anomaly detector alerts;cross site exchange;packet content alerts;zero day attack detection","","2","","21","","","8-10 Nov. 2010","","IEEE","IEEE Conference Publications"
"Outlier Preprocessing in Wireless Sensor Networks: A Two-Layered Ellipse Approach","Khamis, I.; Zeyar Aung","Dept. of Comput. Sci. & Electr. Eng., Masdar Inst. of Sci. & Technol., Masdar, United Arab Emirates","Developments in eSystems Engineering (DeSE), 2013 Sixth International Conference on","20150212","2013","","","73","78","Sensor nodes in wireless sensor networks have limited energy resources and this hinders the dissemination of the gathered data to a central location. This stimulated our research to make use of the limited computational capabilities of these sensor nodes to build a normal model of the data gathered. Hence by having the normal model, anomalies can then be detected and forwarded to a central location. This process is done locally in the sensor nodes and hence reduces the power consumption used in transmitting all the data. Our algorithm is an enhanced version of the Data Capture Anomalies Detection Algorithm, which is used to compute a local model of the normal data in wireless sensor networks. In this paper the Data Capture Anomalies Detection is used to partition the data and then send all the data to a central server for data classification, building on the Data Capture Anomalies Detection method and in order to classify the partitioned data, our algorithm Two-Layered Data Capture Anomalies Detection sends anomalies (2%) as well as roughly (2% or 4%) of normal data for further data processing and classification purposes. Experimental results on synthetic data show that Two-Layered Data Capture Anomalies Detection is able to provide promising results.","2161-1343","978-1-4799-5263-2","","10.1109/DeSE.2013.22","http://ieeexplore.ieee.org.ezproxy.rit.edu/stamp/stamp.jsp?arnumber=7041095","anomaly detection;distributed data mining;elliptical boundary estimation;two-layered ellipse approach;wireless sensor network","Artificial neural networks;Conferences;Covariance matrices;Data mining;Partitioning algorithms;Support vector machines;Wireless sensor networks","data mining;pattern classification;wireless sensor networks","outlier preprocessing;partitioned data classification;two-layered data capture anomaly detection algorithm;two-layered ellipse approach;wireless sensor networks","","0","","18","","","16-18 Dec. 2013","","IEEE","IEEE Conference Publications"
"Investigating False Positive Reduction in HTTP via Procedure Analysis","Abimbola, A.A.; Munoz, J.M.; Buchanan, W.J.","Sch. of Comput., Napier Univ., Scotland","Networking and Services, 2006. ICNS '06. International conference on","20060918","2006","","","87","87","This paper focuses on high false-positive rate of attacks. First, the merits and demerits of research work in curbing false positive rate of attacks in intrusion detection systems (IDSs) are discussed. Then we present our research efforts in the form of an IDS called NetHost-Sensor, recap on past NetHost-Sensor research contributions and discusses in detail its novel procedure analysis technique in curbing false-positive. We discuss in detail, the NetHost-Sensor methodology, its procedure analysis technique and report on our experimental investigation that shows the reduction of false-positives, using HTTP network communication as a medium for analysis. Finally, we validate our research work by comparing false-positives with Snort IDS","","0-7695-2622-5","","10.1109/ICNS.2006.65","http://ieeexplore.ieee.org.ezproxy.rit.edu/stamp/stamp.jsp?arnumber=1690558","","Databases;Expert systems;Fingerprint recognition;Intrusion detection;Monitoring;Operating systems;Pattern matching;Statistical analysis;Web server","Internet;security of data;transport protocols","HTTP network communication;NetHost-Sensor;Snort IDS;false positive attack rate reduction;intrusion detection systems;procedure analysis technique","","2","","19","","","16-18 July 2006","","IEEE","IEEE Conference Publications"
"Modeling and Analysis of Trust Management for Cognitive Mission-Driven Group Communication Systems in Mobile Ad Hoc Networks","Jin-Hee Cho; Swami, A.; Ing-Ray Chen","Res. Lab., Comput. & Inf. Sci. Directorate, U.S. Army, Adelphi, MD, USA","Computational Science and Engineering, 2009. CSE '09. International Conference on","20091009","2009","2","","641","650","We develop and analyze a trust management protocol for cognitive mission-driven group communication systems (GCSs) in mobile ad hoc networks (MANETs) using hierarchical modeling techniques based on stochastic Petri nets. The goal is to efficiently establish acceptable trust levels among mobile nodes without prior interactions. We seek to identify the optimal length of a trust chain among peers in a trust Web so as to maximize the trust levels for peers on the trust chain, by trading off trust space for trust level. The cognitive nodes in the network can dynamically adapt to changing network environments by adjusting their design parameter settings over time to establish an acceptable trust level with other nodes. We define a trust metric that captures unique characteristics of trust concepts in such MANETs. We demonstrate that an optimal trust chain exists for maximizing the trust metric.","","978-1-4244-5334-4","978-0-7695-3823-5","10.1109/CSE.2009.68","http://ieeexplore.ieee.org.ezproxy.rit.edu/stamp/stamp.jsp?arnumber=5283838","cognitive networks;hierarchical modeling;mobile ad hoc networks;reliability.;social networks;stochastic Petri nets;trust chain;trust management;trust metric","Collaboration;Communication system security;Decision making;Military computing;Mobile ad hoc networks;Peer to peer computing;Petri nets;Protocols;Routing;Topology","Petri nets;ad hoc networks;cryptographic protocols;mobile radio;peer-to-peer computing;stochastic processes","MANET;cognitive mission-driven group communication system;cryptography;hierarchical modeling techniques;mobile ad hoc network;peer to peer network;stochastic Petri net;trust Web;trust management protocol","","16","","24","","","29-31 Aug. 2009","","IEEE","IEEE Conference Publications"
"Network Function Placement for NFV Chaining in Packet/Optical Datacenters","Ming Xia; Shirazipour, M.; Ying Zhang; Green, H.; Takacs, A.","Ericsson Res. Silicon Valley, San Jose, CA, USA","Lightwave Technology, Journal of","20150309","2015","33","8","1565","1570","In an operator's datacenter, optical technologies can be employed to perform network function (NF) chaining for larger aggregated flows in parallel with the conventional packet-based fine-grained traffic steering schemes. When network function virtualization (NFV) is enabled, virtualized NFs (vNF) can be placed when and where needed. In this study, we identify the possibility of minimizing the expensive optical/electronic/optical (O/E/O) conversions for NFV chaining in packet/optical datacenters, which is introduced by the on-demand placement of vNFs. When the vNFs of the same NF chain are properly grouped into fewer pods, traffic flows can avoid unnecessary traversals in the optical domain. We formulate the problem of optimal vNF placement in binary integer programming (BIP), and propose an alternative efficient heuristic algorithm to solve this problem. Evaluation results show that our algorithm can achieve near-optimal O/E/O conversions comparable to BIP. We also demonstrate the effectiveness of our algorithm under various scenarios, with comparison to a simple first-fit algorithm.","0733-8724","","","10.1109/JLT.2015.2388585","http://ieeexplore.ieee.org.ezproxy.rit.edu/stamp/stamp.jsp?arnumber=7005460","Datacenter;datacenter;network function placement;network function virtualization;optical;service chaining","Algorithm design and analysis;Heuristic algorithms;Middleboxes;Noise measurement;Optical fiber networks;Optical packet switching;Optical switches","computer centres;integer programming;optical fibre networks;optical wavelength conversion;telecommunication traffic;virtualisation","BIP;NFV;NFV chaining;binary integer programming;expensive optical-electronic-optical conversions;heuristic algorithm;near-optimal O/E/O conversions;network function placement;network function virtualization;packet-based fine-grained traffic steering schemes;packet-optical data centers;traffic flows;vNF","","1","","14","","2015-01-09","April15, 15 2015","","IEEE","IEEE Journals & Magazines"
"A model of deception during cyber-attacks on information systems","Rowe, N.C.","Dept. of Comput. Sci., U.S. Naval Postgraduate Sch., Monterey, CA, USA","Multi-Agent Security and Survivability, 2004 IEEE First Symposium on","20041220","2004","","","21","30","Deception is a classic technique useful for military operations. With information systems around the world under frequent attack every day, it is appropriate to consider analogies from conventional warfare, and deception has historically been powerful as both a tactic and a strategy. We here systematically enumerate and rank the available deception options for information systems, both offensively and defensively. We then consider how defensive deceptions can be packaged within ""generic excuses"" that are more convincing to an attacker than isolated refusals to obey commands. We describe how the selection of the best generic excuses and excuse application times can be formulated with probabilities as an optimization problem and solved. Our theory lends itself well to computer implementation and we provide several examples.","","0-7803-8799-6","","10.1109/MASSUR.2004.1368414","http://ieeexplore.ieee.org.ezproxy.rit.edu/stamp/stamp.jsp?arnumber=1368414","","Application software;Communication system security;Computer crime;Computer science;Costs;Information security;Information systems;Military computing;Operating systems;Packaging","authorisation;data privacy;information systems;multi-agent systems","Bayesian inference;conventional warfare;cyber attacks;deception model;deception options;generic excuses;human communications;information security;information system;military operations;multiagent system;privacy protection","","2","","32","","","30-31 Aug. 2004","","IEEE","IEEE Conference Publications"
"Circular chain VM protection in AdjointVM","Oktay, U.; Aydin, M.A.; Sahingoz, O.K.","Comput. Eng. Dept., Turkish Air Force Acad., Istanbul, Turkey","Technological Advances in Electrical, Electronics and Computer Engineering (TAEECE), 2013 International Conference on","20130715","2013","","","93","97","Cloud computing is a demanding subject and its fans are increasing day by day in the private or corporate areas. Confidentiality is the most important point of information security with respect to integrity and availability in cloud computing especially in financial, governmental and military usage. An Intrusion Detection System (IDS) service increases the cloud's security level. In this paper, a hybrid approach is introduced that can be used in cloud computing to protect cloud users from the untrusted cloud providers or untrusted employees in a circular chain protection model. This model is proposed over an existing model, AdjointVM, which uses three types of technologies (trusted computing, host-based IDS, virtual machine monitor based IDS) to tackle external and internal threats in cloud systems. The proposed model claims to overcome one of the weakest points of AdjointVM model, and aims to build a more secure cloud environment for the users by adding additional security mechanism between VMs. In the proposed model, responsibility of confidentiality is not giving up only to the providers or cloud administrators, a VM can protect another VM in a circular manner and this results a chain structure and constructs a circular structure to enhance global security of the system. At the same time, users can also manage and monitor their own confidentiality by themselves.","","978-1-4673-5612-1","","10.1109/TAEECE.2013.6557202","http://ieeexplore.ieee.org.ezproxy.rit.edu/stamp/stamp.jsp?arnumber=6557202","AdjointVM;cloud computing;intrusion detection;security;trusted computing;virtual machine","Authentication;Computational modeling;Computer hacking;Cryptography;Military computing;Monitoring","cloud computing;data integrity;security of data;trusted computing;virtual machines","AdjointVM;circular chain VM protection model;cloud administrators;cloud computing security level;cloud providers;corporate areas;external threats;host-based IDS;information availability;information confidentiality;information integrity;information security;internal threats;intrusion detection system service;private areas;trusted computing;untrusted cloud providers;untrusted employees;virtual machine monitor-based IDS","","2","","16","","","9-11 May 2013","","IEEE","IEEE Conference Publications"
"Denial of service attacks: An overview","Zlomislic, V.; Fertalj, K.; Sruk, V.","Fac. of Electr. Eng. & Comput, Univ. of Zagreb, Zagreb, Croatia","Information Systems and Technologies (CISTI), 2014 9th Iberian Conference on","20140814","2014","","","1","6","Denial of service (DoS) attacks present one of the most significant threats to assurance of dependable and secure information systems. Rapid development of new and increasingly sophisticated attacks requires resourcefulness in designing and implementing reliable defences. This paper presents an overview of current DoS attack and defence concepts, from a theoretical and practical point of view. Considering the elaborated DoS mechanisms, main directions are proposed for future research required in defending against the evolving threat..","","","","10.1109/CISTI.2014.6876979","http://ieeexplore.ieee.org.ezproxy.rit.edu/stamp/stamp.jsp?arnumber=6876979","DDoS;Denial of Service;Denial of Sustainability;DoS;Network Security;System Security","Computer crime;Filtering;Floods;Protocols;Reliability;Servers","computer network security;information systems","DoS attacks;defence concepts;denial of service attacks;secure information systems","","0","","51","","","18-21 June 2014","","IEEE","IEEE Conference Publications"
"Notice of Retraction<BR>The Construction and Realization of the Intelligent NIPS Based on the Cloud Security","Jia Tiejun; Wang Xiaogang","Coll. of Electron. & Inf., Shanghai Dianji Univ., Shanghai, China","Information Science and Engineering (ICISE), 2009 1st International Conference on","20100426","2009","","","1885","1888","Notice of Retraction<BR><BR>After careful and considered review of the content of this paper by a duly constituted expert committee, this paper has been found to be in violation of IEEE's Publication Principles.<BR><BR>We hereby retract the content of this paper. Reasonable effort should be made to remove all past references to this paper.<BR><BR>The presenting author of this paper has the option to appeal this decision by contacting TPII@ieee.org.<BR><BR>The cloud security is a safe mode applied super Internet based on the cloud computing, also a new technology and the trend of development on network security. On the basis of outlining the cloud security's superiority, key technologies and the IPS technology, this paper proposes a new cloud security-based intelligent NIPS structure, function, characteristic and difference from general NIPS, finally discusses the way of realizing cloud security-based intelligent NIPS.","","978-1-4244-4909-5","","10.1109/ICISE.2009.1192","http://ieeexplore.ieee.org.ezproxy.rit.edu/stamp/stamp.jsp?arnumber=5455133","","Cloud computing;Data security;Distributed computing;Electronic mail;Grid computing;IP networks;Information security;Intelligent networks;Intelligent structures;Parallel processing","Internet;security of data","cloud computing;cloud security;intelligent network invasion prevention systems;network security;super Internet","","3","","8","","","26-28 Dec. 2009","","IEEE","IEEE Conference Publications"
"Research of Intrusion Detection Based on Support Vector Machine","Gengming Zhu; Junguo Liao","Dept. of Comput. Sci. & Eng., Hunan Univ. of Sci. an Technol. Xiangtan, Xiangtan","Advanced Computer Theory and Engineering, 2008. ICACTE '08. International Conference on","20090106","2008","","","434","438","For the network data sets too large, too slow learning speed problem, in this paper, a SVM algorithm based on space block and sample density is proposed and applied into intrusion and detection. According to the local density the algorithm selects training samples and reduces the number of training sample to enhance learning speed. The algorithm can guarantee the accuracy of detection and at the same time the learning speed of it is faster than the traditional SVM intrusion detection method.","","978-0-7695-3489-3","","10.1109/ICACTE.2008.132","http://ieeexplore.ieee.org.ezproxy.rit.edu/stamp/stamp.jsp?arnumber=4736996","","Computer aided manufacturing;Computer network management;Computer networks;Data engineering;Information security;Intrusion detection;Knowledge engineering;National security;Space technology;Support vector machines","security of data;support vector machines","SVM algorithm;intrusion detection;sample density;space block;support vector machine","","3","","8","","","20-22 Dec. 2008","","IEEE","IEEE Conference Publications"
"The Cyber Security Modeling Language: A Tool for Assessing the Vulnerability of Enterprise System Architectures","Sommestad, T.; Ekstedt, M.; Holm, H.","R. Inst. of Technol., Stockholm, Sweden","Systems Journal, IEEE","20130704","2013","7","3","363","373","The cyber security modeling language (CySeMoL) is a modeling language for enterprise-level system architectures coupled to a probabilistic inference engine. If the computer systems of an enterprise are modeled with CySeMoL, this inference engine can assess the probability that attacks on the systems will succeed. The theory used for the attack-probability calculations in CySeMoL is a compilation of research results on a number of security domains and covers a range of attacks and countermeasures. The theory has previously been validated on a component level. In this paper, the theory is also validated on a system level. A test indicates that the reasonableness and correctness of CySeMoL assessments compare with the reasonableness and correctness of the assessments of a security professional. CySeMoL's utility has been tested in case studies.","1932-8184","","","10.1109/JSYST.2012.2221853","http://ieeexplore.ieee.org.ezproxy.rit.edu/stamp/stamp.jsp?arnumber=6378394","Computer security;expert systems;risk analysis;supervisory control and data acquisition (SCADA) systems","Computer architecture;Computer security;Databases;Probabilistic logic;Software;Systems engineering and theory","inference mechanisms;probability;security of data","CySeMoL assessments;attack-probability calculations;cyber security modeling language;enterprise-level system architectures;probabilistic inference engine","","6","","65","","2012-12-11","Sept. 2013","","IEEE","IEEE Journals & Magazines"
"The Study of an Intrusion Detection Algorithm Model Based on Normal Distribution","Li Kang-rong; Miao Fang","Coll. of Inf. Eng., Chengdu Univ. of Technol., Chengdu","Information Science and Engineering, 2008. ISISE '08. International Symposium on","20081230","2008","2","","443","446","The paper puts forward the basic theory and concept of intrusion detection and discusses the essential principle of intrusion detection technology, especially discusses the technology based on statistic model. At the same time, a basic structure of abnormal intrusion detection system has been designed in the paper. According to the probability theory, a new abnormal intrusion detection algorithm model based on normal distribution is also constructed. Comparing to others, the arithmetic model is simple implement, better operative and reliable. The arithmetic model is worth applying and popularizing.","","978-1-4244-2727-4","","10.1109/ISISE.2008.11","http://ieeexplore.ieee.org.ezproxy.rit.edu/stamp/stamp.jsp?arnumber=4732430","abnormal;algorithm model;intrusion detection;normal distribution","","normal distribution;security of data","intrusion detection algorithm;intrusion detection system;normal distribution","","0","","8","","","20-22 Dec. 2008","","IEEE","IEEE Conference Publications"
"[Title page]","","","Advanced Computer Theory and Engineering (ICACTE), 2010 3rd International Conference on","20100920","2010","3","","i","xx","Conference proceedings title page.","2154-7491","978-1-4244-6539-2","","10.1109/ICACTE.2010.5579826","http://ieeexplore.ieee.org.ezproxy.rit.edu/stamp/stamp.jsp?arnumber=5579826","","","","","","0","","","","","20-22 Aug. 2010","","IEEE","IEEE Conference Publications"
