http://ieeexplore.ieee.org/search/searchresult.jsp?download-format=download-csv&bulkSetSize=2000&refinements%3D4291944822%2C4291944246%26ranges%3D2009_2016_p_Publication_Year%26matchBoolean%3Dtrue%26searchField%3DSearch_All_Text%26queryText%3D%28%28%28%28.QT.UNM.QT.%29+OR+.QT.UNM+Dataset.QT.%29+OR+.QT.Firefox+Dataset.QT.%29+AND+.QT.Intrusion+Detection+System.QT.%29,11/9/2015 16:57,"((((""UNM"") OR ""UNM Dataset"") OR ""Firefox Dataset"") AND ""Intrusion Detection System"")",IEEE,,,,,,,,,,,,,,,,,,,,,,,,,,
Using extended information to refine program behavior profile,Feng Xie; Yong Peng; Dongqing Chen,"China Inf. Technol., Security Evaluation Center, Beijing, China","Communication Technology (ICCT), 2012 IEEE 14th International Conference on",20130502,2012,,,991,995,"System call provides the interface between an application and operating system, which is wildly used to detect network intrusions. By the extraction of extended information from system call stack, a new audit event is constructed and is used to refine the program profile in this paper. We name it as l-call. Meanwhile a Chebyshev's inequality based approach is also proposed to measure the anomaly degree which reflects the degree of deviation from the normal behavior due to the intrusions. Compared with system call, l-call has much more granularity to better describe the program behavior. Although the number of l-call is greater than that of system call which will inevitably lead to greater storage overhead, many experiments show that these costs are at an acceptable level, and l-call-based model has acquired more detection performance than system-call-based model.",,978-1-4673-2100-6,,10.1109/ICCT.2012.6511343,http://ieeexplore.ieee.org/stamp/stamp.jsp?arnumber=6511343,Chebyshev's inequality;anomaly degree;extended information;l-call,,computer network security;data flow analysis;operating systems (computers),Chebyshev inequality based approach;detect network intrusions;extended information;l-call-based model;operating system;program behavior profile refinement;program profile;system call stack;system-call-based model,,0,,11,,,9-11 Nov. 2012,,IEEE,IEEE Conference Publications
Anomaly Based Intrusion Detection Using Data Mining and String Metrics,"Nikolova, E.; Jecheva, V.","Fac. of Comput. Sci. & Eng., Burgas Free Univ., Burgas","Communications and Mobile Computing, 2009. CMC '09. WRI International Conference on",20090304,2009,3,,440,444,Computer systems and networks are subject to electronic attacks with increasing number and severity. Intrusion detection is an important technology in the contemporary world as well as an active area of research. The present paper introduces an adaptive approach of data mining techniques and string metrics in anomaly based intrusion detection systems. The conducted simulation experiments and represented results substantiate the proposed method produces reliable results while monitoring the protected system and alarming the detected attacks.,,978-0-7695-3501-2,,10.1109/CMC.2009.287,http://ieeexplore.ieee.org/stamp/stamp.jsp?arnumber=4797292,Data Mining;Intrusion Detection;String Metrics,Classification tree analysis;Computer networks;Computer science;Computerized monitoring;Data engineering;Data mining;Hamming distance;Intrusion detection;Mobile communication;Mobile computing,data mining;security of data,anomaly based intrusion detection systems;data mining;electronic attacks;string metrics,,1,,12,,,6-8 Jan. 2009,,IEEE,IEEE Conference Publications
Intrusion Detection Based on Variable Prefix of System Call,Qi Zheng; ShengYi Jiang,"Sch. of Inf., Guangdong Univ. of Foreign Studies, Guangzhou, China","Networks Security Wireless Communications and Trusted Computing (NSWCTC), 2010 Second International Conference on",20100607,2010,1,,398,401,"System call trace is one of the behavior characteristics of system process. Each system call of the trace depends on several previous system calls. Using Markov model to capture such probabilistic characteristic of the system call is time consuming. Thus, we use Probabilistic Suffix Tree to extract this feature. PST is trained with the normal system call traces. We define a new measure of abnormal system call trace based on the PST to detect abnormal processes. Experiments show that this measurement can well distinguish between normal and abnormal process.",,978-0-7695-4011-5,978-1-4244-6598-9,10.1109/NSWCTC.2010.98,http://ieeexplore.ieee.org/stamp/stamp.jsp?arnumber=5480959,Intrusion detection;probabilistic suffix tree;system call trace,Communication system security;Computer networks;Data mining;Face detection;Feature extraction;Hidden Markov models;Informatics;Intrusion detection;Statistics;Wireless communication,Markov processes;feature extraction;probability;program diagnostics;security of data;trees (mathematics),Markov model;PST;feature extraction;intrusion detection;probabilistic suffix tree;system call trace,,0,,9,,,24-25 April 2010,,IEEE,IEEE Conference Publications
Modelling self-protected networks and dynamic systems,"Fernandez-Diego, M.; Marcelo-Cocho, J.","Dept. of Bus. Adm., Univ. Politec. de Valencia, Valencia, Spain","Network and System Security (NSS), 2011 5th International Conference on",20111027,2011,,,327,331,"With the increasingly security problems in networks and systems, the evolution of development models that underlie current tools and techniques is all that is required to produce a model of self-defense where all the components are self-protected. The great extension of current models recommends a reasonable transition fundamentally based on the family of standards ISO/IEC 31000, where the selection of the appropriate risk assessment techniques revolves around the complexity X of the system or process structure and the uncertainty Y of the environment. The consistency and sufficiency of both factors X Y, demonstrated using the Information Theory, can explain the risk of a dynamic system. However, going deep into their meaning, the Theory of Calculability should ensure its validity in the design of self-protected networks and dynamic systems. This design needs to be chained to the implementation of networks and self-protected components, using a new type of algorithmic languages. The authors propose the outline of such a development model expected to focus and better address the lack of current security.",,978-1-4577-0458-1,,10.1109/ICNSS.2011.6060024,http://ieeexplore.ieee.org/stamp/stamp.jsp?arnumber=6060024,complexity;environment;risk;self-protection;system;uncertainty,Biological system modeling;Complexity theory;IEC standards;Risk management;Security;Software;Uncertainty,computational complexity;risk management;security of data,ISO-1EC 31000;calculabiiity theory;environment uncertainty;risk assessment techniques;security problems;self defense model;self protected dynamic systems;self protected networks;system complexity,,0,,24,,,6-8 Sept. 2011,,IEEE,IEEE Conference Publications
Analyzing the impact of false-accident cyber attacks on traffic flow stability in connected vehicle environment,"Jin, P.J.; Walton, C.M.; Guohui Zhang; Xiaowen Jiang; Singh, A.","Dept. of Civil, Archit., & Environ. Eng., Univ. of Texas at Austin, Austin, TX, USA","Connected Vehicles and Expo (ICCVE), 2013 International Conference on",20140417,2013,,,616,621,"With the rapid development of connected vehicle (CV) technologies, cyber security issues in the vehicular network has emerged as serious concerns for successful deployment of CV systems. In the existing literature, the analysis of the cyber security impacts has been primarily focused from the computer science perspectives investigating potential attacking scenarios and counter-measures through network security strategies. In this paper, we investigate traffic impacts of cyber attacks considering real-world driver behavior, especially the “built-in” safety redundancy of the visual verification by drivers or autonomous driving system. More specifically, we study the impact of “false-accident” attacks on the stability of traffic flow. In the false-accident attack, a vehicle sends out a false accident alert to its surrounding vehicle through CV-enabled network and has considered an attacking scenario that has catastrophic effects. Traffic flow stability is based on widely-used numerical linear stability analysis methods, the ring road test. In such a test, vehicles are restricted within a ring road so that traffic congestion and perturbations appear in cyclic patterns indicating the stability of traffic flow. The study indicates that false-accident attacks do not necessarily yield significant impact on the stability of traffic flow. Sensitivity analysis is conducted by varying the attacking duration, the attacking vehicle position in a platoon, and the CV safety application reaction range.",,,,10.1109/ICCVE.2013.6799866,http://ieeexplore.ieee.org/stamp/stamp.jsp?arnumber=6799866,Car-Following Dynamics;Connected Vehicle Technologies;Cyber Security;Traffic flow stability,Acceleration;Accidents;Numerical stability;Roads;Safety;Stability analysis;Vehicles,numerical stability;sensitivity analysis;telecommunication security;telecommunication traffic;vehicular ad hoc networks,CV safety application reaction range;CV systems;CV technologies;CV-enabled network;attacking scenario;attacking vehicle position;autonomous driving system;built-in safety redundancy;computer science perspectives;connected vehicle technologies;countermeasures;cyber security impacts;cyber security issues;cyclic patterns;false accident alert;false-accident attacks;network security strategies;numerical linear stability analysis methods;perturbations;real-world driver behavior;ring road test;sensitivity analysis;traffic congestion;traffic flow stability;vehicular network;visual verification,,1,,25,,,2-6 Dec. 2013,,IEEE,IEEE Conference Publications
Method for controlling abnormal Internet traffic according to user's behaviour,Sang Wan Kim; Jun Kyung Lee; Park Jong Dae,"Internet Res. Div., ETRI, Daejeon, South Korea","Computer Sciences and Convergence Information Technology (ICCIT), 2011 6th International Conference on",20121004,2011,,,578,581,"This paper relates to a method and apparatus for controlling traffic according to user, and more particularly, to a method and apparatus for controlling traffic according to user that detects traffic abnormalities according to an Internet user's online behavior and controls the traffic of users whose behaviors are at variance with regular Internet user behavior patterns through the use of priority control.",,978-1-4577-0472-7,,,http://ieeexplore.ieee.org/stamp/stamp.jsp?arnumber=6316683,,Internet;Intrusion detection;Monitoring;Process control;Real-time systems;Telecommunication traffic,Internet;behavioural sciences computing;security of data;telecommunication traffic,abnormal Internet traffic;network intrusion detection systems;priority control;traffic abnormalities;user behavior patterns;user online behavior,,0,,20,,,Nov. 29 2011-Dec. 1 2011,,IEEE,IEEE Conference Publications
Cyber-physical systems: A security perspective,"Konstantinou, C.; Maniatakos, M.; Saqib, F.; Shiyan Hu; Plusquellic, J.; Yier Jin","Dept. of Electr. & Comput. Eng., New York Univ., Abu Dhabi, Saudi Arabia","Test Symposium (ETS), 2015 20th IEEE European",20150702,2015,,,1,8,"A cyber-physical system (CPS) is a composition of independently interacting components, including computational elements, communications and control systems. Applications of CPS institute at different levels of integration, ranging from nation-wide power grids, to medium scale, such as the smart home, and small scale, e.g. ubiquitous health care systems including implantable medical devices. Cyber-physical systems primarily transmute how we interact with the physical world, with each system requiring different levels of security based on the sensitivity of the control system and the information it carries. Considering the remarkable progress in CPS technologies during recent years, advancement in security and trust measures is much needed to counter the security violations and privacy leakage of integration elements. This paper focuses on security and privacy concerns at different levels of the composition and presents system level solutions for ensuring the security and trust of modern cyber-physical systems.",,,,10.1109/ETS.2015.7138763,http://ieeexplore.ieee.org/stamp/stamp.jsp?arnumber=7138763,,Computer crime;Guidelines;Medical services;Smart grids;Smart homes,data privacy;security of data,CPS;communications;computational elements;control systems;cyber-physical system;integration elements;nation-wide power grids;privacy leakage;security measure;security violations;smart home;trust measure;ubiquitous health care systems,,0,,87,,,25-29 May 2015,,IEEE,IEEE Conference Publications
Improved Edit Distance Method for System Call Anomaly Detection,Qian Quan; Wu Jinlin; Zhu Wei; Xin Mingjun,"Sch. of Comput. Eng. &amp; Sci., Shanghai Univ., Shanghai, China","Computer and Information Technology (CIT), 2012 IEEE 12th International Conference on",20121224,2012,,,1097,1102,"Edit distance has been widely used in different areas to evaluate the similarity between strings of characters. In this paper, the improved edit distance is applied into the short sequence anomaly detection, a kind of host security area. Some modifications for original edit distance including the position exchange and the shortest distance algorithm are described in detail. Through experiment, it shows that the edit distance based anomaly detection method is proved to be more stable and better detection precision than the classical sequence analysis STIDE method.",,978-1-4673-4873-7,,10.1109/CIT.2012.223,http://ieeexplore.ieee.org/stamp/stamp.jsp?arnumber=6392060,Anomaly detection;Edit distance;Intrusion detection;STIDE,Algorithm design and analysis;Computers;Hamming distance;Hidden Markov models;Libraries;Pattern matching,security of data;string matching,character strings;improved edit distance method;position exchange algorithm;short sequence anomaly detection;shortest distance algorithm;similarity evaluation;system call anomaly detection,,1,,12,,,27-29 Oct. 2012,,IEEE,IEEE Conference Publications
Combining Hidden Markov Models for Improved Anomaly Detection,"Khreich, W.; Granger, E.; Sabourin, R.; Miri, A.","Lab. d''Imagerie, de Vision et d''Intell. Artificielle (LIVIA), Ecole de Technol. Super., Montreal, QC, Canada","Communications, 2009. ICC '09. IEEE International Conference on",20090811,2009,,,1,6,"In host-based intrusion detection systems (HIDS), anomaly detection involves monitoring for significant deviations from normal system behavior. Hidden Markov Models (HMMs) have been shown to provide a high level performance for detecting anomalies in sequences of system calls to the operating system kernel. Although the number of hidden states is a critical parameter for HMM performance, it is often chosen heuristically or empirically, by selecting the single value that provides the best performance on training data. However, this single best HMM does not typically provide a high level of performance over the entire detection space. This paper presents a multiple-HMMs approach, where each HMM is trained using a different number of hidden states, and where HMM responses are combined in the receiver operating characteristics (ROC) space according to the maximum realizable ROC (MRROC) technique. The performance of this approach is compared favorably to that of a single best HMM and to a traditional sequence matching technique called STIDE, using different synthetic HIDS data sets. Results indicate that this approach provides a higher level of performance over a wide range of training set sizes with various alphabet sizes and irregularity indices, and different anomaly sizes, without a significant computational and storage overhead.",1938-1883,978-1-4244-3435-0,978-1-4244-3435-0,10.1109/ICC.2009.5198832,http://ieeexplore.ieee.org/stamp/stamp.jsp?arnumber=5198832,,Communications Society;Computerized monitoring;Event detection;Hidden Markov models;Information technology;Intrusion detection;Kernel;Operating systems;Paper technology;Training data,hidden Markov models;operating system kernels;security of data,HIDS;HMM;anomaly detection;hidden Markov model;host-based intrusion detection system;maximum realizable ROC technique;operating system kernel;receiver operating characteristics;system call,,4,,17,,,14-18 June 2009,,IEEE,IEEE Conference Publications
A comparison of techniques for on-line incremental learning of HMM parameters in anomaly detection,"Khreich, W.; Granger, E.; Miri, A.; Sabourin, R.","Lab. d''Imagerie, de Vision et d''Intell. Artificielle (LIVIA), Ecole de Technol. Super., Montreal, QC, Canada","Computational Intelligence for Security and Defense Applications, 2009. CISDA 2009. IEEE Symposium on",20091218,2009,,,1,8,"Hidden Markov Models (HMMs) have been shown to provide a high level performance for detecting anomalies in intrusion detection systems. Since incomplete training data is always employed in practice, and environments being monitored are susceptible to changes, a system for anomaly detection should update its HMM parameters in response to new training data from the environment. Several techniques have been proposed in literature for on-line learning of HMM parameters. However, the theoretical convergence of these algorithms is based on an infinite stream of data for optimal performances. When learning sequences with a finite length, on-line incremental versions of these algorithms can improve discrimination by allowing for convergence over several training iterations. In this paper, the performance of these techniques is compared for learning new sequences of training data in host-based intrusion detection. The discrimination of HMMs trained with different techniques is assessed from data corresponding to sequences of system calls to the operating system kernel. In addition, the resource requirements are assessed through an analysis of time and memory complexity. Results suggest that the techniques for online incremental learning of HMM parameters can provide a higher level of discrimination than those for on-line learning, yet require significantly fewer resources than with batch training. On-line incremental learning techniques may provide a promising solution for adaptive intrusion detection systems.",,978-1-4244-3763-4,978-1-4244-3764-1,10.1109/CISDA.2009.5356542,http://ieeexplore.ieee.org/stamp/stamp.jsp?arnumber=5356542,,Computerized monitoring;Convergence;Detectors;Event detection;Hidden Markov models;Intrusion detection;Iterative algorithms;Kernel;Operating systems;Training data,hidden Markov models;learning (artificial intelligence);security of data,anomaly detection;hidden Markov models;intrusion detection system;memory complexity;online incremental HMM learning;operating system kernel;time complexity,,0,,20,,,8-10 July 2009,,IEEE,IEEE Conference Publications
Frequency Weighted Hamming Distance for System Call Anomaly Detection,Ying Wu; Jianhui Jiang,"Dept. of Comput. Sci. & Technol., Tongji Univ., Shanghai, China","Computer Science and Information Engineering, 2009 WRI World Congress on",20090724,2009,1,,105,109,"Distance metric is critical to the performance of intrusion detection systems. Frequency weighted Hamming distance (FWHD) fully exploits system call distribution information contained in normal traces, and possesses richer information compared to Hamming distance. Our experiments show that FWHD behaves better than Hamming distance when used for system call anomaly detection.",,978-0-7695-3507-4,,10.1109/CSIE.2009.817,http://ieeexplore.ieee.org/stamp/stamp.jsp?arnumber=5171143,,Computer science;Counting circuits;Databases;Delay effects;Frequency;Hamming distance;Intrusion detection,normal distribution;security of data,frequency weighted hamming distance;intrusion detection system;system call anomaly detection,,0,,10,,,March 31 2009-April 2 2009,,IEEE,IEEE Conference Publications
An Adaptive Approach of String Metrics Application in the Intrusion Detection Systems,"Nikolova, E.; Jecheva, V.","Burgas Free Univ., Burgas, Bulgaria","Computer Science and Information Engineering, 2009 WRI World Congress on",20090724,2009,1,,145,149,The present paper introduces an innovative approach for the anomaly-based intrusion detection systems (IDS). The main idea is to construct a model that characterizes the expected/acceptable behavior of the system using list decoding techniques and distinguishes the intrusive activity from legal one using string metric algorithms. The conducted simulation experiments are represented and discussed as well.,,978-0-7695-3507-4,,10.1109/CSIE.2009.677,http://ieeexplore.ieee.org/stamp/stamp.jsp?arnumber=5171151,anomaly-based IDS;intrusion detection;list decoding;string metrics,Application software;Computational modeling;Computer science;Condition monitoring;Cost function;Databases;Decoding;Intrusion detection;Law;Legal factors,decoding;security of data,IDS;acceptable behavior;adaptive approach;anomaly-based intrusion detection system;list decoding technique;string metric application,,0,,13,,,March 31 2009-April 2 2009,,IEEE,IEEE Conference Publications
