"An Autonomous Road Side Infrastructure Based System in Secure VANETs","W. Liu; H. Zhang; W. Zhang","Sch. of Comput. Sci. & Technol., Harbin Inst. of Technol., Harbin, China","2009 5th International Conference on Wireless Communications, Networking and Mobile Computing","20091030","2009","","","1","6","Road side infrastructures with certification and service aid are important in secure vehicular communication. Few road side infrastructure issues have been addressed in former studies. Lacking trusted certification, scalability, efficiency and intrusion detection in vehicle-only network causes various attacks. In this paper we propose an autonomous road side infrastructure network approach. Some road side infrastructures are preselected administratively and the others gather towards the formers autonomously. Road side infrastructures in the same autonomous network cache and forward certificates, which are invisible to other autonomous network. In our approach, CA cluster in different regions comply with corresponding scalability strategy and regional policy. A distributed IDS system integrated with the CA database provide further security protection from malicious vehicles with legal certificates. The certificate caching and forwarding schema accelerates authentication. In our analysis, our approach has a better efficiency, scalability and security guarantee than former road side infrastructure designs.","2161-9646;21619646","978-1-4244-3692-7;9781424436927","978-1-4244-3693-4;9781424436934","10.1109/WICOM.2009.5302104","http://ieeexplore.ieee.org/stamp/stamp.jsp?arnumber=5302104","","Certification;Data security;Distributed databases;Intrusion detection;Law;Legal factors;Protection;Remotely operated vehicles;Roads;Scalability","ad hoc networks;mobile radio;telecommunication security","CA cluster;VANET;autonomous road side infrastructure network approach;certificate caching;certificate forwarding;distributed IDS system;intrusion detection;scalability strategy;secure vehicular communication;security protection;vehicular ad hoc network","","1","","15","","","24-26 Sept. 2009","","IEEE","IEEE Conference Publications"
"Statistical process control for computer intrusion detection","Nong Ye; S. M. Emran; Xiangyang Li; Qiang Chen","Arizona State Univ., Tempe, AZ, USA","DARPA Information Survivability Conference &amp; Exposition II, 2001. DISCEX '01. Proceedings","20020807","2001","1","","3","14 vol.1","This paper describes the architecture of a distributed, host-based Intrusion Detection System (IDS) that we have developed at the Information and Systems Assurance Laboratory (ISA), Arizona State University (hence, ISA-IDS). ISA-IDS is developed based on statistical process control (SPC). In ISA-IDS we employ two intrusion detection techniques. One is an anomaly detection technique called Chi-square. Another is a misuse detection technique called Clustering. Each technique determines an intrusion warning (IW) level for each audit event. The IW levels from different intrusion detection techniques are then combined using a fusion technique into a composite IW level, 0 for normal, 1 for intrusive, and any value in between to signify, the intrusiveness. We also present the intrusion detection performance of the Chi-square and Clustering techniques","","0-7695-1212-7;0769512127","","10.1109/DISCEX.2001.932187","http://ieeexplore.ieee.org/stamp/stamp.jsp?arnumber=932187","","Computer networks;Computerized monitoring;Condition monitoring;Information security;Instruction sets;Intrusion detection;Laboratories;Operating systems;Process control;Prototypes","computer network management;security of data;statistical process control;supervisory programs;system monitoring","Clustering;Internet;anomaly detection;audit event;chi-square;computer intrusion detection;distributed host-based intrusion detection system;e-commerce systems;fusion technique;intrusion detection techniques;intrusion warning level;misuse detection technique;network security;statistical process control","","8","","16","","","2001","12 Jun 2001-14 Jun 2001","IEEE","IEEE Conference Publications"
"Effective defending against flood attack using stream-check method in tolerant network","D. Kuriakose; D. Daniel","Computer Science and Engineering, Dr. N.G.P Institute of Technology, Coimbatore, India","Green Computing Communication and Electrical Engineering (ICGCCEE), 2014 International Conference on","20141016","2014","","","1","4","The disruption tolerant network (DTN) is appropriate for application where no communication infrastructure is present. Due to limitation of storage capacity DTN is vulnerable to flood attacks. In this paper proposed an intrusion detection scheme that use streaming node to monitor the network environment. Monitor that created three tables, RATE_LIMIT contains the list of the rate limit certificate of each node. DPT_TAB contains the delivery probability value according to the value of this table we can identified the attack happened or not. Streaming node is comparing the estimated value and actual delivery probability value calculated from node. If difference greater than a threshold value, the streaming node will listed as suspicious node. Instead of cross-check it used self-analysis approach for detection of inconsistency. It provided the delivery probability analysis for detection of and evaluation of the effectiveness and efficiency of this scheme. This scheme it effectively reduced propagation delay and increased the packet delivery ratio.","","","","10.1109/ICGCCEE.2014.6921381","http://ieeexplore.ieee.org/stamp/stamp.jsp?arnumber=6921381","Disruption Tolerant Network;Flood Attack;delivery probability","Ad hoc networks;Delays;Floods;IP networks;Limiting;Monitoring;Routing","probability;security of data","DPT_TAB;RATE_LIMIT;delivery probability analysis;disruption tolerant network;flood attack;intrusion detection scheme;packet delivery ratio;propagation delay;storage capacity;stream-check method","","0","","26","","","6-8 March 2014","","IEEE","IEEE Conference Publications"
"Preventing input type validation vulnerabilities using network based intrusion detection systems","V. Sunkari; C. V. G. Rao","CSE, Kakatiya Institute of Technology and Science, Warangal, India","Contemporary Computing and Informatics (IC3I), 2014 International Conference on","20150126","2014","","","702","706","Web applications became most common medium in the internet and are easily accessible using browser software. Because of popularity and ease of use it gained the interest of attackers. Web applications attackers mostly use browsers as an attacking tool. Web applications are prone to all major vulnerabilities as normal software vulnerabilities. Among all, SQL Injections and XSS are most popular and frequently occurred attacks. Existing research works majorly concentrated on code verification with syntax analyzers and are deployed at the server. These techniques overheads the web applications performance because of online verification of SQL statements that are dynamically prepared by the applications and are combined deployed along with the web application at the server. Unfortunately, these techniques are bound to a programming language. Combined approaches such as IPAAS use syntax analyzers as well as HTTP Parameter type verification. Even though the technique overcomes the problem of code modification at client/server, it is also bound to a programming language. We propose a novel technique of HTTP Stateless and automated parameter pollution verification at network level, it is an independent of web application programming language, and can be directly applied on any web application. It doesn't depend on syntax analyzers and is anomaly intrusion detection system, capable of detecting published (known) and un-published (unknown) vulnerabilities. It reduces the sanity checks at web application. The system evaluated on seven SQL/XSS allowed real time web applications with 2783 attack patterns of exploit-db and on all possible parameters. The system successfully prevented 92.96% SQL Injection attacks, 79.86% XSS attacks without impacting server operations.","","","","10.1109/IC3I.2014.7019679","http://ieeexplore.ieee.org/stamp/stamp.jsp?arnumber=7019679","IPAAS;SQl injection Attack;Web application;XSS Attack","Intrusion detection;Protocols;Servers;Software;Syntactics;Training","Internet;SQL;computer crime;hypermedia;program verification","HTTP parameter type verification;HTTP stateless;IPAAS;Internet;SQL injection attacks;SQL statements;Web application attackers;Web application programming language;Web application vulnerabilities;Web applications performance;XSS;anomaly intrusion detection system;attack patterns;attacking tool;automated parameter pollution verification;browser software;client/server;code modification;code verification;input type validation vulnerabilities prevention;network based intrusion detection systems;network level;online verification;sanity checks;server operations;software vulnerabilities;syntax analyzers;unpublished vulnerabilities","","3","","21","","","27-29 Nov. 2014","","IEEE","IEEE Conference Publications"
"An event-based SDN architecture for network security analysis","P. C. Lin; J. C. Liu; P. R. Chiou","Dept. of Comput. Sci. & Inf. Eng., Nation Chung Cheng Univ., Chiayi, Taiwan","Security Technology (ICCST), 2015 International Carnahan Conference on","20160125","2015","","","159","164","Software-defined networking (SDN), which decouples the control plane from traditionally proprietary network devices, is highly flexible and suitable for flow management. However, if the policy depends on the results of network security analysis, the controller will perform complicated packet processing such as packet reassembly and protocol analysis. Such processing will easily overburden the controller, and passing raw packets to the controller will result in large communications overheads. In this work, we propose an event-based SDN architecture for network security analysis. This architecture comes with an event extractor on the network device that performs protocol analysis to extract policy neutral events from network traffic. The network device looks up an extracted event in an event table to see whether a policy exists for the event. If not, it will ask the controller about the policy corresponding to this event and configure the policy in the event table accordingly. Since the controller deals with only high-level event descriptions, it is free from low-level packet processing. We evaluate this architecture by emulating it with the Bro intrusion detection system for event extraction from real traffic. The experimental results show the communication overheads between the network devices and the controller can be effectively reduced.","","978-1-4799-8690-3;9781479986903","","10.1109/CCST.2015.7389675","http://ieeexplore.ieee.org/stamp/stamp.jsp?arnumber=7389675","","Communication networks;Computer architecture;Feature extraction;Performance evaluation;Process control;Protocols;Security","computer network security;software defined networking;telecommunication traffic","Bro intrusion detection system;communication overhead;event-based SDN architecture;network security analysis;network traffic;packet processing;policy configuration;software-defined networking","","","","14","","","21-24 Sept. 2015","","IEEE","IEEE Conference Publications"
"Countering Network-Centric Insider Threats through Self-Protective Autonomic Rule Generation","F. M. Sibai; D. A. Menasc&#x00E9;","","Software Security and Reliability (SERE), 2012 IEEE Sixth International Conference on","20120806","2012","","","273","282","Insider threats are a growing problem in today's organizations. Detecting such attacks is especially challenging because most system owners and system administrators use networks to remotely manage the systems they are responsible for. In previous work, we introduced the Autonomic Violation Prevention System (AVPS) that has a scalable architecture to deal with such threats. This system uses low level human-specified and manually-entered rules to protect networked applications from disgruntled privileged users. However, rule-based systems are generally difficult to maintain when the number of rules is too large. This paper addresses this problem by allowing human beings to enter a smaller number of high-level rules that are automatically translated into one or more low-level rules based on an analysis of the incoming network traffic. The paper discusses how various high level rules (HLR) can detect new unwanted behaviors without any user intervention. Experiments conducted on three types of applications -- FTP, database, and Web -- show that the enhanced AVPS can detect known and unknown insider attacks through high level rules and process automation.","","978-1-4673-2067-2;9781467320672","","10.1109/SERE.2012.40","http://ieeexplore.ieee.org/stamp/stamp.jsp?arnumber=6258317","Insider threat;autonomic computing;network security;privileged user;self-protection","Automation;Databases;Humans;Monitoring;Organizations;Security;Servers","","","","0","1","43","","","20-22 June 2012","","IEEE","IEEE Conference Publications"
"Quarter Sphere Based Distributed Anomaly Detection in Wireless Sensor Networks","S. Rajasegarar; C. Leckie; M. Palaniswami; J. C. Bezdek","Univ. of Melbourne, Melbourne","2007 IEEE International Conference on Communications","20070813","2007","","","3864","3869","Anomaly detection is an important challenge for tasks such as fault diagnosis and intrusion detection in energy constrained wireless sensor networks. A key problem is how to minimise the communication overhead in the network while performing in-network computation when detecting anomalies. Our approach to this problem is based on a formulation that uses distributed, one-class quarter-sphere support vector machines to identify anomalous measurements in the data. We demonstrate using sensor data from the Great Duck Island Project that our distributed approach is energy efficient in terms of communication overhead while achieving comparable accuracy to a centralised scheme.","1550-3607;15503607","1-4244-0353-7;1424403537","","10.1109/ICC.2007.637","http://ieeexplore.ieee.org/stamp/stamp.jsp?arnumber=4289308","","Bandwidth;Computer networks;Computer science;Energy consumption;Energy efficiency;Intrusion detection;Sensor phenomena and characterization;Support vector machine classification;Support vector machines;Wireless sensor networks","fault diagnosis;support vector machines;telecommunication computing;telecommunication security;wireless sensor networks","Great Duck Island Project;distributed anomaly detection;energy constrained wireless sensor networks;fault diagnosis;in-network computation;intrusion detection;quarter sphere;support vector machines","","29","","26","","","24-28 June 2007","","IEEE","IEEE Conference Publications"
"Device-transparent network-layer handoff for micro-mobility","F. Guo; T. c. Chiueh","Computer Science Department Stony Brook University, NY 11794","2009 IEEE International Symposium on Modeling, Analysis & Simulation of Computer and Telecommunication Systems","20091228","2009","","","1","10","An emerging class of applications for enterprise wireless LANs (WLAN) is voice over IP (VoIP) applications, which impose a stringent requirement on end-to-end delay. Because access points on an enterprise WLAN tend to be associated with different IP subnets, support for network-layer handoff is indispensable. Moreover, the handoff frequency is expected to be much higher for WLANs than for cellular networks because the coverage of a WLAN access point is much smaller. Although mobile IP is a mature solution to the network-layer handoff problem, no known mobile IP implementation on IEEE 802.11 WLANs can reduce the handoff latency below 100 msec, a nominal requirement for VoIP applications. This paper describes a novel Ethernet-over-IP overlay network architecture that completely does away with network-layer handoff, and thus reduces the end-to-end handoff delay to that of link-layer handoff, which is supported by WLAN hardware directly. In addition, the proposed wireless overlay network (WON) architecture, which has been implemented in a commercial WLAN access point, represents the first mobility solution that allows a mobile device to maintain its network connections while roaming across different IP subnets without requiring any modification on the mobile device. As a result, the proposed architecture can automatically provide seamless network-layer handoff to a wide variety of mobile devices (such as PDA, portable, cell phone) running on different operating systems, as long as they are equipped with 802.11 network interface.","1526-7539;15267539","978-1-4244-4927-9;9781424449279","978-1-4244-4928-6;9781424449286","10.1109/MASCOT.2009.5366648","http://ieeexplore.ieee.org/stamp/stamp.jsp?arnumber=5366648","","Cellular phones;Delay;Frequency;Hardware;Internet telephony;Land mobile radio cellular systems;Network interfaces;Operating systems;Roaming;Wireless LAN","IP networks;Internet telephony;cellular radio;mobile computing;wireless LAN","Ethernet-over-IP overlay network architecture;IEEE 802.11 WLAN;PDA;cell phone;cellular networks;device-transparent network-layer handoff;enterprise wireless LAN;micromobility;mobile IP;mobile devices;voice over IP;wireless overlay network","","0","1","18","","","21-23 Sept. 2009","","IEEE","IEEE Conference Publications"
"MUOS communications infrastructure demonstration network and encryption-based applications","J. Capulli; J. Pio; B. Burson; J. Dingess; D. Enriquez; D. Long","Gen. Dynamics C4 Syst., Scottsdale, AZ, USA","MILCOM 2005 - 2005 IEEE Military Communications Conference","20060320","2005","","","2700","2704 Vol. 5","The Navy's Mobile User Objective System (MUOS) program is the next-generation UHF satellite communications system for the US Department of Defense. General Dynamics and Ericsson Inc. (as part of the Lockheed Martin (LM) team) has-for the Component Advanced Development (CAD) phase of the program-installed a 3G (third generation) cellular ""trial system"", that was used as a testbed for demonstrations of MUOS communications services. To support the MUOS communication demonstrations, a global telecommunications network was constructed interconnecting several system nodes in the continental United States, as well as the global DSN (defense switched network), PSTN and two satellite systems. The heart of the system resides in Scottsdale, Arizona, and consists of two trailers that contain the core network (CN) and radio access network (RAN) of the ""trial system"". Three radio base stations (RJBS) were connected to the radio network controller (RNC) in the RAN to allow users to communicate wirelessly and securely through the cellular system to other wireless users, DSN phones, PSTN phones, Navy legacy communication systems, public internet, plus public and private servers. The Lockheed-Martin/General Dynamics Team won this competition, and has recently completed the integrated baseline review. The team is now working on implementing the MUOS Program.","2155-7578;21557578","0-7803-9393-7;0780393937","","10.1109/MILCOM.2005.1606074","http://ieeexplore.ieee.org/stamp/stamp.jsp?arnumber=1606074","","Artificial satellites;Communication switching;Cryptography;Heart;Mobile communication;Radio access networks;Satellite broadcasting;Satellite communication;System testing;Telecommunication switching","3G mobile communication;cellular radio;cryptography;radio access networks;satellite communication;telecommunication switching","3G cellular system;CAD;MUOS program;Mobile User Objective System;PSTN;RAN;RJBS;RNC;UHF satellite communications system;US Department of Defense;component advanced development;core network;defense switched network;encryption-based application;global DSN;radio access network;radio base station;radio network controller;wireless communication","","0","3","7","","","17-20 Oct. 2005","","IEEE","IEEE Conference Publications"
"Exploiting integrated GPUs for network packet processing workloads","J. Tseng; R. Wang; J. Tsai; S. Edupuganti; A. W. Min; S. Woo; S. Junkins; T. Y. C. Tai","Intel Labs & Intel Visual and Parallel Computing Group","2016 IEEE NetSoft Conference and Workshops (NetSoft)","20160704","2016","","","161","165","Software-based network packet processing on standard high volume servers promises better flexibility, manageability and scalability, thus gaining tremendous momentum in recent years. Numerous research efforts have focused on boosting packet processing performance by offloading to discrete Graphics Processing Units (GPUs). While integrated GPUs, residing on the same die with the CPU, offer many advanced features such as on-chip interconnect CPU-GPU communication, and shared physical/virtual memory, their applicability for packet processing workloads has not been fully understood and exploited. In this paper, we conduct in-depth profiling and analysis to understand the integrated GPU's capabilities and performance potential for packet processing workloads. Based on that understanding, we introduce a GPU accelerated network packet processing framework that fully utilizes integrated GPU's massive parallel processing capability without the need for large numbers of packet batching, which might cause a significant processing delay. We implemented the proposed framework and evaluated the performance with several common, light-weight packet processing workloads on the Intel<sup>®</sup> Xeon<sup>®</sup> Processor E3-1200 v4 product family (codename Broadwell) with an integrated GT3e GPU. The results show that our GPU accelerated packet processing framework improved the throughput performance by 2-2.5x, compared to optimized packet processing on CPU only.","","","","10.1109/NETSOFT.2016.7502464","http://ieeexplore.ieee.org/stamp/stamp.jsp?arnumber=7502464","","Computer architecture;Graphics processing units;Instruction sets;Kernel;Parallel processing;Servers;Throughput","graphics processing units;parallel processing","Broadwell;Intel Xeon Processor E3-1200 v4 product family;graphics processing units;integrated GT3e GPU;massive parallel processing;network packet processing framework;network packet processing workloads;profiling","","","","17","","","6-10 June 2016","","IEEE","IEEE Conference Publications"
"A Secure Routing Protocol for Clustered Sensor Networks","Z. Ruan; Q. Li; S. Li","Sch. of Comput. & Commun., Hunan Univ., Changsha","2008 4th International Conference on Wireless Communications, Networking and Mobile Computing","20081118","2008","","","1","4","Numerous cluster-based key management schemes have been proposed to secure sensor networks. Nevertheless, most existing schemes did not take the legitimacy of the cluster- head into consideration, which might highly vulnerable to several attacks such as sinkhole; wormhole and selective-forwarding, besides, the network should deal with an addition of new nodes and deletion of nodes being captured. In this paper, a modification of dynamic rekeying distribution was presented to secure communication in cluster-based protocols. All the communications in the protocols are properly authenticated using elliptic curve digital signature scheme. The simulation results demonstrate that our proposal SRC (secure rotation of cluster-head) is more energy-efficient compared to Sec-LEACH and GS-LEACH and have better scalability as well as resilience to node capture.","2161-9646;21619646","978-1-4244-2107-7;9781424421077","978-1-4244-2108-4;9781424421084","10.1109/WiCom.2008.957","http://ieeexplore.ieee.org/stamp/stamp.jsp?arnumber=4678865","","Base stations;Computer network management;Computer networks;Digital signatures;Energy capture;Energy efficiency;Routing protocols;Scalability;Security;Wireless sensor networks","routing protocols;telecommunication security;wireless sensor networks","clustered sensor networks;elliptic curve digital signature scheme;key management schemes;routing protocol;selective-forwarding;wormhole","","0","","11","","","12-14 Oct. 2008","","IEEE","IEEE Conference Publications"
