"A Comprehensive Survey of Voice over IP Security Research","A. D. Keromytis","Department of Computer Science, Mail Code 0401, Columbia University in the City of New York, New York, NY 10027, USA","IEEE Communications Surveys & Tutorials","20120503","2012","14","2","514","537","We present a comprehensive survey of Voice over IP security academic research, using a set of 245 publications forming a closed cross-citation set. We classify these papers according to an extended version of the VoIP Security Alliance (VoIPSA) Threat Taxonomy. Our goal is to provide a roadmap for researchers seeking to understand existing capabilities and to identify gaps in addressing the numerous threats and vulnerabilities present in VoIP systems. We discuss the implications of our findings with respect to vulnerabilities reported in a variety of VoIP products. We identify two specific problem areas (denial of service, and service abuse) as requiring significant more attention from the research community. We also find that the overwhelming majority of the surveyed work takes a black box view of VoIP systems that avoids examining their internal structure and implementation. Such an approach may miss the mark in terms of addressing the main sources of vulnerabilities, i.e., implementation bugs and misconfigurations. Finally, we argue for further work on understanding cross-protocol and cross-mechanism vulnerabilities (emergent properties), which are the byproduct of a highly complex system-of-systems and an indication of the issues in future large-scale systems.","1553-877X;1553877X","","","10.1109/SURV.2011.031611.00112","http://ieeexplore.ieee.org/stamp/stamp.jsp?arnumber=5742777","SIP;VoIP;security","Authentication;Internet telephony;Media;Protocols;Servers;Taxonomy","Internet telephony;telecommunication security","VoIP Security Alliance;VoIP products;VoIP systems;VoIPSA Threat Taxonomy;cross-mechanism vulnerabilities;cross-protocol;large-scale systems;system-of-systems;voice over IP security academic research;voice over IP security research","","20","","268","","2011-04-05","Second Quarter 2012","","IEEE","IEEE Journals & Magazines"
"Balance Based Performance Enhancement for Interactive TCP Traffic Replay","W. Chu; X. Guan; Z. Cai; M. Chen","SKLMS Lab., Xian Jiaotong Univ., Xian, China","Communications (ICC), 2010 IEEE International Conference on","20100701","2010","","","1","5","Interactive network traffic replay plays an important role in testing and evaluating in-line network security devices such as Firewalls, IPSs, etc. In this paper we present a balance-based method for improving the performance of interactive TCP traffic replay. The new method is based on the inherent feature of the TCP protocol, that is, two communicating peers keep synchronized with each other using data acknowledgment. This feature is converted as a balance mechanism in interactive TCP traffic replay and incorporated into the current state-based method. In this way, the cost of state-checking can be significantly reduced and the replay performance is thus enhanced. To validate the effectiveness of the method we implement it by building an interactive replay system. The experimental results indicate that: 1) balance-checking reduces the overhead of state-checking by 40%; 2) the balance-based method enhances the overall replay performance by an average of 5% when the actual TCP traffic traces are replayed.","1550-3607;15503607","978-1-4244-6402-9;9781424464029","","10.1109/ICC.2010.5501960","http://ieeexplore.ieee.org/stamp/stamp.jsp?arnumber=5501960","","Communication system traffic control;Communications Society;Costs;Intelligent networks;Intelligent systems;Protocols;TCPIP;Telecommunication traffic;Testing;Traffic control","","","","1","","17","","","23-27 May 2010","","IEEE","IEEE Conference Publications"
"Automated white-list learning technique for detection of malicious attack on web application","S. M. Murtaza; A. S. Abid","Centres of Excellence in Sciences & Applied Technology, (CESAT) Islamabad, Pakistan","2016 13th International Bhurban Conference on Applied Sciences and Technology (IBCAST)","20160310","2016","","","416","420","Web application security has become crucially vital these days. Earlier ""default allow"" model was used to secure web applications but it was unable to secure web applications against plethora of attacks [1]. In contrast, more restricted security to the web applications is provided by default deny model which at first, builds a model for the particular application and then permits merely those requests that conform to that model while ignoring everything else. Besides this, a novel and effective methodology is followed that allows to analyze the validity of application requests and further results in the generation of semi structured XML cases for the web applications. Furthermore, mature and resilient XML cases are generated by employing learning techniques. This system will further be gauged by examining that XML file containing cases are in correct accordance with the XML format or not. Moreover, the distinction between malicious and non-malicious traffic is carried out carefully. Results have proved its efficacy of rule generation employing access traffic log of cross site scripting (XSS), SQL injection, HTTP Request Splitting, HTTP response splitting and Buffer overflow attacks.","","978-1-4673-9126-9;9781467391269","","10.1109/IBCAST.2016.7429912","http://ieeexplore.ieee.org/stamp/stamp.jsp?arnumber=7429912","Default Deny model(White Listing);Default allow model (Black Listing);WAMG(Web Application Model Generator)","Generators;Logic gates;Maintenance engineering;Organizations;Security;Standards organizations;XML","Internet;learning (artificial intelligence);security of data","Buffer overflow attack;HTTP request splitting attack;HTTP response splitting attack;SQL injection attack;Structured Query Language;Web application security;XSS attack;automated white-list learning technique;cross site scripting attack;default allow model;extensible markup language;malicious attack detection;semistructured XML case generation","","","","20","","","12-16 Jan. 2016","","IEEE","IEEE Conference Publications"
"Coping with Node Misbehaviors in Ad Hoc Networks: A Multi-dimensional Trust Management Approach","W. Li; A. Joshi; T. Finin","Dept. of Comput. Sci. & Electr. Eng., Univ. of Maryland, Baltimore County, Baltimore, MD, USA","2010 Eleventh International Conference on Mobile Data Management","20100621","2010","","","85","94","Nodes in Mobile Ad hoc Networks (MANETs) are required to relay data packets to enable communication between other nodes that are not in radio range with each other. However, whether for selfish or malicious reasons, a node may fail to cooperate during the network operations or even attempt to disturb them, both of which have been recognized as misbehaviors. Various trust management schemes have been studied to assess the behaviors of nodes so as to detect and mitigate node misbehaviors inMANETs. Most of existing schemes model a node's trustworthiness along a single dimension, combining all of the available evidence to calculate a single, scalar trust metric. A single measure, however, may not be expressive enough to adequately describe a node's trustworthiness in many scenarios. In this paper, we describe a multi-dimensional framework to evaluate the trustworthiness of MANET node from multiple perspectives. Our scheme evaluates trustworthiness from three perspectives: collaboration trust, behavioral trust, and reference trust. Different types of observations are used to independently derive values for these three trust dimensions. We present simulation results that illustrate the effectiveness of the proposed scheme in several scenarios.","1551-6245;15516245","978-1-4244-7075-4;9781424470754","","10.1109/MDM.2010.57","http://ieeexplore.ieee.org/stamp/stamp.jsp?arnumber=5489228","Misbehavior;Mobile Ad hoc Network;Multi-dimensional trust;Security","Ad hoc networks;Batteries;Computer network management;Computer science;Conference management;Engineering management;Mobile ad hoc networks;Mobile computing;Radio spectrum management;Relays","","","","11","","26","","","23-26 May 2010","","IEEE","IEEE Conference Publications"
"Hierarchical energy efficient intrusion detection system for black hole attacks in WSNs","S. Athmani; D. E. Boubiche; A. Bilami","Computer Sciences Department. M'Sila University. LaSTIC laboratory, Batna, Algeria","Computer and Information Technology (WCCIT), 2013 World Congress on","20131003","2013","","","1","5","Due to their particular characteristics, wireless sensor networks (WSN) are severely vulnerable to malicious attacks. Black hole is one of the most malicious attacks that target sensors routing protocols. This kind of attacks can have devastating impact on hierarchical routing protocols. Several security solutions have been proposed to secure WSNs from black hole attacks. However, most of these solutions are complex and energy inefficient. In this paper we propose a hierarchical energy efficient intrusion detection system, to protect sensor network from black hole attacks. Our approach is simple and based on control packets exchange between sensor node and base station. We have experimentally evaluated our system using the NS simulator to demonstrate its effectiveness in detecting and preventing efficiently the black hole attacks.","","978-1-4799-0460-0;9781479904600","","10.1109/WCCIT.2013.6618693","http://ieeexplore.ieee.org/stamp/stamp.jsp?arnumber=6618693","LEACH;Wireless sensor networks;black hole attack;energy efficiency;intrusion detection;security","Base stations;Energy efficiency;Intrusion detection;Routing protocols;Sensors;Wireless sensor networks","routing protocols;telecommunication security;wireless sensor networks","NS simulator;WSN;black hole attacks;control packet exchange;hierarchical energy efficient intrusion detection system;hierarchical routing protocols;malicious attacks;sensor routing protocols;wireless sensor networks","","5","","12","","","22-24 June 2013","","IEEE","IEEE Conference Publications"
"Establishing an Efficient and Searchable Encrypted Log Using Record Authenticator","A. Sabbaghi; F. Mahmoudi","Dept. of Electr., Comput. & IT Eng., Azad Univ., Qazvin, Iran","Computer Technology and Development, 2009. ICCTD '09. International Conference on","20091228","2009","2","","206","211","Audit logs are very important part of any secure system and should be highly considered. The content of them which is past events is so sensitive and poses a threat to privacy and information security, so should be protected against any illegal reading and modification. The best way to do this is encryption. Important challenges in an encrypted audit log are speed of log and search process, correctness and semantic of search results and log size. In this paper a novel algorithm in order to build a secure searchable encrypted audit log by generating a record authenticator is presented. SQL command keywords along with their places, form record authenticator. Our new algorithm brings remarkable advantages such as: fast and high accurate search without decrypting any record, fast logging process, keeping tamper resistance of the log, decreasing log size and improving the correctness of search results by recognizing all irrelevant records in search time.","","978-0-7695-3892-1;9780769538921","","10.1109/ICCTD.2009.228","http://ieeexplore.ieee.org/stamp/stamp.jsp?arnumber=5360137","Audit Log;Privacy;Security","Computer security;Cryptography;Data security;Databases;Electric resistance;Information security;Intrusion detection;Power system protection;Privacy;Software systems","SQL;auditing;cryptography;records management","SQL command keywords;illegal modification;illegal reading;information security;record authenticator;secure searchable encrypted audit log;secure system","","0","","10","","","13-15 Nov. 2009","","IEEE","IEEE Conference Publications"
"Mobile agents for routing, topology discovery, and automatic network reconfiguration in ad-hoc networks","N. Migas; W. J. Buchanan; K. A. McArtney","Sch. of Comput., Napier Univ. of Edinburgh, UK","Engineering of Computer-Based Systems, 2003. Proceedings. 10th IEEE International Conference and Workshop on the","20030422","2003","","","200","206","Wireless networks and the usage of mobile devices are becoming popular in recent days, especially in creating ad-hoc networks. There is thus scope for developing mobile systems, where devices take an active part of creating a network infrastructure, and can actually be used to route data between networks. This research proposes to assess different models of the usage of static and mobile agents to determine the best route through ad-hoc networks. The determination of this route is a complex one, and requires research into the best metrics to identify the best path, such as memory capacity, network performance, processing capabilities, cost, and so on. One model is to use a mixture of mobile and static agents to gather relevant information. These agents could perform important tests, which could be used to generate the best route through a network. This research looks at different models for the deployment of these agents, which balance the usage of static and mobile agents. These are appraised in the terms of performance, reconfigurability, and ease of installation.","","0-7695-1917-2;0769519172","","10.1109/ECBS.2003.1194800","http://ieeexplore.ieee.org/stamp/stamp.jsp?arnumber=1194800","","Ad hoc networks;Computer networks;Intelligent networks;Military computing;Mobile agents;Mobile communication;Mobile computing;Network topology;Wireless communication;Wireless networks","ad hoc networks;mobile agents;telecommunication computing;telecommunication network routing","ad-hoc networks;automatic network reconfiguration;cost;data routing;memory capacity;metrics;mobile agents;mobile devices;mobile systems;network infrastructure;network performance;performance;processing capabilities;reconfigurability;static agents;topology discovery;wireless networks","","12","","46","","","7-10 April 2003","","IEEE","IEEE Conference Publications"
"Bayesian Neural Networks for Internet Traffic Classification","T. Auld; A. W. Moore; S. F. Gull","Dept. of Phys., Cambridge Univ.","IEEE Transactions on Neural Networks","20070102","2007","18","1","223","239","Internet traffic identification is an important tool for network management. It allows operators to better predict future traffic matrices and demands, security personnel to detect anomalous behavior, and researchers to develop more realistic traffic models. We present here a traffic classifier that can achieve a high accuracy across a range of application types without any source or destination host-address or port information. We use supervised machine learning based on a Bayesian trained neural network. Though our technique uses training data with categories derived from packet content, training and testing were done using features derived from packet streams consisting of one or more packet headers. By providing classification without access to the contents of packets, our technique offers wider application than methods that require full packet/payloads for classification. This is a powerful advantage, using samples of classified traffic to permit the categorization of traffic based only upon commonly available information","1045-9227;10459227","","","10.1109/TNN.2006.883010","http://ieeexplore.ieee.org/stamp/stamp.jsp?arnumber=4049810","Internet traffic;network operations;neural network applications;pattern recognition;traffic identification","Bayesian methods;IP networks;Information security;Machine learning;Neural networks;Personnel;Predictive models;Telecommunication traffic;Traffic control;Training data","Internet;belief networks;computer network management;learning (artificial intelligence);neural nets;pattern classification;telecommunication traffic","Bayesian neural networks;Internet traffic classification;network management;pattern recognition;supervised machine learning","Algorithms;Bayes Theorem;Cluster Analysis;Computer Security;Information Storage and Retrieval;Internet;Neural Networks (Computer);Pattern Recognition, Automated;Signal Processing, Computer-Assisted","82","2","41","","","Jan. 2007","","IEEE","IEEE Journals & Magazines"
"A novel algorithm for malicious attack detection in UWSN","M. R. Ahmed; M. Aseeri; M. S. Kaiser; N. Z. Zenia; Z. I. Chowdhury","Mil. Technol. Coll., Muscat, Oman","Electrical Engineering and Information Communication Technology (ICEEICT), 2015 International Conference on","20151029","2015","","","1","6","Information transmission in the marine scenario utilizing wireless communications is unique method that empowering the technology for the evolution of imminent marine-surveillance systems and sensory networks. Under-water wireless sensor network (UWSN) in one of the auspicious technology for marine observation. The applications of underwater sensing has several domain that range from oil industry to aquaculture. Some of the UWSN applications include device checking, monitoring and control of pollution in the water, underwater ecosystems monitoring, forecasting of natural disasters and disturbances, exploration and survey missions, as well as study of oceanic life. Nodes in UWSN are normally low cost, low power. Considering the characteristics and the nature of applications, security of UWSN is one of the critical issue and had drawn significant attention to the researchers. In order to have a functional UWSN to extract the authentic data safeguarding and protection mechanisms are crucial. Malicious node attacks has accomplished as one of the most challenging attacks to UWSN. Several research has been conducted to protect UWSN from malicious attacks but majority of the works depend on either training data set or a previously defined threshold. Without an established security infrastructure a UWSN required to detect the malicious attacks is a complication and challenge. In this paper, we used evidential evaluation utilizing Dempster-Shafer theory (DST) of combined multiple evidences to identify the malicious attacks in a UWSN. Moreover, it gives a numerical procedure for fusing together multiple pieces of facts from an untrustworthy and unreliable neighbor with a higher degree of conflict reliability.","","","","10.1109/ICEEICT.2015.7307516","http://ieeexplore.ieee.org/stamp/stamp.jsp?arnumber=7307516","Dempster-shafer Theory;Maliciuos attacks;Protection;Security;Underwater Wireless Sensor Network (UWSN)","Authentication;Computer architecture;Cryptography;Reliability;Wireless communication;Wireless sensor networks;Yttrium","inference mechanisms;underwater acoustic communication;wireless sensor networks","DST;Dempster-Shafer theory;UWSN;conflict reliability;evidential evaluation;information transmission;malicious attack detection;underwater wireless sensor network;wireless communications","","","","23","","","21-23 May 2015","","IEEE","IEEE Conference Publications"
"Defense against packet dropping attacks in opportunistic networks","A. Ahmad; M. Alajeely; R. Doss","School of Information Technology, Deakin University, Melbourne, Australia","Advances in Computing, Communications and Informatics (ICACCI, 2014 International Conference on","20141201","2014","","","1608","1613","Opportunistic networks (OppNets) are an interesting topic that are seen to have a promising future. Many protocols have been developed to accommodate the features of OppNets such as frequent partitions, long delays, and no end-to-end path between the source and destination nodes. Embedding security into these protocols is challenging and has taken a lot of attention in research. One of the attacks that OppNets are exposed to is the packet dropping attack, where the malicious node attempts to drop some packets and forwards an incomplete number of packets which results in the distortion of the message. To increase the security levels in OppNets, this paper presents an algorithm developed to detect packet dropping attacks, and finds the malicious node that attempted the attack. The algorithm detects the attack by using an indicative field in the header section of each packet; the indicative field has 3 sub fields - the identification field, the flag field, and the offset field. These 3 fields are used to find if a node receives the complete original number of packets from the previous node. The algorithm will have the advantage of detecting packets dropped by each intermediate node, this helps solve the difficulties of finding malicious nodes by the destination node only.","","978-1-4799-3078-4;9781479930784","","10.1109/ICACCI.2014.6968318","http://ieeexplore.ieee.org/stamp/stamp.jsp?arnumber=6968318","Defense;Denial of Service;Malicious Node;OppNets;Opportunistic Networks;Packet Dropping Attack;security","Accuracy;Algorithm design and analysis;Delays;Educational institutions;Monitoring;Routing;Security","computer network security","OppNets;opportunistic networks;packet dropping attacks","","1","","17","","","24-27 Sept. 2014","","IEEE","IEEE Conference Publications"
"Intrusion Detection System Modeling","K. J. Han; J. Giordano","US Air Force Research Laboratory, Information Directorate (AFRL/IF), Rome, NY","HPCMP Users Group Conference, 2006","20070319","2006","","","229","235","Database management system (DBMS) controls and manages the data to eliminate data redundancy and to ensure data integrity, consistency and availability, among other features. Even though DBMS vendors continue to offer greater automation and simplicity in managing databases, the need for intrusion database modeling and management practices have not been considered. Our research focuses on not only anomaly detection but also intrusion database management through planning and best practice adoption to improve operational efficiency, lower costs, privacy and security","","0-7695-2797-3;0769527973","","10.1109/HPCMP-UGC.2006.41","http://ieeexplore.ieee.org/stamp/stamp.jsp?arnumber=4134059","","Automatic control;Automation;Best practices;Control systems;Costs;Data privacy;Database systems;Intrusion detection;Modeling;Spatial databases","data integrity;data privacy;database management systems;security of data","anomaly detection;data availability;data consistency;data integrity;data redundancy;database management system;intrusion database management;intrusion database modeling;intrusion detection system modeling","","0","","7","","","June 2006","","IEEE","IEEE Conference Publications"
"Operating System Security","T. Jaeger","","Operating System Security","20140702","2008","","","","","Operating systems provide the fundamental mechanisms for securing computer processing. Since the 1960s, operating systems designers have explored how to build ""secure"" operating systems - operating systems whose mechanisms protect the system against a motivated adversary. Recently, the importance of ensuring such security has become a mainstream issue for all operating systems. In this book, we examine past research that outlines the requirements for a secure operating system and research that implements example systems that aim for such requirements. For system designs that aimed to satisfy these requirements, we see that the complexity of software systems often results in implementation challenges that we are still exploring to this day. However, if a system design does not aim for achieving the secure operating system requirements, then its security features fail to protect the system in a myriad of ways. We also study systems that have been retrofit with secure operating system fe tures after an initial deployment. In all cases, the conflict between function on one hand and security on the other leads to difficult choices and the potential for unwise compromises. From this book, we hope that systems designers and implementors will learn the requirements for operating systems that effectively enforce security and will better understand how to manage the balance between function and security. Table of Contents: Introduction / Access Control Fundamentals / Multics / Security in Ordinary Operating Systems / Verifiable Security Goals / Security Kernels / Securing Commercial Operating Systems / Case Study: Solaris Trusted Extensions / Case Study: Building a Secure Operating System for Linux / Secure Capability Systems / Secure Virtual Machine Systems / System Assurance","","9781598292138","","10.2200/S00126ED1V01Y200808SPT001","http://ieeexplore.ieee.org/xpl/ebooks/bookPdfWithBanner.jsp?fileName=6812759.pdf&bkn=6812758&pdfType=book","","","","","","","","","2008","","","","Morgan & Claypool","Morgan and Claypool eBooks"
