"An execution-flow based method for detecting Cross-site Scripting attacks","Qianjie Zhang; Hao Chen; Jianhua Sun","Adv. Internet & Media Lab., Hunan Univ., Changsha, China","Software Engineering and Data Mining (SEDM), 2010 2nd International Conference on","20100809","2010","","","160","165","We present an execution-flow analysis for JavaScript programs running in a web browser to prevent Cross-site Scripting (XSS) attacks. We construct finite-state automata (FSA) to model the client-side behavior of Ajax applications under normal execution. Our system is deployed in proxy mode. The proxy analyzes the execution flow of client-side JavaScript before the requested web pages arrive at the browser to prevent potentially malicious scripts, which do not conform to the FSA. We evaluate our technique against several real-world applications and the result shows that it protects against a variety of XSS attacks and has an acceptable performance overhead.","","978-1-4244-7324-3","978-89-88678-22-0","","http://ieeexplore.ieee.org/stamp/stamp.jsp?arnumber=5542934","Ajax;FSA;JavaScript;XSS","Application software;Computer languages;Electronic mail;Internet;Java;Learning automata;Monitoring;Protection;Sun;Web pages","","","","0","","18","","","23-25 June 2010","","IEEE","IEEE Conference Publications"
"Wavelet Traffic Detection Based on Variance","Zhang Yi; Mei Ting","Sch. of Humanities & Inf. Manage., Chengdu Med. Coll., Chengdu, China","Measuring Technology and Mechatronics Automation (ICMTMA), 2015 Seventh International Conference on","20150914","2015","","","1403","1406","This paper introduces in detail the realization principle and detection module, anomaly detection technology based on wavelet transform, the experimental results show that it is a effective method to detect traffic anomaly. But also can distinguish normal burst traffic and attack traffic, which improves the accuracy of alarm. But this method lower time complexity is also suitable for large flow of data processing.","","978-1-4673-7142-1","","10.1109/ICMTMA.2015.348","http://ieeexplore.ieee.org/stamp/stamp.jsp?arnumber=7263838","wavelet; transform; model of traffic; anomaly; detection","Bandwidth;Data models;Internet;Telecommunication traffic;Wavelet analysis;Wavelet transforms","computational complexity;security of data;telecommunication traffic;wavelet transforms","anomaly detection technology;attack traffic;data processing;detection module;normal burst traffic;realization principle;time complexity;variance;wavelet traffic detection;wavelet transform","","","","9","","","13-14 June 2015","","IEEE","IEEE Conference Publications"
"An Authenticated Encryption Based Security Framework for NoC Architectures","Sajeesh, K.; Kapoor, H.K.","Dept. of CSE, Indian Inst. of Technol., Guwahati, India","Electronic System Design (ISED), 2011 International Symposium on","20111229","2011","","","134","139","Network on Chip (NoC) is an emerging solution to the existing scalability problems with SoC. However it is exposed to security threats like extraction of secret information from IP cores. In this paper we present an Authenticated Encryption (AE) based security framework for NoC based systems. The security framework resides in Network Interface (NI) of every secure IP core allowing secure communication among such IP cores. We simulated and implemented our framework using Verilog/VHDL modules on top of NoCem emulator. The results showed tolerable area overhead and did not affect the network performance apart from some initial latency.","","978-1-4577-1880-9","","10.1109/ISED.2011.17","http://ieeexplore.ieee.org/stamp/stamp.jsp?arnumber=6117340","GCM;NoCem;authenticated encryption;network-on-chip;security","Authentication;Encryption;Hardware design languages;IP networks;Network interfaces;Nickel","cryptography;hardware description languages;network-on-chip","IP cores;NoC architectures;NoCem emulator;Verilog-VHDL modules;authenticated encryption based security;network interface;network on chip","","1","","18","","","19-21 Dec. 2011","","IEEE","IEEE Conference Publications"
"Coverage and adaptive scheduling algorithms for criticality management on video wireless sensor networks","Makhoul, A.; Saadi, R.; CongDuc Pham","LIUPPA Lab., Univ. of Pau, Pau, France","Ultra Modern Telecommunications & Workshops, 2009. ICUMT '09. International Conference on","20091204","2009","","","1","8","In WSN-based surveillance systems power conservation is an important issue but one must also ensure that the application's objectives are met. In this paper, we jointly address the problem of coverage, disambigation and adaptive scheduling of sensor node's activity to extend the network lifetime while fulfilling a critical surveillance application needs. We first present a distributed algorithm that ensures both coverage of the deployment area and network connectivity by providing multiple cover sets to manage Field of View redundancies. The availability of multiple cover sets leads to a simple but efficient disambigation algorithm. Then, we propose a multiple levels activity model that uses behavior functions modeled by modified Bezier curves to define application classes and allow for adaptive scheduling. Simulation results are presented to validate the performance of the proposed approach.","","978-1-4244-3942-3","978-1-4244-3941-6","10.1109/ICUMT.2009.5345630","http://ieeexplore.ieee.org/stamp/stamp.jsp?arnumber=5345630","","Adaptive scheduling;Cameras;Distributed algorithms;Energy management;Laboratories;Monitoring;Power system management;Scheduling algorithm;Surveillance;Wireless sensor networks","adaptive scheduling;telecommunication network management;video surveillance;wireless sensor networks","adaptive scheduling;coverage scheduling;criticality management;modified Bezier curves;network connectivity;sensor node activity;video surveillance;video wireless sensor networks","","0","","12","","","12-14 Oct. 2009","","IEEE","IEEE Conference Publications"
"Scalable network traffic visualization using compressed graphs","Lei Shi; Qi Liao; Xiaohua Sun; Yarui Chen; Chuang Lin","","Big Data, 2013 IEEE International Conference on","20131223","2013","","","606","612","The visualization of complex network traffic involving a large number of communication devices is a common yet challenging task. Traditional layout methods create the network graph with overwhelming visual clutter, which hinders the network understanding and traffic analysis tasks. The existing graph simplification algorithms (e.g. community-based clustering) can effectively reduce the visual complexity, but lead to less meaningful traffic representations. In this paper, we introduce a new method to the traffic monitoring and anomaly analysis of large networks, namely Structural Equivalence Grouping (SEG). Based on the intrinsic nature of the computer network traffic, SEG condenses the graph by more than 20 times while preserving the critical connectivity information. Computationally, SEG has a linear time complexity and supports undirected, directed and weighted traffic graphs up to a million nodes. We have built a Network Security and Anomaly Visualization (NSAV) tool based on SEG and conducted case studies in several real-world scenarios to show the effectiveness of our technique.","","","","10.1109/BigData.2013.6691629","http://ieeexplore.ieee.org/stamp/stamp.jsp?arnumber=6691629","Graph Compression;Security;Visualization","Complexity theory;Data visualization;Image color analysis;Layout;Security;Vectors;Visualization","computer network security;graph theory;telecommunication traffic","NSAV tool;SEG;anomaly analysis;community-based clustering;complex network traffic;compressed graph;computer network traffic;graph simplification algorithm;linear time complexity;network graph;network security and anomaly visualization;scalable network traffic visualization;structural equivalence grouping;traffic monitoring;undirected traffic graph;visual clutter;visual complexity;weighted traffic graph","","2","","19","","","6-9 Oct. 2013","","IEEE","IEEE Conference Publications"
"An evaluation of data mining classification models for network intrusion detection","Chakchai So-In; Mongkonchai, N.; Aimtongkham, P.; Wijitsopon, K.; Rujirakul, K.","Dept. of Comput. Sci., Khon Kaen Univ., Khon Kaen, Thailand","Digital Information and Communication Technology and it's Applications (DICTAP), 2014 Fourth International Conference on","20140529","2014","","","90","94","Due to a rapid growth of Internet, the number of network attacks has risen leading to the essentials of network intrusion detection systems (IDS) to secure the network. With heterogeneous accesses and huge traffic volumes, several pattern identification techniques have been brought into the research community. Data Mining is one of the analyses which many IDSs have adopted as an attack recognition scheme. Thus, in this paper, the classification methodology including attribute and data selections was drawn based on the well-known classification schemes, i.e., Decision Tree, Ripper Rule, Neural Networks, Naïve Bayes, k-Nearest-Neighbour, and Support Vector Machine, for intrusion detection analysis using both KDD CUP dataset and recent HTTP BOTNET attacks. Performance of the evaluation was measured using recent Weka tools with a standard cross-validation and confusion matrix.","","978-1-4799-3723-3","","10.1109/DICTAP.2014.6821663","http://ieeexplore.ieee.org/stamp/stamp.jsp?arnumber=6821663","BOTNET;Classification;Data Mining;Intrusion Detection;KDD CUP dataset;Network Security","Accuracy;Computational modeling;Data mining;Internet;Intrusion detection;Neural networks;Probes","Internet;computer network security;data mining;invasive software;pattern classification;telecommunication traffic","HTTP BOTNET attacks;IDS;Internet;KDD CUP dataset;Weka tools;attack recognition scheme;attribute selection;confusion matrix;data mining classification models;data selection;network attack;network intrusion detection system;pattern identification techniques;traffic volumes","","0","","22","","","6-8 May 2014","","IEEE","IEEE Conference Publications"
"A Survey on the Electrification of Transportation in a Smart Grid Environment","Wencong Su; Eichi, H.; Wente Zeng; Mo-Yuen Chow","Dept. of Electr. Eng., North Carolina State Univ., Raleigh, NC, USA","Industrial Informatics, IEEE Transactions on","20120119","2012","8","1","1","10","Economics and environmental incentives, as well as advances in technology, are reshaping the traditional view of industrial systems. The anticipation of a large penetration of plug-in hybrid electric vehicles (PHEVs) and plug-in electric vehicles (PEVs) into the market brings up many technical problems that are highly related to industrial information technologies within the next ten years. There is a need for an in-depth understanding of the electrification of transportation in the industrial environment. It is important to consolidate the practical and the conceptual knowledge of industrial informatics in order to support the emerging electric vehicle (EV) technologies. This paper presents a comprehensive overview of the electrification of transportation in an industrial environment. In addition, it provides a comprehensive survey of the EVs in the field of industrial informatics systems, namely: 1) charging infrastructure and PHEV/PEV batteries; 2) intelligent energy management; 3) vehicle-to-grid; and 4) communication requirements. Moreover, this paper presents a future perspective of industrial information technologies to accelerate the market introduction and penetration of advanced electric drive vehicles.","1551-3203","","","10.1109/TII.2011.2172454","http://ieeexplore.ieee.org/stamp/stamp.jsp?arnumber=6051485","Battery;charging infrastructure;communication;electric vehicle (EV);energy management;plug-in electric vehicle (PEV);plug-in hybrid electric vehicle (PHEV);smart grid;vehicle-to-grid (V2G)","Artificial intelligence;Batteries;Energy management;Optimization;Power system stability;Vehicles","battery powered vehicles;hybrid electric vehicles;smart power grids","PHEV-PEV batteries;advanced electric drive vehicles;industrial informatics systems;industrial information technology;industrial systems;intelligent energy management;plug-in electric vehicles;plug-in hybrid electric vehicles;smart grid environment;transportation electrification;vehicle-to-grid","","109","","92","","2011-10-18","Feb. 2012","","IEEE","IEEE Journals & Magazines"
"Table of contents","","","Symbolic and Numeric Algorithms for Scientific Computing (SYNASC), 2010 12th International Symposium on","20110217","2010","","","v","xi","Presents the table of contents of the proceedings.","","978-1-4244-9816-1","","10.1109/SYNASC.2010.7","http://ieeexplore.ieee.org/stamp/stamp.jsp?arnumber=5715353","","","","","","0","","","","","23-26 Sept. 2010","","IEEE","IEEE Conference Publications"
"A real-time surveillance system of electric multiple units(EMUs) in Taipei MRT","Chih-chian Chang; Lee-kuo Lin; Chun-hsuen Tsai","Civil Eng. Dept., Nat. Taipei Univ. of Technol., Taipei, Taiwan","Natural Computation (ICNC), 2010 Sixth International Conference on","20100923","2010","8","","4425","4429","This study represents a surveillance system for obtaining video evidence and real-time monitoring. The system is installed in the Operating Control Center(OCC) of Taipei Main Station. Images from camera installed in the Electric Multiple Units (EMUs) are sent in real time to the EMU cabs, station information desks and OCC, when the EMUs are stationary or moving at up to 80 kilometers per hour). The monitoring equipment enables officials to inspect the in-car videos, providing remote access to historical data and the control system. A warning device reset the system to set up a transmission path; Sending action messages and alerts, and resets by the wired and wireless networks. As well as providing images inside the EMUs, the system monitors platform images from the platform cab screen monitor. When a vehicle stops at the station.","","978-1-4244-5958-2","","10.1109/ICNC.2010.5583503","http://ieeexplore.ieee.org/stamp/stamp.jsp?arnumber=5583503","","Bandwidth;Bridges;Monitoring;Switches;Wireless networks","computerised monitoring;rail traffic;traffic engineering computing;video signal processing;video surveillance","Taipei MRT;Taipei main station;electric multiple units;metro rail transit;platform cab screen monitor;platform images;realtime surveillance system;warning device","","0","","5","","","10-12 Aug. 2010","","IEEE","IEEE Conference Publications"
"A nature inspired anomaly detection system using multiple detection engines","Jiang, F.; Ling, S.S.H.; Agbinya, J.I.","Fac. of Eng. & IT, Univ. of Technol., Sydney, NSW, Australia","Broadband and Biomedical Communications (IB2Com), 2011 6th International Conference on","20120614","2011","","","200","205","The rapid growth of computer networks presents challenges to the single detection engine based system, which has been insufficient in meeting end-users' requirements in the large-scale distributed complex network. In this paper, multiple detection engines with multi-layered intrusion detection mechanisms are proposed. The principle is to coordinate the results from each single-engine intrusion alert system, by seamlessly integrating with the multiple layered distributed service-oriented structure. An improved hidden Markov model (HMM) is created for the detection engine which is capable of the immunology-based self/nonself discrimination. The classifications of normal and abnormal behaviour of system calls are further examined by an advanced fuzzy-based inference process called HPSOWM. Considering a real benchmark dataset from the public domain, our experimental results show that the proposed scheme can greatly shorten the training time of HMM and reduce the false positive rate significantly. The proposed HPSOWM especially works for the efficient classification of unknown behaviors and malicious attacks.","","978-1-4673-0768-0","","10.1109/IB2Com.2011.6217920","http://ieeexplore.ieee.org/stamp/stamp.jsp?arnumber=6217920","","Biological system modeling;Computational modeling;Engines;Hidden Markov models;Immune system;Intrusion detection;Training","computer network security;fuzzy reasoning;hidden Markov models;particle swarm optimisation;service-oriented architecture;wavelet transforms","HMM;HPSOWM;advanced fuzzy-based inference process;computer networks;false positive rate;hidden Markov model;hybrid particle swarm optimization with wavelet mutation approach;immunology-based self-nonself discrimination;large-scale distributed complex network;multilayered intrusion detection mechanisms;multiple detection engines;multiple layered distributed service-oriented structure;nature inspired anomaly detection system;single detection engine based system;single-engine intrusion alert system","","0","","25","","","21-24 Nov. 2011","","IEEE","IEEE Conference Publications"
"Research of intrusion detection system based on machine learning","Ma Jun; Feng Shuqian","Coll. of Inf. Sci. & Eng., Jiao Zuo Univ., Jiao Zuo, China","Computer Engineering and Technology (ICCET), 2010 2nd International Conference on","20100617","2010","7","","V7-713","V7-715","Through the study of the existing intrusion detection system, this paper presents the idea of applying the machine learning methods in the intrusion detection system, establishes a learning-based intrusion detection system model, gives the framework of the system and the main process steps, and designs and tests the machine learning module in it to achieve the learning-based intrusion detection system.","","978-1-4244-6347-3","","10.1109/ICCET.2010.5485703","http://ieeexplore.ieee.org/stamp/stamp.jsp?arnumber=5485703","intrusion detection;machine learning;network security","Computer hacking;Computer networks;Computer security;Data mining;Face detection;Information security;Intrusion detection;Machine learning;Protection;Spatial databases","learning (artificial intelligence);security of data","learning-based intrusion detection system model;machine learning methods;machine learning module","","0","","8","","","16-18 April 2010","","IEEE","IEEE Conference Publications"
"Security Evaluation of Hosts Based on Network Traffic","Cuixia Gao; Zhitang Li; Lin Chen","Sch. of Comput. Sci. & Technol., Huazhong Univ. of Sci. & Technol., Wuhan","E-Business and Information System Security, 2009. EBISS '09. International Conference on","20090630","2009","","","1","5","Malicious behavior will lead to abnormal network traffic patterns. This paper presents a network traffic based method to evaluate the security situation of hosts. A group of variables that can reflect the network traffic feature in a fixed time window are selected as the evaluation metrics. Based on the large samples, we report on a preliminary proof-of-concept approach, that's logistic regression analysis, to evaluate the probability of host that run into insecure status. The evaluation results are regarded as the normalized abnormality value to evaluate the network traffic of hosts. Experiments and testing show that this method can reasonably evaluate the host network abnormal traffic.","","978-1-4244-2909-7","978-1-4244-2910-3","10.1109/EBISS.2009.5138070","http://ieeexplore.ieee.org/stamp/stamp.jsp?arnumber=5138070","","Computer science;Computer security;Information security;Intrusion detection;Logistics;Probability;Regression analysis;Statistics;Telecommunication traffic;Testing","computer networks;probability;regression analysis;telecommunication security;telecommunication traffic","abnormal network traffic pattern;fixed time window;host security evaluation;logistic regression analysis;probability;proof-of-concept approach","","0","","13","","","23-24 May 2009","","IEEE","IEEE Conference Publications"
"Research on the Intrusion detection mechanism based on cloud computing","Xin Wang; Huang Ting-lei; Liu Xiao-yu","Comput. Sci. & Eng., Guilin Univ. of Electron. Technol., Guilin, China","Intelligent Computing and Integrated Systems (ICISS), 2010 International Conference on","20101203","2010","","","125","128","People are paid more attention on Intrusion detection which as an important computer network security technology. According to the development trend of intrusion detection, Detecting all kinds of intrusions effectively requires a global view of the monitored network, we are developing a new intrusion detection mechanism based on cloud computing, which can make up for the deficiency of traditional intrusion detection, and proved to be great scalable.","","978-1-4244-6834-8","","10.1109/ICISS.2010.5656789","http://ieeexplore.ieee.org/stamp/stamp.jsp?arnumber=5656789","Intrusion detection;cloud computing;network security technology","Functional analysis;Gallium","Internet;computer network security","cloud computing;computer network security technology;intrusion detection","","3","","9","","","22-24 Oct. 2010","","IEEE","IEEE Conference Publications"
"Secure Communication via Shared Knowledge and a Salted Hash in Ad-Hoc Environments","Kent, A.D.; Liebrock, L.M.","Dept. of Comput. Sci. & Eng., New Mexico Inst. of Min. & Technol., NM, USA","Computer Software and Applications Conference Workshops (COMPSACW), 2011 IEEE 35th Annual","20111003","2011","","","122","127","Decentralized, message-based communication networks commonly require mechanisms for message confidentiality and integrity. While these needs are traditionally provided through methods of channel encryption and signing, such mechanisms are often difficult or impossible to implement in the ad-hoc, decentralized environments seen in sensor networks, collaborative intrusion detection systems, or other similar peer-to-peer networks. Using the concepts from one-way hashing and language-derived relevance theory, we propose five novel contributions relevant to ad-hoc communications and security: one-way cryptographic hashing as a mechanism for securely communicating in an environment where preexisting shared knowledge exists, hashed shared knowledge messages as a basis for secure formation of self-selecting subgroups and trust building, adding salt to the shared knowledge hashes to remove the static nature of common messages and defend against precomputed table attacks, integration of variable complexity hash functions to dynamically adjust hash complexity relative to message complexity, and a message integrity element based on the secrecy of the original shared knowledge within a hashed message. Although our proposed mechanisms are likely implemented without difficulty from a network and encryption standpoint, they do require significant integration and awareness within the applications relying on them. The method also assumes a static value from a large existing set of shared knowledge, which does not always exist.","","978-1-4577-0980-7","978-0-7695-4459-5","10.1109/COMPSACW.2011.30","http://ieeexplore.ieee.org/stamp/stamp.jsp?arnumber=6032224","hashing;secure communications;shared knowledge","Ad hoc networks;Complexity theory;Encryption;Knowledge engineering;Receivers","ad hoc networks;cryptography;telecommunication security","ad-hoc communication;ad-hoc environment;ad-hoc security;channel encryption;channel signing;collaborative intrusion detection system;complexity hash function;decentralized communication network;language-derived relevance theory;message complexity;message confidentiality;message integrity;message-based communication network;one-way cryptographic hashing mechanism;one-way hashing;peer-to-peer network;salted hash;secure communication;sensor network","","1","","29","","","18-22 July 2011","","IEEE","IEEE Conference Publications"
