"Attack and Fault Identification in Electric Power Control Systems: An Approach to Improve the Security","M. P. Coutinho; G. Lambert-Torres; L. E. B. da Silva; J. G. B. da Silva; J. C. Neto; E. da Costa Bortoni; H. Lazarek","Federal University of Itajuba, Av. BPS 1303, Itajuba 37500-503 MG, Brazil","Power Tech, 2007 IEEE Lausanne","20080606","2007","","","103","107","This paper presented a technique to extract rules in order to identify attacks and faults to improve security of electric power control systems. By using rough sets classification algorithm, a set of rules can be defined. The approach tries to reduce the number of input variables and the number of examples, offering a more compact set of examples to fix the rules to the anomaly detector. An illustrative example is presented.","","978-1-4244-2189-3;9781424421893","978-1-4244-2190-9;9781424421909","10.1109/PCT.2007.4538300","http://ieeexplore.ieee.org/stamp/stamp.jsp?arnumber=4538300","Power system security;control centers;critical infrastructure;hackers;power system operation","Computer security;Control systems;Data security;Fault diagnosis;Industrial control;Information security;National security;Power system security;Protection;Terrorism","fault location;power system control;power system security;rough set theory","anomaly detector;electric power control systems;fault identification;rough sets classification algorithm","","0","","32","","","1-5 July 2007","","IEEE","IEEE Conference Publications"
"On the use of Unified And-Or fuzzy operator for distributed node exhaustion attack decision-making in wireless sensor networks","S. A. Khan; Z. A. Baig","Department of Computer Engineering, King Fahd University of Petroleum & Minerals, Box 1652, Dhahran 31261, Saudi Arabia","Fuzzy Systems (FUZZ), 2010 IEEE International Conference on","20100923","2010","","","1","7","The effect of advances in the fields of ubiquitous computing, wireless communications and embedded system design has seen a corresponding rapid improvement of wireless sensor technology. Sensor networks have emerged as a platform for deployment and sustenance of critical applications that require real-time sensing and data acquisition for decision-making purposes. A significant number of malicious attacks against the security of such networks have been identified in recent times. Considering the untrusted environments of operations of such networks, the threat of distributed attacks against constrained sensory resources i.e. sensor power, computation and communication capabilities cannot be overlooked. In this paper, we propose a fuzzy logic-based approach towards achieving demarkation in the values of specific parameters of an attack detection scheme for detecting distributed node-exhaustion attacks in wireless sensor networks. Using the Unified And-Or (UAO) aggregation operator, we model and formulate a mechanism to achieve a tradeoff between frequent attack detection and sensor node energy utilization. Simulation results prove the effectiveness of our approach in addressing the issue of computing the optimal parameter values for achieving a reasonable tradeoff between attack detection rate and sensor node energy utilization rate.","1098-7584;10987584","978-1-4244-6919-2;9781424469192","","10.1109/FUZZY.2010.5584421","http://ieeexplore.ieee.org/stamp/stamp.jsp?arnumber=5584421","","Cognition;Computer networks;Detectors;Equations;Fuzzy logic;Security;Wireless sensor networks","data acquisition;decision making;fuzzy logic;security of data;wireless sensor networks","attack detection rate;communication capability;data acquisition;distributed attack threat;distributed node exhaustion attack decision making;embedded system;fuzzy logic-based approach;optimal parameter values;real-time sensing;sensor node energy utilization;ubiquitous computing;unified and-or fuzzy operator;wireless communications;wireless sensor network","","4","","19","","","18-23 July 2010","","IEEE","IEEE Conference Publications"
"Digital Forensics: Defining a Research Agenda","K. Nance; B. Hay; M. Bishop","","System Sciences, 2009. HICSS '09. 42nd Hawaii International Conference on","20090120","2009","","","1","6","While many fields have well-defined research agendas, evolution of the field of digital forensics has been largely driven by practitioners in the field. As a result, the majority of the tools and practice have been developed in response to a diverse set of specific threats or scenarios, rather than as the result of a research and development plan. In June, 2008 a group of digital forensics researchers, educators and practitioners met as a working group at the Colloquium for Information Systems Security Education (CISSE 2008) to brainstorm ideas for the development of a research, education, and outreach agenda for Digital Forensics. This paper outlines some of the ideas generated and new research categories and areas identified at this meeting, as well as a plan for future development of a formalized research agenda.","1530-1605;15301605","978-0-7695-3450-3;9780769534503","","10.1109/HICSS.2009.160","http://ieeexplore.ieee.org/stamp/stamp.jsp?arnumber=4755787","","Communities;Computer science;Concrete;Digital forensics;Information security;Information systems;Meeting planning;Research and development;Taxonomy","computer crime;computer science education;research and development","Colloquium for Information Systems Security Education;digital forensics;formalized research agenda","","8","","2","","","5-8 Jan. 2009","","IEEE","IEEE Conference Publications"
"Integrating Genetic Algorithms and Fuzzy c-Means for Anomaly Detection","W. Chimphlee; A. H. Abdullah; M. Noor Md Sap; S. Chimphlee; S. Srinoy","Faculty of Science and Technology, Suan Dusit Rajabhat University, 295 Rajasrima Road, Dusit, Bangkok, Thailand, Tel:","2005 Annual IEEE India Conference - Indicon","20060213","2005","","","575","579","The goal of intrusion detection is to discover unauthorized use of computer systems. New intrusion types, of which detection systems are unaware, are the most difficult to detect. The amount of available network audit data instances is usually large; human labeling is tedious, time-consuming, and expensive. Traditional anomaly detection algorithms require a set of purely normal data from which they train their model. In this paper we propose an intrusion detection method that combines Fuzzy Clustering and Genetic Algorithms. Clustering-based intrusion detection algorithm which trains on unlabeled data in order to detect new intrusions. Fuzzy c-Means allow objects to belong to several clusters simultaneously, with different degrees of membership. Genetic Algorithms (GA) to the problem of selection of optimized feature subsets to reduce the error caused by using land-selected features. Our method is able to detect many different types of intrusions, while maintaining a low false positive rate. We used data set from 1999 KDD intrusion detection contest.","2325-940X;2325940X","0-7803-9503-4;0780395034","","10.1109/INDCON.2005.1590237","http://ieeexplore.ieee.org/stamp/stamp.jsp?arnumber=1590237","Anomaly detection;Fuzzy c-means;Genetic Algorithms;Unsupervised clustering","Clustering algorithms;Computer networks;Data mining;Detection algorithms;Face detection;Fuzzy systems;Genetic algorithms;Humans;Intrusion detection;Labeling","","Anomaly detection;Fuzzy c-means;Genetic Algorithms;Unsupervised clustering","","3","","22","","","11-13 Dec. 2005","","IEEE","IEEE Conference Publications"
"Handling nominal features in anomaly intrusion detection problems","Mei-Ling Shyu; K. Sarinnapakorn; I. Kuruppu-Appuhamilage; Shu-Ching Chen; LiWu Chang; T. Goldring","Dept. of Electr. & Comput. Eng., Miami Univ., Coral Gables, FL, USA","15th International Workshop on Research Issues in Data Engineering: Stream Data Mining and Applications (RIDE-SDMA'05)","20050906","2005","","","55","62","Computer network data stream used in intrusion detection usually involve many data types. A common data type is that of symbolic or nominal features. Whether being coded into numerical values or not, nominal features need to be treated differently from numeric features. This paper studies the effectiveness of two approaches in handling nominal features: a simple coding scheme via the use of indicator variables and a scaling method based on multiple correspondence analysis (MCA). In particular, we apply the techniques with two anomaly detection methods: the principal component classifier (PCC) and the Canberra metric. The experiments with KDD 1999 data demonstrate that MCA works better than the indicator variable approach for both detection methods with the PCC coming much ahead of the Canberra metric.","1097-8585;10978585","0-7695-2390-0;0769523900","","10.1109/RIDE.2005.10","http://ieeexplore.ieee.org/stamp/stamp.jsp?arnumber=1498231","Anomaly detection;indicator variables;intrusion detection;multiple correspondence analysis;nominal features;principal component classifier","Application software;Computer networks;Computer science;Data mining;Feature extraction;Intrusion detection;Laboratories;National security;Telecommunication traffic;Traffic control","computer network management;data mining;principal component analysis;security of data","Canberra metric;KDD 1999 data;anomaly intrusion detection problems;computer network data stream;data type;indicator variables;multiple correspondence analysis;nominal features;principal component classifier;simple coding scheme;symbolic features","","8","","27","","","3-4 April 2005","","IEEE","IEEE Conference Publications"
"Optimization and control problems in Real-time Intrusion Detection","J. B. D. Cabrera; W. Lee; R. K. Prasanth; L. Lewis; R. K. Mehra","Sci. Syst. Co., Woburn, MA, USA","Decision and Control, 2002, Proceedings of the 41st IEEE Conference on","20030310","2002","2","","1408","1413 vol.2","Real-time Intrusion Detection Systems attempt to detect and respond to attacks in real time, i.e. while they are unfolding. When the available computation time is scarce, we have a trade-off involving the computation time of the detection rules and: (1) the accuracy of the rules given by their detection and false alarm rates, (2) the likelihood that a given attack is present, which depends on the prior probability of the attacks, and (3) the damage costs and false alarm costs of the attacks. This paper describes a collection of 0/1 Integer Programming Problems that are associated with the selection of appropriate Rule Portfolios for Real Time Intrusion Detection Systems. The problems are shown to have Knapsack and Set Packing constraints. Due to the inherent uncertainty of the parameters in the cost models, a robust version of the problem is also studied, where parametric uncertainties are allowed to be present. The Linear Programming Relaxation of the robust problem is shown to be convex, opening the possibility of concrete utilization of the proposed methodology. Preliminary results on a research testbed are presented.","0191-2216;01912216","0-7803-7516-5;0780375165","","10.1109/CDC.2002.1184715","http://ieeexplore.ieee.org/stamp/stamp.jsp?arnumber=1184715","","Concrete;Costs;Educational institutions;Intrusion detection;Linear programming;Monitoring;Portfolios;Real time systems;Robustness;Uncertainty","linear programming;optimisation;robust control;safety systems","integer programming;intrusion detection systems;parametric uncertainties;real time intrusion detection;robust problem;rule portfolios","","3","","17","","","10-13 Dec. 2002","","IEEE","IEEE Conference Publications"
"High-Performance Stateful Intrusion Detection System","S. Yoon; B. Kim; J. Oh","Electronics and Telecommunications, Research Institute, Network Security, Architecture Team, 161 Gajeong-dong, Yuseong-gu, Daejeon, Korea. syyoon@etri.re.kr","2006 International Conference on Computational Intelligence and Security","20070129","2006","1","","574","579","This paper is related with a stateful intrusion detection technology which is based on session state tracking in network intrusion detection systems (NIDSs). Today's network security systems are required high-performance as well as good functionality since the speed of the Internet is increasing. But most of the software-based NIDSs (e.g. Snort) show inefficiency and even fail to perform for the faster Internet. In this paper, we provide hardware-based stateful intrusion detection module to overcome these shortcomings of software-based solutions. By implementing stateful intrusion detection module in FPGA, we can solve the problem of performance and has capability of intrusion detection in future multi-gigabit network environment. In addition, we can improve the accuracy of intrusion detection with reducing false positive alerts","","1-4244-0604-8;1424406048","1-4244-0605-6;1424406056","10.1109/ICCIAS.2006.294201","http://ieeexplore.ieee.org/stamp/stamp.jsp?arnumber=4072154","","Data security;Field programmable gate arrays;Hardware;High-speed networks;IP networks;Internet;Intrusion detection;Logic;Pattern matching;Telecommunication traffic","field programmable gate arrays;security of data","Internet;field programmable gate array;hardware-based stateful intrusion detection;network intrusion detection system;network security system;session state tracking","","1","","18","","","Nov. 2006","","IEEE","IEEE Conference Publications"
"Host intrusion detection using system call argument-based clustering combined with Bayesian classification","O. Koucham; T. Rachidi; N. Assem","Sch. of Sci. & Eng., Al Akhawayn Univ. in Ifrane, Ifrane, Morocco","SAI Intelligent Systems Conference (IntelliSys), 2015","20151221","2015","","","1010","1016","We deal in this paper with anomaly-based host intrusion detection using system call traces produced by a host's kernel. In addition to the sequences, we leverage system call arguments, contextual information and domain level knowledge to produce clusters for each individual system call. These clusters are then used to rewrite process sequences of system calls obtained from kernel logs. The new sequences are then fed to a naive Bayes supervised classifier (SC2.2) that builds class conditional probabilities from Markov modeling of system call sequences. The results of our proposed two-stage (that is clustering followed by classification) intrusion detection system on the 1999 DARPA dataset from the MIT Lincoln Lab show significant performance improvements in terms of false positive rate, while maintaining a high detection rate when compared with other classifiers. The two-stage classifier fares also better than classification alone with SC2.2 on system calls without arguments and contextual knowledge.","","","","10.1109/IntelliSys.2015.7361267","http://ieeexplore.ieee.org/stamp/stamp.jsp?arnumber=7361267","Classification;Clustering;Intrusion Detection;System Call Arguments","Electronic mail;Hidden Markov models;Intelligent systems;Intrusion detection;Markov processes;Measurement;Monitoring","Bayes methods;Markov processes;pattern classification;pattern clustering;security of data","Bayesian classification;Markov modeling;SC2.2;anomaly-based host intrusion detection;class conditional probabilities;contextual information;domain level knowledge;host kernel;naive Bayes supervised classifier;process sequence rewriting;system call argument-based clustering;system call arguments;system call sequences;system call traces;two-stage intrusion detection system","","","","18","","","10-11 Nov. 2015","","IEEE","IEEE Conference Publications"
"Special Issue on Cyber-Physical Systems (CPS)Part I","S. Guo; H. Frey; N. Kato; Y. Liu","The University of Aizu, Aizu, Japan","IEEE Transactions on Emerging Topics in Computing","20130923","2013","1","1","6","9","The articles in this special section focus on the technology and applications supported by cyber-physical systems.","2168-6750;21686750","","","10.1109/TETC.2013.2276731","http://ieeexplore.ieee.org/stamp/stamp.jsp?arnumber=6606485","","Ad hoc networks;Collaboration;Computational modeling;Embedded systems;Special issues and sections;Systems engineering and theory","","","","1","","","","","June 2013","","IEEE","IEEE Journals & Magazines"
"Reduced Complexity Intrusion Detection in Sensor Networks Using Genetic Algorithm","R. Khanna; H. Liu; H. H. Chen","Intel Corp., Hillsboro, OR, USA","2009 IEEE International Conference on Communications","20090811","2009","","","1","5","We propose a reduced-complexity genetic algorithm for intrusion detection of resource constrained multi-hop mobile sensor networks. Traditional intrusion detection mechanisms have limited applicability to the sensor networks due to scarce battery and processing resources. Therefore, an effective scheme would require a power efficient and lightweight approach to identify malicious attacks. The goal of this paper is to evaluate sensor node attributes by measuring the perceived threat and its suitability to host local monitoring node (LMN) that acts as trusted proxy agent for the sink and capable of securely monitoring its neighbors. Security attributes in conjunction with genetic algorithm jointly optimizes the placement of monitoring nodes (i.e., LMN) by dynamically evaluating node fitness by profiling workloads patterns, packet statistics, utilization data, battery status, and quality-of-service compliance.","1550-3607;15503607","978-1-4244-3435-0;9781424434350","978-1-4244-3435-0;9781424434350","10.1109/ICC.2009.5199399","http://ieeexplore.ieee.org/stamp/stamp.jsp?arnumber=5199399","","Battery charge measurement;Communication system security;Data security;Genetic algorithms;Intrusion detection;Monitoring;Peer to peer computing;Sensor phenomena and characterization;USA Councils;Wireless sensor networks","communication complexity;genetic algorithms;mobile radio;quality of service;statistical analysis;telecommunication security;wireless sensor networks","battery status;genetic algorithm;local monitoring node;malicious attack;network threat;packet statistics;quality-of-service compliance;reduced complexity intrusion detection;resource constrained multihop mobile sensor network;security attribute;trusted proxy agent;utilization data;workloads pattern","","3","","18","","","14-18 June 2009","","IEEE","IEEE Conference Publications"
"Fuzzy association rules vs fuzzy associative patterns in defending against web service attacks","Gaik-Yee Chana; Fang-Fang Chuaa; Chien-Sing Leeb","Fac. of Comput. & Inf., Multimedia Univ., Cyberjaya, Malaysia","Fuzzy Systems and Knowledge Discovery (FSKD), 2015 12th International Conference on","20160114","2015","","","524","529","This paper presents a fuzzy association rule-based intrusion detection and prevention (FAR IDP) system that is implemented within an e-commerce Web service-based application. This system compares the effectiveness and efficiency of using 20 fuzzy association rules compared to 366 fuzzy associative patterns (FAP) to determine whether to definitely grant access to normal transaction, probably deny access for suspicious transaction or certainly deny access to transactions which may contain malicious inputs or XML content. Experimental results from our FAR IDP system have demonstrated that both rules-based and pattern-based algorithms are able to detect, prevent and predict Web service attacks such as SQL injection, XML injection, DoS and SOAP oversized close to real-time, with detection accuracy of not lower than 99%. There is also a slight difference in terms of time; the transaction time for FAP is almost doubled that of FAR's in ms. Additionally, with a transaction time of less than 0.25ms and a detection accuracy of greater than 99%, our FAR IDP has outperformed many other fuzzy and Web service-based IDP systems.","","978-1-4673-7681-5;9781467376815","","10.1109/FSKD.2015.7381997","http://ieeexplore.ieee.org/stamp/stamp.jsp?arnumber=7381997","Web services;fuzzy association rules;intrusion detection;intrusion prevention","Association rules;Intrusion detection;Pattern matching;Prediction algorithms;Simple object access protocol;XML","Web services;fuzzy reasoning;security of data","DoS attack;FAP;FAR IDP system;SOAP attack;SQL injection attack;Web service attacks;XML injection attack;fuzzy association rules;fuzzy associative patterns;intrusion detection and prevention system;pattern-based algorithm;rules-based algorithm","","","","16","","","15-17 Aug. 2015","","IEEE","IEEE Conference Publications"
"Augmenting Branch Predictor to Secure Program Execution","Y. Shi; G. Lee","University of Illinois at Chicago, USA","37th Annual IEEE/IFIP International Conference on Dependable Systems and Networks (DSN'07)","20070716","2007","","","10","19","Although there are various ways to exploit software vulnerabilities for malicious attacks, the attacks always result in unexpected behavior in program execution, deviating from what the programmer/user intends to do. Program execution blindly follows the execution path specified by control flow transfer instructions with the targets generated at run-time without any validation. An enhancement is therefore proposed to secure program execution by introducing a validation mechanism over control flow transfer instructions at micro-architecture level. The proposed scheme, as a behavior-based protection, treats a triplet of the indirect branch's location, its target address, and the execution path preceding it as a behavior signature of program execution and validates it at run-time. The first two pieces of information can prevent an adversary from overwriting control data and introducing foreign code or impossible targets to redirect an indirect branch. The last one is necessary to defeat the attacks that use a legitimate target but follow an unintended execution path. Interestingly, the branch predictor is found to contain the signature information already and doing a portion of the validation when resolving the branch, thus greatly reducing the validation frequency. An enhancement of branch target buffer (BTB) entry together with a signature table implemented in the form of a Bloom filter in hardware is proposed to incorporate the validation into the processor's pipeline, providing a new defense in the processor architecture to secure program execution.","1530-0889;15300889","0-7695-2855-4;0769528554","","10.1109/DSN.2007.19","http://ieeexplore.ieee.org/stamp/stamp.jsp?arnumber=4272951","Bloom Filter;Branch Predictor;Control Flow Validation;Indirect Branch;Software Protection","Control systems;Data mining;Data security;Decision making;Filters;Frequency;Hardware;Programming profession;Protection;Runtime","program diagnostics;program verification;security of data","branch target buffer;program execution security;software vulnerabilities;unintended execution path;validation mechanism","","3","","29","","","25-28 June 2007","","IEEE","IEEE Conference Publications"
"A causal event graph for cyber-power system events using synchrophasor","U. Adhikari; T. H. Morris; S. Pan","Dept. of Electrical and Computer Engineering, Mississippi State University, Mississippi State, MS 39762","2014 IEEE PES General Meeting | Conference & Exposition","20141030","2014","","","1","5","The probability of occurrence of cyber-power events is ever increasing along with the operational challenges. Increases in electricity demand with inadequate delivery infrastructure and cyber-physical attack threats due to technological interdependencies introduce more complex events. Accurate and timely power system event identification and detection have great significance in system operation, monitoring, and control processes. Insufficient and slow event information may lead to catastrophes. Significant research effort is being made toward developing robust monitoring systems using advanced state of the art technologies such as synchrophasor technologies. This paper extends our previous work [1] and proposes a model that leverages the causal relationship between devices in cyber physical systems. Causal event graphs (CEG), a modified version of Bayesian networks, are used to create unique paths that model deterministic signatures of each cyber-physical event. The CEG and Bayesian network can be incorporated to event detection systems (EDS) to classify cyber physical events. A causal event graph for each scenario can be created using a sequence of power system events, measureable states, and logs from different sources. A modified IEEE 9 bus system with multi zone distance protection schemes for two transmission lines is used to demonstrate the proposed concept. A total of 22 cyber-physical scenarios are mapped into CEG and Bayesian networks to define rules for cyber-power system events.","1932-5517;19325517","","","10.1109/PESGM.2014.6939285","http://ieeexplore.ieee.org/stamp/stamp.jsp?arnumber=6939285","Bayesian network;CEG;EDS;cyber-physical;scenarios;synchrophasor","Bayes methods;Circuit faults;Monitoring;Phasor measurement units;Power system stability;Relays","belief networks;graph theory;phasor measurement;power transmission lines;power transmission protection","Bayesian networks;IEEE 9 bus system;causal event graph;cyber-physical attack threats;cyber-power system events;event detection systems;multizone distance protection;power system event identification;robust monitoring systems;synchrophasor technology;transmission lines","","0","","18","","","27-31 July 2014","","IEEE","IEEE Conference Publications"
