"Efficient hybrid rule pruning for intrusion detection using multi-dimensional probability distribution","N. Lu; S. Mabu; T. Wang; K. Hirasawa","Graduate School of Information, Production and Systems, Waseda University, Kitakyushu, Fukuoka, Japan","SICE Annual Conference (SICE), 2011 Proceedings of","20111027","2011","","","2822","2828","Evolutionary algorithms for data mining have recently received increased attention due to their performance of the global search. Genetic Network Programming(GNP) has been proposed in recent years as one of the evolutionary algorithms and applied to data mining successfully, because of the prominent representation ability with the compact program derived from the directed graph structure and node reusability of GNP. Conventional GNP-based rule mining focused on binary-valued transaction data. Therefore, Fuzzy GNP based class association rule mining has been proposed to deal with the continuous-valued data types in the real network connection data. In this paper, firstly, many interesting rules are extracted by Fuzzy GNP-based hybrid class association rule mining from training data. Then, a post-processing method is used to prune class association rules. After that, a classifier is modeled based on the multi-dimensional probability distribution for testing data. Experiments on KDDCup 1999 data show the substantial improvement of the detection ability of the proposed method.","pending","978-1-4577-0714-8;9781457707148","","","http://ieeexplore.ieee.org/stamp/stamp.jsp?arnumber=6060463","Fuzzy GNP;Genetic Algorithm;Intrusion Detection;Multi-Dimensional Probability Distribution;Rule Pruning","Association rules;Computers;Economic indicators;Genetic algorithms;Genetics;Intrusion detection","data mining;fuzzy set theory;genetic algorithms;pattern classification;security of data;statistical distributions","KDDCupl999 data;class association rule pruning;continuous valued data;data mining;directed graph structure;evolutionary algorithm;fuzzy GNP based class association rule mining;genetic network programming;global search;hybrid rule pruning;intrusion detection ability;multidimensional probability distribution;node reusability;post-processing method;real network connection data;training data","","0","","16","","","13-18 Sept. 2011","","IEEE","IEEE Conference Publications"
"An architecture for network stream splitting in support of intrusion detection","J. D. Judd; J. C. McEachen","Dept. of Comput. Sci., Naval Postgraduate Sch., Monterey, CA, USA","Information, Communications and Signal Processing, 2003 and Fourth Pacific Rim Conference on Multimedia. Proceedings of the 2003 Joint Conference of the Fourth International Conference on","20040504","2003","3","","1717","1721 vol.3","We describe a system where fuzzy reasoning is used to selectively reduce the amount of traffic sent to an intrusion detection system (IDS) while simultaneously both reducing the number of false alarms generated by the IDS and maintaining the ability of the IDS to accurately recognize network attacks. Specifically, we apply a type of filtering we term IDS stream splitting, which consists of classifying each packet as either trusted or un-trusted when it is encountered between the sniffer and the IDS (within the firewall). This classification allows for fewer packets to be sent to an IDS devoted to examining un-trusted traffic. The logic of the splitter looks at each packet as part of a connection and give it a trust ranking from [0..1] using a fuzzy logic model. Initial results indicate that this approach can significantly reduce false alarm rates while increasing system up time.","","0-7803-8185-8;0780381858","","10.1109/ICICS.2003.1292760","http://ieeexplore.ieee.org/stamp/stamp.jsp?arnumber=1292760","","Computer architecture;Computer networks;Computer science;Filtering;Fuzzy logic;Intelligent networks;Intrusion detection;Maintenance engineering;Telecommunication traffic;Traffic control","computer networks;fuzzy logic;message authentication;telecommunication traffic","IDS stream splitting;false alarms;fuzzy logic model;intrusion detection system;network attacks;network stream splitting;sniffer;system up time;trusted traffic;untrusted traffic","","0","","7","","","15-18 Dec. 2003","","IEEE","IEEE Conference Publications"
"Remotely inferring device manipulation of industrial control systems via network behavior","G. Lontorfos; K. D. Fairbanks; L. Watkins; W. H. Robinson","Inf. Security Inst., Johns Hopkins Univ., Baltimore, MD, USA","Local Computer Networks Conference Workshops (LCN Workshops), 2015 IEEE 40th","20151228","2015","","","603","610","This paper presents preliminary findings on a novel method to remotely fingerprint a network of Cyber Physical Systems and demonstrates the ability to remotely infer the functionality of an Industrial Control System device. A monitoring node measures the target device's response to network requests and statistically analyzes the collected data to build and classify a profile of the device's functionality via machine learning. As ICSs are used to control critical infrastructure processes such as power generation and distribution, it is vital to develop methods to detect tampering. A system employing our measurement technique could discover if an insider has made unauthorized changes to a device's logic. Our architecture also has advantages because the monitoring node is separate from the measured device. Our results indicate the ability to accurately infer (i.e., using a tunable threshold value) discrete ranges of task cycle periods (i.e., CPU loads) that could correspond to different functions.","","","","10.1109/LCNW.2015.7365904","http://ieeexplore.ieee.org/stamp/stamp.jsp?arnumber=7365904","cyber-physical systems;device fingerprinting;machine learning;network traffic analysis;processor workload;security;tampering","Central Processing Unit;Delays;Feature extraction;Fingerprint recognition;Monitoring;Telecommunication traffic;Time factors","learning (artificial intelligence);process control;production engineering computing;statistical analysis","ICSs;critical infrastructure process control;cyber physical systems;industrial control system device;industrial control systems;machine learning;measurement technique;monitoring node;network behavior;power distribution;power generation;profile classification;remote network fingerprinting;remotely inferring device manipulation;statistical analysis;tampering detection","","","","16","","","26-29 Oct. 2015","","IEEE","IEEE Conference Publications"
"Implementation of classification and regression Tree (CART) and fuzzy logic algorithm for intrusion detection system","A. F. A. Pinem; E. B. Setiawan","Comput. Sci. Dept., Telkom Univ., Bandung, Indonesia","Information and Communication Technology (ICoICT ), 2015 3rd International Conference on","20150903","2015","","","266","271","Intrusion detection system is a system that can detect the presence intrusion or attack in a computer network. There are 2 type of intrusion detection system that misuse/signature detection and anomaly detection. This research use a combination of Classification and regression Tree (CART) and Fuzzy Logic method is used to detect intrusion or attack. CART is used to build rule or model that will be implemented by fuzzy inference engine. Testing process is performed using Fuzzy Logic without doing defuzzification because the resulting rule will be used as a classification. Training, testing and validation of the model is done by using KDD Cup 1999 dataset that has been through the preprocessing and cleaning data process. Accuracy testing and validation is calculated by using the confusion matrix. From several test performed, the best model is built from training 70%, the depth of tree 11 and node leaf minimum percentage 90% with an accuracy was 85,68% and average time validation was 21,92 second.","","","","10.1109/ICoICT.2015.7231434","http://ieeexplore.ieee.org/stamp/stamp.jsp?arnumber=7231434","Anomaly Detection;Classification and Regression Tree;Fuzzy Logic;Intrusion Detection System;Misuse Detection","Conferences","fuzzy logic;fuzzy reasoning;matrix algebra;pattern classification;regression analysis;security of data","CART;KDD Cup 1999 dataset;anomaly detection;classification and regression tree;cleaning data process;computer network attack;confusion matrix;defuzzification;fuzzy inference engine;fuzzy logic algorithm;fuzzy logic method;intrusion detection system;misuse detection;presence intrusion;signature detection;testing process","","0","","14","","","27-29 May 2015","","IEEE","IEEE Conference Publications"
"An intrusion detection method based on decision tree","Yongjin Liu; Na Li; Leina Shi; Fangping Li","School of Information Engineering, Handan College, China","E-Health Networking, Digital Ecosystems and Technologies (EDT), 2010 International Conference on","20100628","2010","1","","232","235","How to find the intrusion behaviors is a problem that troubled the intrusion detection field for years. Until now, there is not a good method to solve it, epically in a realistic context. Most methods are effective on small data sets, but when used to the massive data of IDS, the effectiveness seems to be unsatisfactory. In this paper, a new method based on decision tree is discussed to solve the problem of low detection rate of massive data.","","978-1-4244-5514-0;9781424455140","","10.1109/EDT.2010.5496597","http://ieeexplore.ieee.org/stamp/stamp.jsp?arnumber=5496597","agent;decision tree;intrusion detection;random decision tree","Bagging;Boosting;Classification tree analysis;Decision trees;Ecosystems;Information systems;Intrusion detection;Large-scale systems;Stability","decision trees;security of data","decision tree;detection rate;intrusion behavior;intrusion detection method;massive data","","2","","12","","","17-18 April 2010","","IEEE","IEEE Conference Publications"
"The Method of Classified Danger Sensed for Windows Process Intrusion Detection","F. Xu; C. Tan; Y. Zheng; M. Geng","Sch. of Comput. Sci., Wuhan Univ., Wuhan, China","Management of e-Commerce and e-Government, 2009. ICMECG '09. International Conference on","20091006","2009","","","469","472","Once the computer system is intruded, the change from normal to abnormal is a gradual procedure. Setting up a calculating model based on danger theory for danger signal during the procedure will improve the accuracy and efficiency of artificial immune system (AIS) greatly. In this paper, the method of classified danger sensed (MCDS) for windows process intrusion detection based on danger theory is proposed. This method divides the processpsilas behavior parameters into two types: numeric and non-numeric types, using the functionpsilas difference and correlation coefficient to analyze the rule and relevance of numeric parameterspsila change, and evaluating the degree of danger of non-numeric parameters by analyzing the danger level and time relationship (TR) of data. Based on these methods, we establish calculating models of numeric and non-numeric danger signals separately, finally give the definition and calculating method of danger degree.","","978-0-7695-3778-8;9780769537788","","10.1109/ICMeCG.2009.72","http://ieeexplore.ieee.org/stamp/stamp.jsp?arnumber=5280069","Artificial Immune System;Danger Sensed;Information Security;Intrusion Detection","Artificial immune systems;Clouds;Computer science;Conference management;Data analysis;Electronic government;Information security;Intrusion detection;Numerical models;Statistical analysis","artificial immune systems;operating systems (computers);security of data","Windows process intrusion detection;artificial immune system;computer system;danger theory model;method-of-classified danger sensed","","0","","8","","","16-19 Sept. 2009","","IEEE","IEEE Conference Publications"
"DTAD: A Dynamic Taint Analysis Detector for Information Security","Z. Bai; L. Wang; J. Chen; L. Xu; J. Liu; X. Liu","Software Eng. Inst., Xidian Univ., Xi'an","Web-Age Information Management, 2008. WAIM '08. The Ninth International Conference on","20080812","2008","","","591","597","Information infection and information leakage in computer systems are mainly caused by insecure network access. Considering the particularity of network security, a tool DTAD (dynamic taint analysis detector) for information flow security detection is designed and implemented, aiming at the problem of data security in network access. This tool performs log recording and state controlling for malicious access and virus vulnerability using the state-control characteristic of virtual machines. Defense systems capture network data by executing applications to determine whether these accesses (i.e. target jumping, function address and instruction access) are legitimate or not. Once an attack is detected, the tool records states of the virtual machine at the process level as well as the kernel level. For attacks caused by malicious code, the tool injects its own diagnostic code into the process space of running programs to substitute the malicious code, as a result, related information for the attacked process is collected. The tool is able to generate precise signatures for network intrusion detection by associating and comparing network data recorded in log files with process information collected by the virtual machine, the whole process is finished automatically. The tool can also precisely identify attack types and provide effective protection measures through fast signature releasing. Experiments have validated the efficiency of the tool in attack recognition and information protection, and indicated that this detection and protection system is effective in recognizing, tracking and processing taint data.","","978-0-7695-3185-4;9780769531854","978-0-7695-3185-4;9780769531854","10.1109/WAIM.2008.60","http://ieeexplore.ieee.org/stamp/stamp.jsp?arnumber=4597071","","Costs;Data security;Detectors;Information analysis;Information management;Information security;Intrusion detection;Protection;Virtual machining;Viruses (medical)","computer viruses;program diagnostics;virtual machines","attack recognition;computer systems;data security;defense systems;diagnostic code;dynamic taint analysis detector;information flow security detection;information infection;information leakage;information protection;information security;log recording;malicious access;network access;network intrusion detection;state control;virtual machines;virus vulnerability","","0","","28","","","20-22 July 2008","","IEEE","IEEE Conference Publications"
"New directions in covert malware modeling which exploit white-listing","J. Wang; G. Kesidis; D. J. Miller","Department of EE & CSE, Penn State University, USA","2007 IEEE Sarnoff Symposium","20080716","2007","","","1","7","Zero-day attacks - especially those that hide the attack exploit by using code obfuscation and encryption - remain a formidable challenge to existing network defenses. Many techniques have been developed that can address known attacks and similar new attacks that may arise in the future. Some methods, like Earlybird and Polygraph, focus on string-based content prevalence in payloads; others focus on the presence of particular I386 instructions, e.g., Sigfree counts the number of ldquousefulrdquo instructions in each request. For both types of systems, a white-listing mechanism, in which some strings or instructions are regarded as innocuous, is necessary to avoid a high false positive rate associated with common content such as URL addresses and peer-to-peer traffic. In this paper, we explore a more sophisticated attack model that not only makes malcode payloads look like nominal ones, but which is also assumed to be both aware of and exploitative of the white-listing itself in forming a Trojan mechanism. In other words, the malware attempts to embed its malcode into the prevalent content that is normally white-listed. If the malcode is encrypted, the attacker will also attempt to obfuscate its plain-text decryption code as much as possible. Both current string-based and instructionbased systems will likely fail to detect such attacks. We propose a comprehensive IDS model in the paper and discuss some potential defensive mechanisms against such attack.","","978-1-4244-2483-2;9781424424832","","10.1109/SARNOF.2007.4567340","http://ieeexplore.ieee.org/stamp/stamp.jsp?arnumber=4567340","","Computer networks;Computer worms;Cryptography;Distributed computing;Electronic mail;Embedded computing;Humans;Intrusion detection;Military computing;Payloads","cryptography;invasive software;peer-to-peer computing;telecommunication security;telecommunication traffic;tree data structures","IDS model;Trojan mechanism;URL addresses;code obfuscation;covert malware modeling;encryption;generalized suffix tree;network defenses;payload-based detection;peer-to-peer traffic;string-based content prevalence;white-listing mechanism;zero-day attacks","","0","1","35","","","April 30 2007-May 2 2007","","IEEE","IEEE Conference Publications"
"CDMA based distribution power net automatization and data transmission system","Wang Hankang; Li Quancheng; Jiang Hai","Dept. of Commun., Nanjing Autom. Res. Inst., China","2005 International Power Engineering Conference","20060508","2005","","","1","254","Taking the opportunity of fast growing mobile data communication, this paper proposes a kind of CDMA network based distribution power net automatization and data transmission system, analyzes economic, security, feasibility and up-to-date aspects of the system, and it also carries out simulations on time delay for MAC layer. Based on China Unicorn's CDMA public mobile network platform, this system provides a high speed, secure, flexible, reliable and economical way of data transmission, processing and communication platform for distribution power net automatization, and which hence realizes distribution power net automatization data transmission and processing","1947-1262;19471262","981-05-5702-7;9810557027","","10.1109/IPEC.2005.206916","http://ieeexplore.ieee.org/stamp/stamp.jsp?arnumber=1627205","Code division multiple access (CDMA);mobile communication;power distribution;wireless data communication","Analytical models;Communication system security;Data analysis;Data communication;Data security;Multiaccess communication;Power generation economics;Power system economics;Power system reliability;Power system security","carrier transmission on power lines;code division multiple access;data communication;mobile radio","CDMA public mobile network platform;MAC layer;data transmission system;distribution power net automatization;mobile data communication;time delay","","1","","13","","","Nov. 29 2005-Dec. 2 2005","","IEEE","IEEE Conference Publications"
"Intrusion Detection System for Electric Power Information Network Based on Improved Ball Vector Machine","W. Yufei; Z. Liang; W. Jing","Dept. of Inf. & Commun., China Electr. Power Res. Inst., Beijing, China","Intelligent Systems Design and Engineering Applications, 2013 Fourth International Conference on","20140630","2013","","","369","373","It is helpful to enhance the information security of Electric Power Information Network (EPIN) that researching the intrusion detection technology. In order to achieve efficient intrusion detection for EPIN, an Intrusion Detection System (IDS) based on the improved Ball Vector Machine (BVM) is proposed. In this paper, the IDS and its detection rules are automatically generated by the way that the improved BVM is used to train the historical data. In the IDS based on the improved BVM, the BVM is used to reduced time-consuming, in addition, in order to enhance the intrusion detection accuracy, the Particle Swarm Optimization (PSO) is used to search the best training parameters of BVM in training process. Finally the experiment based on EPIN data shows that the IDS based on the improved BVM has better performance than the traditions.","","978-1-4799-2791-3;9781479927913","","10.1109/ISDEA.2013.488","http://ieeexplore.ieee.org/stamp/stamp.jsp?arnumber=6843465","controlled islanding;power flow tracing;power system;splitting boundary","Accuracy;Intrusion detection;Optimization;Power systems;Real-time systems;Support vector machines;Training","particle swarm optimisation;power engineering computing;power system security;security of data;support vector machines","BVM;EPIN data;IDS;PSO;electric power information network;historical data training process;improved ball vector machine;information security;intrusion detection system;particle swarm optimization;support vector machine","","0","","13","","","6-7 Nov. 2013","","IEEE","IEEE Conference Publications"
"JCADS: Semi-supervised clustering algorithm for network anomaly intrusion detection systems","R. P. Palnaty; A. Rao","Dept. of CSE, JNTUH, Hyderabad, India","Advanced Computing Technologies (ICACT), 2013 15th International Conference on","20140116","2013","","","1","5","Detection of the anomaly activities in the network has been a growing problem, motivating widespread research in the area of automated intrusion detection systems. In the automated intrusion detection systems, classification of n-dimensional vectors of the network traffic is a challenging area. Several research works was already done on this topic. But most of the works were presented to have high detection rates, But with false positives. In this paper, we presented a novel approach to have a high detection rate and very low false positives and false negatives in the classification of network traffic using jaccords coefficient (JC) similarity. The proposed approach is employed on low dimensional space of network traffic profiles with the KDDCUP99 dataset. The experimental study shows that the use of jaccords coefficient similarity clustering on the network traffic profile will increases the detection rate and avoids the false positives in the classification.","","978-1-4673-2816-6;9781467328166","","10.1109/ICACT.2013.6710498","http://ieeexplore.ieee.org/stamp/stamp.jsp?arnumber=6710498","","Accuracy;Clustering algorithms;Data mining;Indexes;Intrusion detection;Protocols;Tuning","computer network security;pattern classification;pattern clustering;security of data;telecommunication traffic","JC similarity;JCADS;KDDCUP99 dataset;automated intrusion detection systems;detection rate;false negatives;false positives;jaccords coefficient similarity clustering;n-dimensional vectors classification;network anomaly intrusion detection systems;network traffic;semisupervised clustering algorithm","","0","","22","","","21-22 Sept. 2013","","IEEE","IEEE Conference Publications"
"A self learning model for detecting SIP malformed message attacks","S. Aziz; M. Gul","Computer Science Department, National University of Computer and Emerging Sciences, Islamabad, Pakistan","Broadband Network and Multimedia Technology (IC-BNMT), 2010 3rd IEEE International Conference on","20110131","2010","","","744","749","This paper analyses the vulnerabilities exist in SIP protocol, and how these vulnerabilities can be exploited by attackers to attack the SIP based networks i.e VoIP and IMS [IP Multimedia Subsystem]. An attack tool is developed to exploit those vulnerabilities and a two-gram self learning solution is proposed to protect SIP based networks from these attacks.","","978-1-4244-6769-3;9781424467693","","10.1109/ICBNMT.2010.5705189","http://ieeexplore.ieee.org/stamp/stamp.jsp?arnumber=5705189","SIP attack;SIP fuzzing;SIP malformed messages;malformed message detection;self learning;two-gram detection model","Computer crashes;IP networks;Multimedia communication","Internet telephony;multimedia systems;protocols;unsupervised learning","IMS;IP multimedia subsystem;SIP protocol;VoIP;self learning model","","0","","11","","","26-28 Oct. 2010","","IEEE","IEEE Conference Publications"
"Securi CAD by Foreseeti: A CAD Tool for Enterprise Cyber Security Management","M. Ekstedt; P. Johnson; R. Lagerstr&#x00F6;m; D. Gorton; J. Nydr&#x00E9;n; K. Shahzad","KTH R. Inst. of Technol., Stockholm, Sweden","2015 IEEE 19th International Enterprise Distributed Object Computing Workshop","20151029","2015","","","152","155","This paper presents a CAD tool for enterprise cyber security management called securi CAD. It is a software developed during ten years of research at KTH Royal Institute of Technology, and it is now being commercialized by foreseeti (a KTH spin-off company). The idea of the tool is similar to CAD tools used when engineers design and test cars, buildings, etc. Specifically, the securi CAD user first models the IT environment, an existing one or one under development, and then securi CAD, using attack graphs, calculates and highlights potential weaknesses and avenues of attacks. The main benefits with securi CAD are, 1) built in security expertise, 2) visualization, 3) holistic security assessments, and 4) scenario comparison (decision-making) capabilities.","2325-6583;23256583","","","10.1109/EDOCW.2015.40","http://ieeexplore.ieee.org/stamp/stamp.jsp?arnumber=7310686","analysis;cyber security;enterprise architecture;modeling","Analytical models;Computational modeling;Computer architecture;Firewalls (computing);Software","CAD;decision making;graph theory;security of data","CAD tool;Foreseeti;KTH Royal Institute of Technology;KTH spin-off company;SecuriCAD;attack graph;built in security expertise;decision-making capability;enterprise cyber security management;scenario comparison;security assessment;visualization","","","","33","","","21-25 Sept. 2015","","IEEE","IEEE Conference Publications"
