"Reverse proxy framework using sanitization technique for intrusion prevention in database","V. S. Randhe; A. B. Chougule; D. Mukhopadhyay","Dept. of Inf. Technol., Maharashtra Inst. of Technol., Pune, India","Computational Intelligence and Information Technology, 2013. CIIT 2013. Third International Conference on","20141110","2013","","","200","208","With the increasing importance of the internet in our day-to-day life, data security in web application has become very crucial. Ever increasing online and real time transaction services have led to manifold rise in the problems associated with the database security. Attacker uses illegal and unauthorized approaches to hijack the confidential information like username, password and other vital details. Hence the real-time transaction requires security against web based attacks. SQL injection and cross site scripting attack are the most common application layer attack. The SQL injection attacker pass SQL statement through a web application's input fields, URL or hidden parameters and get access to the database or update it. The attacker take a benefit from user provided data in such a way that the user's input is handled as a SQL code. Using this vulnerability an attacker can execute SQL commands directly on the database. SQL injection attacks are most serious threats which take user's input and integrate it into SQL query. Reverse Proxy is a technique which is used to sanitize the users' inputs that may transform into a database attack. In this technique a data redirector program redirects the user's input to the proxy server before it is sent to the application server. At the proxy server, data cleaning algorithm is triggered using a sanitizing application. In this framework we include detection and sanitization of the tainted information being sent to the database and innovate a new prototype.","","","","10.1049/cp.2013.2592","http://ieeexplore.ieee.org/stamp/stamp.jsp?arnumber=6950876","Cross Site Scripting Attack;Data Sanitization;Database Security;SQL Attack;SQL Injection;Security Threats","","Internet;SQL;database management systems;query processing;security of data","Internet;SQL code;SQL injection attacker;SQL query;SQL statement;URL;Web application;Web based attacks;application layer attack;confidential information;cross site scripting attack;data redirector program;data security;database attack;database security;illegal approaches;intrusion prevention;proxy server;real-time transaction;reverse proxy framework;sanitization technique;transaction services;unauthorized approaches","","0","","","","","18-19 Oct. 2013","","IET","IET Conference Publications"
"Towards Situational Awareness of Large-Scale Botnet Probing Events","Z. Li; A. Goyal; Y. Chen; V. Paxson","NEC Laboratories America, Inc., Princeton, NJ, USA","IEEE Transactions on Information Forensics and Security","20110214","2011","6","1","175","188","Botnets dominate today's attack landscape. In this work, we investigate ways to analyze collections of malicious probing traffic in order to understand the significance of large-scale botnet probes. In such events, an entire collection of remote hosts together probes the address space monitored by a sensor in some sort of coordinated fashion. Our goal is to develop methodologies by which sites receiving such probes can infer-using purely local observation-information about the probing activity: What scanning strategies does the probing employ? Is this an attack that specifically targets the site, or is the site only incidentally probed as part of a larger, indiscriminant attack? Our analysis draws upon extensive honeynet data to explore the prevalence of different types of scanning, including properties, such as trend, uniformity, coordination, and darknet avoidance. In addition, we design schemes to extrapolate the global properties of scanning events (e.g., total population and target scope) as inferred from the limited local view of a honeynet. Cross-validating with data from DShield shows that our inferences exhibit promising accuracy.","1556-6013;15566013","","","10.1109/TIFS.2010.2086445","http://ieeexplore.ieee.org/stamp/stamp.jsp?arnumber=5599296","Botnet;computer network security;global property extrapolation;honeynet;scan strategy inference;site security monitoring;situational awareness;statistical inference","","computer network security;telecommunication traffic","attack landscape;cross validation;darknet avoidance;honeynet data;indiscriminant attack;large-scale botnet probing events;malicious probing traffic;probing activity;scanning strategy;situational awareness","","9","","28","","2010-10-11","March 2011","","IEEE","IEEE Journals & Magazines"
"Tracking-Based Wireless Intrusion Detection for Vehicular Networks","F. Santoso; R. Malaney","Sch. of Electr. Eng. & Telecommun., Univ. of New South Wales, Sydney, NSW, Australia","Vehicular Technology Conference (VTC Fall), 2011 IEEE","20111201","2011","","","1","5","In this work we develop a new tracking-based wireless intrusion detection algorithm that allows for the identification of malicious vehicle network users who are not at their appropriate locations. Based on a particle filter implementation and detection thresholds set by Cramer-Rao lower bounds we show how our tracking-verification algorithm is capable of verifying any reported positions within a reasonable time frame of order 30 seconds. We explicitly determine how the performance of the algorithm, as measured by detection and false positive rates, is influenced by the amount of tracking information collected. The results presented here are important for implementation of safe vehicular networks where only users at the expected locations can access and participate in the network communications.","1090-3038;10903038","978-1-4244-8328-0;9781424483280","","10.1109/VETECF.2011.6092896","http://ieeexplore.ieee.org/stamp/stamp.jsp?arnumber=6092896","","Base stations;Intrusion detection;Mathematical model;Noise;Vehicles;Wireless communication;Wireless sensor networks","particle filtering (numerical methods);safety systems;telecommunication security;vehicular ad hoc networks","Cramer-Rao lower bounds;malicious vehicle network users;network communications;particle filter implementation;tracking-based wireless intrusion detection","","1","","17","","","5-8 Sept. 2011","","IEEE","IEEE Conference Publications"
"A New Intrusion Detection System Using Class and Sample Weighted C-support Vector Machine","J. Jiang; R. Li; T. Zheng; F. Su; H. Li","Coll. of Comput. Sci., Inner Mongolia Univ., Huhhot, China","Communications and Mobile Computing (CMC), 2011 Third International Conference on","20110627","2011","","","51","54","Whenever an intrusion occurs, the security of a computer system is compromised. Presently there are a lot of algorithms applied in intrusion detection systems. The SVM is one of the most successful ones in the data mining area, but its biasing behavior with uneven datasets limits its use. Shu-Xin Du proposed an improved approach named weighted SVM to solve this problem. However, Weighted SVM considers different penalty parameters about class only and ignores importance among different samples. In this paper, we introduced class and sample weighted factors respectively and propose a new method, namely, Class and Sample Weighted C-Support Vector Machine (CSWC-SVM) to solve the problem. Furthermore we construct a decision model. Experimental simulations with KDD Cup 1999 Data proved our approach works well and outperforms other approaches such as the standard C-SVM and Weighted SVM in terms of accuracy, false positive rate, and false negative rate.","","978-1-61284-312-4;9781612843124","","10.1109/CMC.2011.101","http://ieeexplore.ieee.org/stamp/stamp.jsp?arnumber=5931123","SVM;biasing behavior;classification;intrusion detection;weighted factor","Error analysis;Intrusion detection;Optimization;Support vector machine classification;Training","pattern classification;security of data;support vector machines","class c-support vector machine;data mining;decision model;intrusion detection system;sample weighted c-support vector machine","","1","","9","","","18-20 April 2011","","IEEE","IEEE Conference Publications"
"Secure Machine Learning, a Brief Overview","X. Liao; L. Ding; Y. Wang","Nat. Eng. Res. Center for Fundamental Software, Inst. of Software, Beijing, China","Secure Software Integration & Reliability Improvement Companion (SSIRI-C), 2011 5th International Conference on","20110825","2011","","","26","29","The purpose of this article is to give a brief overview on the current work towards the emerging research problem of secure machine learning. Machine learning technique has been applied widely in various applications especially in spam detection and network intrusion detection. Most existing learning schemes assume that the environment they settle in is benign. However this is not always true in the real adversarial decision-making situations where the future data sets and the training data set are no longer from the same population, due to the transformations employed by the adversaries. As more and more machine learning systems are put into use, it is imperative to consider the security of the machine learning system. As a emerging problem, it is attracting more and more researchers' attention. In this article, we present a brief overview on secure machine learning and current progress on developing secure machine learning algorithms.","","978-1-4577-0781-0;9781457707810","978-0-7695-4454-0;9780769544540","10.1109/SSIRI-C.2011.15","http://ieeexplore.ieee.org/stamp/stamp.jsp?arnumber=6004498","Overview;Secure Machine Learning","Collaboration;Intrusion detection;Learning systems;Machine learning;Machine learning algorithms;USA Councils","decision making;learning (artificial intelligence);security of data","machine learning security;network intrusion detection;real adversarial decision making situation;secure machine learning;spam detection","","1","","22","","","27-29 June 2011","","IEEE","IEEE Conference Publications"
"Intrusion Detection Based on Support Vector Machine Using Heuristic Genetic Algorithm","T. Yerong; S. Sai; X. Ke; L. Zhe","China Luoyang Electron. Equip. Test Center, Luoyang, China","Communication Systems and Network Technologies (CSNT), 2014 Fourth International Conference on","20140529","2014","","","681","684","The parameters of Support Vector Machine (SVM) are optimized using heuristic genetic algorithm and then to detect the network intrusion behavior. The heuristic real-coded genetic algorithm is used to optimize the best parameters of SVM with Gauss kernel aimed at the classification accuracy of the model. The classification accuracy is largely improved. Experimental results show that this method has a broad application future.","","978-1-4799-3069-2;9781479930692","","10.1109/CSNT.2014.143","http://ieeexplore.ieee.org/stamp/stamp.jsp?arnumber=6821485","genetic algorithm;intrusion detection;support vector machines","Accuracy;Classification algorithms;Genetic algorithms;Intrusion detection;Optimization;Support vector machines;Training","computer network security;genetic algorithms;pattern classification;support vector machines","Gauss kernel;SVM;classification accuracy;heuristic genetic algorithm;intrusion detection;network intrusion behavior;support vector machine","","1","","6","","","7-9 April 2014","","IEEE","IEEE Conference Publications"
"High-Accuracy Angle Detection for the Ultrawide FOV Acquisition Scheme in Free-Space Optical Links","L. Liu; B. Tu; T. Chen; Y. Liu; D. Wang","State Key Laboratory of Advanced Optical Communication Systems and Networks, School of Electronics Engineering and Computer Science, Peking University, Beijing, China","Journal of Lightwave Technology","20141015","2014","32","23","4510","4518","To achieve rapid establishment of free-space optical (FSO) links, we previously proposed an ultrawide field-of-view (FOV) acquisition scheme, which combines the fisheye lens and Voigt anomalous dispersion optical filter. In this paper, we focus on the angle detection accuracy of this ultrawide FOV acquisition scheme, which is one of primary factors for rapid establishment of FSO links. The positioning process is composed of two parts. One is the spot location, which acquires the position of the imaging spot of the incident beam. The other is the mapping from spot location to incident angle, with which the position of imaging spot can be turned into the angles of the incident beam. For the first part, an improved centroid locating algorithm is present to realize the subpixel accuracy of spot location, and theory and simulation are carried out to demonstrate the improved accuracy of this algorithm. For the second part, we propose the fisheye lens calibration algorithm, which integrates the fisheye lens projection model and natural neighbor interpolation algorithm. In addition, by combining with the measured data, the angle detection accuracy of this method can be improved gradually with the increased number of the measured data. The simulation results indicate that this new method can provide high-precision positioning of the laser beams, and the maximum angle detection error of this ultrawide FOV acquisition scheme can be less than 0.054 (0.94 mrad).","0733-8724;07338724","","","10.1109/JLT.2014.2360313","http://ieeexplore.ieee.org/stamp/stamp.jsp?arnumber=6915668","Fisheye lens calibration;fisheye lens calibration;free space optical link;high-accuracy angle detection;spot location;ultra-wide field-of-view acquisition;ultrawide field-of-view acquisition","Accuracy;Imaging;Interpolation;Laser beams;Lenses;Measurement by laser beam;Optical fiber communication","calibration;laser beams;lenses;optical communication equipment;optical images;optical links;optical projectors;photodetectors","Voigt anomalous dispersion optical filter;centroid locating algorithm;fisheye lens calibration algorithm;fisheye lens projection model;free-space optical links;high-accuracy angle detection;high-precision laser beam positioning;incident angle;incident beam imaging spot;integrated optics;natural neighbor interpolation algorithm;ultrawide FOV acquisition scheme;ultrawide field-of-view acquisition scheme","","1","","21","","2014-10-02","Dec.1, 1 2014","","IEEE","IEEE Journals & Magazines"
"Effective Statistical Detection of Smart Confidentiality Attacks in Multi-Domain Networks","M. Gharbaoui; F. Paolucci; A. Giorgetti; B. Martini; P. Castoldi","TeCIP Inst., Scuola Superiore Sant'Anna, Pisa, Italy","IEEE Transactions on Network and Service Management","20131211","2013","10","4","383","397","The need to preserve information confidentiality among network providers has prevented the actual deployment of effective Traffic Engineering (TE) solutions for QoS-enabled end-to-end connectivity services in multi-domain multi-provider networks. The use of Path Computation Element (PCE) architecture can foster the effective implementation of TE through a centralized engine devoted to end-to-end path computations. However, despite authentication, authorization and encryption, confidentiality issues may arise due to abuses of information included in path computation replies to bogus requests issued by malicious PCEs. This paper first demonstrates the security leak allowing the exposure of intra-domain information in current inter-PCE path computation procedures. Then it proposes an anomaly-based approach, namely PCE Anomaly Detector (PAD) in order to detect malicious utilization of path computation services. The proposed PAD employs a novel double-step multi-dimensional formulation based on the Sequential Hypothesis Testing (SHT) statistical classification procedure, able to recognize a suspicious sequence of requests while aiming at inferring confidential information about other domains. PAD is extensively evaluated through simulations. Results show good performance in terms of detection capabilities while guaranteeing the trade-off between accuracy and responsiveness, minimizing false alarm occurrences. Robustness against smart attacks is also proved with respect to a comprehensive set of attack patterns and under different network load conditions. Finally, intra-domain information exposition is evaluated, showing the PAD ability to preserve confidentiality.","1932-4537;19324537","","","10.1109/TNSM.2013.111113.130482","http://ieeexplore.ieee.org/stamp/stamp.jsp?arnumber=6662354","BGP;Multi-domain networks;PCE;control plane security;sequential hypothesis testing;traffic engineering","Computer architecture;Network security;Network topology;Quality of service;Statistical analysis","authorisation;computer network security;cryptography;message authentication;quality of service;statistical analysis;telecommunication traffic","PAD;PCE anomaly detector;PCE architecture;QoS-enabled end-to-end connectivity services;SHT;TE solutions;anomaly-based approach;attack patterns;authentication;authorization;bogus requests;encryption;end-to-end path computations;information confidentiality;inter-PCE path computation;intradomain information exposition;intradomain information exposure;malicious PCE;malicious utilization detection;multidomain multiprovider networks;network load conditions;network providers;path computation element;security leak;sequential hypothesis testing;smart confidentiality attacks;statistical classification procedure;statistical detection;traffic engineering","","1","","","","2013-11-12","December 2013","","IEEE","IEEE Journals & Magazines"
"Notice of Violation of IEEE Publication Principles<BR>A New Optimization Algorithm for Dynamic Compensation of Sensors","W. Tian; J. Liu","Autom. Inst., Beijing Union Univ., Beijing, China","Computer Modeling and Simulation, 2010. ICCMS '10. Second International Conference on","20100225","2010","2","","38","41","Notice of Violation of IEEE Publication Principles<BR><BR>A New Optimization Algorithm for Dynamic Compensation of Sensors<BR>by WenJie Tian, JiCheng Liu<BR>in 2010 Second International Conference on Computer Modeling and Simulation (ICCMS 2010), 2010, pp. 38  41.<BR><BR>After careful and considered review of the content and authorship of this paper by a duly constituted expert committee, this paper has been found to be in violation of IEEE's Publication Principles.<BR><BR>This paper contains significant portions of original text from the paper cited below. The original text was copied with insufficient attribution (including appropriate references to the original author(s) and/or paper title) and without permission.<BR><BR>Due to the nature of this violation, reasonable effort should be made to remove all past references to this paper, and future references should be made to the following article:<BR><BR>Infrared thermometer sensor dynamic error compensation using Hammerstein neural network <BR>by Dehui Wu, Songling Huang, Wei Zhao, Junjun Xin<BR>in Sensors and Actuators A: Physical, 2009, Pages 152  158<BR><BR>A novel structure of dynamic model and improved artificial fish swarm algorithm (AFSA) are proposed in this paper and applied to construct a dynamic model to correct the dynamic errors of the infrared thermometer, because of which the dynamic performance of the thermometer is effectively improved. The dynamic compensator is established and the compensation is described and explicated by the support vector machine (SVM) model. According to SVM model, the novel structure is devised. The identification of thermometer non-linear dynamic compensator is achieved by artificial fish swarm algorithm. The results show that the stabilizing time of the thermometer is reduced and the dynamic performance is obviously improved after compensation.","","978-1-4244-5642-0;9781424456420","978-1-4244-5643-7;9781424456437","10.1109/ICCMS.2010.223","http://ieeexplore.ieee.org/stamp/stamp.jsp?arnumber=5421306","AFSA;SVM model;compensation;identification;infrared thermomete","Frequency;Heuristic algorithms;Infrared sensors;Nonlinear dynamical systems;Sensor phenomena and characterization;Support vector machines;Temperature measurement;Temperature sensors;Thermal conductivity;Thermal resistance","compensation;computerised instrumentation;identification;optimisation;stability;support vector machines;thermometers","artificial fish swarm algorithm;dynamic error correction;dynamic sensors compensation;identification;infrared thermometer;optimization algorithm;support vector machine","","1","","15","","","22-24 Jan. 2010","","IEEE","IEEE Conference Publications"
"CONDOR: A Hybrid IDS to Offer Improved Intrusion Detection","D. J. Day; D. A. Flores; H. S. Lallie","Sheffield Hallam Univ., Sheffield, UK","2012 IEEE 11th International Conference on Trust, Security and Privacy in Computing and Communications","20120906","2012","","","931","936","Intrusion Detection Systems are an accepted and very useful option to monitor, and detect malicious activities. However, Intrusion Detection Systems have inherent limitations which lead to false positives and false negatives; we propose that combining signature and anomaly based IDSs should be examined. This paper contrasts signature and anomaly-based IDSs, and critiques some proposals about hybrid IDSs with signature and heuristic capabilities, before considering some of their contributions in order to include them as main features of a new hybrid IDS named CONDOR (COmbined Network intrusion Detection ORientate), which is designed to offer superior pattern analysis and anomaly detection by reducing false positive rates and administrator intervention.","2324-898X;2324898X","978-1-4673-2172-3;9781467321723","","10.1109/TrustCom.2012.110","http://ieeexplore.ieee.org/stamp/stamp.jsp?arnumber=6296072","Anomaly;IDS;NIDS;false negative;false positive;hybrid;intrusion detection;signature","Databases;Engines;Intrusion detection;Proposals;Servers;Training","computer network security;digital signatures","CONDOR;anomaly based IDS;anomaly detection;combined network intrusion detection orientate;heuristic capability;hybrid IDS;intrusion detection systems;malicious activities detection;malicious activities monitoring;pattern analysis;signature based IDS;signature capability","","1","","27","","","25-27 June 2012","","IEEE","IEEE Conference Publications"
"Performance analysis of MAC protocol in wireless self-organizing network based on finite state machine","Z. Zhao; F. He","School of Communication Engineering Hangzhou, Dianzi University Hang Zhou, China","Future Computer and Communication (ICFCC), 2010 2nd International Conference on","20100628","2010","3","","V3-206","V3-210","Using the model of finite state machine, this paper describes the operation process of the IEEE 802.11 MAC protocol in wireless self-organizing networks as the process of state transfer. Based on the finite state machine and the support vector machine, an attack detection model in MAC layer is proposed. Moreover, in this model, how the attacker avoid successfully being detected and make the attack for different operating state of MAC protocol are studied. The simulation with NS-2.33 shows that the average throughput of the network decreases gradually as attacks are strengthened, while the consumption of the route increases gradually.","","978-1-4244-5821-9;9781424458219","","10.1109/ICFCC.2010.5497665","http://ieeexplore.ieee.org/stamp/stamp.jsp?arnumber=5497665","Finite State Machine;MAC protocol;wireless self-organizing networks","Automata;Communication system security;Helium;Intrusion detection;Media Access Protocol;Performance analysis;Routing protocols;Self-organizing networks;Support vector machines;Wireless application protocol","access protocols;finite state machines;self-organising feature maps;telecommunication computing;wireless LAN","IEEE 802.11;MAC protocol;NS-2.33;finite state machine;wireless self-organizing network","","0","","11","","","21-24 May 2010","","IEEE","IEEE Conference Publications"
