"Adaptive monitoring and management of security events with SDN","I. Adam; T. Ahola; M. Sailio; V. Vallivaara; F. von Eye","Nokia, Munich, Germany","NOMS 2016 - 2016 IEEE/IFIP Network Operations and Management Symposium","20160704","2016","","","817","820","All along changing connectivity requirements and new technologies have increased the complexity and dynamism of distributed system, thus presenting tough challenges for the network management and the network security. As a result new ways for monitoring and managing of security events are required. We present a novel idea how to exploit the software defined networking (SDN) and the real-time network anomaly detection to an efficient whole that offers for an operator both, a view of the security state of the network and the ability to immediately react to the changed situation. We use the man-in-the-middle attack detection as an example.","","","","10.1109/NOMS.2016.7502906","http://ieeexplore.ieee.org/stamp/stamp.jsp?arnumber=7502906","","Adaptive systems;Data visualization;Delays;Intrusion detection;Monitoring;Prototypes","computer network security;software defined networking;telecommunication network management","SDN;adaptive management;adaptive monitoring;anomaly detection;man-in-the-middle attack detection;network management;network security;real-time network;security events;software defined networking","","","","","","","25-29 April 2016","","IEEE","IEEE Conference Publications"
"ARSoS: An Adaptive, Robust, and Sub-Optimal Strategy for Automated Deployment of Anomaly Detection System in MANETs","Z. Zhang; F. Nait-Abdesselam; S. Djahel","LIFL, Univ. of Sci. & Technol. of Lille, Lille","2008 International Wireless Communications and Mobile Computing Conference","20080815","2008","","","606","613","While a variety of AIDS (anomaly-based intrusion detection system) are claimed to be fully distributed, lightweight, and ready for application, their detection cost are not always neglectable, especially when considering the fact that MANET nodes have scarce resources which usually impels them to avoid any unnecessary action. It is therefore a significant issue to optimally deploy AIDS sensors to achieve a better tradeoff between performance and detection cost. However, this optimization problem is challenging in essence because of the special characteristics of MANETs. In particular, the deployment strategy must be adaptive to capture nodes' mobility and robust to detection failures resulted from either accidental system error or intentional subversion. In this paper, we propose an adaptive, robust, and sub-optimal strategy, called ARSoS, to tackle this issue. ARSoS treats each AIDS sensor as an independent agent, and then formulates the sensors' cooperative behavior as a decentralized decision problem. Since each AIDS sensor is only aware of partial information about the other sensors and the neighboring nodes, a reward signal integrating both local observations and global detection measures is introduced to guide the overall cooperation of sensors. An online policy gradient algorithm is then applied to solve the formulated problem. To validate the ARSoS system in terms of adaptability, robustness and optimality, we conducted extensive simulations of an implemented prototype and the obtained results highlight a good performance of the system.","2376-6492;23766492","978-1-4244-2201-2;9781424422012","978-1-4244-2202-9;9781424422029","10.1109/IWCMC.2008.105","http://ieeexplore.ieee.org/stamp/stamp.jsp?arnumber=4600004","","Acoustic sensors;Acquired immune deficiency syndrome;Computational modeling;Cost function;Intrusion detection;Mobile ad hoc networks;Noise robustness;Sensor phenomena and characterization;Virtual prototyping;Web and internet services","ad hoc networks;mobile radio;security of data;telecommunication security","AIDS sensor;ARSoS;MANET;adaptive strategy;anomaly detection system;anomaly-based intrusion detection system;decentralized decision problem;global detection measures;local observations;mobile ad-hoc networks;online policy gradient algorithm;optimization problem;robust strategy;sub-optimal strategy","","1","","18","","","6-8 Aug. 2008","","IEEE","IEEE Conference Publications"
"Network intrusion detection using particle filter and Colored Petri Nets","C. C. Lin; M. S. Wang","Department of Engineering Science, National Cheng Kung University, Tainan, Taiwan","2010 International Symposium on Computer, Communication, Control and Automation (3CA)","20100729","2010","2","","459","462","We have investigated and proposed the particle filter concept in a network intrusion detection system and simulated it using the Colored Petri Nets tools to trace and pre-detect networking abnormal behaviors. The Network Particle Filter scheme has been proposed, which analyzes and simulates what happens during an intrusion behavior in depth. The accuracy of our simulation results is not enough good for a real work applications. In addition, the design of our network flow also does not deal with real attack cases. However, the approaches presented in this work can still be applied to the risk and cost evaluation of an IDS. The experimental results demonstrated that the CSPN model approach is still an efficient, effective and comprehensive way to evaluate an intrusion detection system.","2324-7983;23247983","978-1-4244-5565-2;9781424455652","","10.1109/3CA.2010.5533751","http://ieeexplore.ieee.org/stamp/stamp.jsp?arnumber=5533751","Network Intrusion Detection;Particle Fliter;Petri Nets","Intrusion detection;Particle filters;Petri nets","","","","0","","","","","5-7 May 2010","","IEEE","IEEE Conference Publications"
"Towards ground truthing observations in gray-box anomaly detection","J. Ming; H. Zhang; D. Gao","College of Information Sciences & Technology, Pennsylvania State University, USA","Network and System Security (NSS), 2011 5th International Conference on","20111027","2011","","","25","32","Anomaly detection has been attracting interests from researchers due to its advantage of being able to detect zero-day exploits. A gray-box anomaly detector first observes benign executions of a computer program and then extracts reliable rules that govern the normal execution of the program. However, such observations from benign executions are not necessarily true evidences supporting the rules learned. For example, the observation that a file descriptor being equal to a socket descriptor should not be considered supporting a rule governing the two values to be the same. Ground truthing such observations is a difficult problem since it is not practical to analyze the semantics of every instruction in every program to be protected. In this paper, we propose using taint analysis to automatically help the ground truthing. Intuitively, the same taint source of two values provides ground truth of the data dependence. We implement a host-based anomaly detector with our proposed taint tracking and evaluate the accuracy of rules learned. Results show that we not only manage to filter out incorrect rules that would otherwise be learned (with high support and confidence), but manage recover good rules that are previously believed to be unreliable. We also present overheads of our system and time needed for training.","","978-1-4577-0458-1;9781457704581","","10.1109/ICNSS.2011.6059956","http://ieeexplore.ieee.org/stamp/stamp.jsp?arnumber=6059956","anomaly detection;ground truthing;system call monitor;taint analysis","Analytical models;Detectors;Educational institutions;Monitoring;Semantics;Sockets;Training","security of data","file descriptor;gray box anomaly detection;ground truthing observations;host based anomaly detector;socket descriptor;taint analysis;zero day exploits","","2","","24","","","6-8 Sept. 2011","","IEEE","IEEE Conference Publications"
"A combination classification method of multiple decisions trees-based on generic algorithm towards customer behavior","X. j. Cui; W. m. Tong; Y. j. Li","School of Management, Harbin Institute of Technology, China, 150001","2008 International Conference on Management Science and Engineering 15th Annual Conference Proceedings","20081107","2008","","","104","108","In order to solve the classification problems of customer behaviors with randomicity and non-conformability, a combination classification method is proposed of multiple decision trees based on genetic algorithm. In this method, multiple decision trees that adopt the method of probability measurement level output are combined in parallel. Genetic algorithm is utilized to optimize connection weight matrix in combination algorithm. Furthermore, two sets of simulation experiment data are used to test and evaluate the proposed method. Results of the experiments indicate that the proposed method generates a higher classification accuracy rate than other methodspsila for customer behavior segmentation.","2155-1847;21551847","978-1-4244-2387-3;9781424423873","978-1-4244-2388-0;9781424423880","10.1109/ICMSE.2008.4668901","http://ieeexplore.ieee.org/stamp/stamp.jsp?arnumber=4668901","classification;customer behaviors;decision trees;generic algorithm","Bayesian methods;Classification tree analysis;Conference management;Customer relationship management;Decision trees;Engineering management;Financial management;Genetic algorithms;Technology management;Voting","customer satisfaction;decision trees;genetic algorithms;matrix algebra;pattern classification","combination classification method;connection weight matrix;customer behavior segmentation;generic algorithm;multiple decisions trees;probability measurement level output","","0","1","24","","","10-12 Sept. 2008","","IEEE","IEEE Conference Publications"
"Electric Fence Intrusion Alert System (eleAlert)","L. Wijesinghe; P. Siriwardena; S. Dahanayake; D. Kasthuriratne; R. Corea; D. Dias","","Global Humanitarian Technology Conference (GHTC), 2011 IEEE","20111215","2011","","","46","50","We present the design and implementation of intrusion detection and alerting mechanism (eleAlert) for fences separating wildlife habitats and human settlements. Our objective is to improve the effectiveness of electric fences as a solution to the prevailing human-elephant conflict (HEC) in many parts of the world. eleAlert uses a network of sensors to detect and locate damages instantly and alert communities under threat via the mobile communications network.","","978-1-61284-634-7;9781612846347","978-0-7695-4595-0;9780769545950","10.1109/GHTC.2011.16","http://ieeexplore.ieee.org/stamp/stamp.jsp?arnumber=6103606","Early Warning;Human-Elephant Conflict;Intrusion Detection;energy efficient communication protocol","Batteries;Bridges;Electric fences;Intrusion detection;Maintenance engineering;Mobile communication;Wildlife","alarm systems;mobile radio;safety systems;wireless sensor networks","alerting mechanism;eleAlert;electric fence intrusion alert system;human settlements;human-elephant conflict;intrusion detection;mobile communications network;sensor network;wildlife habitats","","2","","12","","","Oct. 30 2011-Nov. 1 2011","","IEEE","IEEE Conference Publications"
"An efficient approach for Intrusion Detection using data mining methods","K. Wankhade; S. Patka; R. Thool","Department of Information Technology, G. H. Raisoni College of Engineering, Nagpur, INDIA","Advances in Computing, Communications and Informatics (ICACCI), 2013 International Conference on","20131021","2013","","","1615","1618","Intrusion Detection System (IDS) is becoming a vital component of any network in today's world of Internet. IDS are an effective way to detect different kinds of attacks in an interconnected network thereby securing the network. An effective Intrusion Detection System requires high accuracy and detection rate as well as low false alarm rate. This paper focuses on a hybrid approach for intrusion detection system (IDS) based on data mining techniques. The main research method is clustering analysis with the aim to improve the detection rate and decrease the false alarm rate. Most of the previously proposed methods suffer from the drawback of k-means method with low detection rate and high false alarm rate. This paper presents a hybrid data mining approach encompassing feature selection, filtering, clustering, divide and merge and clustering ensemble. A method for calculating the number of the cluster centroid and choosing the appropriate initial cluster centroid is proposed in this paper. The IDS with clustering ensemble is introduced for the effective identification of attacks to achieve high accuracy and detection rate as well as low false alarm rate.","","978-1-4799-2432-5;9781479924325","","10.1109/ICACCI.2013.6637422","http://ieeexplore.ieee.org/stamp/stamp.jsp?arnumber=6637422","Intrusion detection system;clustering;data mining;detection rate;ensemble;false alarm rate;k-means","Accuracy;Classification algorithms;Clustering algorithms;Conferences;Data mining;Intrusion detection;Partitioning algorithms","Internet;computer network security;data mining;feature extraction;pattern clustering","IDS;Internet;clustering analysis;data mining methods;data mining techniques;false alarm rate;feature clustering;feature filtering;feature selection;hybrid data mining approach;interconnected network;intrusion detection approach;intrusion detection system;k-means method","","1","","14","","","22-25 Aug. 2013","","IEEE","IEEE Conference Publications"
"Biometric Identification System Based on Electrocardiogram Data","Y. Gahi; M. Lamrani; A. Zoglat; M. Guennoun; B. Kapralos; K. El-Khatib","Dept. Math-Info, Fac. des Sci. de Rabat, Rabat","2008 New Technologies, Mobility and Security","20081125","2008","","","1","5","Recent advancements in computing and digital signal processing technologies have made automated identification of people based on their biological, physiological, or behavioral traits a feasible approach for access control. The wide variety of available technologies has also increased the number of traits and features that can be collected and used to more accurately identify people. Systems that use biological, physiological, or behavioral trait to grant access to resources are called biometric systems. In this paper we present a biometric identification system based on the Electrocardiogram (ECG) signal. The system extracts 24 temporal and amplitude features from an ECG signal and after processing, reduces the set of features to the nine most relevant features. Preliminary experimental results indicate that the system is accurate and robust and can achieve a 100% identification rate with the reduced set of features.","2157-4952;21574952","978-1-42443547-0;9781424435470","","10.1109/NTMS.2008.ECP.29","http://ieeexplore.ieee.org/stamp/stamp.jsp?arnumber=4689083","","Access control;Biology computing;Biomedical signal processing;Biometrics;Digital signal processing;Electrocardiography;Heart;Humans;Signal processing;Surgery","biometrics (access control);electrocardiography","access control;biometric identification system;digital signal processing;electrocardiogram data","","12","","16","","","5-7 Nov. 2008","","IEEE","IEEE Conference Publications"
"BARLEY: Modelling program behavior with resource usage","K. Leach","Center for Secure Inf. Syst., George Mason Univ., Fairfax, VA, USA","Dependable Systems and Networks Workshop (DSN-W), 2013 43rd Annual IEEE/IFIP Conference on","20130930","2013","","","1","4","Control flow graphs (CFG) have long been an effective and elegant way to represent program execution. In particular, many anomaly detection systems employ CFGs. Unfortunately, typical CFG-based systems rely on inaccurate or impractical heuristics. For example, the state space may be restricted by considering only a call graph, thus reducing accuracy and precision. In this paper, we combine control flow graphs with resource consumption information to more accurately model a program's behavior during execution. Intuitively, this technique allows access to more information within each state, providing opportunities for more accurate decisions when considering anomalous behavior. Additionally, because we do not need as many states to represent an application's execution, we can achieve lower overhead than existing CFG-based systems. We anticipate this technique can be used to detect jump-based return-oriented programming (ROP) attacks on the Linux platform.","2325-6648;23256648","","","10.1109/DSNW.2013.6615519","http://ieeexplore.ieee.org/stamp/stamp.jsp?arnumber=6615519","","Flow graphs;Malware;Monitoring;Programming;Radiation detectors","Linux;flow graphs;security of data","BARLEY;CFG;Linux platform;ROP attacks;anomalous behavior;anomaly detection systems;call graph;control flow graphs;jump-based return-oriented programming attack detection;program behavior modelling;program execution;resource consumption information;resource usage;state space","","0","","16","","","24-27 June 2013","","IEEE","IEEE Conference Publications"
"Ensemble of One-Class Classifiers for Network Intrusion Detection System","A. Zainal; M. A. Maarof; S. M. Shamsuddin; A. Abraham","Fac. of Comput. Sci. & Inf. Syst., Univ. Teknol. Malaysia, Skudai","Information Assurance and Security, 2008. ISIAS '08. Fourth International Conference on","20080919","2008","","","180","185","To achieve high accuracy while lowering false alarm rates are major challenges in designing an intrusion detection system. In addressing this issue, this paper proposes an ensemble of one-class classifiers where each uses different learning paradigms. The techniques deployed in this ensemble model are; linear genetic programming (LGP), adaptive neural fuzzy inference system (ANFIS) and random forest (RF). The strengths from the individual models were evaluated and ensemble rule was formulated. Empirical results show an improvement in detection accuracy for all classes of network traffic; normal, probe, DoS, U2R and R2L. RF, which is an ensemble learning technique that generates many classification trees and aggregates the individual result was also able to address imbalance dataset problem that many of machine learning techniques fail to sufficiently address it.","","978-0-7695-3324-7;9780769533247","","10.1109/IAS.2008.35","http://ieeexplore.ieee.org/stamp/stamp.jsp?arnumber=4627082","ANFIS;Linear Genetic Programming;Random Forest;ensemble classifiers","Aggregates;Classification tree analysis;Fuzzy systems;Genetic programming;Intrusion detection;Machine learning;Probes;Radio frequency;Telecommunication traffic;Traffic control","fuzzy neural nets;fuzzy reasoning;genetic algorithms;learning (artificial intelligence);linear programming;security of data","adaptive neural fuzzy inference system;classification trees;linear genetic programming;machine learning techniques;network intrusion detection system;network traffic;one-class classifiers;random forest","","4","","22","","","8-10 Sept. 2008","","IEEE","IEEE Conference Publications"
"IDS for detecting malicious non-executable files using dynamic analysis","A. Bazzi; Y. Onozato","Graduate School of Engineering, Gunma University, 1-5-1 Tenjin-cho, Kiryu, 376-8515, Japan","Network Operations and Management Symposium (APNOMS), 2013 15th Asia-Pacific","20131202","2013","","","1","3","Attackers are increasingly relying on non-executable files to launch their attacks. Anti-virus solutions can detect a high percentage of malicious files but usually cannot reach and maintain a 100% detection rate. We propose a file-level IDS that relies on automated dynamic analysis system (sandbox) to detect malicious PDF files. We achieved a 99.2% detection rate, where the rates of both the false positives and the false negatives are less than 1%. Because it does not rely on anti-virus signatures, this solution can detect malicious documents that utilize malware not covered by the anti-virus database.","","","","","http://ieeexplore.ieee.org/stamp/stamp.jsp?arnumber=6665213","","Databases;Portable document format","","","","0","","16","","","25-27 Sept. 2013","","IEEE","IEEE Conference Publications"
"Notice of Retraction<BR>3Why we need the intrusion detection prevention systems (IDPS) in it company","S. P. Mirashe; N. V. Kalyankar","Network & Network Security-IDC, Reliance Communication. Koparkharine, Pin-400709, New Mumbai, Maharashtra- India","Computer Engineering and Technology (ICCET), 2010 2nd International Conference on","20100617","2010","7","","V7-112","V7-116","Notice of Retraction<BR><BR>After careful and considered review of the content of this paper by a duly constituted expert committee, this paper has been found to be in violation of IEEE's Publication Principles.<BR><BR>We hereby retract the content of this paper. Reasonable effort should be made to remove all past references to this paper.<BR><BR>The presenting author of this paper has the option to appeal this decision by contacting TPII@ieee.org.<BR><BR>Typical IT Security Technical Work Intrusion Detection/Prevention, Ethical is hacking/Penetration Testing IT Security in the Business Risk, Audit Support, Compliance Policies, Standards, and Procedures IT Security's Role in Creation and Enforcement.","","978-1-4244-6347-3;9781424463473","","10.1109/ICCET.2010.5485336","http://ieeexplore.ieee.org/stamp/stamp.jsp?arnumber=5485336","","Access control;Communication system security;Companies;Computer networks;Computer worms;Information security;Internet;Intrusion detection;Software systems;Web server","computer crime","IDPS;IT company;IT security testing;audit support;business risk;compliance policies;intrusion detection systems;intrusion prevention systems","","0","","5","","","16-18 April 2010","","IEEE","IEEE Conference Publications"
"The Application of Machine Learning Methods to Intrusion Detection","X. Zhang; L. Jia; H. Shi; Z. Tang; X. Wang","Dept. of Fundamental Courses, Xuzhou Air Force Coll., Xuzhou, China","Engineering and Technology (S-CET), 2012 Spring Congress on","20121110","2012","","","1","4","Network and system security is of paramount importance in the present data communication environment. Hackers and intruders can create many successful attempts to cause the crash of the networks and web services by unauthorized intrusion. New threats and associated solutions to prevent these threats are emerging together with the secured system evolution. Intrusion Detection Systems (IDS) are one of these solutions. The main function of Intrusion Detection System is to protect the resources from threats. It analyzes and predicts the behaviours of users, and then these behaviours will be considered an attack or a normal behaviour. We use Rough Set Theory (RST) and Support Vector Machine (SVM) to detect network intrusions. First, packets are captured from the network, RST is used to pre-process the data and reduce the dimensions. The features selected by RST will be sent to SVM model to learn and test respectively. The method is effective to decrease the space density of data. The experiments compare the results with Principal Component Analysis (PCA) and show RST and SVM schema could reduce the false positive rate and increase the accuracy.","","978-1-4577-1965-3;9781457719653","","10.1109/SCET.2012.6341943","http://ieeexplore.ieee.org/stamp/stamp.jsp?arnumber=6341943","","Feature extraction;Intrusion detection;Libraries;Principal component analysis;Rough sets;Support vector machines","Web services;authorisation;computer crime;data communication;learning (artificial intelligence);principal component analysis;rough set theory;support vector machines","IDS;PCA;RST;SVM schema;Web services;attack behavior;data communication environment;false positive rate;hackers;intruders;intrusion detection systems;machine learning methods;network intrusion detection;network security;normal behaviour;principal component analysis;rough set theory;secured system evolution;space density;support vector machine;system security;unauthorized intrusion","","0","","11","","","27-30 May 2012","","IEEE","IEEE Conference Publications"
