"A Semi-Markov Survivability Evaluation Model for Intrusion Tolerant Database Systems","A. H. Wang; S. Yan; P. Liu","Coll. of Inf. Sci. & Technol., Pennsylvania State Univ., Dunmore, PA, USA","Availability, Reliability, and Security, 2010. ARES '10 International Conference on","20100325","2010","","","104","111","Survivability modeling and evaluation have gained increasing importance. Most existing models assume that the distributions for transitions between states are exponential. However, this assumption does not hold in many real cases. To address this problem, we propose a novel semi-Markov survivability evaluation model, which allows the transitions between states to follow nonexponential distributions. Novel quantitative measures are also proposed to characterize the capability of a resilient system in surviving intrusions. Model validation, which is possibly the most important step in the life cycle of model development, is largely overlooked in previous research. In this paper, a real intrusion tolerant database system ITDB is implemented to validate the proposed state-space models. Empirical experiments show that the semi-Markov model predicts the system behaviors with high accuracy. Furthermore, in this paper we evaluate the impact of intrinsic system deficiencies and attack behaviors on the survivability of intrusion tolerant database systems.","","978-1-4244-5879-0;9781424458790","","10.1109/ARES.2010.90","http://ieeexplore.ieee.org/stamp/stamp.jsp?arnumber=5438108","Database Security;Intrusion Tolerance;Modeling and Evaluation;Semi-Markov Process;Survivability","Availability;Benchmark testing;Data security;Database systems;Degradation;Educational institutions;Humans;Information security;Predictive models","Markov processes;database management systems;reliability theory;security of data;state-space methods","ITDB;intrinsic system deficiencies;intrusion tolerant database systems;nonexponential distributions;novel quantitative measures;resilient system;semi Markov survivability evaluation model;state-space models;system behaviors","","3","","19","","","15-18 Feb. 2010","","IEEE","IEEE Conference Publications"
"Measuring intelligent false alarm reduction using an ROC curve-based approach in network intrusion detection","Y. Meng","Department of Computer Science, City University of Hong Kong, China","2012 IEEE International Conference on Computational Intelligence for Measurement Systems and Applications (CIMSA) Proceedings","20120816","2012","","","108","113","Currently, network intrusion detection systems (NIDSs) are being widely deployed in various network environment with the purpose of defending against network attacks. However, these systems can generate a large number of alarms especially false alarms during their detection procedure, which is a big problem that decreases the effectiveness and efficiency of their detection. To mitigate this issue, we have developed an intelligent false alarm filter to filter out false alarms by periodically selecting the most appropriate machine learning algorithm which conducts the best performance from an algorithm pool. To evaluate the best single-algorithm performance among several machine learning schemes, we utilized two measures (e.g., classification accuracy, precision of false alarm) to determine the best algorithm. In this paper, we mainly conduct a study of applying an ROC curve-based approach with cost analysis in our intelligent filter to further improve the decision quality. The experimental results show that by combining our defined ROC curve-based measure, namely relative expected cost, our developed filter can achieve a better outcome in the aspect of cost consideration.","2159-1547;21591547","978-1-4577-1778-9;9781457717789","","10.1109/CIMSA.2012.6269608","http://ieeexplore.ieee.org/stamp/stamp.jsp?arnumber=6269608","Computational Intelligence;False Alarm Reduction;Intelligent Decision Support and Control Systems;Intrusion detection;Performance Measurement","Algorithm design and analysis;Equations;Intrusion detection;Machine learning;Machine learning algorithms;Mathematical model;Support vector machines","alarm systems;computer network security;information filtering;learning (artificial intelligence);performance evaluation","NIDS;ROC curve-based measure;cost analysis;decision quality;intelligent false alarm filter;intelligent false alarm reduction;machine learning algorithm;network attacks;network environment;network intrusion detection system;single-algorithm performance evaluation","","1","","24","","","2-4 July 2012","","IEEE","IEEE Conference Publications"
"Network Intrusion Detection Based on Support Vector Machine","X. Bao; T. Xu; H. Hou","Soft Sci. Inst., Wuhan Univ. of Technol., Wuhan, China","Management and Service Science, 2009. MASS '09. International Conference on","20091030","2009","","","1","4","Network intrusion detection system is a significant guarantee means for network security. However, the current network intrusion detection system generally suffers from less prior knowledge which then leads to poor generalizing ability. Network intrusion detection system based on support vector machine is endowed with favorable generalizing ability even with small sample size (less prior knowledge). The paper first gives an introduction to the basic concept of intrusion detection and the basic principle of the classifier based on support vector machine, then discusses algorithm of support vector machine, and finally forms network intrusion detection system combining anomaly intrusion detection and misuse intrusion detection, based on support vector machine.","","978-1-4244-4638-4;9781424446384","978-1-4244-4639-1;9781424446391","10.1109/ICMSS.2009.5304051","http://ieeexplore.ieee.org/stamp/stamp.jsp?arnumber=5304051","","Data security;Electronic mail;Engines;Information analysis;Information security;Intrusion detection;Machine learning;Operating systems;Support vector machine classification;Support vector machines","security of data;support vector machines","anomaly intrusion detection system;misuse intrusion detection system;network intrusion detection;network security;support vector machine","","12","","7","","","20-22 Sept. 2009","","IEEE","IEEE Conference Publications"
"Detection of Security and Dependability Threats: A Belief Based Reasoning Approach","D. Lorenzoli; G. Spanoudakis","Dept. of Comput., City Univ. London, London, UK","2009 Third International Conference on Emerging Security Information, Systems and Technologies","20090821","2009","","","312","320","Monitoring the preservation of security and dependability (S&D) properties during the operation of systems at runtime is an important verification measure that can increase system resilience. However it does not always provide sufficient scope for taking control actions against violations as it only detects problems after they occur. In this paper, we describe a proactive monitoring approach that detects potential violations of S&D properties, called ldquothreatsrdquo, and discuss the results of an initial evaluation of it.","2162-2108;21622108","978-0-7695-3668-2;9780769536682","","10.1109/SECURWARE.2009.55","http://ieeexplore.ieee.org/stamp/stamp.jsp?arnumber=5210995","belief based reasoning;runtime monitoring;security and dependability","Condition monitoring;Event detection;Information security;Mechanical factors;Resilience;Runtime;Software measurement;Software systems;Uncertainty;Web services","belief networks;program verification;security of data;system monitoring","EVEREST monitoring framework;S&D threat;belief based-reasoning approach;belief graph;detect potential violation;event resoning toolkit;proactive monitoring approach;security detection;security-and-dependability threat;verification measure","","0","","14","","","18-23 June 2009","","IEEE","IEEE Conference Publications"
"Detecting APT Malware Infections Based on Malicious DNS and Traffic Analysis","G. Zhao; K. Xu; L. Xu; B. Wu","Tsinghua University, Beijing, China","IEEE Access","20150803","2015","3","","1132","1142","Advanced persistent threat (APT) is a serious threat to the Internet. With the aid of APT malware, attackers can remotely control infected machines and steal sensitive information. DNS is popular for malware to locate command and control (C&C) servers. In this paper, we propose a novel system placed at the network egress point that aims to efficiently and effectively detect APT malware infections based on malicious DNS and traffic analysis. The system uses malicious DNS analysis techniques to detect suspicious APT malware C&C domains, and then analyzes the traffic of the corresponding suspicious IP using the signature-based and anomaly based detection technology. We extracted 14 features based on big data to characterize different properties of malware-related DNS and the ways that they are queried, and we also defined network traffic features that can identify the traffic of compromised clients that have remotely been controlled. We built a reputation engine to compute a reputation score for an IP address using these features vector together. Our experiment was performed at a large local institute network for two months, and all the features were studied with big data, which includes ~400 million DNS queries. Our security approach cannot only substantially reduce the volume of network traffic that needs to be recorded and analyzed but also improve the sustainability of the system.","2169-3536;21693536","","","10.1109/ACCESS.2015.2458581","http://ieeexplore.ieee.org/stamp/stamp.jsp?arnumber=7163279","APT;DNS;intrusion detection;malware infections","Command and control systems;Feature extraction;IP networks;Intrusion detection;Malware;Web servers","Big Data;Internet;digital signatures;invasive software;query processing","APT malware infection detection;Big Data;C&C servers;DNS query;IP address;Internet;advanced persistent threat;anomaly based detection technology;command and control server;feature vector;large local institute network;malicious DNS analysis techniques;network egress point;network traffic features;security approach;signature-based based detection technology;traffic analysis","","0","","28","","2015-07-20","2015","","IEEE","IEEE Journals & Magazines"
"SIDAN: A tool dedicated to software instrumentation for detecting attacks on non-control-data","J. C. Demay; E. Totel; F. Tronel","SUPELEC, Rennes, France","Risks and Security of Internet and Systems (CRiSIS), 2009 Fourth International Conference on","20100217","2009","","","51","58","Anomaly based intrusion detection systems rely on the build of a normal behavior model. When a deviation from this normal behavior is detected, an alert is raised. This anomaly approach, unlike the misuse approach, is able to detect unknown attacks. A basic technique to build such a model for a program is to use the system call sequences of the process. To improve the accuracy and completeness of this detection model, we can add information related to the system call, such as its arguments or its execution context. But even then, attacks that target non-control-data may be missed and attacks on control-data may be adapted to bypass the detection mechanism using evasion techniques. We propose in this article an approach that focuses on the detection of non-control-data attacks. Our approach aims at exploiting the internal state of a program to detect a memory corruption on non-control-data that could lead to an illegal system call. To achieve this, we propose to build a data-oriented detection model by statically analyzing a program source code. This model is used to instrument the program by adding reasonableness checks that verify the consistent state of the data items the system calls depend on. We thus argue that it is possible to detect a program misuse issued by a non-control-data attack inside the program during its execution. While keeping a low overhead, this approach allows to detect non-control-data attacks.","2151-4763;21514763","978-1-4244-4498-4;9781424444984","","10.1109/CRISIS.2009.5411977","http://ieeexplore.ieee.org/stamp/stamp.jsp?arnumber=5411977","","Context modeling;Control systems;Instruments;Intrusion detection;Libraries;Protection;Software tools","data handling;security of data","SIDAN tool;anomaly based intrusion detection system;data oriented detection model;detection model accuracy;detection model completeness;noncontrol data attacks detection;noncontrol data memory corruption;program internal state;program source code analyzation;software instrumentation","","1","","25","","","19-22 Oct. 2009","","IEEE","IEEE Conference Publications"
"Machine learning techniques applied to intruder detection in networks","J. L. Henao R; J. E. Espinosa O","Politecnico Colombiano &#x201C;Jaime Isaza Cadavid&#x201D;, Medellin, Colombia","2013 47th International Carnahan Conference on Security Technology (ICCST)","20141016","2013","","","1","6","The intrusion in data networks, are a constant problem faced by networks administrators. Because of this, it is necessary identify, study and propose techniques to detect the moment in which the network is attacked, with the purpose of take measures to mitigate these threats. In this paper was conducted a study of the threats taxonomy that could lead to an attack in a data network. For this, we have identified the most relevant characteristics of the network traffic in order to be processed and classified using machine learning techniques, specifically the normalization (Z-Score), dimensionality reduction (PCA) and classification based on artificial neural networks (ANN) to suggest an intrusion detection system (IDS).","1071-6572;10716572","","","10.1109/CCST.2013.6922081","http://ieeexplore.ieee.org/stamp/stamp.jsp?arnumber=6922081","IDS;Intruder Detection Systems;Threat;classification;dimensionality reduction;network attacks;neural networks;normalization","Artificial neural networks;Boolean functions;Data structures;Vectors","learning (artificial intelligence);neural nets;pattern classification;principal component analysis;security of data","ANN classification;IDS;PCA;Z-score;artificial neural networks;data networks;dimensionality reduction;intruder detection;intrusion detection system;machine learning techniques;network traffic;normalization;principal component analysis;threat mitigation;threats taxonomy","","0","","11","","","8-11 Oct. 2013","","IEEE","IEEE Conference Publications"
"Towards Improving Web Attack Detection: Highlighting the Significant Factors","M. A. Wazzan; M. H. Awadh","Deanship of Inf. Technol., King Abdul Aziz Univ., Jeddah, Saudi Arabia","IT Convergence and Security (ICITCS), 2015 5th International Conference on","20151008","2015","","","1","5","Nowadays, with the rapid development of Internet, the use of Web is increasing and the Web applications have become a substantial part of people's daily life (e.g. E-Government, E-Health and E-Learning), as they permit to seamlessly access and manage information. The main security concern for e-business is Web application security. Web applications have many vulnerabilities such as Injection, Broken Authentication and Session Management, and Cross-site scripting (XSS). Subsequently, web applications have become targets of hackers, and a lot of cyber attack began to emerge in order to block the services of these Web applications (Denial of Service Attach). Developers are not aware of these vulnerabilities and have no enough time to secure their applications. Therefore, there is a significant need to study and improve attack detection for web applications through determining the most significant factors for detection. To the best of our knowledge, there is not any research that summarizes the influent factors of detection web attacks. In this paper, the author studies state-of-the-art techniques and research related to web attack detection: the author analyses and compares different methods of web attack detections and summarizes the most important factors for Web attack detection independent of the type of vulnerabilities. At the end, the author gives recommendation to build a framework for web application protection.","","","","10.1109/ICITCS.2015.7293028","http://ieeexplore.ieee.org/stamp/stamp.jsp?arnumber=7293028","","Buffer overflows;Computer crime;IP networks;Intrusion detection;Monitoring;Uniform resource locators","Internet;computer crime;data protection","Internet;Web application protection;Web application security;Web application vulnerabilities;Web attack detection;XSS;broken authentication;cross-site scripting;cyber attack;denial of service attack;e-business;hackers;information access;information management;injection;session management","","","","18","","","24-27 Aug. 2015","","IEEE","IEEE Conference Publications"
"An ensemble framework of anomaly detection using hybridized feature selection approach (HFSA)","N. F. Haq; A. R. Onik; F. M. Shah","Dept. of Comput. Sci. & Eng., Ahsanullah Univ. of Sci. & Technol., Dhaka, Bangladesh","SAI Intelligent Systems Conference (IntelliSys), 2015","20151221","2015","","","989","995","Rapid growth and popularity of internet has re-emphasized the significance of the intrusion detection system in network security. To overcome the vulnerabilities of network security researchers have come up with different frameworks of intrusion detection system using data mining. Feature selection is a significant method to develop a time and cost effective intrusion detection system. The time consumption in building up the classifiers model enhances the efficiency of the system. This work conducted on the analysis of some approaches of intrusion detection using some machine learning methods with wrapper approaches, which is a type of feature selection methodology. Our paper mainly focuses on the classification preciseness of 3 different classifiers using the minimal amount of features selected by three different wrapper search methods on the well-known public type NSL-KDD dataset and showing the comparisons among them. The 3 basic classifiers are Bayesian Network, Naive Bayes and J48. Best First, Genetic Search and Rank Search have been used as the wrapper search methods. The study proposed an ensemble type of a classification model with a hybrid feature selection method based on the research framework. By using the hybrid feature selection method 12 critical features are chosen and with the combination of basic classifiers, a reliable model is developed to differentiate normal and anomaly. Moreover, the result shows a convenient false positive rate of 0.021. Experiment showed that our proposed ensemble approach showed better result than Naive Bayes, Bayesian Network and J48 classifier. Experiments have been conducted on the NSL-KDD dataset using WEKA 3.6 library functions.","","","","10.1109/IntelliSys.2015.7361264","http://ieeexplore.ieee.org/stamp/stamp.jsp?arnumber=7361264","Classifiers;Feature Selection;Intrusion Detection;Majority Vote;NSL-KDD;WEKA Library","Bayes methods;Classification algorithms;Data models;Feature extraction;Intrusion detection;Search methods;Training data","Bayes methods;Internet;belief networks;computer network security;data mining;feature selection;genetic algorithms;learning (artificial intelligence);pattern classification;search problems","Bayesian network classifier;HFSA;Internet popularity;J48 classifier;Naive Bayes classifier;anomaly detection;best first;classification preciseness;cost effective intrusion detection system;data mining;ensemble framework;genetic search;hybridized feature selection approach;machine learning methods;network security;public type NSL-KDD dataset;rank search;time effective intrusion detection system;wrapper search methods","","","","23","","","10-11 Nov. 2015","","IEEE","IEEE Conference Publications"
"A Cooperation Network Model for Secure Management in Dynamic P2P Flow","Y. H. Moon; J. H. Nah; J. S. Jang; C. H. Youn","Electronics and Telecommunications Research Institute (ETRI). yhmoon@etri.re.kr","Advanced Communication Technology, 2008. ICACT 2008. 10th International Conference on","20080422","2008","2","","1176","1181","This paper discusses how to identify Peer-to-Peer (P2P) traffic using a blind technique without observing individual payload in the proposed cooperation network model. Traditionally, the payload inspection based traffic identification methodologies have been studied and developed for static internet traffic generated by well-known network applications such as http, ftp, telnet, smtp, etc. However, this approach is inadequate any more to detect and control newly emerging applications using P2P-like or P2P-based communication protocol. Also it strongly depends on the central intrusion detection system or firewall because signature as the prior-knowledge is normally built on that kind of systems. That fact derives three issues: performance overhead, central point of failure, and abnormality handling of traffic. Therefore, we propose the distributed detector strategy using tight cooperation between flow agent and secure gateway for indentifying the dynamic P2P traffic, even encrypted.","1738-9445;17389445","978-89-5519-136-3;9788955191363","","10.1109/ICACT.2008.4493975","http://ieeexplore.ieee.org/stamp/stamp.jsp?arnumber=4493975","Identification P2P application;P2P network security;P2P traffic detection","Communication system control;Communication system traffic control;IP networks;Inspection;Intrusion detection;Payloads;Peer to peer computing;Protocols;Telecommunication traffic;Traffic control","computer network management;network servers;peer-to-peer computing;security of data","P2P flow;blind technique;cooperation network model;distributed detector strategy;flow agent;peer-to-peer traffic;secure gateway;secure management;tight cooperation","","1","","15","","","17-20 Feb. 2008","","IEEE","IEEE Conference Publications"
"On the sufficiency of time-based correlation for signature-based IDS alerts","S. W. Neville","Dept. of Electr. & Comput. Eng., Victoria Univ., BC, Canada","Communications, Computers and signal Processing, 2003. PACRIM. 2003 IEEE Pacific Rim Conference on","20031014","2003","2","","836","839 vol.2","Intrusion detection system (IDS) alert correlation is becoming an important tool in dealing with the overwhelming data volumes produced by operational deployments of heterogeneous IDS systems. This work looks at the issue of under what conditions time correlation is a sufficient approach to this problem in the sense that it does not introduce erroneous alert dusters. A formal framework for signature-based IDS event detection is developed to aid this discussion. Through this framework it is shown that, even for the simplest case of a single isolated attack, time correlation is not a sufficient approach for noncoincidently located heterogeneous sensors due to the nondeterministic nature of network propagation delays. An approach is then discussed to include additional information about the knowledge domains of the respective IDS sensors, at a per trigger level, to improve the correlation accuracy.","","0-7803-7978-0;0780379780","","10.1109/PACRIM.2003.1235911","http://ieeexplore.ieee.org/stamp/stamp.jsp?arnumber=1235911","","Clocks;Computer networks;Failure analysis;Intrusion detection;Large-scale systems;Observability;Payloads;Propagation delay;Statistics;Telecommunication traffic","handwriting recognition;safety systems;sensors;telecommunication security","correlation accuracy improvement;data volume overwhelming;event detection;heterogeneous IDS system;heterogeneous sensor;intrusion detection system;network propagation delay;signature-based IDS alert;time-based correlation","","0","","7","","","28-30 Aug. 2003","","IEEE","IEEE Conference Publications"
"A scheme for fast network traffic anomaly detection","Xiaofen Wang; L. Pang; Qingqi Pei; Xuejun Li","Mini. of Edu. Key Lab. of Comp. Netw. & Info. Secu., Xidian Univ., Xi'an 710071, China","2010 International Conference on Computer Application and System Modeling (ICCASM 2010)","20101104","2010","1","","V1-592","V1-596","Fast network traffic anomaly detection is an important issue in network security. At present, the Internet environment becomes more and more complex than ever before. The unexpected anomaly occurs constantly, which brings great loss to Internet services. This makes people put forward higher requirements for the speed and real-time of network traffic anomaly detection. How to quickly perceive the traffic anomaly is a new demand in the network anomaly detection. Due to the shortage of the conventional detection methods in terms of speed, a fast anomaly detection scheme is proposed in this paper, which is based on the iterative estimation of Hurst parameter. The anomaly can be determined through the value of estimation. Meanwhile, by on-line we can estimate continuously and refresh the value of Hurst according to the latest network traffic, and then we can get the latest traffic data and speed up the process of anomaly detection. Analyses show that this scheme is effective in fast anomaly detection.","2161-9069;21619069","978-1-4244-7235-2;9781424472352","978-1-4244-7237-6;9781424472376","10.1109/ICCASM.2010.5620645","http://ieeexplore.ieee.org/stamp/stamp.jsp?arnumber=5620645","Anomaly detection;Fast;Hurst;Iteration","Correlation","Internet;iterative methods;telecommunication traffic","Hurst parameter;Internet;fast network traffic anomaly detection;iterative estimation;network security","","2","","11","","","22-24 Oct. 2010","","IEEE","IEEE Conference Publications"
