"Nobot: Embedded malware detection for endpoint devices","Menten, Lawrence E.; Chen, Aiyou; Stiliadis, Dimitrios","Alcatel-Lucent Bell Labs Computing and Software Principles Research Department. Based in Murray Hill, New Jersey","Bell Labs Technical Journal","20140429","2011","16","1","155","170","NoBot is a novel malware detection system that employs packet classification and distinct counting techniques to achieve reliable detection and identification of malware by observing the traffic to and from a network-connected host. The solution is designed to be economically incorporated into endpoint devices, such as Ethernet switches, Gigabit passive optical network (GPON) devices, and digital subscriber line access multiplexers (DSLAMs) leveraging the integral features of the hosting device, such as packet classification, packet counting, packet-forwarding features, and the computing resources of the control processor. NoBot combines these features with deep packet inspection and distinct counting to detect the presence of malware with a low rate of false positive detections. The NoBot software has been incorporated into a Linux device driver, installed into an Android-based smart phone, and implemented as a preprocessor module for the open source Snort Intrusion detection and prevention System (IDS/IPS).","1089-7089","","","10.1002/bltj.20492","http://ieeexplore.ieee.org.ezproxy.rit.edu/stamp/stamp.jsp?arnumber=6770369","","","","","","0","","","","","June 2011","","Alcatel-Lucent","Alcatel-Lucent Journal"
"Mining Network Traffic for Worm Signature Extraction","Hao Tu; Zhitang Li; Bin Liu","Network & Comput. Centre, Huazhong Univ. of Sci. & Technol., Wuhan","Fuzzy Systems and Knowledge Discovery, 2008. FSKD '08. Fifth International Conference on","20081105","2008","4","","327","331","Recent worm increasingly threaten the availability of Internet. It is difficult to catch variety of 0day worms promptly with current signature matching approach because most signatures are developed manually. Several recent efforts to automatically extract worm signatures from Internet traffic have been done, but the efficiency is an unsolved problem especially in real high-speed network. We propose a binary clustering algorithm and a leaves preferred policy to improve the front traffic filter, which can reduce the traffic to be processed and enhance its purity. A position-aware signature generation method based bloom filter is proposed to bring better performance and more accurate signature for content-based defense. Both trace data and tcp dump data are used to test the prototype system and experiment results show the system can efficiently filter through suspicious traffic with high purity, which is no more than 25% of entire traffic, and extract more accurate signature, which can well support popular defense system such as Snort.","","978-0-7695-3305-6","","10.1109/FSKD.2008.434","http://ieeexplore.ieee.org.ezproxy.rit.edu/stamp/stamp.jsp?arnumber=4666407","","Clustering algorithms;Data mining;High-speed networks;IP networks;Information filtering;Information filters;Internet;Prototypes;System testing;Telecommunication traffic","Internet;filtering theory;invasive software;telecommunication traffic","Internet traffic;binary clustering algorithm;bloom filter;content-based defense;current signature matching approach;front traffic filter;network traffic mining;popular defense system;position-aware signature generation method;worm signature extraction","","1","","19","","","18-20 Oct. 2008","","IEEE","IEEE Conference Publications"
"Design of a distributed intrusion detection system based on independent agents","Du Ye; Wang Hui-qiang; Pang Yong-Gang","Comput. Sci. Coll., Harbin Eng. Univ., China","Intelligent Sensing and Information Processing, 2004. Proceedings of International Conference on","20040824","2004","","","254","257","The common problems of current intrusion detection systems are analyzed in this paper. Based on these, a distributed IDS framework model based on independent agents is proposed. This paper describes the function of entities, and defines the communication mechanism. The proposed model is an open system, which has good scalability. Agents are independent individually, while they can communicate and cooperate one another to take actions. In the end, directions for future work are discussed.","","0-7803-8243-9","","10.1109/ICISIP.2004.1287662","http://ieeexplore.ieee.org.ezproxy.rit.edu/stamp/stamp.jsp?arnumber=1287662","","Communication system security;Computer science;Data security;Educational institutions;Event detection;Information security;Intrusion detection;Open systems;Scalability;Time measurement","data communication;multi-agent systems;open systems;security of data","communication mechanism;distributed intrusion detection system;independent agents;open system","","1","1","10","","","2004","","IEEE","IEEE Conference Publications"
"Incremental Clustering Algorithm for Intrusion Detection Using Clonal Selection","Cheng Zhong; Na Li","Sch. of Comput. & Electron. & Inf., Guangxi Univ., Nanning, China","Computational Intelligence and Industrial Application, 2008. PACIIA '08. Pacific-Asia Workshop on","20090120","2008","1","","326","331","A computing cluster radius method is given, and the data is partitioned into initial clusters by comparing the distance from data to cluster centroid with the size of cluster radius. To implement clustering analysis about data with mixed attributes, namely numerical attributes and categorical attributes, the definitions of distance measure and objective function are improved. By applying clonal selection algorithm to optimize the clustering results, the problems such as computing dissimilarity for data with mixed attributes and finally unknown cluster number and easy to fall into local optimization are solved, and better clustering results are obtained. The experiment results show that the presented incremental clustering algorithm for intrusion detection can achieve high detection rate and low false positive rate.","","978-0-7695-3490-9","","10.1109/PACIIA.2008.256","http://ieeexplore.ieee.org.ezproxy.rit.edu/stamp/stamp.jsp?arnumber=4756576","Clonal Selection;Clustering;Incremental Algorithm;Intrusion Detection","Application software;Clustering algorithms;Computational intelligence;Computer industry;Conferences;Data analysis;Electronics industry;Industrial electronics;Intrusion detection;Partitioning algorithms","pattern clustering;security of data","clonal selection;clustering analysis;computing cluster radius method;incremental clustering algorithm;intrusion detection","","1","","9","","","19-20 Dec. 2008","","IEEE","IEEE Conference Publications"
"Accuracy Improvement of Anomaly-Based Intrusion Detection System Using Taguchi Method","Konno, T.; Tateoka, M.","Toshiba Solutions Corporation","Applications and the Internet Workshops, 2005. Saint Workshops 2005. The 2005 Symposium on","20060508","2005","","","90","93","In development of anomaly-based Intrusion Detection System, improving detection accuracy is important. It is considered a kind of optimization problem of the thresholds for dividing normal and potential attack. We applied the Toguchi method, which is a technique for quality engineering, for this purpose. We also use ""the standardized signal-to-noise ratio of digital data"" approach in order to improve simultaneously the two opposite characteristics, false detection rate and true detection rate. The false detection rate can be more decreased by giving more positive training data. By these techniques, 0.186% or the less false positive rate is attained in real data.","","0-7695-2263-7","","10.1109/SAINTW.2005.1619985","http://ieeexplore.ieee.org.ezproxy.rit.edu/stamp/stamp.jsp?arnumber=1619985","","Conferences;Internet;Intrusion detection","","","","1","","3","","","31-04 Jan. 2005","","IEEE","IEEE Conference Publications"
"Analysis of Intrusion Management System Technology","Yaohui Wang; Xiaobo Huang","Inf. Eng. Instn., Northeast Dianli Univ., Jilin, China","Wireless Communications Networking and Mobile Computing (WiCOM), 2010 6th International Conference on","20101014","2010","","","1","3","With the increase of network intrusion and hacking, the network security has become a main problem in computer science and attracts much attention from people. To solve these problems, this paper first analysis the advantages and disadvantages of the traditional security technologies in solve these security problem. Next, introduces an intrusion management system, which can make up for these deficiencies. Then it has a further study of the basic principle of the intrusion prevention system.","","978-1-4244-3708-5","978-1-4244-3709-2","10.1109/WICOM.2010.5601324","http://ieeexplore.ieee.org.ezproxy.rit.edu/stamp/stamp.jsp?arnumber=5601324","","Computer hacking;Face;Fires;Intrusion detection;Monitoring;Real time systems","computer network security","hacking;intrusion management system;intrusion prevention system;network intrusion;network security;security problem","","0","","5","","","23-25 Sept. 2010","","IEEE","IEEE Conference Publications"
"Intrusion Detection Using SVM","Liu Wu; Ren Ping; Liu Ke; Duan Hai-xin","Network Res. Center, Tsinghua Univ., Beijing, China","Wireless Communications, Networking and Mobile Computing (WiCOM), 2011 7th International Conference on","20111010","2011","","","1","4","This paper considers anomaly detection using an improved probabilistic neural networks. We first introduce a Basic Adaptive Boost Algorithm (BABA) and analysis its drawbacks and then introduce an Improved Adaptive Boost Algorithm (IABA) to classify the detected event as normal or intrusive.","2161-9646","978-1-4244-6250-6","","10.1109/wicom.2011.6040153","http://ieeexplore.ieee.org.ezproxy.rit.edu/stamp/stamp.jsp?arnumber=6040153","","Classification algorithms;Intrusion detection;Neural networks;Neurons;Probabilistic logic;Support vector machine classification;Training","computer network security;neural nets;support vector machines","BABA;IABA;SVM;anomaly detection;basic adaptive boost algorithm;drawbacks analysis;improved adaptive boost algorithm;intrusion detection;probabilistic neural network","","0","","8","","","23-25 Sept. 2011","","IEEE","IEEE Conference Publications"
"On the use of Video Content Analysis in ITS : A review from academic to commercial applications","Machy, C.; Carincotte, C.; Desurmont, X.","Image Dept., Multitel asbl, Mons, Belgium","Intelligent Transport Systems Telecommunications,(ITST),2009 9th International Conference on","20100129","2009","","","574","579","Stand-alone cameras or CCTV networks are nowadays commonly present in public areas such as city centers, stores and more recently in transportation infrastructures. In the meantime, automatic processing of video data is a field of activity stirring up the utmost attention in the pattern recognition community; state-of-the-art advances in this area enable the reliable extraction of features and the investigation of numerous applications dedicated to ITS. A first obvious field of application of Video Content Analysis (VCA) consists in improving safety and security in transport's context. Embedded VCA in vehicles can track pedestrians to avoid collisions, improving safety. Used in railway station, VCA are able to detect left luggage allowing to enhance security. Video streams available from such installations may also represent a useful source of information for statistical transportation applications, e.g. monitoring of road traffic conditions or providing accurate counting statistics in railway/subway stations. This paper proposes an overview of the VCA applications in terms of safety, security and efficiency for ITS, with a specific focus on the usability of such VCA systems (emerging research topics, state-of-the-art studies, already commercialized applications, etc).","","978-1-4244-5346-7","978-1-4244-5347-4","10.1109/ITST.2009.5399288","http://ieeexplore.ieee.org.ezproxy.rit.edu/stamp/stamp.jsp?arnumber=5399288","","Cameras;Cities and towns;Data mining;Feature extraction;Information security;Pattern recognition;Rail transportation;Road accidents;Streaming media;Vehicle safety","automated highways;feature extraction;object detection;rail traffic;railway safety;road safety;road traffic;security;traffic engineering computing;transportation;video signal processing","CCTV networks;collision avoidance;counting statistics;feature extraction;improving safety;intelligent transportation system;luggage detection;pattern recognition;pedestrian tracking;railway station;road traffic condition monitoring;stand-alone cameras;subway station;transport safety;transport security;transportation infrastructure;video content analysis;video data processing;video streams","","1","","50","","","20-22 Oct. 2009","","IEEE","IEEE Conference Publications"
"Defense against Bandwidth Attacks with Traffic Resource Management","Hongli Luo; Mei-Ling Shyu","Indiana Purdue Univ., Fort Wayne","Information Reuse and Integration, 2007. IRI 2007. IEEE International Conference on","20070904","2007","","","190","195","In this paper, a framework is proposed to defend against Internet bandwidth attacks with traffic resource management to provide service for legitimate users. Denial of service (DoS) is one of the major bandwidth attacks in the Internet. A DoS attack generates a large volume of traffic to consume the network bandwidth and degrade the service that legitimate users can obtain. Incoming traffic to the server is monitored and features are extracted for each connection. Anomaly detection technique is used to detect the abnormal traffic. Based on the outcome of the anomaly detection technique, the proposed resource management approach allocates suitable bandwidth. With the early detection of DoS, the attack traffic can be isolated. The bandwidth occupied by the attack can be reduced and protected for the legitimate users. Performances are compared under different attack loads with and without resource management. Simulation results show that bandwidth can be greatly saved from an attack and the service for the legitimate users can be protected during an attack.","","1-4244-1500-4","1-4244-1500-4","10.1109/IRI.2007.4296619","http://ieeexplore.ieee.org.ezproxy.rit.edu/stamp/stamp.jsp?arnumber=4296619","","Bandwidth;Computer crime;Degradation;Monitoring;Network servers;Protection;Resource management;Telecommunication traffic;Web and internet services;Web server","Internet;computer network management;telecommunication security;telecommunication traffic","Internet bandwidth attacks;anomaly detection technique;denial of service;legitimate users;traffic resource management","","0","","14","","","13-15 Aug. 2007","","IEEE","IEEE Conference Publications"
"Detecting Masquerading Users in a Document Management System","Sankaranarayanan, V.; Pramanik, S.; Upadhyaya, S.","Computer Science and Engineering, University at Buffalo, Buffalo, NY 14260, Phone: 716-645-3180, Fax: 716-645-3464. Email: vs28@cse.buffalo.edu","Communications, 2006. ICC '06. IEEE International Conference on","20061211","2006","5","","2296","2301","A Document Management System (DMS) is a repository of digital documents that provides functionality for check-in, check-out and shared editing. In a DMS, security mechanisms like encryption of documents and enforcement of policies are implemented to protect from information leakage. These security schemes, essentially applications of Digital Rights Management technologies, while effective against external attacks, are ineffective against insider attacks. The typical insider in a DMS already has access to documents and hence, his capabilities for information leakage are much higher. In this work, we address an important, yet unexplored problem of masquerading users in a DMS, a threat for which the DMS inherently has no protection. We approach the problem by monitoring the pattern and mannerism of user actions on documents and building a profile of each user using the resulting logs. In order to illustrate our ideas, we built user profiles of 41 users working on Microsoft Word and applied two algorithms, viz., IPAM and Nave Bayes to distinguish between them. When supplied with appropriately interpreted command sequences of a DMS, IPAM was able to distinguish between users effectively, while Nave Bayes failed to produce any meaningful results. We recorded an average detection rate of 58% with a false positive of 14%.","8164-9547","1-4244-0355-3","1-4244-0355-3","10.1109/ICC.2006.255112","http://ieeexplore.ieee.org.ezproxy.rit.edu/stamp/stamp.jsp?arnumber=4024507","Digital Rights Management;Document Management System;Insider threat;Intrusion detection;Masquerading Insiders;User profiling","Computer science;Cryptography;Engineering management;Event detection;Information security;Intellectual property;Intrusion detection;Monitoring;Protection;Technology management","","","","0","","26","","","June 2006","","IEEE","IEEE Conference Publications"
"Analysis of TCP flow data for traffic anomaly and scan detection","Muraleedharan, N.","Centre for Dev. of Adv. Comput., Bangalore, India","Networks, 2008. ICON 2008. 16th IEEE International Conference on","20090202","2008","","","1","4","Scanning tools are commonly used by intruders for identifying vulnerable hosts and applications in a network. So from security perspective, to identify the attack in its initial stage and to minimize the impact of attack, it is important to detect scanning activities in a network. We have mainly considered TCP flow because most of the Internet application uses it as a transport protocol. Traditionally, TCP scan traffic detection uses either flag values in the TCP packet header or statistical properties of the connection parameter like number of failed connection attempts. In this paper, we present a novel behaviour analysis of TCP traffic, where by using the flow characteristics, we identify anomalies and scan activities in a network or host. The proposed method provides a generic solution to SYN scan (half open), connect scan, FIN scan, Xmas scan and null scan. Results obtained from our method prove the detection capabilities and accuracy.","1556-6463","978-1-4244-3805-1","","10.1109/ICON.2008.4772645","http://ieeexplore.ieee.org.ezproxy.rit.edu/stamp/stamp.jsp?arnumber=4772645","","Cities and towns;Computer networks;Data flow computing;Data security;Internet;Level measurement;TCPIP;Telecommunication traffic;Transport protocols;Viruses (medical)","Internet;telecommunication security;telecommunication traffic;transport protocols","FIN scan;Internet;SYN scan;TCP flow data;TCP packet header;Xmas scan;behaviour analysis;connect scan;null scan;scan traffic detection;telecommunication security;traffic anomaly;transport protocols","","1","","16","","","12-14 Dec. 2008","","IEEE","IEEE Conference Publications"
"NBTRL: A Software Platform for Network Background Traffic Replay Based on Log","Zhao Kuo; Tang Kuo; Chu Jianfeng; Hu Liang","Jilin Univ., Changchun","Control Conference, 2007. CCC 2007. Chinese","20071015","2007","","","607","611","While the use of intrusion detection system (IDS), which monitors passively specific computing resources, and reports anomalous or intrusive activities, is becoming ubiquitous in today's network, evaluating IDS performance has been found to be challenging. Most IDS testing approaches are faced with selections with regard to their use of background traffic, which plays an important role in IDS testing. This paper presents the design and implementation of NBTRL, a software platform for network background traffic replay based on log files applied to IDS testing. NBTRL consists of information extraction module, packet preprocessing module and replay module. This software platform can extract traffic information from log files, control the speed of background traffic replay, process truncated packets, modify MAC address or IP address of packets, and provide a flexible and reusable experimental environment for IDS testing.","","978-7-81124-055-9","978-7-900719-22-5","10.1109/CHICC.2006.4347201","http://ieeexplore.ieee.org.ezproxy.rit.edu/stamp/stamp.jsp?arnumber=4347201","IDS Testing;Log;Traffic Replay","Communication system traffic control;Computer displays;Computer networks;Data mining;Information security;Intrusion detection;Pervasive computing;Software testing;Telecommunication traffic;Traffic control","information retrieval;program testing;security of data","IDS testing;NBTRL;information extraction module;intrusion detection system;network background traffic replay;packet preprocessing module;replay module;software platform","","1","","25","","","July 26 2007-June 31 2007","","IEEE","IEEE Conference Publications"
"A crowdsourcing approach to protect against novel malware threats","Christoforidis, C.; Vlachos, V.; Androulidakis, I.","Dept. of Comput. Sci. & Eng., Technol. Educ. Inst. of Thessaly, Larissa, Greece","Telecommunications Forum Telfor (TELFOR), 2014 22nd","20150209","2014","","","1063","1066","Worm attacks for more than two decades have been affecting the Internet causing instability and economic loses. In a huge pool of possible victims such as the Internet there can exist many targets running the same software with the same vulnerabilities. To prevent such targets from getting infected one can use the crowd experience to identify a possible attack and restrict the use of possible vulnerable software for a certain period. Crowdsourcing intelligence or collaborative intelligence is the power of many when each one in a group of participants shares certain information. It is characterized by enhancing information accuracy which further improves decision making on the group. This paper presents and analyzes NetBuckler, a collaborative client application which employs collaborative intelligence to defend against Internet worms. It also briefly presents JXTA and its potential.","","978-1-4799-6190-0","","10.1109/TELFOR.2014.7034590","http://ieeexplore.ieee.org.ezproxy.rit.edu/stamp/stamp.jsp?arnumber=7034590","JXTA;collaborative intelligence;peer-to-peer;windows;worm protection","Collaboration;Grippers;Internet;Intrusion detection;Operating systems;Peer-to-peer computing","Internet;decision making;economics;groupware;invasive software","Internet;JXTA;NetBuckler;collaborative intelligence;crowdsourcing intelligence;decision making;economic loses;malware threats;worm attacks","","0","","42","","","25-27 Nov. 2014","","IEEE","IEEE Conference Publications"
"Fates: A Granular Approach to Real-Time Anomaly Detection","Janies, Jeff; Chin-Tser Huang","Univ. of South Carolina, Columbia","Computer Communications and Networks, 2007. ICCCN 2007. Proceedings of 16th International Conference on","20070924","2007","","","605","610","Anomaly-based intrusion detection systems have the ability of detecting novel attacks, but in real-time detection, they face the challenges of producing many false alarms and failing to contend with the high speed of modern networks due to their computationally demanding algorithms. In this paper, we present Fates, an anomaly-based NIDS designed to alleviate the two challenges. Fates views the monitored network as a collection of individual hosts instead of as a single autonomous entity and uses dynamic, individual threshold for each monitored host, such that it can differentiate between characteristics of individual hosts and independently assess their threat to the network. Each packet to and from a monitored host is analyzed with an adaptive and efficient charging scheme that considers the packet's type, number of occurrences, source, and destination. The resulting charge is applied to the individual hosts' threat assessment, providing pinpointed analysis of anomalous activities. We use various datasets to validate Fates's ability to distinguish scanning behavior from benign traffic in real time.","1095-2055","978-1-4244-1251-8","978-1-4244-1251-8","10.1109/ICCCN.2007.4317884","http://ieeexplore.ieee.org.ezproxy.rit.edu/stamp/stamp.jsp?arnumber=4317884","Anomaly-based Detection;Network-based Intrusion Detection System","Computer science;Entropy;Face detection;Intrusion detection;Large-scale systems;Monitoring;Real time systems;Signal detection;Telecommunication traffic;Traffic control","computer network management;real-time systems;telecommunication security;telecommunication traffic","Fates real-time anomaly-based network intrusion detection system;network host monitoring;network traffic;real-time anomaly detection","","0","","25","","","13-16 Aug. 2007","","IEEE","IEEE Conference Publications"
